,event,penalty,penalty_on,drew_by,coords,period,period_time_remaining,penalty_team,drew_by_team,home_team,home_team_id,away_team,away_team_id,home_goals,away_goals,penalty_on_id,drew_by_id,description
25,penalty,Embellishment,Morgan Frost,Jack Roslovic,[39. -8.],1,14:29,PHI,WPG,WPG,52,PHI,4,1,0,8480028,8478458.0,Morgan Frost Embellishment against Jack Roslovic
26,penalty,Holding,Jack Roslovic,Morgan Frost,[42. -2.],1,14:29,WPG,PHI,WPG,52,PHI,4,1,0,8478458,8480028.0,Jack Roslovic Holding against Morgan Frost
96,penalty,Hooking,Mark Scheifele,Ivan Provorov,[-38. -32.],2,16:46,WPG,PHI,WPG,52,PHI,4,2,0,8476460,8478500.0,Mark Scheifele Hooking against Ivan Provorov
119,penalty,Interference,Joel Farabee,Chris Stewart,[-94. -26.],2,10:57,PHI,WPG,WPG,52,PHI,4,2,1,8480797,8473485.0,Joel Farabee Interference against Mathieu Perreault served by Chris Stewart
120,penalty,Game misconduct,Joel Farabee,,[-95. -27.],2,10:57,PHI,WPG,WPG,52,PHI,4,2,1,8480797,,Joel Farabee Game misconduct
166,penalty,Delaying Game - Puck over glass,Travis Sanheim,,[-52.  37.],3,17:41,PHI,WPG,WPG,52,PHI,4,6,2,8477948,,Travis Sanheim Delaying Game - Puck over glass
179,penalty,Delaying Game - Puck over glass,Shayne Gostisbehere,,[-70.  42.],3,13:25,PHI,WPG,WPG,52,PHI,4,6,2,8476906,,Shayne Gostisbehere Delaying Game - Puck over glass
66,penalty,Holding,Jake Gardiner,Neal Pionk,[-77.   1.],1,06:16,CAR,WPG,WPG,52,CAR,12,0,0,8474581,8480145.0,Jake Gardiner Holding against Neal Pionk
83,penalty,Delaying Game - Puck over glass,Josh Morrissey,,[98. 20.],1,02:35,WPG,CAR,WPG,52,CAR,12,0,0,8477504,,Josh Morrissey Delaying Game - Puck over glass
168,penalty,Holding,Anthony Bitetto,Ryan Dzingel,[-46.  13.],2,02:08,WPG,CAR,WPG,52,CAR,12,2,4,8475868,8476288.0,Anthony Bitetto Holding against Ryan Dzingel
211,penalty,Slashing,Sebastian Aho,Nikolaj Ehlers,[ 33. -23.],3,08:51,CAR,WPG,WPG,52,CAR,12,2,6,8478427,8477940.0,Sebastian Aho Slashing against Nikolaj Ehlers
79,penalty,Slashing,Dominik Kubalik,Jack Roslovic,[-56.   0.],1,01:52,CHI,WPG,WPG,52,CHI,16,0,1,8477330,8478458.0,Dominik Kubalik Slashing against Jack Roslovic
121,penalty,Holding,Dennis Gilbert,Mark Scheifele,[85. 37.],2,14:31,CHI,WPG,WPG,52,CHI,16,0,1,8478502,8476460.0,Dennis Gilbert Holding against Mark Scheifele
136,penalty,Tripping,Josh Morrissey,Matthew Highmore,[-49.  39.],2,10:02,WPG,CHI,WPG,52,CHI,16,0,1,8477504,8478146.0,Josh Morrissey Tripping against Matthew Highmore
209,penalty,Too many men on the ice,Joona Luoto,,[16. 32.],3,10:11,WPG,CHI,WPG,52,CHI,16,1,2,8481649,,Too many men/ice served by Joona Luoto
51,penalty,Interference,Luca Sbisa,Nico Sturm,[-73.  -2.],1,06:05,WPG,MIN,MIN,30,WPG,52,0,0,8474579,8481477.0,Luca Sbisa Interference against Nico Sturm
121,penalty,Holding,Anthony Bitetto,Ryan Donato,[72. -4.],2,06:53,WPG,MIN,MIN,30,WPG,52,0,3,8475868,8477987.0,Anthony Bitetto Holding against Ryan Donato
145,penalty,Roughing,Marcus Foligno,Luca Sbisa,[36. 25.],2,00:00,MIN,WPG,MIN,30,WPG,52,0,3,8475220,8474579.0,Marcus Foligno Roughing against Luca Sbisa
148,penalty,Interference - Goalkeeper,Mark Scheifele,Alex Stalock,[79. -1.],3,19:45,WPG,MIN,MIN,30,WPG,52,0,3,8476460,8471774.0,Mark Scheifele Interference - Goalkeeper against Alex Stalock
162,penalty,Roughing,Kevin Fiala,Neal Pionk,[-69.  30.],3,15:03,MIN,WPG,MIN,30,WPG,52,0,4,8477942,8480145.0,Kevin Fiala Roughing against Neal Pionk
163,penalty,Roughing,Neal Pionk,Kevin Fiala,[-50.  37.],3,15:03,WPG,MIN,MIN,30,WPG,52,0,4,8480145,8477942.0,Neal Pionk Roughing against Kevin Fiala
165,penalty,Tripping,Mats Zuccarello,Josh Morrissey,[-15.  34.],3,14:01,MIN,WPG,MIN,30,WPG,52,0,4,8475692,8477504.0,Mats Zuccarello Tripping against Josh Morrissey
188,penalty,Fighting,Luke Kunin,Nathan Beaulieu,[-57. -34.],3,07:26,MIN,WPG,MIN,30,WPG,52,0,6,8479316,8476470.0,Luke Kunin Fighting against Nathan Beaulieu
189,penalty,Fighting,Nathan Beaulieu,Luke Kunin,[-60. -31.],3,07:26,WPG,MIN,MIN,30,WPG,52,0,6,8476470,8479316.0,Nathan Beaulieu Fighting against Luke Kunin
201,penalty,Hi-sticking,Matt Dumba,Tucker Poolman,[-98.   1.],3,04:01,MIN,WPG,MIN,30,WPG,52,0,6,8476856,8477359.0,Matt Dumba Hi-sticking against Tucker Poolman
207,penalty,Delaying Game - Puck over glass,Zach Parise,,[ 48. -20.],3,01:55,MIN,WPG,MIN,30,WPG,52,0,6,8470610,,Zach Parise Delaying Game - Puck over glass
60,penalty,Interference - Goalkeeper,Ben Chiarot,Laurent Brossoit,[88.  0.],1,09:54,MTL,WPG,WPG,52,MTL,8,0,0,8475279,8476316.0,Ben Chiarot Interference - Goalkeeper against Laurent Brossoit
86,penalty,Slashing,Neal Pionk,Joel Armia,[65.  0.],1,06:13,WPG,MTL,WPG,52,MTL,8,1,0,8480145,8476469.0,Neal Pionk Slashing against Joel Armia
153,penalty,Closing hand on puck,Shea Weber,,[4. 2.],2,12:46,MTL,WPG,WPG,52,MTL,8,1,3,8470642,,Shea Weber Closing hand on puck
162,penalty,Too many men on the ice,Jack Roslovic,,[ 7. 35.],2,11:08,WPG,MTL,WPG,52,MTL,8,1,3,8478458,,Too many men/ice served by Jack Roslovic
214,penalty,Interference,Nate Thompson,Patrik Laine,[70. 41.],2,00:16,MTL,WPG,WPG,52,MTL,8,2,5,8470775,8479339.0,Nate Thompson Interference against Patrik Laine
17,penalty,Too many men on the ice,David Perron,,[-18.  39.],1,15:44,STL,WPG,WPG,52,STL,19,0,1,8474102,,Too many men/ice served by David Perron
103,penalty,Holding,Tucker Poolman,Mackenzie MacEachern,[-96.  18.],2,13:18,WPG,STL,WPG,52,STL,19,1,2,8477359,8476907.0,Tucker Poolman Holding against Mackenzie MacEachern
135,penalty,Hooking,Mark Scheifele,Oskar Sundqvist,[-70.   0.],2,04:53,WPG,STL,WPG,52,STL,19,2,2,8476460,8476897.0,Mark Scheifele Hooking against Oskar Sundqvist
143,penalty,Holding,Robert Thomas,Blake Wheeler,[-53.  21.],2,02:29,STL,WPG,WPG,52,STL,19,2,3,8480023,8471218.0,Robert Thomas Holding against Blake Wheeler
164,penalty,Slashing,Vince Dunn,Nikolaj Ehlers,[-56.  10.],3,17:34,STL,WPG,WPG,52,STL,19,2,3,8478407,8477940.0,Vince Dunn Slashing against Nikolaj Ehlers
219,penalty,Unsportsmanlike conduct,Justin Faulk,Mark Scheifele,[-95.  16.],3,04:24,STL,WPG,WPG,52,STL,19,3,4,8475753,8476460.0,Justin Faulk Unsportsmanlike conduct against Mark Scheifele
220,penalty,Unsportsmanlike conduct,Mark Scheifele,Justin Faulk,[-94.  18.],3,04:24,WPG,STL,WPG,52,STL,19,3,4,8476460,8475753.0,Mark Scheifele Unsportsmanlike conduct against Justin Faulk
62,penalty,Tripping,Ryan O'Reilly,Nikolaj Ehlers,[-39.  18.],1,02:12,STL,WPG,STL,19,WPG,52,1,0,8475158,8477940.0,Ryan O'Reilly Tripping against Nikolaj Ehlers
141,penalty,Interference,Alex Pietrangelo,Blake Wheeler,[83.  0.],2,01:42,STL,WPG,STL,19,WPG,52,2,1,8474565,8471218.0,Alex Pietrangelo Interference against Blake Wheeler
150,penalty,Interference,Patrik Laine,Oskar Sundqvist,[-14.  34.],2,00:24,WPG,STL,STL,19,WPG,52,2,1,8479339,8476897.0,Patrik Laine Interference against Oskar Sundqvist
171,penalty,Boarding,Luca Sbisa,Oskar Sundqvist,[92. 31.],3,14:23,WPG,STL,STL,19,WPG,52,2,1,8474579,8476897.0,Luca Sbisa Boarding against Oskar Sundqvist
219,penalty,Holding,Jordan Binnington,Jaden Schwartz,[-80.  -1.],3,02:50,STL,WPG,STL,19,WPG,52,3,1,8476412,8475768.0,Jordan Binnington Holding against Nicholas Shore served by Jaden Schwartz
137,penalty,Slashing,Luca Sbisa,Nathan MacKinnon,[94.  7.],2,09:38,WPG,COL,COL,21,WPG,52,1,2,8474579,8477492.0,Luca Sbisa Slashing against Nathan MacKinnon
150,penalty,Holding,Kyle Connor,Samuel Girard,[-41. -34.],2,06:56,WPG,COL,COL,21,WPG,52,1,2,8478398,8479398.0,Kyle Connor Holding against Samuel Girard
156,penalty,Roughing,Anthony Bitetto,J.T. Compher,[84.  1.],2,06:13,WPG,COL,COL,21,WPG,52,2,2,8475868,8477456.0,Anthony Bitetto Roughing against J.T. Compher
157,penalty,Roughing,J.T. Compher,Anthony Bitetto,[86.  0.],2,06:13,COL,WPG,COL,21,WPG,52,2,2,8477456,8475868.0,J.T. Compher Roughing against Anthony Bitetto
203,penalty,Cross check - double minor,Kyle Connor,Samuel Girard,[ 87. -19.],3,14:55,WPG,COL,COL,21,WPG,52,2,3,8478398,8479398.0,Kyle Connor Cross check - double minor against Samuel Girard
229,penalty,Interference,Nazem Kadri,Mason Appleton,[ -4. -40.],3,09:22,COL,WPG,COL,21,WPG,52,3,3,8475172,8478891.0,Nazem Kadri Interference against Mason Appleton
54,penalty,Tripping,Tyson Barrie,Nikolaj Ehlers,[-51.  -6.],1,09:32,TOR,WPG,WPG,52,TOR,10,0,2,8475197,8477940.0,Tyson Barrie Tripping against Nikolaj Ehlers
108,penalty,Delaying Game - Puck over glass,Jason Spezza,,[ 72. -41.],2,17:26,TOR,WPG,WPG,52,TOR,10,0,2,8469455,,Jason Spezza Delaying Game - Puck over glass
152,penalty,Hooking,Nicholas Shore,John Tavares,[ 67. -40.],2,09:26,WPG,TOR,WPG,52,TOR,10,2,4,8476406,8475166.0,Nicholas Shore Hooking against John Tavares
181,penalty,Slashing,Mathieu Perreault,Kasperi Kapanen,[-51.  22.],2,04:20,WPG,TOR,WPG,52,TOR,10,3,4,8473618,8477953.0,Mathieu Perreault Slashing against Kasperi Kapanen
265,penalty,Hi stick - double minor,Mason Appleton,Mason Marchment,[-40.  39.],3,00:42,WPG,TOR,WPG,52,TOR,10,3,6,8478891,8478975.0,Mason Appleton Hi stick - double minor against Mason Marchment
23,penalty,Interference,Neal Pionk,Zach Parise,[-73.  -3.],1,14:20,WPG,MIN,MIN,30,WPG,52,1,0,8480145,8470610.0,Neal Pionk Interference against Zach Parise
29,penalty,Interference,Neal Pionk,Mats Zuccarello,[-14. -42.],1,12:15,WPG,MIN,MIN,30,WPG,52,1,0,8480145,8475692.0,Neal Pionk Interference against Mats Zuccarello
72,penalty,Holding,Kevin Fiala,Nikolaj Ehlers,[ 59. -32.],2,19:38,MIN,WPG,MIN,30,WPG,52,1,0,8477942,8477940.0,Kevin Fiala Holding against Nikolaj Ehlers
106,penalty,Hi stick - double minor,Luke Kunin,Mark Scheifele,[-23.  42.],2,12:39,MIN,WPG,MIN,30,WPG,52,1,1,8479316,8476460.0,Luke Kunin Hi stick - double minor against Mark Scheifele
108,penalty,Interference,Patrik Laine,Carson Soucy,[-27.   1.],2,12:23,WPG,MIN,MIN,30,WPG,52,1,1,8479339,8477369.0,Patrik Laine Interference against Carson Soucy
112,penalty,Hooking,Tucker Poolman,Kevin Fiala,[81.  0.],2,12:05,WPG,MIN,MIN,30,WPG,52,1,1,8477359,8477942.0,Tucker Poolman Hooking against Kevin Fiala
140,penalty,Delaying Game - Puck over glass,Tucker Poolman,,[83.  8.],2,04:08,WPG,MIN,MIN,30,WPG,52,1,1,8477359,,Tucker Poolman Delaying Game - Puck over glass
149,penalty,Hi stick - double minor,Jordan Greenway,Anthony Bitetto,[81. -5.],2,01:59,MIN,WPG,MIN,30,WPG,52,1,1,8478413,8475868.0,Jordan Greenway Hi stick - double minor against Anthony Bitetto
219,penalty,Slashing,Blake Wheeler,Mats Zuccarello,[-66. -32.],4,04:06,WPG,MIN,MIN,30,WPG,52,2,2,8471218,8475692.0,Blake Wheeler Slashing against Mats Zuccarello
81,penalty,Hooking,Phillip Danault,Mark Scheifele,[59. 18.],1,05:03,MTL,WPG,MTL,8,WPG,52,0,0,8476479,8476460.0,Phillip Danault Hooking against Mark Scheifele
122,penalty,Hooking,Mathieu Perreault,Jeff Petry,[41.  6.],2,17:10,WPG,MTL,MTL,8,WPG,52,0,1,8473618,8473507.0,Mathieu Perreault Hooking against Jeff Petry
262,penalty,Hooking,Luca Sbisa,Nick Suzuki,[-67.   4.],3,03:17,WPG,MTL,MTL,8,WPG,52,2,3,8474579,8480018.0,Luca Sbisa Hooking against Nick Suzuki
55,penalty,Holding,Blake Wheeler,Adam Brooks,[97. 14.],1,03:18,WPG,TOR,TOR,10,WPG,52,1,1,8471218,8478996.0,Blake Wheeler Holding against Adam Brooks
82,penalty,Too many men on the ice,Dmytro Timashov,,[13. 40.],2,16:13,TOR,WPG,TOR,10,WPG,52,1,2,8478857,,Too many men/ice served by Dmytro Timashov
94,penalty,Holding,John Tavares,Mark Scheifele,[-89. -34.],2,12:29,TOR,WPG,TOR,10,WPG,52,2,2,8475166,8476460.0,John Tavares Holding against Mark Scheifele
115,penalty,Hooking,Josh Morrissey,John Tavares,[86. -5.],2,06:40,WPG,TOR,TOR,10,WPG,52,2,3,8477504,8475166.0,Josh Morrissey Hooking against John Tavares
157,penalty,Tripping,Sami Niku,John Tavares,[-30.  33.],3,13:05,WPG,TOR,TOR,10,WPG,52,2,3,8478915,8475166.0,Sami Niku Tripping against John Tavares
80,penalty,Tripping,Luca Sbisa,Brad Marchand,[-87. -23.],2,19:31,WPG,BOS,BOS,6,WPG,52,1,1,8474579,8473419.0,Luca Sbisa Tripping against Brad Marchand
96,penalty,Too many men on the ice,David Backes,,[18. 34.],2,15:37,BOS,WPG,BOS,6,WPG,52,1,1,8470655,,Too many men/ice served by David Backes
128,penalty,Tripping,Blake Wheeler,David Krejci,[45. 30.],2,10:24,WPG,BOS,BOS,6,WPG,52,1,2,8471218,8471276.0,Blake Wheeler Tripping against David Krejci
175,penalty,Interference,Matt Grzelcyk,Nikolaj Ehlers,[ 69. -13.],2,00:43,BOS,WPG,BOS,6,WPG,52,3,2,8476891,8477940.0,Matt Grzelcyk Interference against Nikolaj Ehlers
184,penalty,Tripping,Josh Morrissey,Charlie Coyle,[98.  7.],3,16:51,WPG,BOS,BOS,6,WPG,52,3,3,8477504,8475745.0,Josh Morrissey Tripping against Charlie Coyle
214,penalty,Hooking,Nikolaj Ehlers,Torey Krug,[ 18. -12.],3,07:48,WPG,BOS,BOS,6,WPG,52,5,4,8477940,8476792.0,Nikolaj Ehlers Hooking against Torey Krug
20,penalty,Kneeing,Dmitry Kulikov,Roman Josi,[25. -6.],1,16:06,WPG,NSH,WPG,52,NSH,18,0,0,8475179,8474600.0,Dmitry Kulikov Kneeing against Roman Josi
101,penalty,Hooking,Roman Josi,Kyle Connor,[63. -4.],2,16:57,NSH,WPG,WPG,52,NSH,18,0,1,8474600,8478398.0,Roman Josi Hooking against Kyle Connor
221,penalty,Hooking,Matt Duchene,Mark Scheifele,[56. 31.],3,11:41,NSH,WPG,WPG,52,NSH,18,0,1,8475168,8476460.0,Matt Duchene Hooking against Mark Scheifele
7,penalty,Tripping,Mason Appleton,Tim Schaller,[ 98. -13.],1,18:03,WPG,VAN,WPG,52,VAN,23,1,0,8478891,8477213.0,Mason Appleton Tripping against Tim Schaller
82,penalty,Slashing,Tanner Pearson,Carl Dahlstrom,[-48. -19.],1,02:49,VAN,WPG,WPG,52,VAN,23,2,0,8476871,8477472.0,Tanner Pearson Slashing against Carl Dahlstrom
92,penalty,Delaying Game - Puck over glass,Christopher Tanev,,[-82. -40.],1,00:05,VAN,WPG,WPG,52,VAN,23,2,0,8475690,,Christopher Tanev Delaying Game - Puck over glass
108,penalty,Tripping,Carl Dahlstrom,Tim Schaller,[-29. -28.],2,16:07,WPG,VAN,WPG,52,VAN,23,3,0,8477472,8477213.0,Carl Dahlstrom Tripping against Tim Schaller
138,penalty,Interference,Quinn Hughes,Luca Sbisa,[-57. -15.],2,10:03,VAN,WPG,WPG,52,VAN,23,3,0,8480800,8474579.0,Quinn Hughes Interference against Luca Sbisa
148,penalty,Tripping,Nikolaj Ehlers,Troy Stecher,[ 53. -15.],2,06:20,WPG,VAN,WPG,52,VAN,23,3,0,8477940,8479442.0,Nikolaj Ehlers Tripping against Troy Stecher
154,penalty,Hooking,Adam Lowry,J.T. Miller,[-64.   0.],2,04:07,WPG,VAN,WPG,52,VAN,23,3,0,8476392,8476468.0,Adam Lowry Hooking against J.T. Miller
90,penalty,Holding,Jan Rutta,Mark Scheifele,[83. -3.],2,19:09,TBL,WPG,WPG,52,TBL,14,0,3,8480172,8476460.0,Jan Rutta Holding against Mark Scheifele
174,penalty,Cross checking,Steven Stamkos,Kyle Connor,[82. -4.],2,00:11,TBL,WPG,WPG,52,TBL,14,1,5,8474564,8478398.0,Steven Stamkos Cross checking against Kyle Connor
184,penalty,Delaying Game - Puck over glass,Dmitry Kulikov,,[ 49. -41.],3,17:13,WPG,TBL,WPG,52,TBL,14,1,5,8475179,,Dmitry Kulikov Delaying Game - Puck over glass
47,penalty,Hooking,Dominik Kubalik,Dmitry Kulikov,[-33. -22.],1,11:33,CHI,WPG,CHI,16,WPG,52,1,0,8477330,8475179.0,Dominik Kubalik Hooking against Dmitry Kulikov
48,penalty,Embellishment,Dmitry Kulikov,Dominik Kubalik,[-37. -14.],1,11:33,WPG,CHI,CHI,16,WPG,52,1,0,8475179,8477330.0,Dmitry Kulikov Embellishment against Dominik Kubalik
103,penalty,Interference,Drake Caggiula,Adam Lowry,[-36.   2.],1,00:16,CHI,WPG,CHI,16,WPG,52,2,0,8479465,8476392.0,Drake Caggiula Interference against Adam Lowry
125,penalty,Interference,Drake Caggiula,Nikolaj Ehlers,[58. 10.],2,15:40,CHI,WPG,CHI,16,WPG,52,2,0,8479465,8477940.0,Drake Caggiula Interference against Nikolaj Ehlers
126,penalty,Unsportsmanlike conduct,Drake Caggiula,,[  1. -38.],2,15:40,CHI,WPG,CHI,16,WPG,52,2,0,8479465,,Drake Caggiula Unsportsmanlike conduct
169,penalty,Holding,Anthony Bitetto,Patrick Kane,[69. 40.],2,07:47,WPG,CHI,CHI,16,WPG,52,2,0,8475868,8474141.0,Anthony Bitetto Holding against Patrick Kane
176,penalty,Tripping,Drake Caggiula,Luca Sbisa,[87. -5.],2,05:44,CHI,WPG,CHI,16,WPG,52,2,0,8479465,8474579.0,Drake Caggiula Tripping against Luca Sbisa
248,penalty,Hooking,Mark Scheifele,Alex Nylander,[-80.  11.],3,09:27,WPG,CHI,CHI,16,WPG,52,3,1,8476460,8479423.0,Mark Scheifele Hooking against Alex Nylander
286,penalty,Hooking,Olli Maatta,Mason Appleton,[81.  2.],3,00:37,CHI,WPG,CHI,16,WPG,52,5,2,8476874,8478891.0,Olli Maatta Hooking against Mason Appleton
18,penalty,Hooking,Sami Niku,Martin Necas,[ 42. -12.],1,15:00,WPG,CAR,CAR,12,WPG,52,1,0,8478915,8480039.0,Sami Niku Hooking against Martin Necas
56,penalty,Delaying Game - Puck over glass,Warren Foegele,,[ 64. -39.],1,05:17,CAR,WPG,CAR,12,WPG,52,2,1,8477998,,Warren Foegele Delaying Game - Puck over glass
103,penalty,Interference,Ryan Dzingel,Mason Appleton,[-71.  -1.],2,13:49,CAR,WPG,CAR,12,WPG,52,3,1,8476288,8478891.0,Ryan Dzingel Interference against Mason Appleton
110,penalty,Tripping,Mathieu Perreault,Brock McGinn,[-45. -16.],2,11:51,WPG,CAR,CAR,12,WPG,52,3,1,8473618,8476934.0,Mathieu Perreault Tripping against Brock McGinn
137,penalty,Hi-sticking,Dmitry Kulikov,Ryan Dzingel,[ 83. -34.],2,04:47,WPG,CAR,CAR,12,WPG,52,3,1,8475179,8476288.0,Dmitry Kulikov Hi-sticking against Ryan Dzingel
154,penalty,Slashing,Joel Edmundson,Blake Wheeler,[-63. -15.],2,00:17,CAR,WPG,CAR,12,WPG,52,3,1,8476441,8471218.0,Joel Edmundson Slashing against Blake Wheeler
184,penalty,Interference,Mason Appleton,Justin Williams,[-84.  11.],3,12:50,WPG,CAR,CAR,12,WPG,52,3,1,8478891,8468508.0,Mason Appleton Interference against Justin Williams
198,penalty,Roughing,Andrei Svechnikov,Mark Scheifele,[-94.  16.],3,09:54,CAR,WPG,CAR,12,WPG,52,4,1,8480830,8476460.0,Andrei Svechnikov Roughing against Mark Scheifele
199,penalty,Roughing,Mark Scheifele,Andrei Svechnikov,[-93.  18.],3,09:54,WPG,CAR,CAR,12,WPG,52,4,1,8476460,8480830.0,Mark Scheifele Roughing against Andrei Svechnikov
208,penalty,Hooking,Andrew Copp,Teuvo Teravainen,[-68.  -1.],3,08:20,WPG,CAR,CAR,12,WPG,52,4,1,8477429,8476882.0,Andrew Copp Hooking against Teuvo Teravainen
232,penalty,Fighting,Brett Pesce,Mark Scheifele,[84. -9.],3,02:40,CAR,WPG,CAR,12,WPG,52,4,1,8477488,8476460.0,Brett Pesce Fighting against Mark Scheifele
233,penalty,Fighting,Mark Scheifele,Brett Pesce,[89. -7.],3,02:40,WPG,CAR,CAR,12,WPG,52,4,1,8476460,8477488.0,Mark Scheifele Fighting against Brett Pesce
235,penalty,Tripping,Petr Mrazek,Warren Foegele,[83. -1.],3,02:40,CAR,WPG,CAR,12,WPG,52,4,1,8475852,8477998.0,Petr Mrazek Tripping against Mark Scheifele served by Warren Foegele
236,penalty,Interference,Mark Scheifele,Brett Pesce,[ 78. -10.],3,02:40,WPG,CAR,CAR,12,WPG,52,4,1,8476460,8477488.0,Mark Scheifele Interference against Brett Pesce
238,penalty,Delaying Game - Puck over glass,Jaccob Slavin,,[66.  4.],3,01:46,CAR,WPG,CAR,12,WPG,52,4,1,8476958,,Jaccob Slavin Delaying Game - Puck over glass
245,penalty,Tripping,Neal Pionk,Sebastian Aho,[-38.  41.],3,00:04,WPG,CAR,CAR,12,WPG,52,4,1,8480145,8478427.0,Neal Pionk Tripping against Sebastian Aho
54,penalty,Tripping,Vladislav Gavrikov,Mason Appleton,[-52.  -1.],1,07:46,CBJ,WPG,CBJ,29,WPG,52,1,1,8478882,8478891.0,Vladislav Gavrikov Tripping against Mason Appleton
158,penalty,Tripping,Zach Werenski,Mark Scheifele,[ 41. -30.],2,04:35,CBJ,WPG,CBJ,29,WPG,52,2,2,8478460,8476460.0,Zach Werenski Tripping against Mark Scheifele
165,penalty,Interference,Nicholas Shore,David Savard,[20. 33.],2,02:55,WPG,CBJ,CBJ,29,WPG,52,2,3,8476406,8475233.0,Nicholas Shore Interference against David Savard
78,penalty,Roughing,Charlie McAvoy,Neal Pionk,[-72.  -1.],1,02:48,BOS,WPG,WPG,52,BOS,6,1,0,8479325,8480145.0,Charlie McAvoy Roughing against Neal Pionk
79,penalty,Roughing,Neal Pionk,Charlie McAvoy,[-73.   0.],1,02:48,WPG,BOS,WPG,52,BOS,6,1,0,8480145,8479325.0,Neal Pionk Roughing against Charlie McAvoy
80,penalty,Roughing,Neal Pionk,Mathieu Perreault,[-73.  -2.],1,02:48,WPG,BOS,WPG,52,BOS,6,1,0,8480145,8473618.0,Neal Pionk Roughing against Charlie McAvoy served by Mathieu Perreault
88,penalty,Slashing,Josh Morrissey,David Krejci,[ 74. -24.],1,01:28,WPG,BOS,WPG,52,BOS,6,1,0,8477504,8471276.0,Josh Morrissey Slashing against David Krejci
105,penalty,Hooking,Matt Grzelcyk,Blake Wheeler,[ 79. -10.],2,17:49,BOS,WPG,WPG,52,BOS,6,1,1,8476891,8471218.0,Matt Grzelcyk Hooking against Blake Wheeler
114,penalty,Roughing,Brad Marchand,Danton Heinen,[-14.  27.],2,16:32,BOS,WPG,WPG,52,BOS,6,1,1,8473419,8478046.0,Brad Marchand Roughing against Nikolaj Ehlers served by Danton Heinen
115,penalty,Fighting,Brad Marchand,Nikolaj Ehlers,[-11.  20.],2,16:32,BOS,WPG,WPG,52,BOS,6,1,1,8473419,8477940.0,Brad Marchand Fighting against Nikolaj Ehlers
116,penalty,Fighting,Nikolaj Ehlers,Brad Marchand,[-14.  28.],2,16:32,WPG,BOS,WPG,52,BOS,6,1,1,8477940,8473419.0,Nikolaj Ehlers Fighting against Brad Marchand
121,penalty,Delaying Game - Puck over glass,Brandon Carlo,,[67. 36.],2,15:43,BOS,WPG,WPG,52,BOS,6,1,1,8478443,,Brandon Carlo Delaying Game - Puck over glass
136,penalty,Tripping,Charlie Coyle,Jack Roslovic,[71. 39.],2,12:53,BOS,WPG,WPG,52,BOS,6,1,1,8475745,8478458.0,Charlie Coyle Tripping against Jack Roslovic
148,penalty,Instigator,Brandon Carlo,Danton Heinen,[-4.  5.],2,09:50,BOS,WPG,WPG,52,BOS,6,1,1,8478443,8478046.0,Brandon Carlo Instigator against Gabriel Bourque served by Danton Heinen
149,penalty,Fighting,Brandon Carlo,Gabriel Bourque,[-4.  4.],2,09:50,BOS,WPG,WPG,52,BOS,6,1,1,8478443,8475268.0,Brandon Carlo Fighting against Gabriel Bourque
150,penalty,Misconduct,Brandon Carlo,Gabriel Bourque,[-4.  2.],2,09:50,BOS,WPG,WPG,52,BOS,6,1,1,8478443,8475268.0,Brandon Carlo Misconduct against Gabriel Bourque
151,penalty,Fighting,Gabriel Bourque,Brandon Carlo,[-4.  4.],2,09:50,WPG,BOS,WPG,52,BOS,6,1,1,8475268,8478443.0,Gabriel Bourque Fighting against Brandon Carlo
168,penalty,Fighting,Karson Kuhlman,Luca Sbisa,[-33.   0.],2,04:24,BOS,WPG,WPG,52,BOS,6,1,1,8480901,8474579.0,Karson Kuhlman Fighting against Luca Sbisa
169,penalty,Instigator,Luca Sbisa,Jansen Harkins,[-5.  2.],2,04:24,WPG,BOS,WPG,52,BOS,6,1,1,8474579,8478424.0,Luca Sbisa Instigator against Karson Kuhlman served by Jansen Harkins
170,penalty,Fighting,Luca Sbisa,Karson Kuhlman,[-7.  3.],2,04:24,WPG,BOS,WPG,52,BOS,6,1,1,8474579,8480901.0,Luca Sbisa Fighting against Karson Kuhlman
171,penalty,Misconduct,Luca Sbisa,Karson Kuhlman,[-5.  3.],2,04:24,WPG,BOS,WPG,52,BOS,6,1,1,8474579,8480901.0,Luca Sbisa Misconduct against Karson Kuhlman
184,penalty,Holding,Torey Krug,Patrik Laine,[79.  3.],2,00:00,BOS,WPG,WPG,52,BOS,6,1,1,8476792,8479339.0,Torey Krug Holding against Patrik Laine
194,penalty,Slashing,Sami Niku,Brad Marchand,[79. 17.],3,17:25,WPG,BOS,WPG,52,BOS,6,1,1,8478915,8473419.0,Sami Niku Slashing against Brad Marchand
41,penalty,Roughing,Troy Brouwer,Jansen Harkins,[-95.  20.],1,11:24,STL,WPG,WPG,52,STL,19,0,0,8471426,8478424.0,Troy Brouwer Roughing against Jansen Harkins
42,penalty,Slashing,Andrew Copp,Robert Bortuzzo,[-94.  22.],1,11:24,WPG,STL,WPG,52,STL,19,0,0,8477429,8474145.0,Andrew Copp Slashing against Robert Bortuzzo
65,penalty,Slashing,Colton Parayko,Kyle Connor,[-70. -15.],1,03:24,STL,WPG,WPG,52,STL,19,0,0,8476892,8478398.0,Colton Parayko Slashing against Kyle Connor
96,penalty,Hooking,Mark Scheifele,David Perron,[-59. -40.],2,18:37,WPG,STL,WPG,52,STL,19,1,0,8476460,8474102.0,Mark Scheifele Hooking against David Perron
141,penalty,Holding,Sami Niku,Jaden Schwartz,[-94. -24.],2,08:42,WPG,STL,WPG,52,STL,19,1,0,8478915,8475768.0,Sami Niku Holding against Jaden Schwartz
143,penalty,Hooking,David Perron,Nicholas Shore,[38. 36.],2,08:17,STL,WPG,WPG,52,STL,19,1,0,8474102,8476406.0,David Perron Hooking against Nicholas Shore
