,event,penalty,penalty_on,drew_by,coords,period,period_time_remaining,penalty_team,drew_by_team,home_team,home_team_id,away_team,away_team_id,home_goals,away_goals,penalty_on_id,drew_by_id,description
83,penalty,Hi-sticking,Colton Sissons,Dougie Hamilton,[61.  2.],1,01:42,NSH,CAR,CAR,12,NSH,18,0,2,8476925,8476462.0,Colton Sissons Hi-sticking against Dougie Hamilton
145,penalty,Too many men on the ice,Daniel Carr,,[-13.  40.],2,08:46,NSH,CAR,CAR,12,NSH,18,0,3,8477901,,Too many men/ice served by Daniel Carr
165,penalty,Interference,Jake Gardiner,Craig Smith,[ 6. 29.],2,04:07,CAR,NSH,CAR,12,NSH,18,0,3,8474581,8475225.0,Jake Gardiner Interference against Craig Smith
194,penalty,Tripping,Jake Gardiner,Filip Forsberg,[81. 35.],3,17:01,CAR,NSH,CAR,12,NSH,18,0,3,8474581,8476887.0,Jake Gardiner Tripping against Filip Forsberg
211,penalty,Elbowing,Austin Watson,Haydn Fleury,[-32.  31.],3,13:44,NSH,CAR,CAR,12,NSH,18,0,3,8475766,8477938.0,Austin Watson Elbowing against Haydn Fleury
248,penalty,Holding,Joel Edmundson,Filip Forsberg,[84. 32.],3,02:40,CAR,NSH,CAR,12,NSH,18,0,3,8476441,8476887.0,Joel Edmundson Holding against Filip Forsberg
36,penalty,Tripping,Daniel Carr,Evgenii Dadonov,[-94.  25.],1,12:02,NSH,FLA,FLA,13,NSH,18,0,0,8477901,8474149.0,Daniel Carr Tripping against Evgenii Dadonov
43,penalty,Slashing,Vincent Trocheck,Mikael Granlund,[ 8. 39.],1,09:48,FLA,NSH,FLA,13,NSH,18,0,0,8476389,8475798.0,Vincent Trocheck Slashing against Mikael Granlund
71,penalty,Slashing,Dan Hamhuis,Frank Vatrano,[68. 35.],1,02:53,NSH,FLA,FLA,13,NSH,18,0,0,8469465,8478366.0,Dan Hamhuis Slashing against Frank Vatrano
113,penalty,Delaying Game - Puck over glass,Dan Hamhuis,,[ 42. -40.],2,12:12,NSH,FLA,FLA,13,NSH,18,1,0,8469465,,Dan Hamhuis Delaying Game - Puck over glass
130,penalty,Slashing,Anton Stralman,Matt Duchene,[-95.  15.],2,08:25,FLA,NSH,FLA,13,NSH,18,1,0,8471873,8475168.0,Anton Stralman Slashing against Matt Duchene
139,penalty,Delaying Game - Puck over glass,MacKenzie Weegar,,[-50. -35.],2,06:58,FLA,NSH,FLA,13,NSH,18,1,0,8477346,,MacKenzie Weegar Delaying Game - Puck over glass
168,penalty,Slashing,Jonathan Huberdeau,Mattias Ekholm,[-72.  37.],2,01:02,FLA,NSH,FLA,13,NSH,18,1,0,8476456,8475218.0,Jonathan Huberdeau Slashing against Mattias Ekholm
170,penalty,Interference,Ryan Johansen,Noel Acciari,[-69.  23.],2,01:00,NSH,FLA,FLA,13,NSH,18,1,0,8475793,8478569.0,Ryan Johansen Interference against Noel Acciari
45,penalty,Interference,Carter Verhaeghe,Ryan Ellis,[ 52. -36.],1,08:33,TBL,NSH,NSH,18,TBL,14,0,1,8477409,8475176.0,Carter Verhaeghe Interference against Ryan Ellis
74,penalty,Hi-sticking,Nikita Kucherov,Rocco Grimaldi,[ 43. -38.],2,19:47,TBL,NSH,NSH,18,TBL,14,0,1,8476453,8476428.0,Nikita Kucherov Hi-sticking against Rocco Grimaldi
87,penalty,Fighting,Luke Schenn,Austin Watson,[64. 10.],2,17:07,TBL,NSH,NSH,18,TBL,14,0,1,8474568,8475766.0,Luke Schenn Fighting against Austin Watson
88,penalty,Fighting,Austin Watson,Luke Schenn,[70. 18.],2,17:07,NSH,TBL,NSH,18,TBL,14,0,1,8475766,8474568.0,Austin Watson Fighting against Luke Schenn
114,penalty,Elbowing,Ryan Johansen,Daniel Carr,[69. 38.],2,10:50,NSH,TBL,NSH,18,TBL,14,1,2,8475793,8477901.0,Ryan Johansen Elbowing against Brayden Point served by Daniel Carr
115,penalty,Game misconduct,Ryan Johansen,,[61. 37.],2,10:50,NSH,TBL,NSH,18,TBL,14,1,2,8475793,,Ryan Johansen Game misconduct
169,penalty,Hi-sticking,Mathieu Olivier,Nikita Kucherov,[-59.  38.],3,15:59,NSH,TBL,NSH,18,TBL,14,1,2,8479671,8476453.0,Mathieu Olivier Hi-sticking against Nikita Kucherov
182,penalty,Illegal check to head,Erik Cernak,Daniel Carr,[ 95. -15.],3,12:01,TBL,NSH,NSH,18,TBL,14,1,2,8478416,8477901.0,Erik Cernak Illegal check to head against Daniel Carr
202,penalty,Roughing,Cedric Paquette,Pat Maroon,[-73.   4.],3,06:59,TBL,NSH,NSH,18,TBL,14,2,2,8476975,8474034.0,Cedric Paquette Roughing against Dante Fabbro served by Pat Maroon
203,penalty,Roughing,Dante Fabbro,Cedric Paquette,[-69.  14.],3,06:59,NSH,TBL,NSH,18,TBL,14,2,2,8479371,8476975.0,Dante Fabbro Roughing against Cedric Paquette
204,penalty,Roughing,Cedric Paquette,Dante Fabbro,[-75.  10.],3,06:59,TBL,NSH,NSH,18,TBL,14,2,2,8476975,8479371.0,Cedric Paquette Roughing against Dante Fabbro
215,penalty,Hi-sticking,Nick Bonino,Steven Stamkos,[-69.   1.],3,03:57,NSH,TBL,NSH,18,TBL,14,2,2,8474009,8474564.0,Nick Bonino Hi-sticking against Steven Stamkos
38,penalty,Unsportsmanlike conduct,Yannick Weber,,[-35.   3.],1,10:21,NSH,NJD,NSH,18,NJD,1,2,2,8474134,,Yannick Weber Unsportsmanlike conduct
42,penalty,Slashing,Nikita Gusev,Ryan Ellis,[ 63. -27.],1,09:48,NJD,NSH,NSH,18,NJD,1,2,2,8477038,8475176.0,Nikita Gusev Slashing against Ryan Ellis
45,penalty,Hooking,P.K. Subban,Kyle Turris,[91. 31.],1,08:31,NJD,NSH,NSH,18,NJD,1,2,2,8474056,8474068.0,P.K. Subban Hooking against Kyle Turris
75,penalty,Hooking,Dante Fabbro,Jesper Bratt,[96. -8.],2,19:28,NSH,NJD,NSH,18,NJD,1,2,2,8479371,8479407.0,Dante Fabbro Hooking against Jesper Bratt
83,penalty,Hi-sticking,Miles Wood,Daniel Carr,[-82.  14.],2,17:13,NJD,NSH,NSH,18,NJD,1,2,2,8477425,8477901.0,Miles Wood Hi-sticking against Daniel Carr
118,penalty,Illegal check to head,Blake Coleman,Yannick Weber,[85. 34.],2,09:59,NJD,NSH,NSH,18,NJD,1,4,2,8476399,8474134.0,Blake Coleman Illegal check to head against Yannick Weber
120,penalty,Interference,Ryan Johansen,Pavel Zacha,[-67.  22.],2,09:54,NSH,NJD,NSH,18,NJD,1,4,2,8475793,8478401.0,Ryan Johansen Interference against Pavel Zacha
133,penalty,Tripping,Filip Forsberg,Blake Coleman,[76.  1.],2,07:45,NSH,NJD,NSH,18,NJD,1,4,2,8476887,8476399.0,Filip Forsberg Tripping against Blake Coleman
166,penalty,Holding,Blake Coleman,Kyle Turris,[-31.   1.],3,19:18,NJD,NSH,NSH,18,NJD,1,4,3,8476399,8474068.0,Blake Coleman Holding against Kyle Turris
246,penalty,Too many men on the ice,Jesper Boqvist,,[-66.  36.],3,00:47,NJD,NSH,NSH,18,NJD,1,6,4,8480003,,Too many men/ice served by Jesper Boqvist
3,penalty,Slashing,Barclay Goodrow,Dante Fabbro,[ 55. -23.],1,19:13,SJS,NSH,NSH,18,SJS,28,0,0,8476624,8479371.0,Barclay Goodrow Slashing against Dante Fabbro
31,penalty,Hi stick - double minor,Mario Ferraro,Craig Smith,[-39. -38.],1,11:55,SJS,NSH,NSH,18,SJS,28,0,0,8479983,8475225.0,Mario Ferraro Hi stick - double minor against Craig Smith
53,penalty,Interference,Filip Forsberg,Marcus Sorensen,[ 52. -12.],1,07:09,NSH,SJS,NSH,18,SJS,28,0,0,8476887,8475834.0,Filip Forsberg Interference against Marcus Sorensen
54,penalty,Unsportsmanlike conduct,Marcus Sorensen,,[ 54. -17.],1,07:09,SJS,NSH,NSH,18,SJS,28,0,0,8475834,,Marcus Sorensen Unsportsmanlike conduct
68,penalty,Hooking,Calle Jarnkrok,Marcus Sorensen,[-75.   4.],1,04:24,NSH,SJS,NSH,18,SJS,28,0,0,8475714,8475834.0,Calle Jarnkrok Hooking against Marcus Sorensen
103,penalty,Slashing,Dante Fabbro,Timo Meier,[72.  5.],2,10:29,NSH,SJS,NSH,18,SJS,28,0,0,8479371,8478414.0,Dante Fabbro Slashing against Timo Meier
127,penalty,Slashing,Calle Jarnkrok,Barclay Goodrow,[44. 24.],2,02:45,NSH,SJS,NSH,18,SJS,28,0,0,8475714,8476624.0,Calle Jarnkrok Slashing against Barclay Goodrow
128,penalty,Cross checking,Barclay Goodrow,Calle Jarnkrok,[59.  7.],2,02:45,SJS,NSH,NSH,18,SJS,28,0,0,8476624,8475714.0,Barclay Goodrow Cross checking against Calle Jarnkrok
137,penalty,Unsportsmanlike conduct,Dante Fabbro,,[83.  8.],2,01:08,NSH,SJS,NSH,18,SJS,28,0,0,8479371,,Dante Fabbro Unsportsmanlike conduct
138,penalty,Unsportsmanlike conduct,Timo Meier,,[83.  5.],2,01:08,SJS,NSH,NSH,18,SJS,28,0,0,8478414,,Timo Meier Unsportsmanlike conduct
142,penalty,Cross checking,Roman Josi,Barclay Goodrow,[68. -2.],2,00:26,NSH,SJS,NSH,18,SJS,28,0,0,8474600,8476624.0,Roman Josi Cross checking against Barclay Goodrow
146,penalty,Fighting,Austin Watson,Evander Kane,[93. 17.],2,00:02,NSH,SJS,NSH,18,SJS,28,0,0,8475766,8475169.0,Austin Watson Fighting against Evander Kane
147,penalty,Roughing,Evander Kane,Noah Gregor,[79.  3.],2,00:02,SJS,NSH,NSH,18,SJS,28,0,0,8475169,8479393.0,Evander Kane Roughing against Dan Hamhuis served by Noah Gregor
148,penalty,Roughing,Dan Hamhuis,Evander Kane,[81.  7.],2,00:02,NSH,SJS,NSH,18,SJS,28,0,0,8469465,8475169.0,Dan Hamhuis Roughing against Evander Kane
149,penalty,Roughing,Evander Kane,Dan Hamhuis,[83.  6.],2,00:02,SJS,NSH,NSH,18,SJS,28,0,0,8475169,8469465.0,Evander Kane Roughing against Dan Hamhuis
150,penalty,Fighting,Evander Kane,Austin Watson,[92. 16.],2,00:02,SJS,NSH,NSH,18,SJS,28,0,0,8475169,8475766.0,Evander Kane Fighting against Austin Watson
151,penalty,Misconduct,Evander Kane,Austin Watson,[92. 16.],2,00:02,SJS,NSH,NSH,18,SJS,28,0,0,8475169,8475766.0,Evander Kane Misconduct against Austin Watson
152,penalty,Misconduct,Austin Watson,Evander Kane,[93. 16.],2,00:02,NSH,SJS,NSH,18,SJS,28,0,0,8475766,8475169.0,Austin Watson Misconduct against Evander Kane
159,penalty,Cross checking,Roman Josi,Barclay Goodrow,[-71.  32.],3,17:57,NSH,SJS,NSH,18,SJS,28,0,0,8474600,8476624.0,Roman Josi Cross checking against Barclay Goodrow
160,penalty,Closing hand on puck,Barclay Goodrow,,[-66.  37.],3,17:57,SJS,NSH,NSH,18,SJS,28,0,0,8476624,,Barclay Goodrow Closing hand on puck
188,penalty,Hooking,Erik Karlsson,Daniel Carr,[70.  6.],3,11:31,SJS,NSH,NSH,18,SJS,28,1,0,8474578,8477901.0,Erik Karlsson Hooking against Daniel Carr
192,penalty,PS - Slash on breakaway,Filip Forsberg,Barclay Goodrow,[-81.   6.],3,10:55,NSH,SJS,NSH,18,SJS,28,1,0,8476887,8476624.0,Filip Forsberg PS - Slash on breakaway against Barclay Goodrow
205,penalty,Elbowing,Brent Burns,Daniel Carr,[95. 17.],3,07:41,SJS,NSH,NSH,18,SJS,28,1,0,8470613,8477901.0,Brent Burns Elbowing against Daniel Carr
210,penalty,Missing key [PD_151],Noah Gregor,,[11. 38.],3,07:01,SJS,NSH,NSH,18,SJS,28,2,0,8479393,,Delaying Game - Unsucc. chlg served by Noah Gregor
213,penalty,Hooking,Filip Forsberg,Marcus Sorensen,[44. 37.],3,06:26,NSH,SJS,NSH,18,SJS,28,2,0,8476887,8475834.0,Filip Forsberg Hooking against Marcus Sorensen
77,penalty,Tripping,Brandon Montour,Rocco Grimaldi,[-81. -20.],1,02:10,BUF,NSH,BUF,7,NSH,18,1,2,8477986,8476428.0,Brandon Montour Tripping against Rocco Grimaldi
83,penalty,Delaying Game - Puck over glass,Marco Scandella,,[-68.  41.],1,00:52,BUF,NSH,BUF,7,NSH,18,1,2,8474618,,Marco Scandella Delaying Game - Puck over glass
117,penalty,Hooking,Matt Duchene,Jack Eichel,[-33. -40.],2,12:45,NSH,BUF,BUF,7,NSH,18,2,2,8475168,8478403.0,Matt Duchene Hooking against Jack Eichel
33,penalty,Hi-sticking,Craig Smith,Esa Lindell,[94. 17.],1,11:11,NSH,DAL,NSH,18,DAL,25,0,0,8475225,8476902.0,Craig Smith Hi-sticking against Esa Lindell
54,penalty,Slashing,Matt Irwin,Corey Perry,[-72. -11.],1,05:14,NSH,DAL,NSH,18,DAL,25,0,0,8475625,8470621.0,Matt Irwin Slashing against Corey Perry
95,penalty,Illegal check to head,Andrew Cogliano,Matt Irwin,[ 80. -36.],2,16:27,DAL,NSH,NSH,18,DAL,25,1,0,8471699,8475625.0,Andrew Cogliano Illegal check to head against Matt Irwin
212,penalty,Interference - Goalkeeper,Andrew Cogliano,Pekka Rinne,[-97.  -3.],3,09:20,DAL,NSH,NSH,18,DAL,25,1,4,8471699,8471469.0,Andrew Cogliano Interference - Goalkeeper against Pekka Rinne
235,penalty,Interference,Jamie Oleksiak,Calle Jarnkrok,[ 83. -32.],3,03:52,DAL,NSH,NSH,18,DAL,25,1,4,8476467,8475714.0,Jamie Oleksiak Interference against Calle Jarnkrok
79,penalty,Slashing,Kyle Turris,Pavel Buchnevich,[-74. -19.],1,03:22,NSH,NYR,NYR,3,NSH,18,1,1,8474068,8477402.0,Kyle Turris Slashing against Pavel Buchnevich
98,penalty,Interference,Brendan Lemieux,Roman Josi,[-83.   0.],1,00:41,NYR,NSH,NYR,3,NSH,18,1,1,8477962,8474600.0,Brendan Lemieux Interference against Roman Josi
138,penalty,Elbowing,Ryan Ellis,Pavel Buchnevich,[-74. -40.],2,11:59,NSH,NYR,NYR,3,NSH,18,1,1,8475176,8477402.0,Ryan Ellis Elbowing against Pavel Buchnevich
155,penalty,Roughing,Dante Fabbro,Jesper Fast,[87.  7.],2,08:41,NSH,NYR,NYR,3,NSH,18,1,2,8479371,8475855.0,Dante Fabbro Roughing against Jesper Fast
156,penalty,Holding,Jesper Fast,Dante Fabbro,[88.  7.],2,08:41,NYR,NSH,NYR,3,NSH,18,1,2,8475855,8479371.0,Jesper Fast Holding against Dante Fabbro
164,penalty,Cross checking,Mattias Ekholm,Chris Kreider,[76. -5.],2,06:49,NSH,NYR,NYR,3,NSH,18,1,2,8475218,8475184.0,Mattias Ekholm Cross checking against Chris Kreider
177,penalty,Misconduct,Brendan Lemieux,Rocco Grimaldi,[11. 41.],2,04:33,NYR,NSH,NYR,3,NSH,18,1,3,8477962,8476428.0,Brendan Lemieux Misconduct against Rocco Grimaldi
222,penalty,Holding,Pavel Buchnevich,Dante Fabbro,[-98.   1.],3,14:10,NYR,NSH,NYR,3,NSH,18,1,3,8477402,8479371.0,Pavel Buchnevich Holding against Dante Fabbro
253,penalty,Tripping,Matt Duchene,Kaapo Kakko,[-9. 39.],3,07:22,NSH,NYR,NYR,3,NSH,18,1,3,8475168,8481554.0,Matt Duchene Tripping against Kaapo Kakko
66,penalty,Holding the stick,Filip Forsberg,Ryan Pulock,[-78.   4.],1,09:33,NSH,NYI,NYI,2,NSH,18,0,1,8476887,8477506.0,Filip Forsberg Holding the stick against Ryan Pulock
101,penalty,Hooking,Nick Leddy,Colton Sissons,[-64. -28.],1,02:36,NYI,NSH,NYI,2,NSH,18,0,1,8475181,8476925.0,Nick Leddy Hooking against Colton Sissons
127,penalty,Interference,Austin Watson,Derick Brassard,[58.  9.],2,16:49,NSH,NYI,NYI,2,NSH,18,1,1,8475766,8473544.0,Austin Watson Interference against Derick Brassard
149,penalty,Hooking,Anders Lee,Dan Hamhuis,[-48.   3.],2,12:30,NYI,NSH,NYI,2,NSH,18,2,1,8475314,8469465.0,Anders Lee Hooking against Dan Hamhuis
171,penalty,Holding,Mathew Barzal,Dante Fabbro,[-71. -20.],2,08:04,NYI,NSH,NYI,2,NSH,18,3,3,8478445,8479371.0,Mathew Barzal Holding against Dante Fabbro
172,penalty,Hi-sticking,Dante Fabbro,Mathew Barzal,[-72. -15.],2,08:04,NSH,NYI,NYI,2,NSH,18,3,3,8479371,8478445.0,Dante Fabbro Hi-sticking against Mathew Barzal
240,penalty,Interference,Scott Mayfield,Austin Watson,[-69.  39.],3,10:10,NYI,NSH,NYI,2,NSH,18,3,6,8476429,8475766.0,Scott Mayfield Interference against Austin Watson
268,penalty,Charging,Ross Johnston,Jordan Eberle,[-22.  36.],3,04:26,NYI,NSH,NYI,2,NSH,18,3,8,8477527,8474586.0,Ross Johnston Charging against Austin Watson served by Jordan Eberle
269,penalty,Misconduct,Ross Johnston,,[-26.  38.],3,04:26,NYI,NSH,NYI,2,NSH,18,3,8,8477527,,Ross Johnston Misconduct
273,penalty,Roughing,Scott Mayfield,Derick Brassard,[-83.   7.],3,03:55,NYI,NSH,NYI,2,NSH,18,3,8,8476429,8473544.0,Scott Mayfield Roughing against Craig Smith served by Derick Brassard
274,penalty,Roughing,Scott Mayfield,Craig Smith,[-82.   8.],3,03:55,NYI,NSH,NYI,2,NSH,18,3,8,8476429,8475225.0,Scott Mayfield Roughing against Craig Smith
275,penalty,Roughing,Craig Smith,Yakov Trenin,[-80.   9.],3,03:55,NSH,NYI,NYI,2,NSH,18,3,8,8475225,8478508.0,Craig Smith Roughing against Scott Mayfield served by Yakov Trenin
276,penalty,Misconduct,Scott Mayfield,,[-82.   6.],3,03:55,NYI,NSH,NYI,2,NSH,18,3,8,8476429,,Scott Mayfield Misconduct
278,penalty,Misconduct,Craig Smith,,[-83.   5.],3,03:55,NSH,NYI,NYI,2,NSH,18,3,8,8475225,,Craig Smith Misconduct
129,penalty,Holding,Colton Sissons,Artem Anisimov,[-79.   8.],2,18:09,NSH,OTT,OTT,9,NSH,18,0,1,8476925,8473573.0,Colton Sissons Holding against Artem Anisimov
131,penalty,Interference,Thomas Chabot,Calle Jarnkrok,[-23. -18.],2,17:48,OTT,NSH,OTT,9,NSH,18,0,1,8478469,8475714.0,Thomas Chabot Interference against Calle Jarnkrok
165,penalty,Tripping,Roman Josi,Tyler Ennis,[-82.  35.],2,09:01,NSH,OTT,OTT,9,NSH,18,2,1,8474600,8474589.0,Roman Josi Tripping against Tyler Ennis
208,penalty,Slashing,Colin Blackwell,Brady Tkachuk,[ 3. 35.],3,19:35,NSH,OTT,OTT,9,NSH,18,3,1,8476278,8480801.0,Colin Blackwell Slashing against Brady Tkachuk
245,penalty,Tripping,Mark Borowiecki,Kyle Turris,[-71. -35.],3,10:48,OTT,NSH,OTT,9,NSH,18,4,2,8474697,8474068.0,Mark Borowiecki Tripping against Kyle Turris
301,penalty,Holding,Calle Jarnkrok,Erik Brannstrom,[-60.  14.],4,02:44,NSH,OTT,OTT,9,NSH,18,4,4,8475714,8480073.0,Calle Jarnkrok Holding against Erik Brannstrom
1,penalty,Holding,Viktor Arvidsson,Brad Marchand,[48. 36.],1,19:34,NSH,BOS,BOS,6,NSH,18,0,0,8478042,8473419.0,Viktor Arvidsson Holding against Brad Marchand
33,penalty,Slashing,Anders Bjork,Ryan Ellis,[58. 34.],1,12:47,BOS,NSH,BOS,6,NSH,18,0,0,8478075,8475176.0,Anders Bjork Slashing against Ryan Ellis
62,penalty,Tripping,David Krejci,Matt Duchene,[-65.  26.],1,04:50,BOS,NSH,BOS,6,NSH,18,0,0,8471276,8475168.0,David Krejci Tripping against Matt Duchene
106,penalty,Tripping,Dan Hamhuis,Brett Ritchie,[-72. -15.],2,15:37,NSH,BOS,BOS,6,NSH,18,0,0,8469465,8476439.0,Dan Hamhuis Tripping against Brett Ritchie
132,penalty,Slashing,Matt Grzelcyk,Matt Duchene,[81.  7.],2,09:41,BOS,NSH,BOS,6,NSH,18,1,0,8476891,8475168.0,Matt Grzelcyk Slashing against Matt Duchene
138,penalty,Tripping,Craig Smith,Brandon Carlo,[72.  1.],2,08:33,NSH,BOS,BOS,6,NSH,18,1,0,8475225,8478443.0,Craig Smith Tripping against Brandon Carlo
175,penalty,Roughing,Filip Forsberg,Charlie McAvoy,[19. 38.],2,02:04,NSH,BOS,BOS,6,NSH,18,1,1,8476887,8479325.0,Filip Forsberg Roughing against Charlie McAvoy
156,penalty,Delaying Game - Puck over glass,Dante Fabbro,,[ 57. -37.],2,01:19,NSH,ARI,NSH,18,ARI,53,2,1,8479371,,Dante Fabbro Delaying Game - Puck over glass
173,penalty,Interference,Nick Schmaltz,Calle Jarnkrok,[35. 11.],3,15:13,ARI,NSH,NSH,18,ARI,53,2,1,8477951,8475714.0,Nick Schmaltz Interference against Calle Jarnkrok
217,penalty,Holding,Colton Sissons,Nick Schmaltz,[-47.  18.],3,00:25,NSH,ARI,NSH,18,ARI,53,3,2,8476925,8477951.0,Colton Sissons Holding against Nick Schmaltz
42,penalty,Tripping,Nick Bonino,Zach Aston-Reese,[-20.  31.],1,07:45,NSH,PIT,NSH,18,PIT,5,1,1,8474009,8479944.0,Nick Bonino Tripping against Zach Aston-Reese
67,penalty,Tripping,Evgeni Malkin,Viktor Arvidsson,[ 82. -18.],1,03:38,PIT,NSH,NSH,18,PIT,5,1,3,8471215,8478042.0,Evgeni Malkin Tripping against Viktor Arvidsson
197,penalty,Slashing,Mattias Ekholm,Evgeni Malkin,[-71.  -2.],3,11:01,NSH,PIT,NSH,18,PIT,5,1,5,8475218,8471215.0,Mattias Ekholm Slashing against Evgeni Malkin
198,penalty,Roughing,Evgeni Malkin,Mattias Ekholm,[-37. -18.],3,11:01,PIT,NSH,NSH,18,PIT,5,1,5,8471215,8475218.0,Evgeni Malkin Roughing against Mattias Ekholm
199,penalty,Roughing,Bryan Rust,Matt Irwin,[-39. -14.],3,11:01,PIT,NSH,NSH,18,PIT,5,1,5,8475810,8475625.0,Bryan Rust Roughing against Matt Irwin
200,penalty,Roughing,Matt Irwin,Bryan Rust,[-43. -14.],3,11:01,NSH,PIT,NSH,18,PIT,5,1,5,8475625,8475810.0,Matt Irwin Roughing against Bryan Rust
201,penalty,Misconduct,Mattias Ekholm,,[-18. -36.],3,11:01,NSH,PIT,NSH,18,PIT,5,1,5,8475218,,Mattias Ekholm Misconduct
202,penalty,Roughing,Mattias Ekholm,Evgeni Malkin,[-45.   4.],3,11:01,NSH,PIT,NSH,18,PIT,5,1,5,8475218,8471215.0,Mattias Ekholm Roughing against Evgeni Malkin
203,penalty,Roughing,Evgeni Malkin,Mattias Ekholm,[-34.  -9.],3,11:01,PIT,NSH,NSH,18,PIT,5,1,5,8471215,8475218.0,Evgeni Malkin Roughing against Mattias Ekholm
229,penalty,Tripping,Evgeni Malkin,Rocco Grimaldi,[-92. -23.],3,04:37,PIT,NSH,NSH,18,PIT,5,2,5,8471215,8476428.0,Evgeni Malkin Tripping against Rocco Grimaldi
42,penalty,Hi-sticking,Kyle Turris,John Marino,[-98.  12.],1,11:59,NSH,PIT,PIT,5,NSH,18,2,0,8474068,8478507.0,Kyle Turris Hi-sticking against John Marino
112,penalty,Hi-sticking,Sam Lafferty,Mattias Ekholm,[-71.   2.],2,16:19,PIT,NSH,PIT,5,NSH,18,3,0,8478043,8475218.0,Sam Lafferty Hi-sticking against Mattias Ekholm
119,penalty,Hooking,Kyle Turris,Evgeni Malkin,[ 54. -27.],2,15:29,NSH,PIT,PIT,5,NSH,18,3,1,8474068,8471215.0,Kyle Turris Hooking against Evgeni Malkin
124,penalty,Too many men on the ice,Craig Smith,,[14. 39.],2,13:07,NSH,PIT,PIT,5,NSH,18,3,1,8475225,,Too many men/ice served by Craig Smith
216,penalty,Hooking,Evgeni Malkin,Matt Duchene,[-67.  20.],3,15:23,PIT,NSH,PIT,5,NSH,18,4,3,8471215,8475168.0,Evgeni Malkin Hooking against Matt Duchene
278,penalty,Interference - Goalkeeper,Austin Watson,Matt Murray,[-83.   0.],3,01:26,NSH,PIT,PIT,5,NSH,18,4,4,8475766,8476899.0,Austin Watson Interference - Goalkeeper against Matt Murray
17,penalty,Elbowing,Corey Perry,Alexander Radulov,[39. -3.],1,17:16,DAL,NSH,DAL,25,NSH,18,0,0,8470621,8471228.0,Corey Perry Elbowing against Ryan Ellis served by Alexander Radulov
18,penalty,Game misconduct,Corey Perry,Ryan Ellis,[34. -5.],1,17:16,DAL,NSH,DAL,25,NSH,18,0,0,8470621,8475176.0,Corey Perry Game misconduct against Ryan Ellis
24,penalty,Delaying Game - Puck over glass,Blake Comeau,,[76. 39.],1,15:38,DAL,NSH,DAL,25,NSH,18,0,0,8471260,,Blake Comeau Delaying Game - Puck over glass
42,penalty,PS - Tripping on breakaway,Matt Irwin,Denis Gurianov,[-61.  -5.],1,11:22,NSH,DAL,DAL,25,NSH,18,0,2,8475625,8478495.0,Matt Irwin PS - Tripping on breakaway against Denis Gurianov
58,penalty,Roughing,Radek Faksa,Colin Blackwell,[-54. -39.],1,08:33,DAL,NSH,DAL,25,NSH,18,0,2,8476889,8476278.0,Radek Faksa Roughing against Colin Blackwell
59,penalty,Roughing,Colin Blackwell,Radek Faksa,[-60. -39.],1,08:33,NSH,DAL,DAL,25,NSH,18,0,2,8476278,8476889.0,Colin Blackwell Roughing against Radek Faksa
155,penalty,Boarding,Tyler Seguin,Austin Watson,[ 20. -38.],2,09:00,DAL,NSH,DAL,25,NSH,18,0,2,8475794,8475766.0,Tyler Seguin Boarding against Austin Watson
187,penalty,Cross checking,Roman Josi,Joe Pavelski,[ 98. -15.],2,03:16,NSH,DAL,DAL,25,NSH,18,0,2,8474600,8470794.0,Roman Josi Cross checking against Joe Pavelski
200,penalty,Delaying Game - Puck over glass,Colin Blackwell,,[ 45. -40.],2,00:49,NSH,DAL,DAL,25,NSH,18,1,2,8476278,,Colin Blackwell Delaying Game - Puck over glass
231,penalty,Hooking,Ryan Johansen,Miro Heiskanen,[-78.  39.],3,16:18,NSH,DAL,DAL,25,NSH,18,2,2,8475793,8480036.0,Ryan Johansen Hooking against Miro Heiskanen
16,penalty,Holding,Calle Jarnkrok,Blake Lizotte,[-91.  32.],1,16:44,NSH,LAK,LAK,26,NSH,18,0,0,8475714,8481481.0,Calle Jarnkrok Holding against Blake Lizotte
67,penalty,Delaying Game - Puck over glass,Austin Wagner,,[ 69. -38.],1,06:40,LAK,NSH,LAK,26,NSH,18,0,1,8478455,,Austin Wagner Delaying Game - Puck over glass
72,penalty,Holding the stick,Mikael Granlund,Matt Roy,[85. 38.],1,05:36,NSH,LAK,LAK,26,NSH,18,0,1,8475798,8478911.0,Mikael Granlund Holding the stick against Matt Roy
95,penalty,Fighting,Kyle Clifford,Jarred Tinordi,[-40.  15.],1,00:44,LAK,NSH,LAK,26,NSH,18,0,2,8475160,8475797.0,Kyle Clifford Fighting against Jarred Tinordi
96,penalty,Fighting,Jarred Tinordi,Kyle Clifford,[-36.  21.],1,00:44,NSH,LAK,LAK,26,NSH,18,0,2,8475797,8475160.0,Jarred Tinordi Fighting against Kyle Clifford
104,penalty,Slashing,Martin Frk,Mikael Granlund,[-13.  29.],2,17:44,LAK,NSH,LAK,26,NSH,18,0,2,8476924,8475798.0,Martin Frk Slashing against Mikael Granlund
122,penalty,Interference,Craig Smith,Adrian Kempe,[66. 10.],2,14:27,NSH,LAK,LAK,26,NSH,18,0,2,8475225,8477960.0,Craig Smith Interference against Adrian Kempe
156,penalty,Slashing,Blake Lizotte,Roman Josi,[  9. -26.],2,06:41,LAK,NSH,LAK,26,NSH,18,1,2,8481481,8474600.0,Blake Lizotte Slashing against Roman Josi
241,penalty,Tripping,Ben Hutton,Colin Blackwell,[57. 14.],3,07:00,LAK,NSH,LAK,26,NSH,18,1,4,8477018,8476278.0,Ben Hutton Tripping against Colin Blackwell
246,penalty,Delaying Game - Puck over glass,Matt Roy,,[ 55. -20.],3,05:39,LAK,NSH,LAK,26,NSH,18,1,4,8478911,,Matt Roy Delaying Game - Puck over glass
248,penalty,Hooking,Nick Bonino,Alex Iafallo,[52. 37.],3,05:12,NSH,LAK,LAK,26,NSH,18,1,4,8474009,8480113.0,Nick Bonino Hooking against Alex Iafallo
1,penalty,Fighting,Austin Watson,Nicolas Deslauriers,[29. 24.],1,19:57,NSH,ANA,ANA,24,NSH,18,0,0,8475766,8475235.0,Austin Watson Fighting against Nicolas Deslauriers
2,penalty,Fighting,Nicolas Deslauriers,Austin Watson,[45. 27.],1,19:57,ANA,NSH,ANA,24,NSH,18,0,0,8475235,8475766.0,Nicolas Deslauriers Fighting against Austin Watson
89,penalty,Embellishment,Viktor Arvidsson,Max Jones,[26. 31.],1,00:45,NSH,ANA,ANA,24,NSH,18,1,1,8478042,8479368.0,Viktor Arvidsson Embellishment against Max Jones
90,penalty,Interference,Max Jones,Viktor Arvidsson,[ 8. 39.],1,00:45,ANA,NSH,ANA,24,NSH,18,1,1,8479368,8478042.0,Max Jones Interference against Viktor Arvidsson
105,penalty,Interference,Cam Fowler,Filip Forsberg,[ 91. -18.],2,18:02,ANA,NSH,ANA,24,NSH,18,1,1,8475764,8476887.0,Cam Fowler Interference against Filip Forsberg
130,penalty,Interference,Kyle Turris,Daniel Sprong,[75. 18.],2,13:24,NSH,ANA,ANA,24,NSH,18,1,2,8474068,8478466.0,Kyle Turris Interference against Daniel Sprong
136,penalty,Tripping,Filip Forsberg,Ryan Getzlaf,[-69.  32.],2,11:52,NSH,ANA,ANA,24,NSH,18,1,2,8476887,8470612.0,Filip Forsberg Tripping against Ryan Getzlaf
156,penalty,Tripping,Ryan Johansen,Isac Lundestrom,[-87.  36.],2,06:59,NSH,ANA,ANA,24,NSH,18,2,2,8475793,8480806.0,Ryan Johansen Tripping against Isac Lundestrom
169,penalty,Holding,Alexandre Carrier,Jakob Silfverberg,[ 20. -38.],2,03:54,NSH,ANA,ANA,24,NSH,18,3,2,8478851,8475164.0,Alexandre Carrier Holding against Jakob Silfverberg
188,penalty,Holding,Max Comtois,Roman Josi,[ 40. -38.],3,19:02,ANA,NSH,ANA,24,NSH,18,4,2,8480031,8474600.0,Max Comtois Holding against Roman Josi
265,penalty,Too many men on the ice,Rocco Grimaldi,,[ 7. 37.],3,02:30,NSH,ANA,ANA,24,NSH,18,4,4,8476428,,Too many men/ice served by Rocco Grimaldi
2,penalty,Cross checking,Brad Marchand,Viktor Arvidsson,[ 61. -16.],1,19:46,BOS,NSH,NSH,18,BOS,6,0,0,8473419,8478042.0,Brad Marchand Cross checking against Viktor Arvidsson
4,penalty,Embellishment,Viktor Arvidsson,Brad Marchand,[ 75. -28.],1,19:46,NSH,BOS,NSH,18,BOS,6,0,0,8478042,8473419.0,Viktor Arvidsson Embellishment against Brad Marchand
26,penalty,Boarding,Sean Kuraly,Matt Duchene,[-93.  26.],1,13:50,BOS,NSH,NSH,18,BOS,6,0,1,8476374,8475168.0,Sean Kuraly Boarding against Matt Duchene
78,penalty,Too many men on the ice,Brett Ritchie,,[ 9. 37.],2,17:41,BOS,NSH,NSH,18,BOS,6,0,1,8476439,,Too many men/ice served by Brett Ritchie
117,penalty,Tripping,Brandon Carlo,Viktor Arvidsson,[-41. -23.],2,10:59,BOS,NSH,NSH,18,BOS,6,0,2,8478443,8478042.0,Brandon Carlo Tripping against Viktor Arvidsson
122,penalty,Hi-sticking,Matt Grzelcyk,Craig Smith,[-90.  10.],2,09:32,BOS,NSH,NSH,18,BOS,6,0,2,8476891,8475225.0,Matt Grzelcyk Hi-sticking against Craig Smith
150,penalty,Too many men on the ice,Kyle Turris,,[12. 36.],2,03:31,NSH,BOS,NSH,18,BOS,6,1,2,8474068,,Too many men/ice served by Kyle Turris
