,event,penalty,penalty_on,drew_by,coords,period,period_time_remaining,penalty_team,drew_by_team,home_team,home_team_id,away_team,away_team_id,home_goals,away_goals,penalty_on_id,drew_by_id,description
182,penalty,Tripping,Rocco Grimaldi,Zdeno Chara,[96. 19.],3,16:08,NSH,BOS,NSH,18,BOS,6,1,4,8476428,8465009.0,Rocco Grimaldi Tripping against Zdeno Chara
207,penalty,Roughing,Zdeno Chara,Brett Ritchie,[95. -3.],3,08:20,BOS,NSH,NSH,18,BOS,6,1,4,8465009,8476439.0,Zdeno Chara Roughing against Yakov Trenin served by Brett Ritchie
208,penalty,Fighting,Yakov Trenin,Zdeno Chara,[94.  7.],3,08:20,NSH,BOS,NSH,18,BOS,6,1,4,8478508,8465009.0,Yakov Trenin Fighting against Zdeno Chara
209,penalty,Fighting,Zdeno Chara,Yakov Trenin,[95. 10.],3,08:20,BOS,NSH,NSH,18,BOS,6,1,4,8465009,8478508.0,Zdeno Chara Fighting against Yakov Trenin
211,penalty,Hooking,John Moore,Viktor Arvidsson,[84. -9.],3,08:16,BOS,NSH,NSH,18,BOS,6,1,4,8475186,8478042.0,John Moore Hooking against Viktor Arvidsson
234,penalty,Hooking,Roman Josi,Par Lindholm,[-28.  -1.],3,04:22,NSH,BOS,NSH,18,BOS,6,1,4,8474600,8480944.0,Roman Josi Hooking against Par Lindholm
241,penalty,Tripping,Charlie Coyle,Mikael Granlund,[-16.  21.],3,02:14,BOS,NSH,NSH,18,BOS,6,1,4,8475745,8475798.0,Charlie Coyle Tripping against Mikael Granlund
95,penalty,Too many men on the ice,John Quenneville,,[ 9. 37.],1,00:46,CHI,NSH,CHI,16,NSH,18,0,3,8477961,,Too many men/ice served by John Quenneville
138,penalty,Hi-sticking,Olli Maatta,Matt Duchene,[97. -7.],2,12:44,CHI,NSH,CHI,16,NSH,18,1,3,8476874,8475168.0,Olli Maatta Hi-sticking against Matt Duchene
164,penalty,Holding,Jarred Tinordi,Dominik Kubalik,[95. -8.],2,07:48,NSH,CHI,CHI,16,NSH,18,1,3,8475797,8477330.0,Jarred Tinordi Holding against Dominik Kubalik
223,penalty,Hooking,Roman Josi,Jonathan Toews,[-96.   9.],3,15:17,NSH,CHI,CHI,16,NSH,18,1,3,8474600,8473604.0,Roman Josi Hooking against Jonathan Toews
249,penalty,Tripping,Nick Bonino,Matthew Highmore,[78.  0.],3,10:19,NSH,CHI,CHI,16,NSH,18,2,3,8474009,8478146.0,Nick Bonino Tripping against Matthew Highmore
20,penalty,Kneeing,Dmitry Kulikov,Roman Josi,[25. -6.],1,16:06,WPG,NSH,WPG,52,NSH,18,0,0,8475179,8474600.0,Dmitry Kulikov Kneeing against Roman Josi
101,penalty,Hooking,Roman Josi,Kyle Connor,[63. -4.],2,16:57,NSH,WPG,WPG,52,NSH,18,0,1,8474600,8478398.0,Roman Josi Hooking against Kyle Connor
221,penalty,Hooking,Matt Duchene,Mark Scheifele,[56. 31.],3,11:41,NSH,WPG,WPG,52,NSH,18,0,1,8475168,8476460.0,Matt Duchene Hooking against Mark Scheifele
65,penalty,Tripping,Darnell Nurse,Yakov Trenin,[-32.  37.],1,06:59,EDM,NSH,EDM,22,NSH,18,1,1,8477498,8478508.0,Darnell Nurse Tripping against Yakov Trenin
90,penalty,Hooking,Yannick Weber,Kailer Yamamoto,[80. 12.],1,01:09,NSH,EDM,EDM,22,NSH,18,1,2,8474134,8479977.0,Yannick Weber Hooking against Kailer Yamamoto
177,penalty,Hi-sticking,Mikael Granlund,Gaetan Haas,[48. 12.],2,02:08,NSH,EDM,EDM,22,NSH,18,3,2,8475798,8481813.0,Mikael Granlund Hi-sticking against Gaetan Haas
179,penalty,Slashing,James Neal,Calle Jarnkrok,[-50. -16.],2,01:47,EDM,NSH,EDM,22,NSH,18,3,2,8471707,8475714.0,James Neal Slashing against Calle Jarnkrok
225,penalty,Interference,Kailer Yamamoto,Matt Duchene,[-10.   1.],3,11:34,EDM,NSH,EDM,22,NSH,18,3,2,8479977,8475168.0,Kailer Yamamoto Interference against Matt Duchene
236,penalty,Interference,Rocco Grimaldi,Joakim Nygard,[ 5. 27.],3,08:18,NSH,EDM,EDM,22,NSH,18,3,2,8476428,8481638.0,Rocco Grimaldi Interference against Joakim Nygard
267,penalty,Too many men on the ice,Calle Jarnkrok,,[-15.  33.],3,01:23,NSH,EDM,EDM,22,NSH,18,3,2,8475714,,Too many men/ice served by Calle Jarnkrok
53,penalty,Hooking,Dante Fabbro,Chase De Leo,[-77.   0.],1,08:15,NSH,ANA,NSH,18,ANA,24,0,1,8479371,8478029.0,Dante Fabbro Hooking against Chase De Leo
178,penalty,Holding,Nicolas Deslauriers,Dante Fabbro,[-96.   0.],3,13:38,ANA,NSH,NSH,18,ANA,24,1,3,8475235,8479371.0,Nicolas Deslauriers Holding against Dante Fabbro
201,penalty,Too many men on the ice,Rocco Grimaldi,,[-14.  37.],3,05:24,NSH,ANA,NSH,18,ANA,24,1,4,8476428,,Too many men/ice served by Rocco Grimaldi
12,penalty,Tripping,Colin Blackwell,Lawrence Pilut,[ 52. -16.],1,17:52,NSH,BUF,NSH,18,BUF,7,0,0,8476278,8480935.0,Colin Blackwell Tripping against Lawrence Pilut
27,penalty,Interference,Rasmus Dahlin,Kyle Turris,[-25. -35.],1,12:46,BUF,NSH,NSH,18,BUF,7,0,0,8480839,8474068.0,Rasmus Dahlin Interference against Kyle Turris
125,penalty,Cross checking,Calle Jarnkrok,Brandon Montour,[-85.   2.],2,10:13,NSH,BUF,NSH,18,BUF,7,1,1,8475714,8477986.0,Calle Jarnkrok Cross checking against Brandon Montour
166,penalty,Tripping,Yannick Weber,Marcus Johansson,[32. 37.],3,19:16,NSH,BUF,NSH,18,BUF,7,1,1,8474134,8475149.0,Yannick Weber Tripping against Marcus Johansson
208,penalty,Tripping,Jack Eichel,Matt Duchene,[ 63. -29.],3,06:36,BUF,NSH,NSH,18,BUF,7,1,1,8478403,8475168.0,Jack Eichel Tripping against Matt Duchene
233,penalty,Slashing,Rasmus Dahlin,Rocco Grimaldi,[66. -1.],3,02:46,BUF,NSH,NSH,18,BUF,7,2,1,8480839,8476428.0,Rasmus Dahlin Slashing against Rocco Grimaldi
122,penalty,Hooking,Nick Bonino,Auston Matthews,[74. 14.],2,09:49,NSH,TOR,NSH,18,TOR,10,1,3,8474009,8479318.0,Nick Bonino Hooking against Auston Matthews
146,penalty,Interference,Justin Holl,Roman Josi,[-57. -38.],2,03:23,TOR,NSH,NSH,18,TOR,10,1,4,8475718,8474600.0,Justin Holl Interference against Roman Josi
150,penalty,Hooking,Kyle Turris,Mitchell Marner,[-84.  -8.],2,02:43,NSH,TOR,NSH,18,TOR,10,1,4,8474068,8478483.0,Kyle Turris Hooking against Mitchell Marner
37,penalty,Hi-sticking,Jarred Tinordi,Garnet Hathaway,[-75.   7.],1,13:19,NSH,WSH,WSH,15,NSH,18,0,0,8475797,8477903.0,Jarred Tinordi Hi-sticking against Garnet Hathaway
57,penalty,Holding,Dmitry Orlov,Filip Forsberg,[32. -1.],1,08:58,WSH,NSH,WSH,15,NSH,18,1,1,8475200,8476887.0,Dmitry Orlov Holding against Filip Forsberg
86,penalty,Hooking,Kyle Turris,Dmitry Orlov,[ 69. -15.],1,02:25,NSH,WSH,WSH,15,NSH,18,2,3,8474068,8475200.0,Kyle Turris Hooking against Dmitry Orlov
123,penalty,Hooking,Matt Duchene,John Carlson,[ 32. -38.],2,17:41,NSH,WSH,WSH,15,NSH,18,2,3,8475168,8474590.0,Matt Duchene Hooking against John Carlson
159,penalty,Hi-sticking,Mattias Ekholm,Tom Wilson,[86. 31.],2,10:44,NSH,WSH,WSH,15,NSH,18,3,3,8475218,8476880.0,Mattias Ekholm Hi-sticking against Tom Wilson
180,penalty,Hooking,Garnet Hathaway,Colin Blackwell,[-16. -31.],2,04:23,WSH,NSH,WSH,15,NSH,18,4,3,8477903,8476278.0,Garnet Hathaway Hooking against Colin Blackwell
197,penalty,Roughing,Richard Panik,Ryan Johansen,[ 11. -27.],3,19:25,WSH,NSH,WSH,15,NSH,18,4,3,8475209,8475793.0,Richard Panik Roughing against Ryan Johansen
198,penalty,Slashing,Ryan Johansen,Richard Panik,[-13. -18.],3,19:25,NSH,WSH,WSH,15,NSH,18,4,3,8475793,8475209.0,Ryan Johansen Slashing against Richard Panik
202,penalty,Hi-sticking,Viktor Arvidsson,Tom Wilson,[-13.  -6.],3,18:03,NSH,WSH,WSH,15,NSH,18,4,3,8478042,8476880.0,Viktor Arvidsson Hi-sticking against Tom Wilson
231,penalty,Slashing,Jakub Vrana,Yannick Weber,[-30.  14.],3,08:45,WSH,NSH,WSH,15,NSH,18,4,4,8477944,8474134.0,Jakub Vrana Slashing against Yannick Weber
260,penalty,Hooking,Lars Eller,Jarred Tinordi,[-95.  23.],3,03:57,WSH,NSH,WSH,15,NSH,18,4,5,8474189,8475797.0,Lars Eller Hooking against Jarred Tinordi
10,penalty,Hi-sticking,Colton Sissons,John Hayden,[ 55. -33.],1,17:07,NSH,NJD,NJD,1,NSH,18,0,1,8476925,8477401.0,Colton Sissons Hi-sticking against John Hayden
15,penalty,Tripping,Damon Severson,Kyle Turris,[32. 38.],1,15:38,NJD,NSH,NJD,1,NSH,18,0,1,8476923,8474068.0,Damon Severson Tripping against Kyle Turris
83,penalty,Holding,Blake Coleman,Dante Fabbro,[-89. -30.],2,18:27,NJD,NSH,NJD,1,NSH,18,1,2,8476399,8479371.0,Blake Coleman Holding against Dante Fabbro
104,penalty,Hooking,Ryan Johansen,Nikita Gusev,[-68.  10.],2,13:02,NSH,NJD,NJD,1,NSH,18,1,2,8475793,8477038.0,Ryan Johansen Hooking against Nikita Gusev
113,penalty,Hi-sticking,Matt Duchene,Nikita Gusev,[-71. -22.],2,10:01,NSH,NJD,NJD,1,NSH,18,2,2,8475168,8477038.0,Matt Duchene Hi-sticking against Nikita Gusev
190,penalty,Hooking,Wayne Simmonds,Colton Sissons,[-76. -30.],3,10:40,NJD,NSH,NJD,1,NSH,18,5,4,8474190,8476925.0,Wayne Simmonds Hooking against Colton Sissons
