,event,hitter,hittee,coords,period,period_time_remaining,hitter_team,hittee_team,home_team,home_team_id,away_team,away_team_id,home_goals,away_goals,hitter_id,hittee_id,description
215,hit,Jake Muzzin,Jaden Schwartz,[ 32. -39.],3,04:00,TOR,STL,STL,19,TOR,10,2,5,8474162,8475768.0,Jake Muzzin hit Jaden Schwartz
220,hit,Colton Parayko,Ilya Mikheyev,[-75. -40.],3,02:25,STL,TOR,STL,19,TOR,10,2,5,8476892,8481624.0,Colton Parayko hit Ilya Mikheyev
223,hit,Jacob de la Rose,Justin Holl,[60. 41.],3,02:07,STL,TOR,STL,19,TOR,10,2,5,8477455,8475718.0,Jacob de la Rose hit Justin Holl
1,hit,Christopher Tanev,Zach Hyman,[ 6. 40.],1,19:32,VAN,TOR,VAN,23,TOR,10,0,0,8475690,8475786.0,Christopher Tanev hit Zach Hyman
7,hit,Kasperi Kapanen,Troy Stecher,[97. 22.],1,17:49,TOR,VAN,VAN,23,TOR,10,0,0,8477953,8479442.0,Kasperi Kapanen hit Troy Stecher
11,hit,Jake Muzzin,Brock Boeser,[-8. 23.],1,16:36,TOR,VAN,VAN,23,TOR,10,0,0,8474162,8478444.0,Jake Muzzin hit Brock Boeser
18,hit,Bo Horvat,Justin Holl,[-98. -20.],1,14:43,VAN,TOR,VAN,23,TOR,10,0,0,8477500,8475718.0,Bo Horvat hit Justin Holl
29,hit,Micheal Ferland,Cody Ceci,[-38. -41.],1,11:36,VAN,TOR,VAN,23,TOR,10,0,0,8475907,8476879.0,Micheal Ferland hit Cody Ceci
30,hit,Micheal Ferland,Alexander Kerfoot,[-92. -20.],1,11:24,VAN,TOR,VAN,23,TOR,10,0,0,8475907,8477021.0,Micheal Ferland hit Alexander Kerfoot
45,hit,Micheal Ferland,John Tavares,[98. -1.],1,07:05,VAN,TOR,VAN,23,TOR,10,0,0,8475907,8475166.0,Micheal Ferland hit John Tavares
49,hit,Antoine Roussel,Tyson Barrie,[-99.   0.],1,05:53,VAN,TOR,VAN,23,TOR,10,0,0,8474849,8475197.0,Antoine Roussel hit Tyson Barrie
50,hit,J.T. Miller,Cody Ceci,[-23. -40.],1,04:48,VAN,TOR,VAN,23,TOR,10,0,0,8476468,8476879.0,J.T. Miller hit Cody Ceci
56,hit,Tyler Myers,Zach Hyman,[98.  4.],1,03:50,VAN,TOR,VAN,23,TOR,10,0,0,8474574,8475786.0,Tyler Myers hit Zach Hyman
76,hit,Tanner Pearson,Tyson Barrie,[90. 32.],2,19:18,VAN,TOR,VAN,23,TOR,10,0,0,8476871,8475197.0,Tanner Pearson hit Tyson Barrie
89,hit,Zach Hyman,Quinn Hughes,[-8. 40.],2,16:53,TOR,VAN,VAN,23,TOR,10,0,1,8475786,8480800.0,Zach Hyman hit Quinn Hughes
97,hit,Kasperi Kapanen,Troy Stecher,[-87. -34.],2,14:48,TOR,VAN,VAN,23,TOR,10,0,1,8477953,8479442.0,Kasperi Kapanen hit Troy Stecher
102,hit,Christopher Tanev,Zach Hyman,[-97.  -7.],2,13:03,VAN,TOR,VAN,23,TOR,10,0,1,8475690,8475786.0,Christopher Tanev hit Zach Hyman
125,hit,Jake Virtanen,Travis Dermott,[90. 33.],2,05:59,VAN,TOR,VAN,23,TOR,10,0,1,8477937,8478408.0,Jake Virtanen hit Travis Dermott
127,hit,Brock Boeser,Cody Ceci,[51. 40.],2,04:56,VAN,TOR,VAN,23,TOR,10,0,1,8478444,8476879.0,Brock Boeser hit Cody Ceci
130,hit,Justin Holl,Josh Leivo,[97.  2.],2,03:59,TOR,VAN,VAN,23,TOR,10,0,1,8475718,8476410.0,Justin Holl hit Josh Leivo
143,hit,Tyler Myers,Mitchell Marner,[ 27. -32.],2,00:44,VAN,TOR,VAN,23,TOR,10,0,1,8474574,8478483.0,Tyler Myers hit Mitchell Marner
163,hit,Tanner Pearson,Tyson Barrie,[ 44. -40.],3,14:04,VAN,TOR,VAN,23,TOR,10,0,2,8476871,8475197.0,Tanner Pearson hit Tyson Barrie
178,hit,Brock Boeser,Pontus Aberg,[ -4. -42.],3,09:11,VAN,TOR,VAN,23,TOR,10,0,2,8478444,8476857.0,Brock Boeser hit Pontus Aberg
186,hit,Morgan Rielly,Josh Leivo,[-91.  28.],3,07:26,TOR,VAN,VAN,23,TOR,10,1,2,8476853,8476410.0,Morgan Rielly hit Josh Leivo
194,hit,Morgan Rielly,Josh Leivo,[-96. -14.],3,05:29,TOR,VAN,VAN,23,TOR,10,1,2,8476853,8476410.0,Morgan Rielly hit Josh Leivo
202,hit,Morgan Rielly,Antoine Roussel,[28. 32.],3,03:39,TOR,VAN,VAN,23,TOR,10,1,3,8476853,8474849.0,Morgan Rielly hit Antoine Roussel
10,hit,Michael Stone,Jason Spezza,[97.  8.],1,17:53,CGY,TOR,CGY,20,TOR,10,0,0,8474628,8469455.0,Michael Stone hit Jason Spezza
13,hit,Zach Hyman,Mark Giordano,[94. 22.],1,16:55,TOR,CGY,CGY,20,TOR,10,0,0,8475786,8470966.0,Zach Hyman hit Mark Giordano
16,hit,Travis Dermott,Dillon Dube,[-11. -26.],1,15:47,TOR,CGY,CGY,20,TOR,10,0,0,8478408,8479346.0,Travis Dermott hit Dillon Dube
17,hit,Dillon Dube,Travis Dermott,[-38.  35.],1,15:42,CGY,TOR,CGY,20,TOR,10,0,0,8479346,8478408.0,Dillon Dube hit Travis Dermott
22,hit,Milan Lucic,Nic Petan,[ 80. -38.],1,14:39,CGY,TOR,CGY,20,TOR,10,0,0,8473473,8477464.0,Milan Lucic hit Nic Petan
27,hit,Mark Jankowski,Jake Muzzin,[-84. -34.],1,13:40,CGY,TOR,CGY,20,TOR,10,0,0,8476873,8474162.0,Mark Jankowski hit Jake Muzzin
42,hit,Milan Lucic,Cody Ceci,[-81. -37.],1,10:40,CGY,TOR,CGY,20,TOR,10,0,1,8473473,8476879.0,Milan Lucic hit Cody Ceci
51,hit,Sean Monahan,Justin Holl,[-94.  22.],1,08:51,CGY,TOR,CGY,20,TOR,10,0,1,8477497,8475718.0,Sean Monahan hit Justin Holl
60,hit,Kasperi Kapanen,Michael Frolik,[87. 24.],1,06:53,TOR,CGY,CGY,20,TOR,10,0,1,8477953,8473564.0,Kasperi Kapanen hit Michael Frolik
66,hit,Pierre Engvall,Milan Lucic,[-74. -40.],1,05:33,TOR,CGY,CGY,20,TOR,10,0,1,8478115,8473473.0,Pierre Engvall hit Milan Lucic
68,hit,Sean Monahan,Auston Matthews,[-59. -37.],1,05:07,CGY,TOR,CGY,20,TOR,10,0,1,8477497,8479318.0,Sean Monahan hit Auston Matthews
100,hit,Noah Hanifin,Morgan Rielly,[-76.  41.],2,18:38,CGY,TOR,CGY,20,TOR,10,1,1,8478396,8476853.0,Noah Hanifin hit Morgan Rielly
101,hit,Tyson Barrie,Elias Lindholm,[97.  2.],2,18:34,TOR,CGY,CGY,20,TOR,10,1,1,8475197,8477496.0,Tyson Barrie hit Elias Lindholm
106,hit,Milan Lucic,Pierre Engvall,[ 82. -37.],2,17:05,CGY,TOR,CGY,20,TOR,10,1,1,8473473,8478115.0,Milan Lucic hit Pierre Engvall
121,hit,Milan Lucic,John Tavares,[-18. -41.],2,14:03,CGY,TOR,CGY,20,TOR,10,1,1,8473473,8475166.0,Milan Lucic hit John Tavares
133,hit,Dillon Dube,Jason Spezza,[ 40. -30.],2,11:32,CGY,TOR,CGY,20,TOR,10,1,1,8479346,8469455.0,Dillon Dube hit Jason Spezza
137,hit,Milan Lucic,Cody Ceci,[ 97. -22.],2,10:58,CGY,TOR,CGY,20,TOR,10,1,1,8473473,8476879.0,Milan Lucic hit Cody Ceci
146,hit,Jake Muzzin,Sean Monahan,[ 98. -20.],2,07:29,TOR,CGY,CGY,20,TOR,10,1,1,8474162,8477497.0,Jake Muzzin hit Sean Monahan
160,hit,Elias Lindholm,Jake Muzzin,[ 99. -16.],2,03:47,CGY,TOR,CGY,20,TOR,10,1,2,8477496,8474162.0,Elias Lindholm hit Jake Muzzin
163,hit,Jake Muzzin,Matthew Tkachuk,[ 70. -11.],2,03:27,TOR,CGY,CGY,20,TOR,10,1,2,8474162,8479314.0,Jake Muzzin hit Matthew Tkachuk
164,hit,Matthew Tkachuk,William Nylander,[-36.  40.],2,03:20,CGY,TOR,CGY,20,TOR,10,1,2,8479314,8477939.0,Matthew Tkachuk hit William Nylander
165,hit,Elias Lindholm,Auston Matthews,[ 85. -32.],2,03:18,CGY,TOR,CGY,20,TOR,10,1,2,8477496,8479318.0,Elias Lindholm hit Auston Matthews
177,hit,Matthew Tkachuk,Jake Muzzin,[40. 40.],2,00:34,CGY,TOR,CGY,20,TOR,10,1,2,8479314,8474162.0,Matthew Tkachuk hit Jake Muzzin
179,hit,Justin Holl,Matthew Tkachuk,[98. -1.],2,00:11,TOR,CGY,CGY,20,TOR,10,1,2,8475718,8479314.0,Justin Holl hit Matthew Tkachuk
187,hit,Jake Muzzin,Andrew Mangiapane,[-86.   6.],3,19:18,TOR,CGY,CGY,20,TOR,10,2,2,8474162,8478233.0,Jake Muzzin hit Andrew Mangiapane
188,hit,Justin Holl,Matthew Tkachuk,[-85. -35.],3,19:15,TOR,CGY,CGY,20,TOR,10,2,2,8475718,8479314.0,Justin Holl hit Matthew Tkachuk
195,hit,Mikael Backlund,Jake Muzzin,[-95.  27.],3,17:45,CGY,TOR,CGY,20,TOR,10,3,2,8474150,8474162.0,Mikael Backlund hit Jake Muzzin
228,hit,Milan Lucic,Justin Holl,[-82. -34.],3,12:45,CGY,TOR,CGY,20,TOR,10,4,2,8473473,8475718.0,Milan Lucic hit Justin Holl
234,hit,Kasperi Kapanen,Mikael Backlund,[-15. -41.],3,11:15,TOR,CGY,CGY,20,TOR,10,4,2,8477953,8474150.0,Kasperi Kapanen hit Mikael Backlund
239,hit,Zach Hyman,Rasmus Andersson,[23. 41.],3,09:41,TOR,CGY,CGY,20,TOR,10,4,2,8475786,8478397.0,Zach Hyman hit Rasmus Andersson
243,hit,Dillon Dube,Alexander Kerfoot,[-72. -37.],3,08:57,CGY,TOR,CGY,20,TOR,10,4,2,8479346,8477021.0,Dillon Dube hit Alexander Kerfoot
251,hit,Mikael Backlund,Travis Dermott,[-94.  28.],3,05:48,CGY,TOR,CGY,20,TOR,10,4,2,8474150,8478408.0,Mikael Backlund hit Travis Dermott
261,hit,Rasmus Andersson,Mitchell Marner,[ 74. -40.],3,04:03,CGY,TOR,CGY,20,TOR,10,4,2,8478397,8478483.0,Rasmus Andersson hit Mitchell Marner
273,hit,Mikael Backlund,Morgan Rielly,[ 92. -28.],3,00:21,CGY,TOR,CGY,20,TOR,10,4,2,8474150,8476853.0,Mikael Backlund hit Morgan Rielly
1,hit,Josh Archibald,Morgan Rielly,[96. -7.],1,19:47,EDM,TOR,EDM,22,TOR,10,0,0,8476326,8476853.0,Josh Archibald hit Morgan Rielly
4,hit,Morgan Rielly,Josh Archibald,[ -3. -38.],1,19:22,TOR,EDM,EDM,22,TOR,10,0,0,8476853,8476326.0,Morgan Rielly hit Josh Archibald
12,hit,Justin Holl,Connor McDavid,[69. 39.],1,18:33,TOR,EDM,EDM,22,TOR,10,0,0,8475718,8478402.0,Justin Holl hit Connor McDavid
18,hit,Markus Granlund,Travis Dermott,[ 35. -40.],1,17:23,EDM,TOR,EDM,22,TOR,10,0,0,8476440,8478408.0,Markus Granlund hit Travis Dermott
36,hit,Ethan Bear,Justin Holl,[98. 13.],1,13:54,EDM,TOR,EDM,22,TOR,10,0,1,8478451,8475718.0,Ethan Bear hit Justin Holl
49,hit,Josh Archibald,Jake Muzzin,[-11. -39.],1,10:57,EDM,TOR,EDM,22,TOR,10,0,1,8476326,8474162.0,Josh Archibald hit Jake Muzzin
53,hit,Dmytro Timashov,Oscar Klefbom,[-98.  -4.],1,10:03,TOR,EDM,EDM,22,TOR,10,0,1,8478857,8476472.0,Dmytro Timashov hit Oscar Klefbom
58,hit,Leon Draisaitl,John Tavares,[ 67. -41.],1,08:16,EDM,TOR,EDM,22,TOR,10,0,1,8477934,8475166.0,Leon Draisaitl hit John Tavares
60,hit,Darnell Nurse,Zach Hyman,[-96.   4.],1,07:59,EDM,TOR,EDM,22,TOR,10,0,1,8477498,8475786.0,Darnell Nurse hit Zach Hyman
66,hit,Darnell Nurse,Alexander Kerfoot,[-85.  35.],1,06:47,EDM,TOR,EDM,22,TOR,10,0,1,8477498,8477021.0,Darnell Nurse hit Alexander Kerfoot
76,hit,Gaetan Haas,Frederik Gauthier,[-88. -31.],1,04:40,EDM,TOR,EDM,22,TOR,10,0,1,8481813,8477512.0,Gaetan Haas hit Frederik Gauthier
82,hit,Zack Kassian,Jake Muzzin,[97. -7.],1,03:08,EDM,TOR,EDM,22,TOR,10,0,1,8475178,8474162.0,Zack Kassian hit Jake Muzzin
90,hit,Adam Larsson,William Nylander,[-98.  -2.],1,01:37,EDM,TOR,EDM,22,TOR,10,0,1,8476457,8477939.0,Adam Larsson hit William Nylander
96,hit,Cody Ceci,Riley Sheahan,[-91. -28.],2,19:27,TOR,EDM,EDM,22,TOR,10,0,1,8476879,8475772.0,Cody Ceci hit Riley Sheahan
97,hit,Jujhar Khaira,John Tavares,[-93. -25.],2,19:26,EDM,TOR,EDM,22,TOR,10,0,1,8476915,8475166.0,Jujhar Khaira hit John Tavares
124,hit,James Neal,Jake Muzzin,[-63.   4.],2,13:35,EDM,TOR,EDM,22,TOR,10,0,2,8471707,8474162.0,James Neal hit Jake Muzzin
125,hit,James Neal,Mitchell Marner,[-95.  16.],2,13:32,EDM,TOR,EDM,22,TOR,10,0,2,8471707,8478483.0,James Neal hit Mitchell Marner
126,hit,Justin Holl,Sam Gagner,[-91. -29.],2,13:21,TOR,EDM,EDM,22,TOR,10,0,2,8475718,8474040.0,Justin Holl hit Sam Gagner
127,hit,Sam Gagner,Jake Muzzin,[-98.  -7.],2,13:10,EDM,TOR,EDM,22,TOR,10,0,2,8474040,8474162.0,Sam Gagner hit Jake Muzzin
128,hit,James Neal,Justin Holl,[-92. -23.],2,13:07,EDM,TOR,EDM,22,TOR,10,0,2,8471707,8475718.0,James Neal hit Justin Holl
131,hit,Ethan Bear,Frederik Gauthier,[ 77. -37.],2,11:38,EDM,TOR,EDM,22,TOR,10,0,2,8478451,8477512.0,Ethan Bear hit Frederik Gauthier
134,hit,Dmytro Timashov,Gaetan Haas,[76. 39.],2,10:56,TOR,EDM,EDM,22,TOR,10,0,2,8478857,8481813.0,Dmytro Timashov hit Gaetan Haas
135,hit,Jake Muzzin,Alex Chiasson,[-29.   9.],2,10:47,TOR,EDM,EDM,22,TOR,10,0,2,8474162,8475163.0,Jake Muzzin hit Alex Chiasson
148,hit,Ethan Bear,Ilya Mikheyev,[22. 38.],2,08:38,EDM,TOR,EDM,22,TOR,10,0,2,8478451,8481624.0,Ethan Bear hit Ilya Mikheyev
153,hit,Josh Archibald,Jake Muzzin,[79. 38.],2,07:52,EDM,TOR,EDM,22,TOR,10,0,2,8476326,8474162.0,Josh Archibald hit Jake Muzzin
155,hit,Justin Holl,Jujhar Khaira,[ -3. -39.],2,07:42,TOR,EDM,EDM,22,TOR,10,0,2,8475718,8476915.0,Justin Holl hit Jujhar Khaira
159,hit,Dmytro Timashov,Gaetan Haas,[-85.  35.],2,06:57,TOR,EDM,EDM,22,TOR,10,0,2,8478857,8481813.0,Dmytro Timashov hit Gaetan Haas
162,hit,John Tavares,Oscar Klefbom,[ 51. -37.],2,06:18,TOR,EDM,EDM,22,TOR,10,0,2,8475166,8476472.0,John Tavares hit Oscar Klefbom
166,hit,Zack Kassian,Jake Muzzin,[-97.  -3.],2,05:50,EDM,TOR,EDM,22,TOR,10,0,2,8475178,8474162.0,Zack Kassian hit Jake Muzzin
176,hit,Travis Dermott,Leon Draisaitl,[-89.  31.],2,03:41,TOR,EDM,EDM,22,TOR,10,0,2,8478408,8477934.0,Travis Dermott hit Leon Draisaitl
179,hit,Cody Ceci,Jujhar Khaira,[-95.  -3.],2,02:04,TOR,EDM,EDM,22,TOR,10,0,2,8476879,8476915.0,Cody Ceci hit Jujhar Khaira
183,hit,Kris Russell,Zach Hyman,[33. 37.],2,00:45,EDM,TOR,EDM,22,TOR,10,0,2,8471729,8475786.0,Kris Russell hit Zach Hyman
186,hit,Connor McDavid,Cody Ceci,[78. 37.],3,19:49,EDM,TOR,EDM,22,TOR,10,0,2,8478402,8476879.0,Connor McDavid hit Cody Ceci
190,hit,Jake Muzzin,Oscar Klefbom,[65. 39.],3,18:53,TOR,EDM,EDM,22,TOR,10,0,2,8474162,8476472.0,Jake Muzzin hit Oscar Klefbom
198,hit,Alex Chiasson,Jason Spezza,[ 32. -37.],3,17:20,EDM,TOR,EDM,22,TOR,10,0,2,8475163,8469455.0,Alex Chiasson hit Jason Spezza
200,hit,Adam Larsson,Justin Holl,[-14. -39.],3,17:07,EDM,TOR,EDM,22,TOR,10,0,2,8476457,8475718.0,Adam Larsson hit Justin Holl
203,hit,Pierre Engvall,Josh Archibald,[-31. -38.],3,15:56,TOR,EDM,EDM,22,TOR,10,0,2,8478115,8476326.0,Pierre Engvall hit Josh Archibald
204,hit,Markus Granlund,Travis Dermott,[ 97. -13.],3,15:47,EDM,TOR,EDM,22,TOR,10,0,2,8476440,8478408.0,Markus Granlund hit Travis Dermott
219,hit,Gaetan Haas,Kasperi Kapanen,[-46. -38.],3,12:55,EDM,TOR,EDM,22,TOR,10,1,2,8481813,8477953.0,Gaetan Haas hit Kasperi Kapanen
222,hit,James Neal,Zach Hyman,[-28.  33.],3,11:41,EDM,TOR,EDM,22,TOR,10,1,2,8471707,8475786.0,James Neal hit Zach Hyman
226,hit,Jake Muzzin,Zack Kassian,[ 95. -19.],3,10:21,TOR,EDM,EDM,22,TOR,10,1,2,8474162,8475178.0,Jake Muzzin hit Zack Kassian
235,hit,Morgan Rielly,Josh Archibald,[ 96. -15.],3,09:35,TOR,EDM,EDM,22,TOR,10,1,2,8476853,8476326.0,Morgan Rielly hit Josh Archibald
236,hit,Jake Muzzin,Gaetan Haas,[75. -9.],3,09:18,TOR,EDM,EDM,22,TOR,10,1,2,8474162,8481813.0,Jake Muzzin hit Gaetan Haas
239,hit,Gaetan Haas,Zach Hyman,[-82.  34.],3,08:49,EDM,TOR,EDM,22,TOR,10,1,2,8481813,8475786.0,Gaetan Haas hit Zach Hyman
253,hit,Cody Ceci,Jujhar Khaira,[29. 39.],3,06:07,TOR,EDM,EDM,22,TOR,10,1,3,8476879,8476915.0,Cody Ceci hit Jujhar Khaira
254,hit,Caleb Jones,Kasperi Kapanen,[-77. -37.],3,05:25,EDM,TOR,EDM,22,TOR,10,1,3,8478452,8477953.0,Caleb Jones hit Kasperi Kapanen
271,hit,Frederik Gauthier,Alex Chiasson,[ 37. -36.],3,01:13,TOR,EDM,EDM,22,TOR,10,1,4,8477512,8475163.0,Frederik Gauthier hit Alex Chiasson
274,hit,Travis Dermott,Gaetan Haas,[97. -8.],3,00:41,TOR,EDM,EDM,22,TOR,10,1,4,8478408,8481813.0,Travis Dermott hit Gaetan Haas
275,hit,Alexander Kerfoot,Jujhar Khaira,[ 43. -37.],3,00:26,TOR,EDM,EDM,22,TOR,10,1,4,8477021,8476915.0,Alexander Kerfoot hit Jujhar Khaira
276,hit,Oscar Klefbom,Ilya Mikheyev,[-28. -36.],3,00:14,EDM,TOR,EDM,22,TOR,10,1,4,8476472,8481624.0,Oscar Klefbom hit Ilya Mikheyev
7,hit,Dmytro Timashov,Brandon Montour,[-98. -11.],1,17:41,TOR,BUF,TOR,10,BUF,7,0,0,8478857,8477986.0,Dmytro Timashov hit Brandon Montour
13,hit,Henri Jokiharju,Zach Hyman,[ 34. -39.],1,17:04,BUF,TOR,TOR,10,BUF,7,1,0,8480035,8475786.0,Henri Jokiharju hit Zach Hyman
26,hit,Zach Hyman,Henri Jokiharju,[-95.  21.],1,14:00,TOR,BUF,TOR,10,BUF,7,1,0,8475786,8480035.0,Zach Hyman hit Henri Jokiharju
38,hit,Jake Muzzin,Jack Eichel,[-72. -32.],1,11:38,TOR,BUF,TOR,10,BUF,7,1,0,8474162,8478403.0,Jake Muzzin hit Jack Eichel
39,hit,Morgan Rielly,Johan Larsson,[98.  2.],1,11:14,TOR,BUF,TOR,10,BUF,7,1,0,8476853,8475728.0,Morgan Rielly hit Johan Larsson
40,hit,Zemgus Girgensons,Morgan Rielly,[-42. -37.],1,11:02,BUF,TOR,TOR,10,BUF,7,1,0,8476878,8476853.0,Zemgus Girgensons hit Morgan Rielly
64,hit,Justin Holl,Johan Larsson,[92. 29.],1,05:36,TOR,BUF,TOR,10,BUF,7,1,0,8475718,8475728.0,Justin Holl hit Johan Larsson
69,hit,Pierre Engvall,Rasmus Ristolainen,[-47. -38.],1,04:47,TOR,BUF,TOR,10,BUF,7,1,0,8478115,8477499.0,Pierre Engvall hit Rasmus Ristolainen
71,hit,Henri Jokiharju,Zach Hyman,[-77. -39.],1,03:53,BUF,TOR,TOR,10,BUF,7,1,0,8480035,8475786.0,Henri Jokiharju hit Zach Hyman
74,hit,Evan Rodrigues,Cody Ceci,[-74.  40.],1,02:21,BUF,TOR,TOR,10,BUF,7,1,0,8478542,8476879.0,Evan Rodrigues hit Cody Ceci
77,hit,Jimmy Vesey,Cody Ceci,[ 96. -20.],1,02:01,BUF,TOR,TOR,10,BUF,7,1,0,8476918,8476879.0,Jimmy Vesey hit Cody Ceci
78,hit,Frederik Gauthier,Johan Larsson,[ 74. -40.],1,01:20,TOR,BUF,TOR,10,BUF,7,1,0,8477512,8475728.0,Frederik Gauthier hit Johan Larsson
88,hit,Zemgus Girgensons,Morgan Rielly,[-15. -40.],2,19:00,BUF,TOR,TOR,10,BUF,7,1,0,8476878,8476853.0,Zemgus Girgensons hit Morgan Rielly
89,hit,Kasperi Kapanen,Marco Scandella,[ 94. -15.],2,18:53,TOR,BUF,TOR,10,BUF,7,1,0,8477953,8474618.0,Kasperi Kapanen hit Marco Scandella
90,hit,Johan Larsson,Auston Matthews,[-95.  16.],2,18:27,BUF,TOR,TOR,10,BUF,7,1,0,8475728,8479318.0,Johan Larsson hit Auston Matthews
94,hit,Rasmus Dahlin,Pierre Engvall,[ 93. -20.],2,17:32,BUF,TOR,TOR,10,BUF,7,1,0,8480839,8478115.0,Rasmus Dahlin hit Pierre Engvall
97,hit,Jake Muzzin,Sam Reinhart,[-91.  32.],2,16:01,TOR,BUF,TOR,10,BUF,7,1,0,8474162,8477933.0,Jake Muzzin hit Sam Reinhart
99,hit,Morgan Rielly,Johan Larsson,[-28.  34.],2,15:42,TOR,BUF,TOR,10,BUF,7,1,0,8476853,8475728.0,Morgan Rielly hit Johan Larsson
111,hit,Jake Muzzin,Sam Reinhart,[-98.  13.],2,13:37,TOR,BUF,TOR,10,BUF,7,2,0,8474162,8477933.0,Jake Muzzin hit Sam Reinhart
112,hit,Sam Reinhart,Jake Muzzin,[-97.   4.],2,13:30,BUF,TOR,TOR,10,BUF,7,2,0,8477933,8474162.0,Sam Reinhart hit Jake Muzzin
113,hit,Henri Jokiharju,John Tavares,[-56.  39.],2,12:34,BUF,TOR,TOR,10,BUF,7,2,0,8480035,8475166.0,Henri Jokiharju hit John Tavares
115,hit,John Tavares,Johan Larsson,[96. 17.],2,12:00,TOR,BUF,TOR,10,BUF,7,2,0,8475166,8475728.0,John Tavares hit Johan Larsson
125,hit,Jake McCabe,Kasperi Kapanen,[ 33. -40.],2,08:50,BUF,TOR,TOR,10,BUF,7,2,0,8476931,8477953.0,Jake McCabe hit Kasperi Kapanen
127,hit,Jake McCabe,William Nylander,[ 95. -24.],2,08:29,BUF,TOR,TOR,10,BUF,7,2,0,8476931,8477939.0,Jake McCabe hit William Nylander
142,hit,Marco Scandella,John Tavares,[98. -7.],2,05:45,BUF,TOR,TOR,10,BUF,7,2,0,8474618,8475166.0,Marco Scandella hit John Tavares
143,hit,Henri Jokiharju,John Tavares,[ 91. -23.],2,05:38,BUF,TOR,TOR,10,BUF,7,2,0,8480035,8475166.0,Henri Jokiharju hit John Tavares
144,hit,Sam Reinhart,Alexander Kerfoot,[-97.  12.],2,05:02,BUF,TOR,TOR,10,BUF,7,2,0,8477933,8477021.0,Sam Reinhart hit Alexander Kerfoot
153,hit,Marcus Johansson,Tyson Barrie,[-92. -28.],2,02:41,BUF,TOR,TOR,10,BUF,7,2,0,8475149,8475197.0,Marcus Johansson hit Tyson Barrie
161,hit,Justin Holl,Sam Reinhart,[-72. -41.],2,00:33,TOR,BUF,TOR,10,BUF,7,3,0,8475718,8477933.0,Justin Holl hit Sam Reinhart
162,hit,Brandon Montour,Zach Hyman,[ 92. -31.],2,00:20,BUF,TOR,TOR,10,BUF,7,3,0,8477986,8475786.0,Brandon Montour hit Zach Hyman
171,hit,Zemgus Girgensons,Travis Dermott,[ 98. -14.],3,18:20,BUF,TOR,TOR,10,BUF,7,3,1,8476878,8478408.0,Zemgus Girgensons hit Travis Dermott
175,hit,Jack Eichel,Cody Ceci,[ 8. 39.],3,17:11,BUF,TOR,TOR,10,BUF,7,3,1,8478403,8476879.0,Jack Eichel hit Cody Ceci
188,hit,Henri Jokiharju,William Nylander,[-97.  14.],3,14:29,BUF,TOR,TOR,10,BUF,7,4,1,8480035,8477939.0,Henri Jokiharju hit William Nylander
199,hit,Henri Jokiharju,Zach Hyman,[-97. -17.],3,12:13,BUF,TOR,TOR,10,BUF,7,4,2,8480035,8475786.0,Henri Jokiharju hit Zach Hyman
203,hit,Jeff Skinner,Travis Dermott,[ 89. -24.],3,11:23,BUF,TOR,TOR,10,BUF,7,4,2,8475784,8478408.0,Jeff Skinner hit Travis Dermott
204,hit,Jake Muzzin,Rasmus Ristolainen,[ 31. -33.],3,10:33,TOR,BUF,TOR,10,BUF,7,4,2,8474162,8477499.0,Jake Muzzin hit Rasmus Ristolainen
211,hit,Dmytro Timashov,Brandon Montour,[-22. -29.],3,07:36,TOR,BUF,TOR,10,BUF,7,4,2,8478857,8477986.0,Dmytro Timashov hit Brandon Montour
214,hit,Rasmus Dahlin,Mitchell Marner,[-71. -38.],3,07:23,BUF,TOR,TOR,10,BUF,7,4,2,8480839,8478483.0,Rasmus Dahlin hit Mitchell Marner
215,hit,Brandon Montour,Zach Hyman,[ 32. -38.],3,06:59,BUF,TOR,TOR,10,BUF,7,4,2,8477986,8475786.0,Brandon Montour hit Zach Hyman
232,hit,Jake Muzzin,Sam Reinhart,[ 34. -39.],3,03:28,TOR,BUF,TOR,10,BUF,7,4,3,8474162,8477933.0,Jake Muzzin hit Sam Reinhart
237,hit,Henri Jokiharju,John Tavares,[-61.   3.],3,02:21,BUF,TOR,TOR,10,BUF,7,5,3,8480035,8475166.0,Henri Jokiharju hit John Tavares
1,hit,Zach Hyman,Jacob Trouba,[80. 37.],1,19:42,TOR,NYR,NYR,3,TOR,10,0,0,8475786,8476885.0,Zach Hyman hit Jacob Trouba
5,hit,Jesper Fast,Tyson Barrie,[-97.  -9.],1,19:21,NYR,TOR,NYR,3,TOR,10,0,0,8475855,8475197.0,Jesper Fast hit Tyson Barrie
22,hit,Jesper Fast,Jake Muzzin,[-86.  33.],1,16:52,NYR,TOR,NYR,3,TOR,10,0,0,8475855,8474162.0,Jesper Fast hit Jake Muzzin
25,hit,Jacob Trouba,Frederik Gauthier,[ 98. -15.],1,16:12,NYR,TOR,NYR,3,TOR,10,0,0,8476885,8477512.0,Jacob Trouba hit Frederik Gauthier
29,hit,Pierre Engvall,Ryan Lindgren,[97.  3.],1,14:27,TOR,NYR,NYR,3,TOR,10,0,0,8478115,8479324.0,Pierre Engvall hit Ryan Lindgren
30,hit,Jake Muzzin,Ryan Strome,[-87.  34.],1,14:18,TOR,NYR,NYR,3,TOR,10,0,0,8474162,8476458.0,Jake Muzzin hit Ryan Strome
37,hit,Mika Zibanejad,Jake Muzzin,[-97. -17.],1,13:14,NYR,TOR,NYR,3,TOR,10,0,0,8476459,8474162.0,Mika Zibanejad hit Jake Muzzin
38,hit,Chris Kreider,Jake Muzzin,[-97. -16.],1,13:03,NYR,TOR,NYR,3,TOR,10,0,0,8475184,8474162.0,Chris Kreider hit Jake Muzzin
45,hit,Dmytro Timashov,Tony DeAngelo,[77. 37.],1,11:30,TOR,NYR,NYR,3,TOR,10,0,0,8478857,8477950.0,Dmytro Timashov hit Tony DeAngelo
50,hit,Brady Skjei,Alexander Kerfoot,[94. 27.],1,10:27,NYR,TOR,NYR,3,TOR,10,0,0,8476869,8477021.0,Brady Skjei hit Alexander Kerfoot
55,hit,Jesper Fast,Travis Dermott,[-97.   5.],1,09:03,NYR,TOR,NYR,3,TOR,10,0,1,8475855,8478408.0,Jesper Fast hit Travis Dermott
56,hit,Travis Dermott,Mika Zibanejad,[-95.  18.],1,08:49,TOR,NYR,NYR,3,TOR,10,0,1,8478408,8476459.0,Travis Dermott hit Mika Zibanejad
60,hit,Chris Kreider,Tyson Barrie,[-92. -30.],1,08:19,NYR,TOR,NYR,3,TOR,10,0,1,8475184,8475197.0,Chris Kreider hit Tyson Barrie
73,hit,Cody Ceci,Chris Kreider,[-90.  31.],1,06:21,TOR,NYR,NYR,3,TOR,10,0,2,8476879,8475184.0,Cody Ceci hit Chris Kreider
74,hit,Chris Kreider,Cody Ceci,[-98.   7.],1,06:13,NYR,TOR,NYR,3,TOR,10,0,2,8475184,8476879.0,Chris Kreider hit Cody Ceci
78,hit,Chris Kreider,Morgan Rielly,[-67.  39.],1,05:34,NYR,TOR,NYR,3,TOR,10,1,2,8475184,8476853.0,Chris Kreider hit Morgan Rielly
86,hit,Kaapo Kakko,Cody Ceci,[-53. -39.],1,03:07,NYR,TOR,NYR,3,TOR,10,1,2,8481554,8476879.0,Kaapo Kakko hit Cody Ceci
90,hit,Adam Fox,William Nylander,[69. 40.],1,02:00,NYR,TOR,NYR,3,TOR,10,2,2,8479323,8477939.0,Adam Fox hit William Nylander
106,hit,Jesper Fast,Morgan Rielly,[ 93. -29.],2,19:02,NYR,TOR,NYR,3,TOR,10,2,2,8475855,8476853.0,Jesper Fast hit Morgan Rielly
136,hit,Cody Ceci,Greg McKegg,[-42.  34.],2,11:24,TOR,NYR,NYR,3,TOR,10,3,3,8476879,8475735.0,Cody Ceci hit Greg McKegg
160,hit,Jacob Trouba,Dmytro Timashov,[-78. -15.],2,06:22,NYR,TOR,NYR,3,TOR,10,3,3,8476885,8478857.0,Jacob Trouba hit Dmytro Timashov
162,hit,Brendan Lemieux,Alexander Kerfoot,[-43.  38.],2,05:42,NYR,TOR,NYR,3,TOR,10,3,3,8477962,8477021.0,Brendan Lemieux hit Alexander Kerfoot
163,hit,Jacob Trouba,Jake Muzzin,[-35. -39.],2,05:24,NYR,TOR,NYR,3,TOR,10,3,3,8476885,8474162.0,Jacob Trouba hit Jake Muzzin
172,hit,Tony DeAngelo,Justin Holl,[-84.  36.],2,02:45,NYR,TOR,NYR,3,TOR,10,3,3,8477950,8475718.0,Tony DeAngelo hit Justin Holl
173,hit,Brendan Lemieux,Justin Holl,[64. 39.],2,02:32,NYR,TOR,NYR,3,TOR,10,3,3,8477962,8475718.0,Brendan Lemieux hit Justin Holl
175,hit,Dmytro Timashov,Mika Zibanejad,[ 31. -38.],2,01:58,TOR,NYR,NYR,3,TOR,10,3,3,8478857,8476459.0,Dmytro Timashov hit Mika Zibanejad
178,hit,Jacob Trouba,Alexander Kerfoot,[-56. -40.],2,00:46,NYR,TOR,NYR,3,TOR,10,3,3,8476885,8477021.0,Jacob Trouba hit Alexander Kerfoot
184,hit,Jacob Trouba,Morgan Rielly,[-96. -14.],2,00:02,NYR,TOR,NYR,3,TOR,10,3,3,8476885,8476853.0,Jacob Trouba hit Morgan Rielly
194,hit,Cody Ceci,Filip Chytil,[-96.  -1.],3,18:00,TOR,NYR,NYR,3,TOR,10,3,3,8476879,8480078.0,Cody Ceci hit Filip Chytil
202,hit,Greg McKegg,Tyson Barrie,[-65. -38.],3,16:43,NYR,TOR,NYR,3,TOR,10,3,5,8475735,8475197.0,Greg McKegg hit Tyson Barrie
216,hit,Cody Ceci,Brett Howden,[ -6. -31.],3,12:09,TOR,NYR,NYR,3,TOR,10,3,5,8476879,8479353.0,Cody Ceci hit Brett Howden
219,hit,Alexander Kerfoot,Ryan Lindgren,[ 90. -30.],3,11:54,TOR,NYR,NYR,3,TOR,10,3,5,8477021,8479324.0,Alexander Kerfoot hit Ryan Lindgren
240,hit,Ryan Lindgren,Jason Spezza,[ 16. -16.],3,06:55,NYR,TOR,NYR,3,TOR,10,3,5,8479324,8469455.0,Ryan Lindgren hit Jason Spezza
256,hit,Travis Dermott,Greg McKegg,[-44.  30.],3,03:07,TOR,NYR,NYR,3,TOR,10,3,6,8478408,8475735.0,Travis Dermott hit Greg McKegg
261,hit,William Nylander,Kaapo Kakko,[-97.   2.],3,01:58,TOR,NYR,NYR,3,TOR,10,3,6,8477939,8481554.0,William Nylander hit Kaapo Kakko
267,hit,Tony DeAngelo,Alexander Kerfoot,[96. -6.],3,00:12,NYR,TOR,NYR,3,TOR,10,3,6,8477950,8477021.0,Tony DeAngelo hit Alexander Kerfoot
5,hit,Valtteri Filppula,Kasperi Kapanen,[-1. 40.],1,18:47,DET,TOR,TOR,10,DET,17,0,0,8470047,8477953.0,Valtteri Filppula hit Kasperi Kapanen
10,hit,Trevor Moore,Brendan Perlini,[-20.  39.],1,17:15,TOR,DET,TOR,10,DET,17,0,0,8479675,8477943.0,Trevor Moore hit Brendan Perlini
18,hit,Patrik Nemeth,Auston Matthews,[-86.  35.],1,15:36,DET,TOR,TOR,10,DET,17,0,0,8475747,8479318.0,Patrik Nemeth hit Auston Matthews
20,hit,Cody Ceci,Robby Fabbri,[ 56. -40.],1,14:59,TOR,DET,TOR,10,DET,17,0,0,8476879,8477952.0,Cody Ceci hit Robby Fabbri
23,hit,Luke Glendening,Justin Holl,[92. 30.],1,13:51,DET,TOR,TOR,10,DET,17,0,0,8476822,8475718.0,Luke Glendening hit Justin Holl
24,hit,Frederik Gauthier,Luke Glendening,[95. 17.],1,13:42,TOR,DET,TOR,10,DET,17,0,0,8477512,8476822.0,Frederik Gauthier hit Luke Glendening
32,hit,Madison Bowey,Alexander Kerfoot,[-59. -38.],1,10:55,DET,TOR,TOR,10,DET,17,0,0,8477474,8477021.0,Madison Bowey hit Alexander Kerfoot
34,hit,Anthony Mantha,Frederik Gauthier,[-17. -23.],1,10:34,DET,TOR,TOR,10,DET,17,0,0,8477511,8477512.0,Anthony Mantha hit Frederik Gauthier
43,hit,Andreas Athanasiou,Justin Holl,[85. 32.],1,08:27,DET,TOR,TOR,10,DET,17,0,0,8476960,8475718.0,Andreas Athanasiou hit Justin Holl
44,hit,Brian Lashoff,Zach Hyman,[-80.  37.],1,08:20,DET,TOR,TOR,10,DET,17,0,0,8474873,8475786.0,Brian Lashoff hit Zach Hyman
45,hit,Madison Bowey,John Tavares,[-97. -17.],1,07:58,DET,TOR,TOR,10,DET,17,0,0,8477474,8475166.0,Madison Bowey hit John Tavares
48,hit,Luke Glendening,Ilya Mikheyev,[-95. -21.],1,07:18,DET,TOR,TOR,10,DET,17,0,0,8476822,8481624.0,Luke Glendening hit Ilya Mikheyev
