,event,hitter,hittee,coords,period,period_time_remaining,hitter_team,hittee_team,home_team,home_team_id,away_team,away_team_id,home_goals,away_goals,hitter_id,hittee_id,description
192,hit,Travis Konecny,Auston Matthews,[96. 20.],3,12:36,PHI,TOR,TOR,10,PHI,4,2,2,8478439,8479318.0,Travis Konecny hit Auston Matthews
205,hit,Philippe Myers,William Nylander,[-72.  39.],3,10:02,PHI,TOR,TOR,10,PHI,4,2,2,8479026,8477939.0,Philippe Myers hit William Nylander
210,hit,Dmytro Timashov,Philippe Myers,[-84. -35.],3,07:29,TOR,PHI,TOR,10,PHI,4,2,2,8478857,8479026.0,Dmytro Timashov hit Philippe Myers
228,hit,Travis Konecny,John Tavares,[-36. -38.],3,03:10,PHI,TOR,TOR,10,PHI,4,2,2,8478439,8475166.0,Travis Konecny hit John Tavares
1,hit,Jake Muzzin,Brandon Saad,[-98.  11.],1,19:34,TOR,CHI,CHI,16,TOR,10,0,0,8474162,8476438.0,Jake Muzzin hit Brandon Saad
7,hit,Olli Maatta,Auston Matthews,[ 95. -28.],1,18:33,CHI,TOR,CHI,16,TOR,10,0,0,8476874,8479318.0,Olli Maatta hit Auston Matthews
12,hit,Drake Caggiula,Morgan Rielly,[-72. -38.],1,16:14,CHI,TOR,CHI,16,TOR,10,0,0,8479465,8476853.0,Drake Caggiula hit Morgan Rielly
13,hit,Drake Caggiula,Auston Matthews,[ 74. -39.],1,16:04,CHI,TOR,CHI,16,TOR,10,0,0,8479465,8479318.0,Drake Caggiula hit Auston Matthews
15,hit,Duncan Keith,Andreas Johnsson,[-35. -38.],1,15:46,CHI,TOR,CHI,16,TOR,10,0,0,8470281,8477341.0,Duncan Keith hit Andreas Johnsson
19,hit,Alex DeBrincat,Cody Ceci,[-98. -21.],1,14:22,CHI,TOR,CHI,16,TOR,10,1,0,8479337,8476879.0,Alex DeBrincat hit Cody Ceci
27,hit,Jake Muzzin,David Kampf,[-96.  21.],1,12:27,TOR,CHI,CHI,16,TOR,10,1,0,8474162,8480144.0,Jake Muzzin hit David Kampf
32,hit,Andrew Shaw,Justin Holl,[ 15. -39.],1,11:09,CHI,TOR,CHI,16,TOR,10,1,0,8476381,8475718.0,Andrew Shaw hit Justin Holl
34,hit,Alexander Kerfoot,Alex DeBrincat,[ 95. -23.],1,10:05,TOR,CHI,CHI,16,TOR,10,1,0,8477021,8479337.0,Alexander Kerfoot hit Alex DeBrincat
39,hit,Travis Dermott,Jonathan Toews,[-46.  14.],1,09:12,TOR,CHI,CHI,16,TOR,10,1,0,8478408,8473604.0,Travis Dermott hit Jonathan Toews
40,hit,Adam Boqvist,Morgan Rielly,[ 95. -23.],1,08:44,CHI,TOR,CHI,16,TOR,10,1,0,8480871,8476853.0,Adam Boqvist hit Morgan Rielly
51,hit,Brandon Saad,Morgan Rielly,[-33.  39.],1,07:30,CHI,TOR,CHI,16,TOR,10,3,0,8476438,8476853.0,Brandon Saad hit Morgan Rielly
53,hit,Travis Dermott,Kirby Dach,[ 11. -16.],1,07:05,TOR,CHI,CHI,16,TOR,10,3,0,8478408,8481523.0,Travis Dermott hit Kirby Dach
56,hit,Trevor Moore,Calvin de Haan,[ 46. -40.],1,06:37,TOR,CHI,CHI,16,TOR,10,3,0,8479675,8475177.0,Trevor Moore hit Calvin de Haan
59,hit,Zack Smith,Jake Muzzin,[22. 41.],1,06:11,CHI,TOR,CHI,16,TOR,10,3,0,8474250,8474162.0,Zack Smith hit Jake Muzzin
70,hit,Zack Smith,Justin Holl,[ 56. -40.],1,04:45,CHI,TOR,CHI,16,TOR,10,3,0,8474250,8475718.0,Zack Smith hit Justin Holl
94,hit,Dominik Kubalik,Nicholas Shore,[-93.  32.],1,01:54,CHI,TOR,CHI,16,TOR,10,4,1,8477330,8476406.0,Dominik Kubalik hit Nicholas Shore
98,hit,Zack Smith,Cody Ceci,[-20. -38.],1,00:16,CHI,TOR,CHI,16,TOR,10,4,1,8474250,8476879.0,Zack Smith hit Cody Ceci
102,hit,Trevor Moore,Brent Seabrook,[-94. -24.],2,18:48,TOR,CHI,CHI,16,TOR,10,4,1,8479675,8470607.0,Trevor Moore hit Brent Seabrook
103,hit,Cody Ceci,Dylan Strome,[ 63. -40.],2,18:12,TOR,CHI,CHI,16,TOR,10,4,1,8476879,8478440.0,Cody Ceci hit Dylan Strome
105,hit,Frederik Gauthier,Andrew Shaw,[-50. -39.],2,17:38,TOR,CHI,CHI,16,TOR,10,4,1,8477512,8476381.0,Frederik Gauthier hit Andrew Shaw
111,hit,Brent Seabrook,Alexander Kerfoot,[-94. -25.],2,15:46,CHI,TOR,CHI,16,TOR,10,4,1,8470607,8477021.0,Brent Seabrook hit Alexander Kerfoot
113,hit,Trevor Moore,Calvin de Haan,[-86. -36.],2,15:17,TOR,CHI,CHI,16,TOR,10,4,1,8479675,8475177.0,Trevor Moore hit Calvin de Haan
114,hit,Zack Smith,Frederik Gauthier,[ 45. -40.],2,15:02,CHI,TOR,CHI,16,TOR,10,4,1,8474250,8477512.0,Zack Smith hit Frederik Gauthier
121,hit,Travis Dermott,Zack Smith,[98. -9.],2,13:29,TOR,CHI,CHI,16,TOR,10,4,1,8478408,8474250.0,Travis Dermott hit Zack Smith
128,hit,Dominik Kubalik,Tyson Barrie,[ 78. -39.],2,12:49,CHI,TOR,CHI,16,TOR,10,4,1,8477330,8475197.0,Dominik Kubalik hit Tyson Barrie
130,hit,Frederik Gauthier,Adam Boqvist,[-63. -38.],2,12:31,TOR,CHI,CHI,16,TOR,10,4,1,8477512,8480871.0,Frederik Gauthier hit Adam Boqvist
133,hit,Cody Ceci,Drake Caggiula,[-43.  39.],2,12:12,TOR,CHI,CHI,16,TOR,10,4,1,8476879,8479465.0,Cody Ceci hit Drake Caggiula
139,hit,Andrew Shaw,Trevor Moore,[ 77. -40.],2,11:22,CHI,TOR,CHI,16,TOR,10,4,1,8476381,8479675.0,Andrew Shaw hit Trevor Moore
148,hit,Zack Smith,Alexander Kerfoot,[-23. -38.],2,08:55,CHI,TOR,CHI,16,TOR,10,4,1,8474250,8477021.0,Zack Smith hit Alexander Kerfoot
185,hit,Calvin de Haan,Andreas Johnsson,[-90. -33.],2,01:30,CHI,TOR,CHI,16,TOR,10,4,1,8475177,8477341.0,Calvin de Haan hit Andreas Johnsson
187,hit,Brent Seabrook,Kasperi Kapanen,[-82. -23.],2,00:57,CHI,TOR,CHI,16,TOR,10,4,1,8470607,8477953.0,Brent Seabrook hit Kasperi Kapanen
197,hit,Calvin de Haan,Trevor Moore,[ 97. -23.],3,18:31,CHI,TOR,CHI,16,TOR,10,4,1,8475177,8479675.0,Calvin de Haan hit Trevor Moore
198,hit,Trevor Moore,Adam Boqvist,[ 48. -40.],3,18:28,TOR,CHI,CHI,16,TOR,10,4,1,8479675,8480871.0,Trevor Moore hit Adam Boqvist
204,hit,Erik Gustafsson,Frederik Gauthier,[ 80. -37.],3,17:15,CHI,TOR,CHI,16,TOR,10,4,2,8476979,8477512.0,Erik Gustafsson hit Frederik Gauthier
206,hit,Frederik Gauthier,Brent Seabrook,[89. 32.],3,17:01,TOR,CHI,CHI,16,TOR,10,4,2,8477512,8470607.0,Frederik Gauthier hit Brent Seabrook
207,hit,Dmytro Timashov,Andrew Shaw,[43. 40.],3,16:52,TOR,CHI,CHI,16,TOR,10,4,2,8478857,8476381.0,Dmytro Timashov hit Andrew Shaw
231,hit,Drake Caggiula,Cody Ceci,[-96. -11.],3,11:19,CHI,TOR,CHI,16,TOR,10,4,2,8479465,8476879.0,Drake Caggiula hit Cody Ceci
257,hit,Olli Maatta,Frederik Gauthier,[ 72. -38.],3,07:05,CHI,TOR,CHI,16,TOR,10,4,3,8476874,8477512.0,Olli Maatta hit Frederik Gauthier
261,hit,Calvin de Haan,Cody Ceci,[97. 13.],3,06:02,CHI,TOR,CHI,16,TOR,10,4,3,8475177,8476879.0,Calvin de Haan hit Cody Ceci
267,hit,Zack Smith,Tyson Barrie,[-90. -34.],3,04:14,CHI,TOR,CHI,16,TOR,10,4,3,8474250,8475197.0,Zack Smith hit Tyson Barrie
270,hit,Travis Dermott,Drake Caggiula,[ 31. -40.],3,04:00,TOR,CHI,CHI,16,TOR,10,4,3,8478408,8479465.0,Travis Dermott hit Drake Caggiula
275,hit,Kasperi Kapanen,Olli Maatta,[ 30. -24.],3,03:29,TOR,CHI,CHI,16,TOR,10,5,3,8477953,8476874.0,Kasperi Kapanen hit Olli Maatta
1,hit,Casey Cizikas,Tyson Barrie,[ 69. -40.],1,19:50,NYI,TOR,NYI,2,TOR,10,0,0,8475231,8475197.0,Casey Cizikas hit Tyson Barrie
2,hit,Jake Muzzin,Casey Cizikas,[93. 27.],1,19:36,TOR,NYI,NYI,2,TOR,10,0,0,8474162,8475231.0,Jake Muzzin hit Casey Cizikas
4,hit,Travis Dermott,Josh Bailey,[96. 17.],1,19:16,TOR,NYI,NYI,2,TOR,10,0,0,8478408,8474573.0,Travis Dermott hit Josh Bailey
7,hit,Anthony Beauvillier,Justin Holl,[94. 22.],1,18:50,NYI,TOR,NYI,2,TOR,10,0,0,8478463,8475718.0,Anthony Beauvillier hit Justin Holl
12,hit,Anders Lee,Cody Ceci,[-57.  39.],1,17:59,NYI,TOR,NYI,2,TOR,10,0,0,8475314,8476879.0,Anders Lee hit Cody Ceci
13,hit,Derick Brassard,Jake Muzzin,[ 67. -39.],1,17:28,NYI,TOR,NYI,2,TOR,10,0,0,8473544,8474162.0,Derick Brassard hit Jake Muzzin
14,hit,Trevor Moore,Devon Toews,[-56. -37.],1,17:17,TOR,NYI,NYI,2,TOR,10,0,0,8479675,8478038.0,Trevor Moore hit Devon Toews
15,hit,Casey Cizikas,Travis Dermott,[-18. -38.],1,16:37,NYI,TOR,NYI,2,TOR,10,0,0,8475231,8478408.0,Casey Cizikas hit Travis Dermott
16,hit,Nick Leddy,Nic Petan,[-76.  38.],1,16:32,NYI,TOR,NYI,2,TOR,10,0,0,8475181,8477464.0,Nick Leddy hit Nic Petan
24,hit,Scott Mayfield,Zach Hyman,[-52.   5.],1,15:14,NYI,TOR,NYI,2,TOR,10,0,0,8476429,8475786.0,Scott Mayfield hit Zach Hyman
27,hit,Travis Dermott,Derick Brassard,[-18.  -5.],1,14:44,TOR,NYI,NYI,2,TOR,10,0,0,8478408,8473544.0,Travis Dermott hit Derick Brassard
28,hit,Leo Komarov,Travis Dermott,[ 58. -38.],1,14:22,NYI,TOR,NYI,2,TOR,10,0,0,8473463,8478408.0,Leo Komarov hit Travis Dermott
29,hit,Nicholas Shore,Nick Leddy,[-13.  35.],1,14:10,TOR,NYI,NYI,2,TOR,10,0,0,8476406,8475181.0,Nicholas Shore hit Nick Leddy
31,hit,Ross Johnston,Cody Ceci,[-18.  38.],1,13:30,NYI,TOR,NYI,2,TOR,10,0,0,8477527,8476879.0,Ross Johnston hit Cody Ceci
43,hit,Brock Nelson,Jake Muzzin,[-20.  12.],1,10:57,NYI,TOR,NYI,2,TOR,10,0,0,8475754,8474162.0,Brock Nelson hit Jake Muzzin
44,hit,Johnny Boychuk,Tyson Barrie,[-93.  25.],1,10:56,NYI,TOR,NYI,2,TOR,10,0,0,8470187,8475197.0,Johnny Boychuk hit Tyson Barrie
47,hit,Justin Holl,Jordan Eberle,[-81. -37.],1,10:12,TOR,NYI,NYI,2,TOR,10,0,0,8475718,8474586.0,Justin Holl hit Jordan Eberle
51,hit,Auston Matthews,Adam Pelech,[-96.   2.],1,09:20,TOR,NYI,NYI,2,TOR,10,0,0,8479318,8476917.0,Auston Matthews hit Adam Pelech
52,hit,Tyson Barrie,Anthony Beauvillier,[96. -7.],1,08:55,TOR,NYI,NYI,2,TOR,10,0,0,8475197,8478463.0,Tyson Barrie hit Anthony Beauvillier
56,hit,Casey Cizikas,Cody Ceci,[55. 38.],1,07:57,NYI,TOR,NYI,2,TOR,10,0,0,8475231,8476879.0,Casey Cizikas hit Cody Ceci
57,hit,Cal Clutterbuck,Morgan Rielly,[-40. -38.],1,07:47,NYI,TOR,NYI,2,TOR,10,0,0,8473504,8476853.0,Cal Clutterbuck hit Morgan Rielly
59,hit,Trevor Moore,Scott Mayfield,[-85.  34.],1,07:27,TOR,NYI,NYI,2,TOR,10,0,0,8479675,8476429.0,Trevor Moore hit Scott Mayfield
60,hit,Derick Brassard,Trevor Moore,[ 59. -40.],1,07:15,NYI,TOR,NYI,2,TOR,10,0,0,8473544,8479675.0,Derick Brassard hit Trevor Moore
62,hit,Johnny Boychuk,Trevor Moore,[-47. -38.],1,06:44,NYI,TOR,NYI,2,TOR,10,0,0,8470187,8479675.0,Johnny Boychuk hit Trevor Moore
67,hit,Johnny Boychuk,Nic Petan,[-86.  33.],1,06:15,NYI,TOR,NYI,2,TOR,10,0,0,8470187,8477464.0,Johnny Boychuk hit Nic Petan
77,hit,Cal Clutterbuck,Andreas Johnsson,[ 77. -37.],1,03:53,NYI,TOR,NYI,2,TOR,10,1,0,8473504,8477341.0,Cal Clutterbuck hit Andreas Johnsson
79,hit,Johnny Boychuk,Ilya Mikheyev,[-35. -38.],1,03:19,NYI,TOR,NYI,2,TOR,10,1,0,8470187,8481624.0,Johnny Boychuk hit Ilya Mikheyev
92,hit,Justin Holl,Anthony Beauvillier,[58. 38.],1,00:47,TOR,NYI,NYI,2,TOR,10,1,0,8475718,8478463.0,Justin Holl hit Anthony Beauvillier
95,hit,Casey Cizikas,Jake Muzzin,[97. -9.],1,00:28,NYI,TOR,NYI,2,TOR,10,2,0,8475231,8474162.0,Casey Cizikas hit Jake Muzzin
96,hit,Cal Clutterbuck,Auston Matthews,[ 63. -38.],1,00:26,NYI,TOR,NYI,2,TOR,10,2,0,8473504,8479318.0,Cal Clutterbuck hit Auston Matthews
104,hit,Johnny Boychuk,Alexander Kerfoot,[95.  7.],2,18:32,NYI,TOR,NYI,2,TOR,10,2,1,8470187,8477021.0,Johnny Boychuk hit Alexander Kerfoot
111,hit,Cal Clutterbuck,Tyson Barrie,[ 14. -40.],2,16:31,NYI,TOR,NYI,2,TOR,10,2,1,8473504,8475197.0,Cal Clutterbuck hit Tyson Barrie
112,hit,Jake Muzzin,Cal Clutterbuck,[17. 39.],2,16:21,TOR,NYI,NYI,2,TOR,10,2,1,8474162,8473504.0,Jake Muzzin hit Cal Clutterbuck
113,hit,Kasperi Kapanen,Ryan Pulock,[98. -5.],2,16:13,TOR,NYI,NYI,2,TOR,10,2,1,8477953,8477506.0,Kasperi Kapanen hit Ryan Pulock
120,hit,Trevor Moore,Nick Leddy,[ 34. -39.],2,14:39,TOR,NYI,NYI,2,TOR,10,2,1,8479675,8475181.0,Trevor Moore hit Nick Leddy
127,hit,Leo Komarov,Nicholas Shore,[-53. -39.],2,13:43,NYI,TOR,NYI,2,TOR,10,2,1,8473463,8476406.0,Leo Komarov hit Nicholas Shore
129,hit,Derick Brassard,Morgan Rielly,[-94.  24.],2,13:13,NYI,TOR,NYI,2,TOR,10,2,1,8473544,8476853.0,Derick Brassard hit Morgan Rielly
134,hit,Devon Toews,Justin Holl,[ 83. -36.],2,12:32,NYI,TOR,NYI,2,TOR,10,2,1,8478038,8475718.0,Devon Toews hit Justin Holl
137,hit,Trevor Moore,Johnny Boychuk,[ 96. -23.],2,11:19,TOR,NYI,NYI,2,TOR,10,2,1,8479675,8470187.0,Trevor Moore hit Johnny Boychuk
139,hit,Casey Cizikas,Tyson Barrie,[-95. -21.],2,11:07,NYI,TOR,NYI,2,TOR,10,2,1,8475231,8475197.0,Casey Cizikas hit Tyson Barrie
140,hit,Ross Johnston,Jake Muzzin,[-93. -23.],2,10:50,NYI,TOR,NYI,2,TOR,10,2,1,8477527,8474162.0,Ross Johnston hit Jake Muzzin
144,hit,Scott Mayfield,John Tavares,[ 68. -31.],2,09:38,NYI,TOR,NYI,2,TOR,10,2,1,8476429,8475166.0,Scott Mayfield hit John Tavares
154,hit,Michael Dal Colle,Cody Ceci,[-96. -21.],2,07:30,NYI,TOR,NYI,2,TOR,10,2,2,8477936,8476879.0,Michael Dal Colle hit Cody Ceci
155,hit,Derick Brassard,Morgan Rielly,[-96.   9.],2,07:26,NYI,TOR,NYI,2,TOR,10,2,2,8473544,8476853.0,Derick Brassard hit Morgan Rielly
156,hit,Leo Komarov,Morgan Rielly,[56. 39.],2,07:23,NYI,TOR,NYI,2,TOR,10,2,2,8473463,8476853.0,Leo Komarov hit Morgan Rielly
163,hit,Adam Pelech,William Nylander,[85. 10.],2,06:21,NYI,TOR,NYI,2,TOR,10,2,2,8476917,8477939.0,Adam Pelech hit William Nylander
165,hit,Kasperi Kapanen,Scott Mayfield,[ 95. -24.],2,05:41,TOR,NYI,NYI,2,TOR,10,2,2,8477953,8476429.0,Kasperi Kapanen hit Scott Mayfield
170,hit,Frederik Gauthier,Anders Lee,[-96.   1.],2,04:52,TOR,NYI,NYI,2,TOR,10,2,2,8477512,8475314.0,Frederik Gauthier hit Anders Lee
176,hit,Jake Muzzin,Brock Nelson,[-74. -34.],2,03:40,TOR,NYI,NYI,2,TOR,10,2,2,8474162,8475754.0,Jake Muzzin hit Brock Nelson
196,hit,Zach Hyman,Scott Mayfield,[-93. -22.],3,19:40,TOR,NYI,NYI,2,TOR,10,3,2,8475786,8476429.0,Zach Hyman hit Scott Mayfield
208,hit,Johnny Boychuk,Alexander Kerfoot,[-95. -19.],3,17:49,NYI,TOR,NYI,2,TOR,10,3,2,8470187,8477021.0,Johnny Boychuk hit Alexander Kerfoot
212,hit,Frederik Gauthier,Ryan Pulock,[-84. -35.],3,16:59,TOR,NYI,NYI,2,TOR,10,3,2,8477512,8477506.0,Frederik Gauthier hit Ryan Pulock
217,hit,Scott Mayfield,Andreas Johnsson,[-97. -15.],3,15:40,NYI,TOR,NYI,2,TOR,10,3,2,8476429,8477341.0,Scott Mayfield hit Andreas Johnsson
218,hit,Derick Brassard,Morgan Rielly,[-87. -34.],3,15:21,NYI,TOR,NYI,2,TOR,10,3,2,8473544,8476853.0,Derick Brassard hit Morgan Rielly
228,hit,Johnny Boychuk,William Nylander,[-88. -33.],3,14:25,NYI,TOR,NYI,2,TOR,10,3,2,8470187,8477939.0,Johnny Boychuk hit William Nylander
246,hit,Johnny Boychuk,Alexander Kerfoot,[-89. -29.],3,09:55,NYI,TOR,NYI,2,TOR,10,4,2,8470187,8477021.0,Johnny Boychuk hit Alexander Kerfoot
248,hit,Trevor Moore,Josh Bailey,[-94.  22.],3,09:47,TOR,NYI,NYI,2,TOR,10,4,2,8479675,8474573.0,Trevor Moore hit Josh Bailey
265,hit,Morgan Rielly,Michael Dal Colle,[ 98. -18.],3,05:22,TOR,NYI,NYI,2,TOR,10,4,2,8476853,8477936.0,Morgan Rielly hit Michael Dal Colle
267,hit,Andreas Johnsson,Ryan Pulock,[-69. -39.],3,05:14,TOR,NYI,NYI,2,TOR,10,4,2,8477341,8477506.0,Andreas Johnsson hit Ryan Pulock
273,hit,Nick Leddy,Alexander Kerfoot,[-82.  37.],3,03:52,NYI,TOR,NYI,2,TOR,10,4,2,8475181,8477021.0,Nick Leddy hit Alexander Kerfoot
278,hit,Mathew Barzal,Alexander Kerfoot,[92. 25.],3,03:10,NYI,TOR,NYI,2,TOR,10,4,2,8478445,8477021.0,Mathew Barzal hit Alexander Kerfoot
289,hit,Cal Clutterbuck,Morgan Rielly,[-35. -40.],3,00:23,NYI,TOR,NYI,2,TOR,10,5,4,8473504,8476853.0,Cal Clutterbuck hit Morgan Rielly
2,hit,Andreas Johnsson,Brandon Carlo,[-97. -17.],1,19:17,TOR,BOS,TOR,10,BOS,6,0,0,8477341,8478443.0,Andreas Johnsson hit Brandon Carlo
4,hit,Jason Spezza,Trent Frederic,[-16.  39.],1,18:29,TOR,BOS,TOR,10,BOS,6,0,0,8469455,8479365.0,Jason Spezza hit Trent Frederic
5,hit,Trent Frederic,Jason Spezza,[-16.  40.],1,18:22,BOS,TOR,TOR,10,BOS,6,0,0,8479365,8469455.0,Trent Frederic hit Jason Spezza
6,hit,Trent Frederic,Justin Holl,[95. 28.],1,18:15,BOS,TOR,TOR,10,BOS,6,0,0,8479365,8475718.0,Trent Frederic hit Justin Holl
10,hit,Connor Clifton,Frederik Gauthier,[-96. -24.],1,17:24,BOS,TOR,TOR,10,BOS,6,0,0,8477365,8477512.0,Connor Clifton hit Frederik Gauthier
15,hit,Jake Muzzin,Anders Bjork,[ 94. -29.],1,16:17,TOR,BOS,TOR,10,BOS,6,0,0,8474162,8478075.0,Jake Muzzin hit Anders Bjork
19,hit,David Krejci,Andreas Johnsson,[-97. -17.],1,16:00,BOS,TOR,TOR,10,BOS,6,0,0,8471276,8477341.0,David Krejci hit Andreas Johnsson
24,hit,Nicholas Shore,Sean Kuraly,[ 33. -37.],1,15:21,TOR,BOS,TOR,10,BOS,6,0,0,8476406,8476374.0,Nicholas Shore hit Sean Kuraly
25,hit,Trent Frederic,Jake Muzzin,[96. 10.],1,15:01,BOS,TOR,TOR,10,BOS,6,0,0,8479365,8474162.0,Trent Frederic hit Jake Muzzin
27,hit,Trent Frederic,Frederik Gauthier,[16. 39.],1,14:46,BOS,TOR,TOR,10,BOS,6,0,0,8479365,8477512.0,Trent Frederic hit Frederik Gauthier
28,hit,Trent Frederic,John Tavares,[97. -6.],1,14:34,BOS,TOR,TOR,10,BOS,6,0,0,8479365,8475166.0,Trent Frederic hit John Tavares
33,hit,Anders Bjork,Travis Dermott,[ 81. -35.],1,13:59,BOS,TOR,TOR,10,BOS,6,0,0,8478075,8478408.0,Anders Bjork hit Travis Dermott
41,hit,David Pastrnak,John Tavares,[-69. -39.],1,12:48,BOS,TOR,TOR,10,BOS,6,0,0,8477956,8475166.0,David Pastrnak hit John Tavares
51,hit,Chris Wagner,Trevor Moore,[-24.  14.],1,11:26,BOS,TOR,TOR,10,BOS,6,0,0,8475780,8479675.0,Chris Wagner hit Trevor Moore
54,hit,Chris Wagner,Justin Holl,[49. 40.],1,10:55,BOS,TOR,TOR,10,BOS,6,0,0,8475780,8475718.0,Chris Wagner hit Justin Holl
56,hit,Justin Holl,Chris Wagner,[87. 35.],1,10:49,TOR,BOS,TOR,10,BOS,6,0,0,8475718,8475780.0,Justin Holl hit Chris Wagner
63,hit,Auston Matthews,Charlie Coyle,[  7. -39.],1,09:22,TOR,BOS,TOR,10,BOS,6,0,0,8479318,8475745.0,Auston Matthews hit Charlie Coyle
68,hit,Chris Wagner,Nic Petan,[-18. -41.],1,07:29,BOS,TOR,TOR,10,BOS,6,0,0,8475780,8477464.0,Chris Wagner hit Nic Petan
70,hit,Urho Vaakanainen,Jason Spezza,[-99.  16.],1,07:17,BOS,TOR,TOR,10,BOS,6,0,0,8480001,8469455.0,Urho Vaakanainen hit Jason Spezza
84,hit,Joakim Nordstrom,Auston Matthews,[ 23. -38.],1,04:34,BOS,TOR,TOR,10,BOS,6,0,1,8475807,8479318.0,Joakim Nordstrom hit Auston Matthews
86,hit,Sean Kuraly,Nic Petan,[-28.  -1.],1,04:08,BOS,TOR,TOR,10,BOS,6,0,1,8476374,8477464.0,Sean Kuraly hit Nic Petan
88,hit,Jake Muzzin,Brad Marchand,[ 54. -38.],1,03:40,TOR,BOS,TOR,10,BOS,6,0,1,8474162,8473419.0,Jake Muzzin hit Brad Marchand
94,hit,Justin Holl,Brad Marchand,[88. 35.],1,02:26,TOR,BOS,TOR,10,BOS,6,0,1,8475718,8473419.0,Justin Holl hit Brad Marchand
96,hit,Morgan Rielly,David Pastrnak,[ 63. -39.],1,02:00,TOR,BOS,TOR,10,BOS,6,0,1,8476853,8477956.0,Morgan Rielly hit David Pastrnak
99,hit,Urho Vaakanainen,William Nylander,[-97.  20.],1,00:47,BOS,TOR,TOR,10,BOS,6,0,1,8480001,8477939.0,Urho Vaakanainen hit William Nylander
108,hit,Tyson Barrie,Joakim Nordstrom,[-98. -11.],2,18:11,TOR,BOS,TOR,10,BOS,6,0,1,8475197,8475807.0,Tyson Barrie hit Joakim Nordstrom
114,hit,Jake Muzzin,Brandon Carlo,[-99.  12.],2,17:04,TOR,BOS,TOR,10,BOS,6,0,1,8474162,8478443.0,Jake Muzzin hit Brandon Carlo
121,hit,Jake Muzzin,Anders Bjork,[-66.  14.],2,16:20,TOR,BOS,TOR,10,BOS,6,0,1,8474162,8478075.0,Jake Muzzin hit Anders Bjork
136,hit,Justin Holl,Charlie McAvoy,[-91.  30.],2,12:44,TOR,BOS,TOR,10,BOS,6,0,1,8475718,8479325.0,Justin Holl hit Charlie McAvoy
139,hit,Nicholas Shore,Urho Vaakanainen,[95. 26.],2,12:23,TOR,BOS,TOR,10,BOS,6,0,1,8476406,8480001.0,Nicholas Shore hit Urho Vaakanainen
140,hit,Frederik Gauthier,Charlie Coyle,[ 93. -18.],2,12:15,TOR,BOS,TOR,10,BOS,6,0,1,8477512,8475745.0,Frederik Gauthier hit Charlie Coyle
141,hit,Frederik Gauthier,Urho Vaakanainen,[98.  5.],2,11:58,TOR,BOS,TOR,10,BOS,6,0,1,8477512,8480001.0,Frederik Gauthier hit Urho Vaakanainen
161,hit,Chris Wagner,Justin Holl,[-14. -42.],2,09:28,BOS,TOR,TOR,10,BOS,6,1,1,8475780,8475718.0,Chris Wagner hit Justin Holl
162,hit,Auston Matthews,Connor Clifton,[95. 23.],2,09:23,TOR,BOS,TOR,10,BOS,6,1,1,8479318,8477365.0,Auston Matthews hit Connor Clifton
179,hit,Brad Marchand,Zach Hyman,[-28.  39.],2,06:40,BOS,TOR,TOR,10,BOS,6,1,1,8473419,8475786.0,Brad Marchand hit Zach Hyman
180,hit,Charlie McAvoy,Frederik Gauthier,[92. 30.],2,06:24,BOS,TOR,TOR,10,BOS,6,1,1,8479325,8477512.0,Charlie McAvoy hit Frederik Gauthier
184,hit,Charlie McAvoy,William Nylander,[96. 13.],2,05:38,BOS,TOR,TOR,10,BOS,6,1,1,8479325,8477939.0,Charlie McAvoy hit William Nylander
189,hit,Trent Frederic,Tyson Barrie,[-98.   2.],2,04:35,BOS,TOR,TOR,10,BOS,6,1,1,8479365,8475197.0,Trent Frederic hit Tyson Barrie
192,hit,Zach Hyman,Matt Grzelcyk,[ 42. -40.],2,04:13,TOR,BOS,TOR,10,BOS,6,1,1,8475786,8476891.0,Zach Hyman hit Matt Grzelcyk
194,hit,Brandon Carlo,Zach Hyman,[-27.  18.],2,03:49,BOS,TOR,TOR,10,BOS,6,1,1,8478443,8475786.0,Brandon Carlo hit Zach Hyman
201,hit,Sean Kuraly,Andreas Johnsson,[47. 40.],2,02:23,BOS,TOR,TOR,10,BOS,6,1,1,8476374,8477341.0,Sean Kuraly hit Andreas Johnsson
211,hit,Charlie Coyle,Jake Muzzin,[78. 40.],2,00:04,BOS,TOR,TOR,10,BOS,6,1,1,8475745,8474162.0,Charlie Coyle hit Jake Muzzin
223,hit,Par Lindholm,Ilya Mikheyev,[-76.  40.],3,17:43,BOS,TOR,TOR,10,BOS,6,1,2,8480944,8481624.0,Par Lindholm hit Ilya Mikheyev
225,hit,Nicholas Shore,Brandon Carlo,[-94.  21.],3,16:50,TOR,BOS,TOR,10,BOS,6,1,2,8476406,8478443.0,Nicholas Shore hit Brandon Carlo
229,hit,Zdeno Chara,Zach Hyman,[-92. -28.],3,16:08,BOS,TOR,TOR,10,BOS,6,1,2,8465009,8475786.0,Zdeno Chara hit Zach Hyman
240,hit,Patrice Bergeron,Zach Hyman,[ 59. -34.],3,14:32,BOS,TOR,TOR,10,BOS,6,2,3,8470638,8475786.0,Patrice Bergeron hit Zach Hyman
246,hit,Connor Clifton,Auston Matthews,[-97.  -2.],3,13:04,BOS,TOR,TOR,10,BOS,6,2,3,8477365,8479318.0,Connor Clifton hit Auston Matthews
248,hit,Auston Matthews,Charlie McAvoy,[-90. -33.],3,12:33,TOR,BOS,TOR,10,BOS,6,2,3,8479318,8479325.0,Auston Matthews hit Charlie McAvoy
250,hit,Charlie Coyle,Jake Muzzin,[99.  2.],3,11:47,BOS,TOR,TOR,10,BOS,6,2,3,8475745,8474162.0,Charlie Coyle hit Jake Muzzin
251,hit,Connor Clifton,Morgan Rielly,[-29. -41.],3,11:24,BOS,TOR,TOR,10,BOS,6,2,3,8477365,8476853.0,Connor Clifton hit Morgan Rielly
252,hit,Urho Vaakanainen,Nic Petan,[-83. -36.],3,11:16,BOS,TOR,TOR,10,BOS,6,2,3,8480001,8477464.0,Urho Vaakanainen hit Nic Petan
257,hit,Andreas Johnsson,Par Lindholm,[-44.  39.],3,10:21,TOR,BOS,TOR,10,BOS,6,2,3,8477341,8480944.0,Andreas Johnsson hit Par Lindholm
264,hit,John Tavares,Matt Grzelcyk,[-82.  38.],3,09:08,TOR,BOS,TOR,10,BOS,6,2,3,8475166,8476891.0,John Tavares hit Matt Grzelcyk
266,hit,Cody Ceci,Sean Kuraly,[25. 40.],3,09:00,TOR,BOS,TOR,10,BOS,6,2,3,8476879,8476374.0,Cody Ceci hit Sean Kuraly
268,hit,Chris Wagner,Travis Dermott,[97. 11.],3,08:49,BOS,TOR,TOR,10,BOS,6,2,3,8475780,8478408.0,Chris Wagner hit Travis Dermott
271,hit,Morgan Rielly,David Krejci,[ 26. -12.],3,08:22,TOR,BOS,TOR,10,BOS,6,2,3,8476853,8471276.0,Morgan Rielly hit David Krejci
276,hit,Patrice Bergeron,Kasperi Kapanen,[-76. -41.],3,06:27,BOS,TOR,TOR,10,BOS,6,2,3,8470638,8477953.0,Patrice Bergeron hit Kasperi Kapanen
285,hit,Zdeno Chara,Justin Holl,[-98.  10.],3,04:01,BOS,TOR,TOR,10,BOS,6,2,3,8465009,8475718.0,Zdeno Chara hit Justin Holl
292,hit,Charlie McAvoy,Nic Petan,[-77. -41.],3,02:49,BOS,TOR,TOR,10,BOS,6,2,3,8479325,8477464.0,Charlie McAvoy hit Nic Petan
7,hit,Morgan Rielly,Brandon Tanev,[9. 7.],1,18:50,TOR,PIT,PIT,5,TOR,10,0,0,8476853,8479293.0,Morgan Rielly hit Brandon Tanev
12,hit,Dmytro Timashov,Alex Galchenyuk,[-53.  13.],1,17:59,TOR,PIT,PIT,5,TOR,10,0,0,8478857,8476851.0,Dmytro Timashov hit Alex Galchenyuk
20,hit,Brandon Tanev,Morgan Rielly,[ 85. -39.],1,17:01,PIT,TOR,PIT,5,TOR,10,0,0,8479293,8476853.0,Brandon Tanev hit Morgan Rielly
21,hit,Cody Ceci,Brandon Tanev,[98.  5.],1,16:58,TOR,PIT,PIT,5,TOR,10,0,0,8476879,8479293.0,Cody Ceci hit Brandon Tanev
23,hit,Jared McCann,Cody Ceci,[-5. 41.],1,16:38,PIT,TOR,PIT,5,TOR,10,0,0,8477955,8476879.0,Jared McCann hit Cody Ceci
28,hit,Dmytro Timashov,Bryan Rust,[ 71. -41.],1,15:41,TOR,PIT,PIT,5,TOR,10,0,0,8478857,8475810.0,Dmytro Timashov hit Bryan Rust
34,hit,Jared McCann,Nicholas Shore,[73. 41.],1,14:29,PIT,TOR,PIT,5,TOR,10,0,0,8477955,8476406.0,Jared McCann hit Nicholas Shore
49,hit,Kasperi Kapanen,Jared McCann,[ 61. -41.],1,12:26,TOR,PIT,PIT,5,TOR,10,1,0,8477953,8477955.0,Kasperi Kapanen hit Jared McCann
51,hit,Brandon Tanev,Cody Ceci,[-74.  39.],1,12:02,PIT,TOR,PIT,5,TOR,10,1,0,8479293,8476879.0,Brandon Tanev hit Cody Ceci
52,hit,Zach Hyman,Justin Schultz,[-64. -40.],1,11:41,TOR,PIT,PIT,5,TOR,10,1,0,8475786,8474602.0,Zach Hyman hit Justin Schultz
59,hit,Jared McCann,Jake Muzzin,[35. -8.],1,09:28,PIT,TOR,PIT,5,TOR,10,2,0,8477955,8474162.0,Jared McCann hit Jake Muzzin
60,hit,Jake Muzzin,Dominik Kahun,[98. -5.],1,09:11,TOR,PIT,PIT,5,TOR,10,2,0,8474162,8480946.0,Jake Muzzin hit Dominik Kahun
62,hit,Jake Muzzin,Evgeni Malkin,[ 98. -11.],1,08:50,TOR,PIT,PIT,5,TOR,10,2,0,8474162,8471215.0,Jake Muzzin hit Evgeni Malkin
70,hit,Juuso Riikola,Nic Petan,[ 32. -31.],1,07:01,PIT,TOR,PIT,5,TOR,10,2,0,8480945,8477464.0,Juuso Riikola hit Nic Petan
71,hit,Jack Johnson,Ilya Mikheyev,[-13. -41.],1,06:59,PIT,TOR,PIT,5,TOR,10,2,0,8471677,8481624.0,Jack Johnson hit Ilya Mikheyev
73,hit,Frederik Gauthier,Marcus Pettersson,[-93.  26.],1,06:38,TOR,PIT,PIT,5,TOR,10,2,0,8477512,8477969.0,Frederik Gauthier hit Marcus Pettersson
81,hit,Zach Aston-Reese,Andreas Johnsson,[-23.  17.],1,04:00,PIT,TOR,PIT,5,TOR,10,2,0,8479944,8477341.0,Zach Aston-Reese hit Andreas Johnsson
83,hit,Juuso Riikola,Auston Matthews,[-98.   1.],1,03:37,PIT,TOR,PIT,5,TOR,10,2,0,8480945,8479318.0,Juuso Riikola hit Auston Matthews
88,hit,Juuso Riikola,Ilya Mikheyev,[-84. -37.],1,02:12,PIT,TOR,PIT,5,TOR,10,2,0,8480945,8481624.0,Juuso Riikola hit Ilya Mikheyev
95,hit,Zach Aston-Reese,Justin Holl,[-46.  41.],1,01:33,PIT,TOR,PIT,5,TOR,10,2,0,8479944,8475718.0,Zach Aston-Reese hit Justin Holl
97,hit,Kasperi Kapanen,Zach Aston-Reese,[99. -7.],1,01:07,TOR,PIT,PIT,5,TOR,10,2,0,8477953,8479944.0,Kasperi Kapanen hit Zach Aston-Reese
98,hit,Travis Dermott,Teddy Blueger,[ 97. -19.],1,00:56,TOR,PIT,PIT,5,TOR,10,2,0,8478408,8476927.0,Travis Dermott hit Teddy Blueger
104,hit,Cody Ceci,Jake Guentzel,[ 59. -40.],1,00:24,TOR,PIT,PIT,5,TOR,10,2,0,8476879,8477404.0,Cody Ceci hit Jake Guentzel
109,hit,Brandon Tanev,Morgan Rielly,[-94.  25.],2,19:46,PIT,TOR,PIT,5,TOR,10,2,0,8479293,8476853.0,Brandon Tanev hit Morgan Rielly
110,hit,Marcus Pettersson,Kasperi Kapanen,[ 69. -41.],2,19:32,PIT,TOR,PIT,5,TOR,10,2,0,8477969,8477953.0,Marcus Pettersson hit Kasperi Kapanen
111,hit,Jared McCann,John Tavares,[99.  6.],2,19:28,PIT,TOR,PIT,5,TOR,10,2,0,8477955,8475166.0,Jared McCann hit John Tavares
131,hit,Justin Holl,Sam Lafferty,[-99.   9.],2,15:52,TOR,PIT,PIT,5,TOR,10,3,0,8475718,8478043.0,Justin Holl hit Sam Lafferty
135,hit,Cody Ceci,Jake Guentzel,[-15. -29.],2,14:57,TOR,PIT,PIT,5,TOR,10,4,0,8476879,8477404.0,Cody Ceci hit Jake Guentzel
138,hit,Joseph Blandisi,Jason Spezza,[97. -2.],2,14:17,PIT,TOR,PIT,5,TOR,10,4,0,8477010,8469455.0,Joseph Blandisi hit Jason Spezza
143,hit,Dmytro Timashov,Justin Schultz,[ 99. -15.],2,13:18,TOR,PIT,PIT,5,TOR,10,4,0,8478857,8474602.0,Dmytro Timashov hit Justin Schultz
