,event,hitter,hittee,coords,period,period_time_remaining,hitter_team,hittee_team,home_team,home_team_id,away_team,away_team_id,home_goals,away_goals,hitter_id,hittee_id,description
118,hit,Filip Chlapik,Martin Marincin,[-97. -20.],2,17:29,OTT,TOR,TOR,10,OTT,9,1,1,8478488,8475716.0,Filip Chlapik hit Martin Marincin
119,hit,Trevor Moore,Erik Brannstrom,[97. 26.],2,17:19,TOR,OTT,TOR,10,OTT,9,1,1,8479675,8480073.0,Trevor Moore hit Erik Brannstrom
122,hit,Kasperi Kapanen,Dylan DeMelo,[99. 27.],2,17:08,TOR,OTT,TOR,10,OTT,9,1,1,8477953,8476331.0,Kasperi Kapanen hit Dylan DeMelo
127,hit,Bobby Ryan,William Nylander,[81. 38.],2,15:38,OTT,TOR,TOR,10,OTT,9,1,1,8471676,8477939.0,Bobby Ryan hit William Nylander
139,hit,Jean-Gabriel Pageau,Jake Muzzin,[96. 25.],2,14:19,OTT,TOR,TOR,10,OTT,9,2,1,8476419,8474162.0,Jean-Gabriel Pageau hit Jake Muzzin
153,hit,Dmytro Timashov,Thomas Chabot,[96.  1.],2,11:17,TOR,OTT,TOR,10,OTT,9,3,2,8478857,8478469.0,Dmytro Timashov hit Thomas Chabot
154,hit,Jake Muzzin,Drake Batherson,[-43.  38.],2,10:46,TOR,OTT,TOR,10,OTT,9,3,2,8474162,8480208.0,Jake Muzzin hit Drake Batherson
156,hit,Brady Tkachuk,Cody Ceci,[-37. -39.],2,10:12,OTT,TOR,TOR,10,OTT,9,3,2,8480801,8476879.0,Brady Tkachuk hit Cody Ceci
158,hit,Brady Tkachuk,Alexander Kerfoot,[ 95. -19.],2,10:02,OTT,TOR,TOR,10,OTT,9,3,2,8480801,8477021.0,Brady Tkachuk hit Alexander Kerfoot
167,hit,Andreas Johnsson,Nikita Zaitsev,[ 96. -17.],2,07:41,TOR,OTT,TOR,10,OTT,9,3,2,8477341,8479458.0,Andreas Johnsson hit Nikita Zaitsev
177,hit,Alexander Kerfoot,Mark Borowiecki,[-94. -26.],2,06:12,TOR,OTT,TOR,10,OTT,9,3,2,8477021,8474697.0,Alexander Kerfoot hit Mark Borowiecki
188,hit,Ilya Mikheyev,Dylan DeMelo,[ 93. -35.],2,05:00,TOR,OTT,TOR,10,OTT,9,4,2,8481624,8476331.0,Ilya Mikheyev hit Dylan DeMelo
196,hit,Chris Tierney,Martin Marincin,[-98.   3.],2,02:39,OTT,TOR,TOR,10,OTT,9,4,2,8476919,8475716.0,Chris Tierney hit Martin Marincin
197,hit,Erik Brannstrom,Dmytro Timashov,[ 84. -37.],2,02:30,OTT,TOR,TOR,10,OTT,9,4,2,8480073,8478857.0,Erik Brannstrom hit Dmytro Timashov
199,hit,Ron Hainsey,Jake Muzzin,[74. 40.],2,02:20,OTT,TOR,TOR,10,OTT,9,4,2,8468493,8474162.0,Ron Hainsey hit Jake Muzzin
200,hit,Thomas Chabot,Andreas Johnsson,[ 63. -39.],2,01:56,OTT,TOR,TOR,10,OTT,9,4,2,8478469,8477341.0,Thomas Chabot hit Andreas Johnsson
203,hit,Nikita Zaitsev,John Tavares,[95. 20.],2,01:26,OTT,TOR,TOR,10,OTT,9,4,2,8479458,8475166.0,Nikita Zaitsev hit John Tavares
209,hit,Anthony Duclair,Cody Ceci,[-96. -26.],2,00:24,OTT,TOR,TOR,10,OTT,9,4,2,8477407,8476879.0,Anthony Duclair hit Cody Ceci
215,hit,Kasperi Kapanen,Nikita Zaitsev,[-83.  39.],3,19:15,TOR,OTT,TOR,10,OTT,9,4,2,8477953,8479458.0,Kasperi Kapanen hit Nikita Zaitsev
219,hit,Chris Tierney,Jake Muzzin,[-43. -38.],3,18:56,OTT,TOR,TOR,10,OTT,9,4,2,8476919,8474162.0,Chris Tierney hit Jake Muzzin
222,hit,Tyler Ennis,Alexander Kerfoot,[-10.  24.],3,18:13,OTT,TOR,TOR,10,OTT,9,4,2,8474589,8477021.0,Tyler Ennis hit Alexander Kerfoot
223,hit,Dylan DeMelo,Alexander Kerfoot,[-33.  29.],3,18:07,OTT,TOR,TOR,10,OTT,9,4,2,8476331,8477021.0,Dylan DeMelo hit Alexander Kerfoot
228,hit,Erik Brannstrom,Mitchell Marner,[-94. -23.],3,17:25,OTT,TOR,TOR,10,OTT,9,4,2,8480073,8478483.0,Erik Brannstrom hit Mitchell Marner
230,hit,Dmytro Timashov,Filip Chlapik,[51. 36.],3,17:00,TOR,OTT,TOR,10,OTT,9,4,2,8478857,8478488.0,Dmytro Timashov hit Filip Chlapik
238,hit,Anthony Duclair,Tyson Barrie,[96.  0.],3,15:16,OTT,TOR,TOR,10,OTT,9,4,2,8477407,8475197.0,Anthony Duclair hit Tyson Barrie
241,hit,Nikita Zaitsev,Frederik Gauthier,[-97.  13.],3,14:30,OTT,TOR,TOR,10,OTT,9,4,2,8479458,8477512.0,Nikita Zaitsev hit Frederik Gauthier
250,hit,Brady Tkachuk,Morgan Rielly,[96. -9.],3,11:58,OTT,TOR,TOR,10,OTT,9,4,2,8480801,8476853.0,Brady Tkachuk hit Morgan Rielly
251,hit,Scott Sabourin,Cody Ceci,[97. 22.],3,11:46,OTT,TOR,TOR,10,OTT,9,4,2,8477149,8476879.0,Scott Sabourin hit Cody Ceci
254,hit,Dylan DeMelo,Rasmus Sandin,[-44. -38.],3,10:34,OTT,TOR,TOR,10,OTT,9,4,2,8476331,8480873.0,Dylan DeMelo hit Rasmus Sandin
259,hit,Chris Tierney,Alexander Kerfoot,[-97.  25.],3,10:07,OTT,TOR,TOR,10,OTT,9,5,2,8476919,8477021.0,Chris Tierney hit Alexander Kerfoot
261,hit,Bobby Ryan,Alexander Kerfoot,[35. 39.],3,09:34,OTT,TOR,TOR,10,OTT,9,5,2,8471676,8477021.0,Bobby Ryan hit Alexander Kerfoot
264,hit,Filip Chlapik,Tyson Barrie,[63. 41.],3,08:14,OTT,TOR,TOR,10,OTT,9,5,2,8478488,8475197.0,Filip Chlapik hit Tyson Barrie
268,hit,Anthony Duclair,Rasmus Sandin,[-18. -38.],3,07:24,OTT,TOR,TOR,10,OTT,9,5,2,8477407,8480873.0,Anthony Duclair hit Rasmus Sandin
269,hit,Chris Tierney,John Tavares,[-34. -37.],3,07:10,OTT,TOR,TOR,10,OTT,9,5,2,8476919,8475166.0,Chris Tierney hit John Tavares
270,hit,Ron Hainsey,John Tavares,[ 27. -37.],3,07:01,OTT,TOR,TOR,10,OTT,9,5,2,8468493,8475166.0,Ron Hainsey hit John Tavares
280,hit,Brady Tkachuk,Dmytro Timashov,[ 92. -35.],3,05:19,OTT,TOR,TOR,10,OTT,9,5,2,8480801,8478857.0,Brady Tkachuk hit Dmytro Timashov
281,hit,Brady Tkachuk,Rasmus Sandin,[ 94. -35.],3,05:10,OTT,TOR,TOR,10,OTT,9,5,2,8480801,8480873.0,Brady Tkachuk hit Rasmus Sandin
283,hit,Bobby Ryan,Cody Ceci,[85. 40.],3,04:45,OTT,TOR,TOR,10,OTT,9,5,2,8471676,8476879.0,Bobby Ryan hit Cody Ceci
284,hit,Dylan DeMelo,William Nylander,[-98.  29.],3,04:33,OTT,TOR,TOR,10,OTT,9,5,2,8476331,8477939.0,Dylan DeMelo hit William Nylander
1,hit,Boone Jenner,Kasperi Kapanen,[ 70. -38.],1,19:49,CBJ,TOR,CBJ,29,TOR,10,0,0,8476432,8477953.0,Boone Jenner hit Kasperi Kapanen
3,hit,Cam Atkinson,Jake Muzzin,[97. 23.],1,19:07,CBJ,TOR,CBJ,29,TOR,10,0,0,8474715,8474162.0,Cam Atkinson hit Jake Muzzin
6,hit,Alexander Kerfoot,Oliver Bjorkstrand,[ 16. -38.],1,18:06,TOR,CBJ,CBJ,29,TOR,10,0,0,8477021,8477416.0,Alexander Kerfoot hit Oliver Bjorkstrand
23,hit,Jake Muzzin,Josh Anderson,[12. 30.],1,15:21,TOR,CBJ,CBJ,29,TOR,10,0,0,8474162,8476981.0,Jake Muzzin hit Josh Anderson
28,hit,Andreas Johnsson,David Savard,[-96.  32.],1,13:11,TOR,CBJ,CBJ,29,TOR,10,0,0,8477341,8475233.0,Andreas Johnsson hit David Savard
29,hit,David Savard,Andreas Johnsson,[-79.  39.],1,13:04,CBJ,TOR,CBJ,29,TOR,10,0,0,8475233,8477341.0,David Savard hit Andreas Johnsson
35,hit,Alexandre Texier,Trevor Moore,[ 85. -28.],1,11:15,CBJ,TOR,CBJ,29,TOR,10,0,0,8480074,8479675.0,Alexandre Texier hit Trevor Moore
37,hit,Josh Anderson,Justin Holl,[ 57. -38.],1,10:44,CBJ,TOR,CBJ,29,TOR,10,0,0,8476981,8475718.0,Josh Anderson hit Justin Holl
45,hit,Morgan Rielly,Josh Anderson,[ 87. -37.],1,09:23,TOR,CBJ,CBJ,29,TOR,10,0,0,8476853,8476981.0,Morgan Rielly hit Josh Anderson
46,hit,Boone Jenner,Cody Ceci,[ 95. -30.],1,09:07,CBJ,TOR,CBJ,29,TOR,10,0,0,8476432,8476879.0,Boone Jenner hit Cody Ceci
67,hit,Jake Muzzin,Pierre-Luc Dubois,[ 61. -40.],1,05:05,TOR,CBJ,CBJ,29,TOR,10,0,1,8474162,8479400.0,Jake Muzzin hit Pierre-Luc Dubois
70,hit,Alexander Kerfoot,Zach Werenski,[-97. -24.],1,04:17,TOR,CBJ,CBJ,29,TOR,10,0,1,8477021,8478460.0,Alexander Kerfoot hit Zach Werenski
72,hit,Seth Jones,John Tavares,[-96.   8.],1,04:05,CBJ,TOR,CBJ,29,TOR,10,0,1,8477495,8475166.0,Seth Jones hit John Tavares
73,hit,Nic Petan,Pierre-Luc Dubois,[ 40. -37.],1,03:34,TOR,CBJ,CBJ,29,TOR,10,0,1,8477464,8479400.0,Nic Petan hit Pierre-Luc Dubois
79,hit,Alexandre Texier,Jake Muzzin,[96. -8.],1,03:00,CBJ,TOR,CBJ,29,TOR,10,0,1,8480074,8474162.0,Alexandre Texier hit Jake Muzzin
93,hit,Pierre-Luc Dubois,Auston Matthews,[ 40. -40.],2,19:17,CBJ,TOR,CBJ,29,TOR,10,0,1,8479400,8479318.0,Pierre-Luc Dubois hit Auston Matthews
97,hit,Alexander Wennberg,Mitchell Marner,[ 42. -16.],2,18:51,CBJ,TOR,CBJ,29,TOR,10,0,1,8477505,8478483.0,Alexander Wennberg hit Mitchell Marner
100,hit,Rasmus Sandin,Oliver Bjorkstrand,[-96.  29.],2,18:04,TOR,CBJ,CBJ,29,TOR,10,0,1,8480873,8477416.0,Rasmus Sandin hit Oliver Bjorkstrand
106,hit,Boone Jenner,Frederik Gauthier,[ 51. -37.],2,17:19,CBJ,TOR,CBJ,29,TOR,10,0,1,8476432,8477512.0,Boone Jenner hit Frederik Gauthier
108,hit,Boone Jenner,Frederik Gauthier,[96.  7.],2,17:00,CBJ,TOR,CBJ,29,TOR,10,0,1,8476432,8477512.0,Boone Jenner hit Frederik Gauthier
121,hit,Jakob Lilja,Cody Ceci,[-95. -31.],2,13:29,CBJ,TOR,CBJ,29,TOR,10,0,1,8481650,8476879.0,Jakob Lilja hit Cody Ceci
122,hit,Riley Nash,Cody Ceci,[-97. -17.],2,13:27,CBJ,TOR,CBJ,29,TOR,10,0,1,8474062,8476879.0,Riley Nash hit Cody Ceci
123,hit,Morgan Rielly,Jakob Lilja,[-97.  13.],2,13:25,TOR,CBJ,CBJ,29,TOR,10,0,1,8476853,8481650.0,Morgan Rielly hit Jakob Lilja
126,hit,Cody Ceci,Alexandre Texier,[-93. -33.],2,11:59,TOR,CBJ,CBJ,29,TOR,10,0,1,8476879,8480074.0,Cody Ceci hit Alexandre Texier
127,hit,Kasperi Kapanen,Alexandre Texier,[-94.  34.],2,11:49,TOR,CBJ,CBJ,29,TOR,10,0,1,8477953,8480074.0,Kasperi Kapanen hit Alexandre Texier
132,hit,Ilya Mikheyev,Ryan Murray,[ 97. -13.],2,11:12,TOR,CBJ,CBJ,29,TOR,10,0,1,8481624,8476850.0,Ilya Mikheyev hit Ryan Murray
133,hit,Trevor Moore,Seth Jones,[97. 24.],2,11:09,TOR,CBJ,CBJ,29,TOR,10,0,1,8479675,8477495.0,Trevor Moore hit Seth Jones
135,hit,Trevor Moore,Seth Jones,[95. 34.],2,10:50,TOR,CBJ,CBJ,29,TOR,10,0,1,8479675,8477495.0,Trevor Moore hit Seth Jones
136,hit,Frederik Gauthier,Markus Nutivaara,[96. 32.],2,10:12,TOR,CBJ,CBJ,29,TOR,10,0,1,8477512,8478906.0,Frederik Gauthier hit Markus Nutivaara
138,hit,Scott Harrington,Frederik Gauthier,[76.  5.],2,09:41,CBJ,TOR,CBJ,29,TOR,10,0,1,8476449,8477512.0,Scott Harrington hit Frederik Gauthier
142,hit,Pierre-Luc Dubois,John Tavares,[-77. -37.],2,09:12,CBJ,TOR,CBJ,29,TOR,10,0,2,8479400,8475166.0,Pierre-Luc Dubois hit John Tavares
182,hit,Josh Anderson,Andreas Johnsson,[-76.  -5.],3,19:01,CBJ,TOR,CBJ,29,TOR,10,1,2,8476981,8477341.0,Josh Anderson hit Andreas Johnsson
200,hit,Nick Foligno,Cody Ceci,[85. 41.],3,14:15,CBJ,TOR,CBJ,29,TOR,10,1,3,8473422,8476879.0,Nick Foligno hit Cody Ceci
203,hit,Rasmus Sandin,Boone Jenner,[ 82. -37.],3,13:44,TOR,CBJ,CBJ,29,TOR,10,1,3,8480873,8476432.0,Rasmus Sandin hit Boone Jenner
204,hit,Rasmus Sandin,Nick Foligno,[ 95. -19.],3,13:33,TOR,CBJ,CBJ,29,TOR,10,1,3,8480873,8473422.0,Rasmus Sandin hit Nick Foligno
212,hit,David Savard,William Nylander,[-59.  39.],3,11:44,CBJ,TOR,CBJ,29,TOR,10,1,3,8475233,8477939.0,David Savard hit William Nylander
217,hit,Nick Foligno,Morgan Rielly,[ 85. -40.],3,09:59,CBJ,TOR,CBJ,29,TOR,10,1,3,8473422,8476853.0,Nick Foligno hit Morgan Rielly
234,hit,Trevor Moore,David Savard,[-77.  38.],3,05:08,TOR,CBJ,CBJ,29,TOR,10,1,4,8479675,8475233.0,Trevor Moore hit David Savard
2,hit,Jordan Weal,Jake Muzzin,[ 15. -40.],1,19:29,MTL,TOR,TOR,10,MTL,8,0,0,8475738,8474162.0,Jordan Weal hit Jake Muzzin
7,hit,Kasperi Kapanen,Victor Mete,[-98.  20.],1,18:56,TOR,MTL,TOR,10,MTL,8,0,0,8477953,8479376.0,Kasperi Kapanen hit Victor Mete
12,hit,Brett Kulak,Alexander Kerfoot,[-97.  32.],1,18:28,MTL,TOR,TOR,10,MTL,8,0,1,8476967,8477021.0,Brett Kulak hit Alexander Kerfoot
16,hit,Ben Chiarot,Auston Matthews,[ 84. -32.],1,17:33,MTL,TOR,TOR,10,MTL,8,0,1,8475279,8479318.0,Ben Chiarot hit Auston Matthews
24,hit,Dmytro Timashov,Victor Mete,[-97.  26.],1,16:35,TOR,MTL,TOR,10,MTL,8,0,1,8478857,8479376.0,Dmytro Timashov hit Victor Mete
35,hit,Trevor Moore,Nick Suzuki,[-95. -30.],1,14:30,TOR,MTL,TOR,10,MTL,8,0,1,8479675,8480018.0,Trevor Moore hit Nick Suzuki
41,hit,Andreas Johnsson,Jesperi Kotkaniemi,[-37. -38.],1,13:35,TOR,MTL,TOR,10,MTL,8,1,1,8477341,8480829.0,Andreas Johnsson hit Jesperi Kotkaniemi
42,hit,Nicholas Shore,Tomas Tatar,[29. 31.],1,13:14,TOR,MTL,TOR,10,MTL,8,1,1,8476406,8475193.0,Nicholas Shore hit Tomas Tatar
43,hit,Cale Fleury,Jake Muzzin,[-97. -28.],1,13:02,MTL,TOR,TOR,10,MTL,8,1,1,8479985,8474162.0,Cale Fleury hit Jake Muzzin
50,hit,Phillip Danault,Kasperi Kapanen,[-52.  40.],1,12:05,MTL,TOR,TOR,10,MTL,8,1,1,8476479,8477953.0,Phillip Danault hit Kasperi Kapanen
55,hit,Martin Marincin,Nate Thompson,[ 96. -35.],1,10:41,TOR,MTL,TOR,10,MTL,8,1,1,8475716,8470775.0,Martin Marincin hit Nate Thompson
59,hit,Jake Muzzin,Jesperi Kotkaniemi,[ 49. -38.],1,10:01,TOR,MTL,TOR,10,MTL,8,1,1,8474162,8480829.0,Jake Muzzin hit Jesperi Kotkaniemi
64,hit,Shea Weber,Alexander Kerfoot,[-39. -37.],1,09:26,MTL,TOR,TOR,10,MTL,8,1,1,8470642,8477021.0,Shea Weber hit Alexander Kerfoot
73,hit,Artturi Lehkonen,Kasperi Kapanen,[-40.  38.],1,07:33,MTL,TOR,TOR,10,MTL,8,1,1,8477476,8477953.0,Artturi Lehkonen hit Kasperi Kapanen
76,hit,Alexander Kerfoot,Tomas Tatar,[-40.  27.],1,06:36,TOR,MTL,TOR,10,MTL,8,1,1,8477021,8475193.0,Alexander Kerfoot hit Tomas Tatar
91,hit,Nate Thompson,Tyson Barrie,[96. 31.],1,03:21,MTL,TOR,TOR,10,MTL,8,2,1,8470775,8475197.0,Nate Thompson hit Tyson Barrie
92,hit,Shea Weber,John Tavares,[-43. -37.],1,02:58,MTL,TOR,TOR,10,MTL,8,2,1,8470642,8475166.0,Shea Weber hit John Tavares
112,hit,Ilya Mikheyev,Phillip Danault,[ 96. -35.],2,18:44,TOR,MTL,TOR,10,MTL,8,2,1,8481624,8476479.0,Ilya Mikheyev hit Phillip Danault
125,hit,Jeff Petry,Nicholas Shore,[ 95. -34.],2,16:38,MTL,TOR,TOR,10,MTL,8,3,1,8473507,8476406.0,Jeff Petry hit Nicholas Shore
126,hit,Jake Muzzin,Nate Thompson,[ 79. -24.],2,16:24,TOR,MTL,TOR,10,MTL,8,3,1,8474162,8470775.0,Jake Muzzin hit Nate Thompson
128,hit,Nate Thompson,Jake Muzzin,[44. 31.],2,16:13,MTL,TOR,TOR,10,MTL,8,3,1,8470775,8474162.0,Nate Thompson hit Jake Muzzin
143,hit,Jonathan Drouin,Dmytro Timashov,[-86.  38.],2,11:56,MTL,TOR,TOR,10,MTL,8,3,1,8477494,8478857.0,Jonathan Drouin hit Dmytro Timashov
144,hit,Ilya Mikheyev,Ben Chiarot,[96. 19.],2,11:27,TOR,MTL,TOR,10,MTL,8,3,1,8481624,8475279.0,Ilya Mikheyev hit Ben Chiarot
148,hit,Ben Chiarot,John Tavares,[96. 19.],2,11:00,MTL,TOR,TOR,10,MTL,8,3,1,8475279,8475166.0,Ben Chiarot hit John Tavares
157,hit,John Tavares,Shea Weber,[97. 27.],2,09:54,TOR,MTL,TOR,10,MTL,8,3,1,8475166,8470642.0,John Tavares hit Shea Weber
160,hit,Jeff Petry,Trevor Moore,[65. 22.],2,09:00,MTL,TOR,TOR,10,MTL,8,3,1,8473507,8479675.0,Jeff Petry hit Trevor Moore
162,hit,Max Domi,Dmytro Timashov,[-91.  33.],2,08:18,MTL,TOR,TOR,10,MTL,8,3,1,8477503,8478857.0,Max Domi hit Dmytro Timashov
167,hit,John Tavares,Joel Armia,[84. 36.],2,07:13,TOR,MTL,TOR,10,MTL,8,3,1,8475166,8476469.0,John Tavares hit Joel Armia
169,hit,Auston Matthews,Brett Kulak,[83. 39.],2,06:43,TOR,MTL,TOR,10,MTL,8,3,1,8479318,8476967.0,Auston Matthews hit Brett Kulak
173,hit,Jeff Petry,Auston Matthews,[ 18. -37.],2,05:57,MTL,TOR,TOR,10,MTL,8,3,1,8473507,8479318.0,Jeff Petry hit Auston Matthews
179,hit,Jake Muzzin,Nick Suzuki,[-75.  41.],2,04:59,TOR,MTL,TOR,10,MTL,8,3,1,8474162,8480018.0,Jake Muzzin hit Nick Suzuki
182,hit,Jesperi Kotkaniemi,Tyson Barrie,[-99. -13.],2,04:05,MTL,TOR,TOR,10,MTL,8,3,1,8480829,8475197.0,Jesperi Kotkaniemi hit Tyson Barrie
189,hit,Brendan Gallagher,Alexander Kerfoot,[-84.  32.],2,03:06,MTL,TOR,TOR,10,MTL,8,3,1,8475848,8477021.0,Brendan Gallagher hit Alexander Kerfoot
206,hit,Jeff Petry,Ilya Mikheyev,[-11. -36.],3,19:41,MTL,TOR,TOR,10,MTL,8,3,1,8473507,8481624.0,Jeff Petry hit Ilya Mikheyev
207,hit,Cody Ceci,Brendan Gallagher,[ 96. -35.],3,19:26,TOR,MTL,TOR,10,MTL,8,3,1,8476879,8475848.0,Cody Ceci hit Brendan Gallagher
209,hit,Max Domi,Tyson Barrie,[ -8. -38.],3,18:58,MTL,TOR,TOR,10,MTL,8,3,1,8477503,8475197.0,Max Domi hit Tyson Barrie
211,hit,Shea Weber,William Nylander,[-34.  31.],3,18:37,MTL,TOR,TOR,10,MTL,8,3,1,8470642,8477939.0,Shea Weber hit William Nylander
218,hit,Brendan Gallagher,Cody Ceci,[68. 39.],3,16:40,MTL,TOR,TOR,10,MTL,8,3,1,8475848,8476879.0,Brendan Gallagher hit Cody Ceci
219,hit,Trevor Moore,Brett Kulak,[-96.  27.],3,16:33,TOR,MTL,TOR,10,MTL,8,3,1,8479675,8476967.0,Trevor Moore hit Brett Kulak
220,hit,Brett Kulak,Trevor Moore,[-95.   8.],3,16:27,MTL,TOR,TOR,10,MTL,8,3,1,8476967,8479675.0,Brett Kulak hit Trevor Moore
245,hit,Jake Muzzin,Max Domi,[ 39. -40.],3,11:56,TOR,MTL,TOR,10,MTL,8,4,3,8474162,8477503.0,Jake Muzzin hit Max Domi
250,hit,Joel Armia,Rasmus Sandin,[ 97. -12.],3,10:59,MTL,TOR,TOR,10,MTL,8,4,3,8476469,8480873.0,Joel Armia hit Rasmus Sandin
253,hit,Artturi Lehkonen,Jake Muzzin,[ 96. -20.],3,10:42,MTL,TOR,TOR,10,MTL,8,4,3,8477476,8474162.0,Artturi Lehkonen hit Jake Muzzin
272,hit,Auston Matthews,Jeff Petry,[-97.  19.],3,05:48,TOR,MTL,TOR,10,MTL,8,4,4,8479318,8473507.0,Auston Matthews hit Jeff Petry
293,hit,Tomas Tatar,Mitchell Marner,[ 97. -20.],4,04:13,MTL,TOR,TOR,10,MTL,8,5,5,8475193,8478483.0,Tomas Tatar hit Mitchell Marner
2,hit,David Perron,Kasperi Kapanen,[-80. -37.],1,19:40,STL,TOR,TOR,10,STL,19,0,0,8474102,8477953.0,David Perron hit Kasperi Kapanen
7,hit,Jay Bouwmeester,Auston Matthews,[-64.  39.],1,18:47,STL,TOR,TOR,10,STL,19,0,0,8470151,8479318.0,Jay Bouwmeester hit Auston Matthews
8,hit,Andreas Johnsson,Colton Parayko,[-62. -37.],1,18:33,TOR,STL,TOR,10,STL,19,0,0,8477341,8476892.0,Andreas Johnsson hit Colton Parayko
10,hit,Jay Bouwmeester,William Nylander,[-96.  13.],1,18:18,STL,TOR,TOR,10,STL,19,0,0,8470151,8477939.0,Jay Bouwmeester hit William Nylander
18,hit,John Tavares,Jaden Schwartz,[ 87. -31.],1,17:10,TOR,STL,TOR,10,STL,19,0,0,8475166,8475768.0,John Tavares hit Jaden Schwartz
19,hit,Jake Muzzin,Jaden Schwartz,[ 30. -37.],1,17:00,TOR,STL,TOR,10,STL,19,0,0,8474162,8475768.0,Jake Muzzin hit Jaden Schwartz
21,hit,Frederik Gauthier,Zach Sanford,[35. 38.],1,16:20,TOR,STL,TOR,10,STL,19,0,0,8477512,8477482.0,Frederik Gauthier hit Zach Sanford
24,hit,Sammy Blais,John Tavares,[ 74. -39.],1,15:41,STL,TOR,TOR,10,STL,19,0,0,8478104,8475166.0,Sammy Blais hit John Tavares
26,hit,Mitchell Marner,Sammy Blais,[17. 40.],1,15:17,TOR,STL,TOR,10,STL,19,0,0,8478483,8478104.0,Mitchell Marner hit Sammy Blais
35,hit,Brayden Schenn,Cody Ceci,[ 96. -15.],1,13:24,STL,TOR,TOR,10,STL,19,0,0,8475170,8476879.0,Brayden Schenn hit Cody Ceci
42,hit,Zach Sanford,Mitchell Marner,[ 90. -30.],1,12:27,STL,TOR,TOR,10,STL,19,0,0,8477482,8478483.0,Zach Sanford hit Mitchell Marner
50,hit,Ivan Barbashev,Rasmus Sandin,[91. 35.],1,10:21,STL,TOR,TOR,10,STL,19,0,0,8477964,8480873.0,Ivan Barbashev hit Rasmus Sandin
53,hit,Ivan Barbashev,Rasmus Sandin,[ 95. -28.],1,09:43,STL,TOR,TOR,10,STL,19,0,0,8477964,8480873.0,Ivan Barbashev hit Rasmus Sandin
70,hit,Sammy Blais,Jake Muzzin,[35. 38.],1,05:43,STL,TOR,TOR,10,STL,19,0,0,8478104,8474162.0,Sammy Blais hit Jake Muzzin
78,hit,Carl Gunnarsson,Alexander Kerfoot,[-98.  24.],1,03:59,STL,TOR,TOR,10,STL,19,0,0,8474125,8477021.0,Carl Gunnarsson hit Alexander Kerfoot
79,hit,Oskar Sundqvist,Tyson Barrie,[-83. -37.],1,03:50,STL,TOR,TOR,10,STL,19,0,0,8476897,8475197.0,Oskar Sundqvist hit Tyson Barrie
82,hit,Ilya Mikheyev,David Perron,[-39. -34.],1,03:19,TOR,STL,TOR,10,STL,19,0,0,8481624,8474102.0,Ilya Mikheyev hit David Perron
85,hit,Jake Muzzin,David Perron,[33. 35.],1,02:44,TOR,STL,TOR,10,STL,19,0,0,8474162,8474102.0,Jake Muzzin hit David Perron
87,hit,Cody Ceci,Vladimir Tarasenko,[56. 39.],1,02:06,TOR,STL,TOR,10,STL,19,0,0,8476879,8475765.0,Cody Ceci hit Vladimir Tarasenko
88,hit,Vladimir Tarasenko,Nic Petan,[-32. -37.],1,01:54,STL,TOR,TOR,10,STL,19,0,0,8475765,8477464.0,Vladimir Tarasenko hit Nic Petan
98,hit,Kasperi Kapanen,Carl Gunnarsson,[97. 29.],2,19:24,TOR,STL,TOR,10,STL,19,0,0,8477953,8474125.0,Kasperi Kapanen hit Carl Gunnarsson
100,hit,Vladimir Tarasenko,Andreas Johnsson,[-39.  39.],2,18:46,STL,TOR,TOR,10,STL,19,0,0,8475765,8477341.0,Vladimir Tarasenko hit Andreas Johnsson
107,hit,Ivan Barbashev,Rasmus Sandin,[-94.  33.],2,17:26,STL,TOR,TOR,10,STL,19,0,0,8477964,8480873.0,Ivan Barbashev hit Rasmus Sandin
122,hit,Jake Muzzin,Jaden Schwartz,[-68.  39.],2,13:56,TOR,STL,TOR,10,STL,19,0,0,8474162,8475768.0,Jake Muzzin hit Jaden Schwartz
127,hit,Kasperi Kapanen,Sammy Blais,[-96.  16.],2,13:03,TOR,STL,TOR,10,STL,19,0,0,8477953,8478104.0,Kasperi Kapanen hit Sammy Blais
128,hit,Justin Holl,Zach Sanford,[-96.  14.],2,12:17,TOR,STL,TOR,10,STL,19,0,0,8475718,8477482.0,Justin Holl hit Zach Sanford
137,hit,Vladimir Tarasenko,William Nylander,[19. 35.],2,10:51,STL,TOR,TOR,10,STL,19,0,1,8475765,8477939.0,Vladimir Tarasenko hit William Nylander
148,hit,Zach Sanford,Alexander Kerfoot,[ 56. -38.],2,09:05,STL,TOR,TOR,10,STL,19,0,1,8477482,8477021.0,Zach Sanford hit Alexander Kerfoot
150,hit,Justin Faulk,Trevor Moore,[95. 26.],2,08:48,STL,TOR,TOR,10,STL,19,0,1,8475753,8479675.0,Justin Faulk hit Trevor Moore
177,hit,Alexander Kerfoot,Tyler Bozak,[-86. -40.],2,02:00,TOR,STL,TOR,10,STL,19,2,1,8477021,8475098.0,Alexander Kerfoot hit Tyler Bozak
178,hit,Tyler Bozak,Alexander Kerfoot,[-85.  38.],2,01:52,STL,TOR,TOR,10,STL,19,2,1,8475098,8477021.0,Tyler Bozak hit Alexander Kerfoot
185,hit,Jay Bouwmeester,William Nylander,[92. 35.],2,00:09,STL,TOR,TOR,10,STL,19,2,2,8470151,8477939.0,Jay Bouwmeester hit William Nylander
189,hit,David Perron,Jake Muzzin,[-34. -40.],3,19:40,STL,TOR,TOR,10,STL,19,2,2,8474102,8474162.0,David Perron hit Jake Muzzin
191,hit,Sammy Blais,Tyson Barrie,[-61.  39.],3,19:29,STL,TOR,TOR,10,STL,19,2,2,8478104,8475197.0,Sammy Blais hit Tyson Barrie
214,hit,Jay Bouwmeester,John Tavares,[-61.  39.],3,14:52,STL,TOR,TOR,10,STL,19,2,2,8470151,8475166.0,Jay Bouwmeester hit John Tavares
220,hit,Zach Sanford,Justin Holl,[90. 33.],3,13:13,STL,TOR,TOR,10,STL,19,2,2,8477482,8475718.0,Zach Sanford hit Justin Holl
251,hit,Zach Sanford,Justin Holl,[56. 37.],3,06:50,STL,TOR,TOR,10,STL,19,2,3,8477482,8475718.0,Zach Sanford hit Justin Holl
252,hit,Zach Sanford,Frederik Gauthier,[67. 36.],3,06:33,STL,TOR,TOR,10,STL,19,2,3,8477482,8477512.0,Zach Sanford hit Frederik Gauthier
255,hit,Nic Petan,Jaden Schwartz,[14. 39.],3,06:04,TOR,STL,TOR,10,STL,19,2,3,8477464,8475768.0,Nic Petan hit Jaden Schwartz
265,hit,Rasmus Sandin,Tyler Bozak,[78. 38.],3,03:32,TOR,STL,TOR,10,STL,19,2,3,8480873,8475098.0,Rasmus Sandin hit Tyler Bozak
267,hit,Oskar Sundqvist,Rasmus Sandin,[ 97. -28.],3,02:24,STL,TOR,TOR,10,STL,19,2,3,8476897,8480873.0,Oskar Sundqvist hit Rasmus Sandin
2,hit,Erik Cernak,Kasperi Kapanen,[-69.  38.],1,19:09,TBL,TOR,TOR,10,TBL,14,0,0,8478416,8477953.0,Erik Cernak hit Kasperi Kapanen
7,hit,Mitchell Marner,Brayden Point,[ 41. -37.],1,17:47,TOR,TBL,TOR,10,TBL,14,0,0,8478483,8478010.0,Mitchell Marner hit Brayden Point
18,hit,Luke Witkowski,Nic Petan,[ 45. -38.],1,15:10,TBL,TOR,TOR,10,TBL,14,1,1,8474722,8477464.0,Luke Witkowski hit Nic Petan
19,hit,Frederik Gauthier,Victor Hedman,[-95.  22.],1,14:59,TOR,TBL,TOR,10,TBL,14,1,1,8477512,8475167.0,Frederik Gauthier hit Victor Hedman
21,hit,Trevor Moore,Erik Cernak,[-74. -38.],1,14:44,TOR,TBL,TOR,10,TBL,14,1,1,8479675,8478416.0,Trevor Moore hit Erik Cernak
24,hit,Jake Muzzin,Mathieu Joseph,[ 23. -37.],1,14:26,TOR,TBL,TOR,10,TBL,14,1,1,8474162,8478472.0,Jake Muzzin hit Mathieu Joseph
25,hit,Yanni Gourde,Mitchell Marner,[-74. -21.],1,14:25,TBL,TOR,TOR,10,TBL,14,1,1,8476826,8478483.0,Yanni Gourde hit Mitchell Marner
26,hit,Tyler Johnson,Justin Holl,[ 74. -33.],1,14:16,TBL,TOR,TOR,10,TBL,14,1,1,8474870,8475718.0,Tyler Johnson hit Justin Holl
38,hit,Cody Ceci,Brayden Point,[95. 28.],1,11:49,TOR,TBL,TOR,10,TBL,14,2,1,8476879,8478010.0,Cody Ceci hit Brayden Point
47,hit,Braydon Coburn,Jason Spezza,[-63.  40.],1,10:20,TBL,TOR,TOR,10,TBL,14,2,1,8470601,8469455.0,Braydon Coburn hit Jason Spezza
67,hit,Victor Hedman,Mitchell Marner,[-32. -29.],1,06:07,TBL,TOR,TOR,10,TBL,14,2,3,8475167,8478483.0,Victor Hedman hit Mitchell Marner
80,hit,Ryan McDonagh,Ilya Mikheyev,[-43. -38.],1,03:33,TBL,TOR,TOR,10,TBL,14,2,3,8474151,8481624.0,Ryan McDonagh hit Ilya Mikheyev
82,hit,Erik Cernak,Alexander Kerfoot,[-97. -18.],1,03:14,TBL,TOR,TOR,10,TBL,14,2,3,8478416,8477021.0,Erik Cernak hit Alexander Kerfoot
88,hit,Victor Hedman,Frederik Gauthier,[-19.  39.],1,01:58,TBL,TOR,TOR,10,TBL,14,3,3,8475167,8477512.0,Victor Hedman hit Frederik Gauthier
89,hit,Luke Witkowski,Jake Muzzin,[ 61. -40.],1,01:43,TBL,TOR,TOR,10,TBL,14,3,3,8474722,8474162.0,Luke Witkowski hit Jake Muzzin
95,hit,Brayden Point,Jake Muzzin,[96. 11.],1,00:54,TBL,TOR,TOR,10,TBL,14,3,3,8478010,8474162.0,Brayden Point hit Jake Muzzin
99,hit,Anthony Cirelli,Andreas Johnsson,[ 38. -38.],1,00:15,TBL,TOR,TOR,10,TBL,14,3,4,8478519,8477341.0,Anthony Cirelli hit Andreas Johnsson
100,hit,Ondrej Palat,Justin Holl,[99. 27.],1,00:01,TBL,TOR,TOR,10,TBL,14,3,4,8476292,8475718.0,Ondrej Palat hit Justin Holl
103,hit,Alex Killorn,Jake Muzzin,[-96.  35.],2,19:31,TBL,TOR,TOR,10,TBL,14,3,4,8473986,8474162.0,Alex Killorn hit Jake Muzzin
121,hit,Ondrej Palat,Jake Muzzin,[-96. -22.],2,15:05,TBL,TOR,TOR,10,TBL,14,3,4,8476292,8474162.0,Ondrej Palat hit Jake Muzzin
131,hit,Kasperi Kapanen,Ryan McDonagh,[ 97. -20.],2,12:52,TOR,TBL,TOR,10,TBL,14,3,4,8477953,8474151.0,Kasperi Kapanen hit Ryan McDonagh
137,hit,Alexander Kerfoot,Mikhail Sergachev,[97. 24.],2,11:09,TOR,TBL,TOR,10,TBL,14,3,4,8477021,8479410.0,Alexander Kerfoot hit Mikhail Sergachev
140,hit,Trevor Moore,Alex Killorn,[15. 37.],2,10:36,TOR,TBL,TOR,10,TBL,14,3,4,8479675,8473986.0,Trevor Moore hit Alex Killorn
144,hit,Erik Cernak,Kasperi Kapanen,[45. 39.],2,09:49,TBL,TOR,TOR,10,TBL,14,3,4,8478416,8477953.0,Erik Cernak hit Kasperi Kapanen
151,hit,Mikhail Sergachev,Nic Petan,[-28. -33.],2,08:09,TBL,TOR,TOR,10,TBL,14,3,5,8479410,8477464.0,Mikhail Sergachev hit Nic Petan
155,hit,Braydon Coburn,Auston Matthews,[ 96. -19.],2,06:32,TBL,TOR,TOR,10,TBL,14,3,5,8470601,8479318.0,Braydon Coburn hit Auston Matthews
163,hit,Ryan McDonagh,Ilya Mikheyev,[84. 38.],2,03:58,TBL,TOR,TOR,10,TBL,14,3,5,8474151,8481624.0,Ryan McDonagh hit Ilya Mikheyev
165,hit,Ondrej Palat,Cody Ceci,[-96. -20.],2,02:59,TBL,TOR,TOR,10,TBL,14,3,5,8476292,8476879.0,Ondrej Palat hit Cody Ceci
168,hit,Jake Muzzin,Ondrej Palat,[-21. -39.],2,02:31,TOR,TBL,TOR,10,TBL,14,3,5,8474162,8476292.0,Jake Muzzin hit Ondrej Palat
169,hit,Tyson Barrie,Mikhail Sergachev,[94. 36.],2,02:18,TOR,TBL,TOR,10,TBL,14,3,5,8475197,8479410.0,Tyson Barrie hit Mikhail Sergachev
171,hit,Erik Cernak,Alexander Kerfoot,[ 95. -27.],2,01:40,TBL,TOR,TOR,10,TBL,14,3,5,8478416,8477021.0,Erik Cernak hit Alexander Kerfoot
188,hit,Luke Witkowski,Rasmus Sandin,[39.  0.],3,17:01,TBL,TOR,TOR,10,TBL,14,3,5,8474722,8480873.0,Luke Witkowski hit Rasmus Sandin
190,hit,Ondrej Palat,William Nylander,[-36. -21.],3,16:35,TBL,TOR,TOR,10,TBL,14,3,5,8476292,8477939.0,Ondrej Palat hit William Nylander
