,event,hitter,hittee,coords,period,period_time_remaining,hitter_team,hittee_team,home_team,home_team_id,away_team,away_team_id,home_goals,away_goals,hitter_id,hittee_id,description
147,hit,Colton Sceviour,Tim Heed,[-28.  41.],2,02:00,FLA,SJS,FLA,13,SJS,28,3,1,8474098,8475841.0,Colton Sceviour hit Tim Heed
167,hit,Mario Ferraro,Aleksander Barkov,[-79.  38.],3,16:58,SJS,FLA,FLA,13,SJS,28,3,1,8479983,8477493.0,Mario Ferraro hit Aleksander Barkov
173,hit,Brian Boyle,Barclay Goodrow,[-64. -39.],3,15:13,FLA,SJS,FLA,13,SJS,28,3,1,8470619,8476624.0,Brian Boyle hit Barclay Goodrow
174,hit,Barclay Goodrow,MacKenzie Weegar,[97.  5.],3,15:05,SJS,FLA,FLA,13,SJS,28,3,1,8476624,8477346.0,Barclay Goodrow hit MacKenzie Weegar
181,hit,Barclay Goodrow,Brett Connolly,[-86. -33.],3,12:58,SJS,FLA,FLA,13,SJS,28,3,1,8476624,8475792.0,Barclay Goodrow hit Brett Connolly
182,hit,MacKenzie Weegar,Mario Ferraro,[99.  7.],3,12:06,FLA,SJS,FLA,13,SJS,28,3,1,8477346,8479983.0,MacKenzie Weegar hit Mario Ferraro
185,hit,Noel Acciari,Timo Meier,[-14.  39.],3,11:23,FLA,SJS,FLA,13,SJS,28,3,1,8478569,8478414.0,Noel Acciari hit Timo Meier
190,hit,Joe Thornton,Evgenii Dadonov,[-74. -31.],3,10:15,SJS,FLA,FLA,13,SJS,28,3,1,8466138,8474149.0,Joe Thornton hit Evgenii Dadonov
211,hit,Logan Couture,MacKenzie Weegar,[97.  3.],3,06:50,SJS,FLA,FLA,13,SJS,28,4,1,8474053,8477346.0,Logan Couture hit MacKenzie Weegar
213,hit,Colton Sceviour,Brenden Dillon,[87. 33.],3,06:41,FLA,SJS,FLA,13,SJS,28,4,1,8474098,8475455.0,Colton Sceviour hit Brenden Dillon
214,hit,Brian Boyle,Logan Couture,[85. 32.],3,06:29,FLA,SJS,FLA,13,SJS,28,4,1,8470619,8474053.0,Brian Boyle hit Logan Couture
223,hit,Josh Brown,Patrick Marleau,[90. 24.],3,04:37,FLA,SJS,FLA,13,SJS,28,4,1,8477384,8466139.0,Josh Brown hit Patrick Marleau
224,hit,Noah Gregor,MacKenzie Weegar,[ 70. -35.],3,04:13,SJS,FLA,FLA,13,SJS,28,4,1,8479393,8477346.0,Noah Gregor hit MacKenzie Weegar
225,hit,Mario Ferraro,Colton Sceviour,[-88.  35.],3,03:04,SJS,FLA,FLA,13,SJS,28,4,1,8479983,8474098.0,Mario Ferraro hit Colton Sceviour
235,hit,Noah Gregor,Mike Matheson,[95. 11.],3,01:11,SJS,FLA,FLA,13,SJS,28,5,1,8479393,8476875.0,Noah Gregor hit Mike Matheson
1,hit,Logan Couture,Craig Smith,[28. 40.],1,19:29,SJS,NSH,NSH,18,SJS,28,0,0,8474053,8475225.0,Logan Couture hit Craig Smith
12,hit,Marc-Edouard Vlasic,Colton Sissons,[ 70. -37.],1,16:15,SJS,NSH,NSH,18,SJS,28,0,0,8471709,8476925.0,Marc-Edouard Vlasic hit Colton Sissons
23,hit,Craig Smith,Mario Ferraro,[ 45. -38.],1,13:49,NSH,SJS,NSH,18,SJS,28,0,0,8475225,8479983.0,Craig Smith hit Mario Ferraro
24,hit,Mario Ferraro,Craig Smith,[97. 18.],1,13:36,SJS,NSH,NSH,18,SJS,28,0,0,8479983,8475225.0,Mario Ferraro hit Craig Smith
26,hit,Brenden Dillon,Matt Irwin,[ 36. -38.],1,13:00,SJS,NSH,NSH,18,SJS,28,0,0,8475455,8475625.0,Brenden Dillon hit Matt Irwin
47,hit,Tim Heed,Austin Watson,[ 73. -38.],1,07:28,SJS,NSH,NSH,18,SJS,28,0,0,8475841,8475766.0,Tim Heed hit Austin Watson
57,hit,Logan Couture,Calle Jarnkrok,[-35.  39.],1,05:56,SJS,NSH,NSH,18,SJS,28,0,0,8474053,8475714.0,Logan Couture hit Calle Jarnkrok
67,hit,Joe Thornton,Calle Jarnkrok,[ 13. -39.],1,04:36,SJS,NSH,NSH,18,SJS,28,0,0,8466138,8475714.0,Joe Thornton hit Calle Jarnkrok
79,hit,Filip Forsberg,Mario Ferraro,[-39.  36.],1,00:48,NSH,SJS,NSH,18,SJS,28,0,0,8476887,8479983.0,Filip Forsberg hit Mario Ferraro
80,hit,Mario Ferraro,Filip Forsberg,[51. 37.],1,00:42,SJS,NSH,NSH,18,SJS,28,0,0,8479983,8476887.0,Mario Ferraro hit Filip Forsberg
89,hit,Dylan Gambrell,Matt Irwin,[ 76. -38.],2,17:13,SJS,NSH,NSH,18,SJS,28,0,0,8479580,8475625.0,Dylan Gambrell hit Matt Irwin
91,hit,Barclay Goodrow,Daniel Carr,[ 76. -38.],2,16:53,SJS,NSH,NSH,18,SJS,28,0,0,8476624,8477901.0,Barclay Goodrow hit Daniel Carr
95,hit,Logan Couture,Matt Duchene,[-89.  30.],2,13:25,SJS,NSH,NSH,18,SJS,28,0,0,8474053,8475168.0,Logan Couture hit Matt Duchene
100,hit,Kevin Labanc,Dante Fabbro,[76. 39.],2,10:51,SJS,NSH,NSH,18,SJS,28,0,0,8478099,8479371.0,Kevin Labanc hit Dante Fabbro
112,hit,Matt Duchene,Dylan Gambrell,[65. 39.],2,07:04,NSH,SJS,NSH,18,SJS,28,0,0,8475168,8479580.0,Matt Duchene hit Dylan Gambrell
113,hit,Brenden Dillon,Kyle Turris,[-85. -35.],2,06:34,SJS,NSH,NSH,18,SJS,28,0,0,8475455,8474068.0,Brenden Dillon hit Kyle Turris
114,hit,Brent Burns,Rocco Grimaldi,[-31. -39.],2,05:44,SJS,NSH,NSH,18,SJS,28,0,0,8470613,8476428.0,Brent Burns hit Rocco Grimaldi
120,hit,Noah Gregor,Roman Josi,[94.  7.],2,03:31,SJS,NSH,NSH,18,SJS,28,0,0,8479393,8474600.0,Noah Gregor hit Roman Josi
121,hit,Craig Smith,Noah Gregor,[ 90. -32.],2,03:24,NSH,SJS,NSH,18,SJS,28,0,0,8475225,8479393.0,Craig Smith hit Noah Gregor
158,hit,Craig Smith,Brenden Dillon,[49. 39.],3,18:27,NSH,SJS,NSH,18,SJS,28,0,0,8475225,8475455.0,Craig Smith hit Brenden Dillon
172,hit,Colton Sissons,Marcus Sorensen,[ 83. -33.],3,15:27,NSH,SJS,NSH,18,SJS,28,1,0,8476925,8475834.0,Colton Sissons hit Marcus Sorensen
173,hit,Marcus Sorensen,Dante Fabbro,[-96. -19.],3,14:44,SJS,NSH,NSH,18,SJS,28,1,0,8475834,8479371.0,Marcus Sorensen hit Dante Fabbro
175,hit,Erik Karlsson,Filip Forsberg,[10. 38.],3,14:20,SJS,NSH,NSH,18,SJS,28,1,0,8474578,8476887.0,Erik Karlsson hit Filip Forsberg
181,hit,Marcus Sorensen,Rocco Grimaldi,[ 19. -41.],3,12:37,SJS,NSH,NSH,18,SJS,28,1,0,8475834,8476428.0,Marcus Sorensen hit Rocco Grimaldi
185,hit,Mario Ferraro,Dante Fabbro,[ 64. -37.],3,12:08,SJS,NSH,NSH,18,SJS,28,1,0,8479983,8479371.0,Mario Ferraro hit Dante Fabbro
199,hit,Tomas Hertl,Dante Fabbro,[ 71. -38.],3,08:59,SJS,NSH,NSH,18,SJS,28,1,0,8476881,8479371.0,Tomas Hertl hit Dante Fabbro
223,hit,Mattias Ekholm,Marcus Sorensen,[-93.  25.],3,03:26,NSH,SJS,NSH,18,SJS,28,2,0,8475218,8475834.0,Mattias Ekholm hit Marcus Sorensen
226,hit,Joe Thornton,Filip Forsberg,[-62.  38.],3,02:56,SJS,NSH,NSH,18,SJS,28,2,0,8466138,8476887.0,Joe Thornton hit Filip Forsberg
10,hit,Brendan Smith,Brent Burns,[-78.  40.],1,17:08,NYR,SJS,SJS,28,NYR,3,0,0,8474090,8470613.0,Brendan Smith hit Brent Burns
14,hit,Jacob Trouba,Timo Meier,[98. 14.],1,15:44,NYR,SJS,SJS,28,NYR,3,0,0,8476885,8478414.0,Jacob Trouba hit Timo Meier
18,hit,Jesper Fast,Barclay Goodrow,[ 19. -42.],1,14:25,NYR,SJS,SJS,28,NYR,3,0,0,8475855,8476624.0,Jesper Fast hit Barclay Goodrow
22,hit,Kevin Labanc,Adam Fox,[99.  3.],1,13:24,SJS,NYR,SJS,28,NYR,3,0,0,8478099,8479323.0,Kevin Labanc hit Adam Fox
42,hit,Barclay Goodrow,Brady Skjei,[95. 18.],1,07:43,SJS,NYR,SJS,28,NYR,3,1,0,8476624,8476869.0,Barclay Goodrow hit Brady Skjei
46,hit,Evander Kane,Artemi Panarin,[-44. -41.],1,06:54,SJS,NYR,SJS,28,NYR,3,1,0,8475169,8478550.0,Evander Kane hit Artemi Panarin
55,hit,Greg McKegg,Logan Couture,[ 32. -42.],1,04:23,NYR,SJS,SJS,28,NYR,3,1,0,8475735,8474053.0,Greg McKegg hit Logan Couture
61,hit,Greg McKegg,Joachim Blichfeld,[ 89. -32.],1,02:36,NYR,SJS,SJS,28,NYR,3,1,0,8475735,8479571.0,Greg McKegg hit Joachim Blichfeld
84,hit,Barclay Goodrow,Brendan Smith,[-65. -42.],2,17:39,SJS,NYR,SJS,28,NYR,3,1,0,8476624,8474090.0,Barclay Goodrow hit Brendan Smith
86,hit,Micheal Haley,Brenden Dillon,[38. 25.],2,17:08,NYR,SJS,SJS,28,NYR,3,1,0,8474230,8475455.0,Micheal Haley hit Brenden Dillon
92,hit,Marc Staal,Dylan Gambrell,[-68.  40.],2,15:51,NYR,SJS,SJS,28,NYR,3,1,0,8471686,8479580.0,Marc Staal hit Dylan Gambrell
100,hit,Brenden Dillon,Mika Zibanejad,[ 71. -42.],2,14:29,SJS,NYR,SJS,28,NYR,3,1,1,8475455,8476459.0,Brenden Dillon hit Mika Zibanejad
116,hit,Joachim Blichfeld,Ryan Lindgren,[-97. -21.],2,11:16,SJS,NYR,SJS,28,NYR,3,1,2,8479571,8479324.0,Joachim Blichfeld hit Ryan Lindgren
118,hit,Jesper Fast,Dylan Gambrell,[ 67. -40.],2,10:44,NYR,SJS,SJS,28,NYR,3,1,2,8475855,8479580.0,Jesper Fast hit Dylan Gambrell
120,hit,Kevin Labanc,Brendan Smith,[-81.  41.],2,10:08,SJS,NYR,SJS,28,NYR,3,1,2,8478099,8474090.0,Kevin Labanc hit Brendan Smith
129,hit,Ryan Lindgren,Marc-Edouard Vlasic,[-85. -36.],2,07:38,NYR,SJS,SJS,28,NYR,3,2,2,8479324,8471709.0,Ryan Lindgren hit Marc-Edouard Vlasic
135,hit,Mario Ferraro,Filip Chytil,[-31.  41.],2,06:29,SJS,NYR,SJS,28,NYR,3,2,2,8479983,8480078.0,Mario Ferraro hit Filip Chytil
141,hit,Joachim Blichfeld,Marc Staal,[43. 39.],2,04:31,SJS,NYR,SJS,28,NYR,3,2,2,8479571,8471686.0,Joachim Blichfeld hit Marc Staal
144,hit,Mario Ferraro,Brendan Smith,[60. 40.],2,03:39,SJS,NYR,SJS,28,NYR,3,2,2,8479983,8474090.0,Mario Ferraro hit Brendan Smith
145,hit,Ryan Lindgren,Marcus Sorensen,[-98.  -8.],2,03:31,NYR,SJS,SJS,28,NYR,3,2,2,8479324,8475834.0,Ryan Lindgren hit Marcus Sorensen
146,hit,Micheal Haley,Melker Karlsson,[ 28. -42.],2,03:19,NYR,SJS,SJS,28,NYR,3,2,2,8474230,8477922.0,Micheal Haley hit Melker Karlsson
162,hit,Tony DeAngelo,Kevin Labanc,[ 96. -10.],3,18:50,NYR,SJS,SJS,28,NYR,3,2,2,8477950,8478099.0,Tony DeAngelo hit Kevin Labanc
166,hit,Brenden Dillon,Brendan Smith,[-47.  40.],3,17:43,SJS,NYR,SJS,28,NYR,3,2,2,8475455,8474090.0,Brenden Dillon hit Brendan Smith
168,hit,Brendan Smith,Melker Karlsson,[-57. -41.],3,17:13,NYR,SJS,SJS,28,NYR,3,2,2,8474090,8477922.0,Brendan Smith hit Melker Karlsson
181,hit,Brenden Dillon,Kaapo Kakko,[-88. -31.],3,13:55,SJS,NYR,SJS,28,NYR,3,3,2,8475455,8481554.0,Brenden Dillon hit Kaapo Kakko
185,hit,Micheal Haley,Mario Ferraro,[64. 41.],3,12:58,NYR,SJS,SJS,28,NYR,3,3,2,8474230,8479983.0,Micheal Haley hit Mario Ferraro
194,hit,Chris Kreider,Brenden Dillon,[-94.  25.],3,11:33,NYR,SJS,SJS,28,NYR,3,3,2,8475184,8475455.0,Chris Kreider hit Brenden Dillon
201,hit,Evander Kane,Adam Fox,[81. 24.],3,10:02,SJS,NYR,SJS,28,NYR,3,3,3,8475169,8479323.0,Evander Kane hit Adam Fox
202,hit,Timo Meier,Artemi Panarin,[-32. -22.],3,09:58,SJS,NYR,SJS,28,NYR,3,3,3,8478414,8478550.0,Timo Meier hit Artemi Panarin
206,hit,Mario Ferraro,Pavel Buchnevich,[-20.  26.],3,09:13,SJS,NYR,SJS,28,NYR,3,3,3,8479983,8477402.0,Mario Ferraro hit Pavel Buchnevich
207,hit,Pavel Buchnevich,Barclay Goodrow,[-64.  41.],3,09:05,NYR,SJS,SJS,28,NYR,3,3,3,8477402,8476624.0,Pavel Buchnevich hit Barclay Goodrow
210,hit,Logan Couture,Jacob Trouba,[-41.  39.],3,08:28,SJS,NYR,SJS,28,NYR,3,3,3,8474053,8476885.0,Logan Couture hit Jacob Trouba
211,hit,Evander Kane,Brady Skjei,[ 96. -28.],3,08:20,SJS,NYR,SJS,28,NYR,3,3,3,8475169,8476869.0,Evander Kane hit Brady Skjei
213,hit,Brenden Dillon,Ryan Strome,[-97.  -1.],3,07:57,SJS,NYR,SJS,28,NYR,3,3,3,8475455,8476458.0,Brenden Dillon hit Ryan Strome
214,hit,Artemi Panarin,Evander Kane,[13. 39.],3,07:52,NYR,SJS,SJS,28,NYR,3,3,3,8478550,8475169.0,Artemi Panarin hit Evander Kane
215,hit,Tomas Hertl,Chris Kreider,[-85.  21.],3,07:01,SJS,NYR,SJS,28,NYR,3,3,3,8476881,8475184.0,Tomas Hertl hit Chris Kreider
222,hit,Evander Kane,Jacob Trouba,[94. 26.],3,05:54,SJS,NYR,SJS,28,NYR,3,3,4,8475169,8476885.0,Evander Kane hit Jacob Trouba
225,hit,Marc Staal,Kevin Labanc,[ 82. -39.],3,04:49,NYR,SJS,SJS,28,NYR,3,3,4,8471686,8478099.0,Marc Staal hit Kevin Labanc
232,hit,Timo Meier,Tony DeAngelo,[82. 35.],3,02:40,SJS,NYR,SJS,28,NYR,3,3,5,8478414,8477950.0,Timo Meier hit Tony DeAngelo
237,hit,Pavel Buchnevich,Dylan Gambrell,[-38. -38.],3,01:19,NYR,SJS,SJS,28,NYR,3,3,6,8477402,8479580.0,Pavel Buchnevich hit Dylan Gambrell
2,hit,Joachim Blichfeld,Troy Stecher,[98. 18.],1,19:43,SJS,VAN,SJS,28,VAN,23,0,0,8479571,8479442.0,Joachim Blichfeld hit Troy Stecher
5,hit,Oscar Fantenberg,Kevin Labanc,[ 99. -17.],1,18:24,VAN,SJS,SJS,28,VAN,23,0,0,8480147,8478099.0,Oscar Fantenberg hit Kevin Labanc
27,hit,Oscar Fantenberg,Logan Couture,[ 76. -42.],1,13:09,VAN,SJS,SJS,28,VAN,23,0,0,8480147,8474053.0,Oscar Fantenberg hit Logan Couture
30,hit,Jake Virtanen,Brenden Dillon,[-98. -14.],1,12:07,VAN,SJS,SJS,28,VAN,23,0,0,8477937,8475455.0,Jake Virtanen hit Brenden Dillon
36,hit,Melker Karlsson,Quinn Hughes,[ 77. -41.],1,11:03,SJS,VAN,SJS,28,VAN,23,0,0,8477922,8480800.0,Melker Karlsson hit Quinn Hughes
37,hit,Mario Ferraro,Josh Leivo,[-15. -41.],1,10:52,SJS,VAN,SJS,28,VAN,23,0,0,8479983,8476410.0,Mario Ferraro hit Josh Leivo
55,hit,Elias Pettersson,Logan Couture,[ 85. -39.],1,07:38,VAN,SJS,SJS,28,VAN,23,1,0,8480012,8474053.0,Elias Pettersson hit Logan Couture
58,hit,Brock Boeser,Tim Heed,[61. 41.],1,06:26,VAN,SJS,SJS,28,VAN,23,1,0,8478444,8475841.0,Brock Boeser hit Tim Heed
67,hit,Barclay Goodrow,Bo Horvat,[-33. -42.],1,05:14,SJS,VAN,SJS,28,VAN,23,1,0,8476624,8477500.0,Barclay Goodrow hit Bo Horvat
72,hit,Brenden Dillon,Antoine Roussel,[-54.  41.],1,04:35,SJS,VAN,SJS,28,VAN,23,1,0,8475455,8474849.0,Brenden Dillon hit Antoine Roussel
74,hit,Brandon Sutter,Joe Thornton,[-54. -41.],1,03:40,VAN,SJS,SJS,28,VAN,23,1,0,8474091,8466138.0,Brandon Sutter hit Joe Thornton
82,hit,Tim Schaller,Patrick Marleau,[-99.  10.],1,01:12,VAN,SJS,SJS,28,VAN,23,1,0,8477213,8466139.0,Tim Schaller hit Patrick Marleau
87,hit,J.T. Miller,Logan Couture,[-34.  18.],1,00:05,VAN,SJS,SJS,28,VAN,23,1,0,8476468,8474053.0,J.T. Miller hit Logan Couture
93,hit,Jay Beagle,Evander Kane,[-79.   4.],2,18:32,VAN,SJS,SJS,28,VAN,23,1,0,8474291,8475169.0,Jay Beagle hit Evander Kane
116,hit,Brenden Dillon,Brandon Sutter,[ 97. -21.],2,11:12,SJS,VAN,SJS,28,VAN,23,1,0,8475455,8474091.0,Brenden Dillon hit Brandon Sutter
118,hit,Tim Schaller,Brent Burns,[ 40. -41.],2,10:56,VAN,SJS,SJS,28,VAN,23,1,0,8477213,8470613.0,Tim Schaller hit Brent Burns
148,hit,Barclay Goodrow,Josh Leivo,[ 82. -40.],2,04:23,SJS,VAN,SJS,28,VAN,23,1,0,8476624,8476410.0,Barclay Goodrow hit Josh Leivo
152,hit,Brenden Dillon,Josh Leivo,[99.  6.],2,03:44,SJS,VAN,SJS,28,VAN,23,1,0,8475455,8476410.0,Brenden Dillon hit Josh Leivo
165,hit,Patrick Marleau,Christopher Tanev,[-18.  41.],3,19:51,SJS,VAN,SJS,28,VAN,23,1,0,8466139,8475690.0,Patrick Marleau hit Christopher Tanev
176,hit,Noah Gregor,Oscar Fantenberg,[98. 24.],3,16:52,SJS,VAN,SJS,28,VAN,23,1,0,8479393,8480147.0,Noah Gregor hit Oscar Fantenberg
181,hit,Antoine Roussel,Mario Ferraro,[-45. -42.],3,14:19,VAN,SJS,SJS,28,VAN,23,1,0,8474849,8479983.0,Antoine Roussel hit Mario Ferraro
190,hit,Patrick Marleau,Jake Virtanen,[49. 42.],3,12:11,SJS,VAN,SJS,28,VAN,23,2,0,8466139,8477937.0,Patrick Marleau hit Jake Virtanen
196,hit,Evander Kane,Christopher Tanev,[96. 27.],3,10:41,SJS,VAN,SJS,28,VAN,23,2,1,8475169,8475690.0,Evander Kane hit Christopher Tanev
222,hit,Kevin Labanc,Quinn Hughes,[-63. -42.],3,04:21,SJS,VAN,SJS,28,VAN,23,2,1,8478099,8480800.0,Kevin Labanc hit Quinn Hughes
1,hit,Timo Meier,Jakob Chychrun,[-17. -42.],1,19:53,SJS,ARI,SJS,28,ARI,53,0,0,8478414,8479345.0,Timo Meier hit Jakob Chychrun
2,hit,Logan Couture,Jakob Chychrun,[-96. -22.],1,19:39,SJS,ARI,SJS,28,ARI,53,0,0,8474053,8479345.0,Logan Couture hit Jakob Chychrun
4,hit,Aaron Ness,Barclay Goodrow,[ 94. -28.],1,18:02,ARI,SJS,SJS,28,ARI,53,0,0,8474604,8476624.0,Aaron Ness hit Barclay Goodrow
16,hit,Barclay Goodrow,Lawson Crouse,[-16. -41.],1,14:51,SJS,ARI,SJS,28,ARI,53,0,1,8476624,8478474.0,Barclay Goodrow hit Lawson Crouse
19,hit,Evander Kane,Oliver Ekman-Larsson,[ -8. -41.],1,14:10,SJS,ARI,SJS,28,ARI,53,0,1,8475169,8475171.0,Evander Kane hit Oliver Ekman-Larsson
21,hit,Jacob Middleton,Conor Garland,[-92.  32.],1,12:57,SJS,ARI,SJS,28,ARI,53,0,1,8478136,8478856.0,Jacob Middleton hit Conor Garland
23,hit,Ilya Lyubushkin,Marcus Sorensen,[32. 42.],1,10:55,ARI,SJS,SJS,28,ARI,53,0,1,8480950,8475834.0,Ilya Lyubushkin hit Marcus Sorensen
24,hit,Marcus Sorensen,Ilya Lyubushkin,[73. 39.],1,10:50,SJS,ARI,SJS,28,ARI,53,0,1,8475834,8480950.0,Marcus Sorensen hit Ilya Lyubushkin
25,hit,Barclay Goodrow,Oliver Ekman-Larsson,[98. -2.],1,10:48,SJS,ARI,SJS,28,ARI,53,0,1,8476624,8475171.0,Barclay Goodrow hit Oliver Ekman-Larsson
28,hit,Dylan Gambrell,Oliver Ekman-Larsson,[ 97. -20.],1,09:52,SJS,ARI,SJS,28,ARI,53,0,1,8479580,8475171.0,Dylan Gambrell hit Oliver Ekman-Larsson
29,hit,Ilya Lyubushkin,Dylan Gambrell,[ 97. -17.],1,09:43,ARI,SJS,SJS,28,ARI,53,0,1,8480950,8479580.0,Ilya Lyubushkin hit Dylan Gambrell
36,hit,Brenden Dillon,Clayton Keller,[-42.  40.],1,08:40,SJS,ARI,SJS,28,ARI,53,0,1,8475455,8479343.0,Brenden Dillon hit Clayton Keller
37,hit,Brent Burns,Nick Schmaltz,[-29.  41.],1,08:33,SJS,ARI,SJS,28,ARI,53,0,1,8470613,8477951.0,Brent Burns hit Nick Schmaltz
41,hit,Evander Kane,Phil Kessel,[-96.  -5.],1,07:44,SJS,ARI,SJS,28,ARI,53,0,1,8475169,8473548.0,Evander Kane hit Phil Kessel
45,hit,Ilya Lyubushkin,Kevin Labanc,[80. 37.],1,06:57,ARI,SJS,SJS,28,ARI,53,0,1,8480950,8478099.0,Ilya Lyubushkin hit Kevin Labanc
53,hit,Brenden Dillon,Lawson Crouse,[-85.  18.],1,04:43,SJS,ARI,SJS,28,ARI,53,0,1,8475455,8478474.0,Brenden Dillon hit Lawson Crouse
62,hit,Oliver Ekman-Larsson,Antti Suomela,[ 35. -40.],1,01:41,ARI,SJS,SJS,28,ARI,53,1,1,8475171,8480965.0,Oliver Ekman-Larsson hit Antti Suomela
70,hit,Alex Goligoski,Logan Couture,[-99.  -8.],2,19:05,ARI,SJS,SJS,28,ARI,53,1,1,8471274,8474053.0,Alex Goligoski hit Logan Couture
74,hit,Lawson Crouse,Kevin Labanc,[-27.  41.],2,18:37,ARI,SJS,SJS,28,ARI,53,1,1,8478474,8478099.0,Lawson Crouse hit Kevin Labanc
89,hit,Patrick Marleau,Jakob Chychrun,[-85. -38.],2,15:04,SJS,ARI,SJS,28,ARI,53,1,1,8466139,8479345.0,Patrick Marleau hit Jakob Chychrun
96,hit,Derek Stepan,Dylan Gambrell,[-16.  41.],2,13:54,ARI,SJS,SJS,28,ARI,53,1,1,8474613,8479580.0,Derek Stepan hit Dylan Gambrell
105,hit,Barclay Goodrow,Jakob Chychrun,[-86.  34.],2,12:12,SJS,ARI,SJS,28,ARI,53,1,1,8476624,8479345.0,Barclay Goodrow hit Jakob Chychrun
106,hit,Barclay Goodrow,Jakob Chychrun,[-92.  29.],2,12:09,SJS,ARI,SJS,28,ARI,53,1,1,8476624,8479345.0,Barclay Goodrow hit Jakob Chychrun
108,hit,Barclay Goodrow,Jakob Chychrun,[-81.  36.],2,11:59,SJS,ARI,SJS,28,ARI,53,1,1,8476624,8479345.0,Barclay Goodrow hit Jakob Chychrun
118,hit,Brad Richardson,Tomas Hertl,[94. 22.],2,10:07,ARI,SJS,SJS,28,ARI,53,1,2,8470755,8476881.0,Brad Richardson hit Tomas Hertl
122,hit,Evander Kane,Aaron Ness,[-7. 38.],2,09:14,SJS,ARI,SJS,28,ARI,53,1,2,8475169,8474604.0,Evander Kane hit Aaron Ness
137,hit,Lawson Crouse,Tomas Hertl,[-10.  40.],2,04:40,ARI,SJS,SJS,28,ARI,53,2,2,8478474,8476881.0,Lawson Crouse hit Tomas Hertl
162,hit,Oliver Ekman-Larsson,Patrick Marleau,[ 76. -40.],3,17:56,ARI,SJS,SJS,28,ARI,53,2,2,8475171,8466139.0,Oliver Ekman-Larsson hit Patrick Marleau
170,hit,Ilya Lyubushkin,Joe Thornton,[ 50. -41.],3,14:55,ARI,SJS,SJS,28,ARI,53,2,2,8480950,8466138.0,Ilya Lyubushkin hit Joe Thornton
174,hit,Brenden Dillon,Clayton Keller,[-27.  -6.],3,13:27,SJS,ARI,SJS,28,ARI,53,2,2,8475455,8479343.0,Brenden Dillon hit Clayton Keller
175,hit,Brent Burns,Jakob Chychrun,[-32. -42.],3,13:19,SJS,ARI,SJS,28,ARI,53,2,2,8470613,8479345.0,Brent Burns hit Jakob Chychrun
183,hit,Brent Burns,Jordan Oesterle,[-31. -26.],3,11:33,SJS,ARI,SJS,28,ARI,53,2,2,8470613,8477851.0,Brent Burns hit Jordan Oesterle
186,hit,Lawson Crouse,Barclay Goodrow,[-97.   6.],3,09:42,ARI,SJS,SJS,28,ARI,53,2,2,8478474,8476624.0,Lawson Crouse hit Barclay Goodrow
187,hit,Ilya Lyubushkin,Marcus Sorensen,[ 98. -11.],3,09:33,ARI,SJS,SJS,28,ARI,53,2,2,8480950,8475834.0,Ilya Lyubushkin hit Marcus Sorensen
202,hit,Carl Soderberg,Tomas Hertl,[51. 41.],3,04:57,ARI,SJS,SJS,28,ARI,53,2,2,8471262,8476881.0,Carl Soderberg hit Tomas Hertl
206,hit,Ilya Lyubushkin,Evander Kane,[87. 35.],3,02:51,ARI,SJS,SJS,28,ARI,53,2,2,8480950,8475169.0,Ilya Lyubushkin hit Evander Kane
209,hit,Jakob Chychrun,Barclay Goodrow,[98. -8.],3,02:15,ARI,SJS,SJS,28,ARI,53,2,3,8479345,8476624.0,Jakob Chychrun hit Barclay Goodrow
210,hit,Ilya Lyubushkin,Logan Couture,[ 30. -37.],3,01:36,ARI,SJS,SJS,28,ARI,53,2,3,8480950,8474053.0,Ilya Lyubushkin hit Logan Couture
211,hit,Ilya Lyubushkin,Evander Kane,[52. 40.],3,01:16,ARI,SJS,SJS,28,ARI,53,2,3,8480950,8475169.0,Ilya Lyubushkin hit Evander Kane
8,hit,Justin Faulk,Timo Meier,[97.  7.],1,16:45,STL,SJS,SJS,28,STL,19,0,0,8475753,8478414.0,Justin Faulk hit Timo Meier
9,hit,Evander Kane,Justin Faulk,[ 96. -11.],1,16:05,SJS,STL,SJS,28,STL,19,0,0,8475169,8475753.0,Evander Kane hit Justin Faulk
19,hit,Joel Kellman,Mackenzie MacEachern,[93. 18.],1,13:19,SJS,STL,SJS,28,STL,19,0,0,8481516,8476907.0,Joel Kellman hit Mackenzie MacEachern
20,hit,Brenden Dillon,Jaden Schwartz,[-89.  26.],1,12:51,SJS,STL,SJS,28,STL,19,0,0,8475455,8475768.0,Brenden Dillon hit Jaden Schwartz
37,hit,Tim Heed,Jaden Schwartz,[-95.  12.],1,09:23,SJS,STL,SJS,28,STL,19,0,0,8475841,8475768.0,Tim Heed hit Jaden Schwartz
38,hit,Justin Faulk,Timo Meier,[-65. -35.],1,09:19,STL,SJS,SJS,28,STL,19,0,0,8475753,8478414.0,Justin Faulk hit Timo Meier
43,hit,Evander Kane,Colton Parayko,[88. 20.],1,08:22,SJS,STL,SJS,28,STL,19,0,0,8475169,8476892.0,Evander Kane hit Colton Parayko
50,hit,Barclay Goodrow,Jordan Kyrou,[33. 34.],1,06:12,SJS,STL,SJS,28,STL,19,0,0,8476624,8479385.0,Barclay Goodrow hit Jordan Kyrou
51,hit,Justin Faulk,Barclay Goodrow,[ 97. -20.],1,05:34,STL,SJS,SJS,28,STL,19,0,0,8475753,8476624.0,Justin Faulk hit Barclay Goodrow
59,hit,Stefan Noesen,Ivan Barbashev,[-36. -34.],1,03:23,SJS,STL,SJS,28,STL,19,0,0,8476474,8477964.0,Stefan Noesen hit Ivan Barbashev
63,hit,Patrick Marleau,David Perron,[-46. -35.],1,01:59,SJS,STL,SJS,28,STL,19,0,0,8466139,8474102.0,Patrick Marleau hit David Perron
85,hit,Timo Meier,Oskar Sundqvist,[ 76. -33.],2,18:33,SJS,STL,SJS,28,STL,19,1,0,8478414,8476897.0,Timo Meier hit Oskar Sundqvist
96,hit,Stefan Noesen,Robert Thomas,[-72.  30.],2,16:34,SJS,STL,SJS,28,STL,19,1,1,8476474,8480023.0,Stefan Noesen hit Robert Thomas
107,hit,Jay Bouwmeester,Joel Kellman,[-92. -25.],2,14:09,STL,SJS,SJS,28,STL,19,1,2,8470151,8481516.0,Jay Bouwmeester hit Joel Kellman
112,hit,Tomas Hertl,Vince Dunn,[ 86. -26.],2,11:23,SJS,STL,SJS,28,STL,19,1,2,8476881,8478407.0,Tomas Hertl hit Vince Dunn
115,hit,Jacob de la Rose,Tomas Hertl,[-98. -11.],2,10:48,STL,SJS,SJS,28,STL,19,1,2,8477455,8476881.0,Jacob de la Rose hit Tomas Hertl
117,hit,Justin Faulk,Marcus Sorensen,[-95. -17.],2,10:20,STL,SJS,SJS,28,STL,19,1,2,8475753,8475834.0,Justin Faulk hit Marcus Sorensen
118,hit,Barclay Goodrow,Vince Dunn,[-93.  10.],2,10:01,SJS,STL,SJS,28,STL,19,1,2,8476624,8478407.0,Barclay Goodrow hit Vince Dunn
121,hit,Brenden Dillon,Jordan Kyrou,[-33. -32.],2,09:34,SJS,STL,SJS,28,STL,19,1,2,8475455,8479385.0,Brenden Dillon hit Jordan Kyrou
130,hit,Ivan Barbashev,Erik Karlsson,[ 95. -19.],2,07:44,STL,SJS,SJS,28,STL,19,1,2,8477964,8474578.0,Ivan Barbashev hit Erik Karlsson
133,hit,Timo Meier,Brayden Schenn,[-14.  29.],2,06:46,SJS,STL,SJS,28,STL,19,1,2,8478414,8475170.0,Timo Meier hit Brayden Schenn
134,hit,Oskar Sundqvist,Marc-Edouard Vlasic,[97. 10.],2,06:09,STL,SJS,SJS,28,STL,19,1,2,8476897,8471709.0,Oskar Sundqvist hit Marc-Edouard Vlasic
136,hit,Jacob Middleton,Oskar Sundqvist,[57. 35.],2,05:37,SJS,STL,SJS,28,STL,19,1,2,8478136,8476897.0,Jacob Middleton hit Oskar Sundqvist
145,hit,Evander Kane,Robert Bortuzzo,[-29. -39.],2,02:49,SJS,STL,SJS,28,STL,19,2,2,8475169,8474145.0,Evander Kane hit Robert Bortuzzo
147,hit,Barclay Goodrow,Jay Bouwmeester,[-90. -18.],2,02:36,SJS,STL,SJS,28,STL,19,2,2,8476624,8470151.0,Barclay Goodrow hit Jay Bouwmeester
155,hit,Brayden Schenn,Evander Kane,[-78.  26.],2,00:41,STL,SJS,SJS,28,STL,19,2,2,8475170,8475169.0,Brayden Schenn hit Evander Kane
183,hit,David Perron,Erik Karlsson,[-75. -37.],3,13:09,STL,SJS,SJS,28,STL,19,2,2,8474102,8474578.0,David Perron hit Erik Karlsson
186,hit,Justin Faulk,Stefan Noesen,[27.  1.],3,12:35,STL,SJS,SJS,28,STL,19,2,2,8475753,8476474.0,Justin Faulk hit Stefan Noesen
189,hit,Evander Kane,Vince Dunn,[51. 33.],3,12:13,SJS,STL,SJS,28,STL,19,2,2,8475169,8478407.0,Evander Kane hit Vince Dunn
15,hit,Brenden Dillon,Paul Stastny,[-87.  35.],1,16:37,SJS,VGK,SJS,28,VGK,54,0,0,8475455,8471669.0,Brenden Dillon hit Paul Stastny
18,hit,Tomas Nosek,Kevin Labanc,[99. 18.],1,15:59,VGK,SJS,SJS,28,VGK,54,0,0,8477931,8478099.0,Tomas Nosek hit Kevin Labanc
21,hit,Melker Karlsson,Jon Merrill,[98. 22.],1,15:15,SJS,VGK,SJS,28,VGK,54,0,0,8477922,8475750.0,Melker Karlsson hit Jon Merrill
24,hit,Evander Kane,Brayden McNabb,[ 67. -42.],1,14:15,SJS,VGK,SJS,28,VGK,54,0,0,8475169,8475188.0,Evander Kane hit Brayden McNabb
38,hit,Jon Merrill,Marcus Sorensen,[ 57. -42.],1,10:56,VGK,SJS,SJS,28,VGK,54,0,0,8475750,8475834.0,Jon Merrill hit Marcus Sorensen
41,hit,Brent Burns,Ryan Reaves,[-24.  40.],1,10:16,SJS,VGK,SJS,28,VGK,54,0,0,8470613,8471817.0,Brent Burns hit Ryan Reaves
43,hit,Shea Theodore,Tomas Hertl,[99. -9.],1,09:36,VGK,SJS,SJS,28,VGK,54,0,0,8477447,8476881.0,Shea Theodore hit Tomas Hertl
44,hit,Logan Couture,Brayden McNabb,[ 99. -17.],1,09:01,SJS,VGK,SJS,28,VGK,54,0,0,8474053,8475188.0,Logan Couture hit Brayden McNabb
45,hit,Jacob Middleton,Mark Stone,[-81.  39.],1,08:33,SJS,VGK,SJS,28,VGK,54,0,0,8478136,8475913.0,Jacob Middleton hit Mark Stone
50,hit,Brenden Dillon,Jon Merrill,[99. 14.],1,07:34,SJS,VGK,SJS,28,VGK,54,0,0,8475455,8475750.0,Brenden Dillon hit Jon Merrill
57,hit,Valentin Zykov,Evander Kane,[60. 21.],1,05:55,VGK,SJS,SJS,28,VGK,54,0,0,8477458,8475169.0,Valentin Zykov hit Evander Kane
58,hit,Brenden Dillon,Chandler Stephenson,[-90.  35.],1,05:20,SJS,VGK,SJS,28,VGK,54,0,0,8475455,8476905.0,Brenden Dillon hit Chandler Stephenson
81,hit,Evander Kane,Mark Stone,[-3. 41.],2,18:56,SJS,VGK,SJS,28,VGK,54,0,0,8475169,8475913.0,Evander Kane hit Mark Stone
93,hit,Barclay Goodrow,Nicolas Hague,[-91.  31.],2,16:49,SJS,VGK,SJS,28,VGK,54,0,0,8476624,8479980.0,Barclay Goodrow hit Nicolas Hague
94,hit,Brenden Dillon,Ryan Reaves,[ 85. -39.],2,16:40,SJS,VGK,SJS,28,VGK,54,0,0,8475455,8471817.0,Brenden Dillon hit Ryan Reaves
95,hit,Brent Burns,Ryan Reaves,[99. 15.],2,16:27,SJS,VGK,SJS,28,VGK,54,0,0,8470613,8471817.0,Brent Burns hit Ryan Reaves
96,hit,Timo Meier,William Carrier,[29. 38.],2,16:15,SJS,VGK,SJS,28,VGK,54,0,0,8478414,8477478.0,Timo Meier hit William Carrier
116,hit,Tim Heed,William Carrier,[99. -9.],2,13:15,SJS,VGK,SJS,28,VGK,54,0,0,8475841,8477478.0,Tim Heed hit William Carrier
118,hit,William Carrier,Tim Heed,[98. -8.],2,13:04,VGK,SJS,SJS,28,VGK,54,0,0,8477478,8475841.0,William Carrier hit Tim Heed
138,hit,Barclay Goodrow,Max Pacioretty,[ 19. -42.],2,05:08,SJS,VGK,SJS,28,VGK,54,0,0,8476624,8474157.0,Barclay Goodrow hit Max Pacioretty
139,hit,Tim Heed,Chandler Stephenson,[95. 28.],2,04:59,SJS,VGK,SJS,28,VGK,54,0,0,8475841,8476905.0,Tim Heed hit Chandler Stephenson
