,event,hitter,hittee,coords,period,period_time_remaining,hitter_team,hittee_team,home_team,home_team_id,away_team,away_team_id,home_goals,away_goals,hitter_id,hittee_id,description
153,hit,Marcus Sorensen,Valentin Zykov,[ 42. -38.],2,08:40,SJS,VGK,VGK,54,SJS,28,3,1,8475834,8477458.0,Marcus Sorensen hit Valentin Zykov
154,hit,William Carrier,Tim Heed,[97. 24.],2,08:01,VGK,SJS,VGK,54,SJS,28,3,1,8477478,8475841.0,William Carrier hit Tim Heed
155,hit,Ryan Reaves,Mario Ferraro,[ 92. -37.],2,07:56,VGK,SJS,VGK,54,SJS,28,3,1,8471817,8479983.0,Ryan Reaves hit Mario Ferraro
156,hit,Ryan Reaves,Mario Ferraro,[97. -7.],2,07:53,VGK,SJS,VGK,54,SJS,28,3,1,8471817,8479983.0,Ryan Reaves hit Mario Ferraro
158,hit,Dylan Gambrell,Nick Holden,[ 80. -37.],2,07:32,SJS,VGK,VGK,54,SJS,28,3,1,8479580,8474207.0,Dylan Gambrell hit Nick Holden
159,hit,William Carrier,Dylan Gambrell,[32. 39.],2,07:17,VGK,SJS,VGK,54,SJS,28,3,1,8477478,8479580.0,William Carrier hit Dylan Gambrell
161,hit,Barclay Goodrow,Tomas Nosek,[62. 36.],2,06:55,SJS,VGK,VGK,54,SJS,28,3,1,8476624,8477931.0,Barclay Goodrow hit Tomas Nosek
163,hit,Brenden Dillon,Jonathan Marchessault,[ 96. -17.],2,06:29,SJS,VGK,VGK,54,SJS,28,3,1,8475455,8476539.0,Brenden Dillon hit Jonathan Marchessault
164,hit,Brayden McNabb,Timo Meier,[38. 19.],2,06:28,VGK,SJS,VGK,54,SJS,28,3,1,8475188,8478414.0,Brayden McNabb hit Timo Meier
165,hit,Reilly Smith,Brenden Dillon,[ 87. -35.],2,06:22,VGK,SJS,VGK,54,SJS,28,3,1,8475191,8475455.0,Reilly Smith hit Brenden Dillon
166,hit,Logan Couture,Jonathan Marchessault,[ 59. -38.],2,06:18,SJS,VGK,VGK,54,SJS,28,3,1,8474053,8476539.0,Logan Couture hit Jonathan Marchessault
178,hit,Cody Glass,Dylan Gambrell,[-21. -37.],2,03:42,VGK,SJS,VGK,54,SJS,28,3,1,8479996,8479580.0,Cody Glass hit Dylan Gambrell
179,hit,Lean Bergmann,Jonathan Marchessault,[ 34. -35.],2,03:29,SJS,VGK,VGK,54,SJS,28,3,1,8481640,8476539.0,Lean Bergmann hit Jonathan Marchessault
184,hit,Dalton Prout,Ryan Reaves,[ 92. -36.],2,02:40,SJS,VGK,VGK,54,SJS,28,3,1,8474774,8471817.0,Dalton Prout hit Ryan Reaves
185,hit,Brenden Dillon,William Carrier,[97.  0.],2,02:36,SJS,VGK,VGK,54,SJS,28,3,1,8475455,8477478.0,Brenden Dillon hit William Carrier
187,hit,Paul Stastny,Brent Burns,[ 93. -35.],2,01:56,VGK,SJS,VGK,54,SJS,28,3,1,8471669,8470613.0,Paul Stastny hit Brent Burns
188,hit,Brent Burns,Brandon Pirri,[96.  1.],2,01:33,SJS,VGK,VGK,54,SJS,28,3,1,8470613,8475204.0,Brent Burns hit Brandon Pirri
196,hit,Melker Karlsson,Jon Merrill,[33. 39.],2,00:25,SJS,VGK,VGK,54,SJS,28,3,1,8477922,8475750.0,Melker Karlsson hit Jon Merrill
198,hit,Timo Meier,Jon Merrill,[-96.  13.],2,00:12,SJS,VGK,VGK,54,SJS,28,3,1,8478414,8475750.0,Timo Meier hit Jon Merrill
207,hit,Brayden McNabb,Melker Karlsson,[ 51. -37.],3,17:34,VGK,SJS,VGK,54,SJS,28,3,1,8475188,8477922.0,Brayden McNabb hit Melker Karlsson
208,hit,Marcus Sorensen,Jon Merrill,[95.  0.],3,17:30,SJS,VGK,VGK,54,SJS,28,3,1,8475834,8475750.0,Marcus Sorensen hit Jon Merrill
220,hit,Marc-Edouard Vlasic,Reilly Smith,[-20.  29.],3,15:36,SJS,VGK,VGK,54,SJS,28,4,1,8471709,8475191.0,Marc-Edouard Vlasic hit Reilly Smith
226,hit,Lukas Radil,Jonathan Marchessault,[-93.  34.],3,14:28,SJS,VGK,VGK,54,SJS,28,4,1,8480780,8476539.0,Lukas Radil hit Jonathan Marchessault
227,hit,Tomas Hertl,Deryk Engelland,[-32.  35.],3,14:23,SJS,VGK,VGK,54,SJS,28,4,1,8476881,8468674.0,Tomas Hertl hit Deryk Engelland
231,hit,Dalton Prout,Max Pacioretty,[-47. -37.],3,13:41,SJS,VGK,VGK,54,SJS,28,4,1,8474774,8474157.0,Dalton Prout hit Max Pacioretty
232,hit,Marcus Sorensen,Shea Theodore,[ 96. -22.],3,13:31,SJS,VGK,VGK,54,SJS,28,4,1,8475834,8477447.0,Marcus Sorensen hit Shea Theodore
233,hit,Valentin Zykov,Dalton Prout,[-94.  29.],3,13:13,VGK,SJS,VGK,54,SJS,28,4,1,8477458,8474774.0,Valentin Zykov hit Dalton Prout
236,hit,Barclay Goodrow,Max Pacioretty,[ 16. -39.],3,12:24,SJS,VGK,VGK,54,SJS,28,4,1,8476624,8474157.0,Barclay Goodrow hit Max Pacioretty
252,hit,Brayden McNabb,Danil Yurtaykin,[ 53. -38.],3,08:53,VGK,SJS,VGK,54,SJS,28,4,1,8475188,8481515.0,Brayden McNabb hit Danil Yurtaykin
254,hit,Valentin Zykov,Mario Ferraro,[-96. -26.],3,08:42,VGK,SJS,VGK,54,SJS,28,4,1,8477458,8479983.0,Valentin Zykov hit Mario Ferraro
256,hit,Brenden Dillon,Ryan Reaves,[-97.  -5.],3,08:11,SJS,VGK,VGK,54,SJS,28,4,1,8475455,8471817.0,Brenden Dillon hit Ryan Reaves
257,hit,Ryan Reaves,Tomas Hertl,[-90. -38.],3,08:07,VGK,SJS,VGK,54,SJS,28,4,1,8471817,8476881.0,Ryan Reaves hit Tomas Hertl
258,hit,William Carrier,Tomas Hertl,[-90. -37.],3,08:03,VGK,SJS,VGK,54,SJS,28,4,1,8477478,8476881.0,William Carrier hit Tomas Hertl
259,hit,Tim Heed,William Carrier,[-96. -28.],3,08:00,SJS,VGK,VGK,54,SJS,28,4,1,8475841,8477478.0,Tim Heed hit William Carrier
263,hit,Jon Merrill,Dylan Gambrell,[ 16. -39.],3,07:21,VGK,SJS,VGK,54,SJS,28,4,1,8475750,8479580.0,Jon Merrill hit Dylan Gambrell
264,hit,Nick Holden,Melker Karlsson,[ 93. -34.],3,07:12,VGK,SJS,VGK,54,SJS,28,4,1,8474207,8477922.0,Nick Holden hit Melker Karlsson
283,hit,Marc-Edouard Vlasic,Max Pacioretty,[-94.  35.],3,01:46,SJS,VGK,VGK,54,SJS,28,4,1,8471709,8474157.0,Marc-Edouard Vlasic hit Max Pacioretty
284,hit,Ryan Reaves,Dylan Gambrell,[-10. -37.],3,01:39,VGK,SJS,VGK,54,SJS,28,4,1,8471817,8479580.0,Ryan Reaves hit Dylan Gambrell
285,hit,Marc-Edouard Vlasic,Max Pacioretty,[-92. -36.],3,01:35,SJS,VGK,VGK,54,SJS,28,4,1,8471709,8474157.0,Marc-Edouard Vlasic hit Max Pacioretty
286,hit,Brenden Dillon,William Carrier,[-21.  35.],3,01:03,SJS,VGK,VGK,54,SJS,28,4,1,8475455,8477478.0,Brenden Dillon hit William Carrier
288,hit,Barclay Goodrow,Jon Merrill,[ 86. -38.],3,00:52,SJS,VGK,VGK,54,SJS,28,4,1,8476624,8475750.0,Barclay Goodrow hit Jon Merrill
7,hit,Cody Glass,Logan Couture,[93. 31.],1,19:15,VGK,SJS,SJS,28,VGK,54,0,0,8479996,8474053.0,Cody Glass hit Logan Couture
8,hit,Mark Stone,Marc-Edouard Vlasic,[55. 38.],1,18:51,VGK,SJS,SJS,28,VGK,54,0,0,8475913,8471709.0,Mark Stone hit Marc-Edouard Vlasic
18,hit,Ryan Reaves,Jacob Middleton,[-96. -37.],1,17:53,VGK,SJS,SJS,28,VGK,54,0,0,8471817,8478136.0,Ryan Reaves hit Jacob Middleton
20,hit,Jacob Middleton,Ryan Reaves,[-97. -18.],1,17:42,SJS,VGK,SJS,28,VGK,54,0,0,8478136,8471817.0,Jacob Middleton hit Ryan Reaves
21,hit,Ryan Reaves,Dylan Gambrell,[-91. -19.],1,17:35,VGK,SJS,SJS,28,VGK,54,0,0,8471817,8479580.0,Ryan Reaves hit Dylan Gambrell
28,hit,Brayden McNabb,Timo Meier,[ 21. -17.],1,16:16,VGK,SJS,SJS,28,VGK,54,0,0,8475188,8478414.0,Brayden McNabb hit Timo Meier
29,hit,Brent Burns,Mark Stone,[-34. -18.],1,16:08,SJS,VGK,SJS,28,VGK,54,0,0,8470613,8475913.0,Brent Burns hit Mark Stone
33,hit,Paul Stastny,Melker Karlsson,[-55. -27.],1,15:22,VGK,SJS,SJS,28,VGK,54,0,0,8471669,8477922.0,Paul Stastny hit Melker Karlsson
34,hit,Brenden Dillon,Brandon Pirri,[-80.  39.],1,15:15,SJS,VGK,SJS,28,VGK,54,0,0,8475455,8475204.0,Brenden Dillon hit Brandon Pirri
36,hit,Mario Ferraro,Tomas Nosek,[-19. -40.],1,15:02,SJS,VGK,SJS,28,VGK,54,0,0,8479983,8477931.0,Mario Ferraro hit Tomas Nosek
39,hit,Brenden Dillon,Tomas Nosek,[-23.  39.],1,14:30,SJS,VGK,SJS,28,VGK,54,0,1,8475455,8477931.0,Brenden Dillon hit Tomas Nosek
44,hit,Max Pacioretty,Timo Meier,[ 6. 22.],1,13:04,VGK,SJS,SJS,28,VGK,54,0,1,8474157,8478414.0,Max Pacioretty hit Timo Meier
45,hit,Max Pacioretty,Timo Meier,[16. -2.],1,12:48,VGK,SJS,SJS,28,VGK,54,0,1,8474157,8478414.0,Max Pacioretty hit Timo Meier
46,hit,Deryk Engelland,Logan Couture,[ 95. -10.],1,12:43,VGK,SJS,SJS,28,VGK,54,0,1,8468674,8474053.0,Deryk Engelland hit Logan Couture
47,hit,Timo Meier,Nicolas Hague,[ 57. -40.],1,12:33,SJS,VGK,SJS,28,VGK,54,0,1,8478414,8479980.0,Timo Meier hit Nicolas Hague
52,hit,Lean Bergmann,Nick Holden,[ 42. -37.],1,11:34,SJS,VGK,SJS,28,VGK,54,0,1,8481640,8474207.0,Lean Bergmann hit Nick Holden
53,hit,Barclay Goodrow,Jon Merrill,[ 93. -33.],1,11:19,SJS,VGK,SJS,28,VGK,54,0,1,8476624,8475750.0,Barclay Goodrow hit Jon Merrill
54,hit,Tomas Hertl,Jon Merrill,[ 3. 39.],1,10:50,SJS,VGK,SJS,28,VGK,54,0,1,8476881,8475750.0,Tomas Hertl hit Jon Merrill
55,hit,Ryan Reaves,Brenden Dillon,[-91.  14.],1,10:43,VGK,SJS,SJS,28,VGK,54,0,1,8471817,8475455.0,Ryan Reaves hit Brenden Dillon
62,hit,Jonathan Marchessault,Lukas Radil,[68. 30.],1,09:05,VGK,SJS,SJS,28,VGK,54,0,1,8476539,8480780.0,Jonathan Marchessault hit Lukas Radil
68,hit,Danil Yurtaykin,Brayden McNabb,[-69. -40.],1,07:53,SJS,VGK,SJS,28,VGK,54,0,1,8481515,8475188.0,Danil Yurtaykin hit Brayden McNabb
71,hit,William Carrier,Barclay Goodrow,[ 69. -38.],1,07:10,VGK,SJS,SJS,28,VGK,54,0,1,8477478,8476624.0,William Carrier hit Barclay Goodrow
76,hit,Ryan Reaves,Jacob Middleton,[-23.  40.],1,06:37,VGK,SJS,SJS,28,VGK,54,0,1,8471817,8478136.0,Ryan Reaves hit Jacob Middleton
77,hit,Jacob Middleton,William Carrier,[-19.  11.],1,06:29,SJS,VGK,SJS,28,VGK,54,0,1,8478136,8477478.0,Jacob Middleton hit William Carrier
78,hit,Nick Holden,Tomas Hertl,[94. 10.],1,06:11,VGK,SJS,SJS,28,VGK,54,0,1,8474207,8476881.0,Nick Holden hit Tomas Hertl
90,hit,Tomas Hertl,Valentin Zykov,[ 97. -25.],1,03:39,SJS,VGK,SJS,28,VGK,54,0,2,8476881,8477458.0,Tomas Hertl hit Valentin Zykov
94,hit,Ryan Reaves,Jacob Middleton,[-82.  -9.],1,02:24,VGK,SJS,SJS,28,VGK,54,0,2,8471817,8478136.0,Ryan Reaves hit Jacob Middleton
99,hit,Shea Theodore,Danil Yurtaykin,[95.  4.],1,01:24,VGK,SJS,SJS,28,VGK,54,0,2,8477447,8481515.0,Shea Theodore hit Danil Yurtaykin
102,hit,Marc-Edouard Vlasic,Jonathan Marchessault,[-58.  36.],1,00:13,SJS,VGK,SJS,28,VGK,54,0,2,8471709,8476539.0,Marc-Edouard Vlasic hit Jonathan Marchessault
114,hit,Jonathan Marchessault,Mario Ferraro,[ 31. -31.],2,16:16,VGK,SJS,SJS,28,VGK,54,0,2,8476539,8479983.0,Jonathan Marchessault hit Mario Ferraro
116,hit,Ryan Reaves,Brent Burns,[ 98. -10.],2,15:28,VGK,SJS,SJS,28,VGK,54,0,2,8471817,8470613.0,Ryan Reaves hit Brent Burns
117,hit,Barclay Goodrow,Valentin Zykov,[-62.  36.],2,14:35,SJS,VGK,SJS,28,VGK,54,0,2,8476624,8477458.0,Barclay Goodrow hit Valentin Zykov
130,hit,Barclay Goodrow,Nicolas Hague,[87. 34.],2,10:20,SJS,VGK,SJS,28,VGK,54,0,2,8476624,8479980.0,Barclay Goodrow hit Nicolas Hague
131,hit,Brenden Dillon,Max Pacioretty,[-69.  41.],2,10:18,SJS,VGK,SJS,28,VGK,54,0,2,8475455,8474157.0,Brenden Dillon hit Max Pacioretty
132,hit,Max Pacioretty,Barclay Goodrow,[ 89. -35.],2,10:11,VGK,SJS,SJS,28,VGK,54,0,2,8474157,8476624.0,Max Pacioretty hit Barclay Goodrow
143,hit,Nick Holden,Melker Karlsson,[-95.  12.],2,07:29,VGK,SJS,SJS,28,VGK,54,0,2,8474207,8477922.0,Nick Holden hit Melker Karlsson
148,hit,Brent Burns,William Carrier,[-55.  40.],2,06:40,SJS,VGK,SJS,28,VGK,54,0,2,8470613,8477478.0,Brent Burns hit William Carrier
151,hit,Brenden Dillon,Brandon Pirri,[ 91. -35.],2,05:38,SJS,VGK,SJS,28,VGK,54,0,2,8475455,8475204.0,Brenden Dillon hit Brandon Pirri
152,hit,Brenden Dillon,Valentin Zykov,[99.  1.],2,05:32,SJS,VGK,SJS,28,VGK,54,0,2,8475455,8477458.0,Brenden Dillon hit Valentin Zykov
167,hit,Melker Karlsson,Deryk Engelland,[ -9. -36.],2,02:57,SJS,VGK,SJS,28,VGK,54,0,4,8477922,8468674.0,Melker Karlsson hit Deryk Engelland
168,hit,Melker Karlsson,Nicolas Hague,[-93. -19.],2,02:42,SJS,VGK,SJS,28,VGK,54,0,4,8477922,8479980.0,Melker Karlsson hit Nicolas Hague
172,hit,Mario Ferraro,Brandon Pirri,[ 89. -22.],2,01:53,SJS,VGK,SJS,28,VGK,54,0,4,8479983,8475204.0,Mario Ferraro hit Brandon Pirri
178,hit,Marcus Sorensen,Nick Holden,[-89. -38.],2,00:39,SJS,VGK,SJS,28,VGK,54,0,4,8475834,8474207.0,Marcus Sorensen hit Nick Holden
179,hit,Brent Burns,William Carrier,[-33.  38.],2,00:15,SJS,VGK,SJS,28,VGK,54,0,4,8470613,8477478.0,Brent Burns hit William Carrier
191,hit,Brent Burns,Mark Stone,[-96.  11.],3,17:16,SJS,VGK,SJS,28,VGK,54,0,4,8470613,8475913.0,Brent Burns hit Mark Stone
192,hit,Brayden McNabb,Timo Meier,[ 95. -17.],3,16:56,VGK,SJS,SJS,28,VGK,54,0,4,8475188,8478414.0,Brayden McNabb hit Timo Meier
193,hit,Timo Meier,Shea Theodore,[37. 39.],3,16:45,SJS,VGK,SJS,28,VGK,54,0,4,8478414,8477447.0,Timo Meier hit Shea Theodore
196,hit,Ryan Reaves,Mario Ferraro,[ 36. -34.],3,16:17,VGK,SJS,SJS,28,VGK,54,0,4,8471817,8479983.0,Ryan Reaves hit Mario Ferraro
205,hit,Lean Bergmann,Nick Holden,[-45.  37.],3,14:36,SJS,VGK,SJS,28,VGK,54,0,4,8481640,8474207.0,Lean Bergmann hit Nick Holden
206,hit,Ryan Reaves,Mario Ferraro,[ 94. -10.],3,13:26,VGK,SJS,SJS,28,VGK,54,0,4,8471817,8479983.0,Ryan Reaves hit Mario Ferraro
209,hit,Brenden Dillon,Ryan Reaves,[-96. -22.],3,13:03,SJS,VGK,SJS,28,VGK,54,0,4,8475455,8471817.0,Brenden Dillon hit Ryan Reaves
216,hit,Lean Bergmann,Jon Merrill,[ 98. -34.],3,11:18,SJS,VGK,SJS,28,VGK,54,0,4,8481640,8475750.0,Lean Bergmann hit Jon Merrill
233,hit,William Carrier,Marc-Edouard Vlasic,[-95.  16.],3,08:01,VGK,SJS,SJS,28,VGK,54,0,5,8477478,8471709.0,William Carrier hit Marc-Edouard Vlasic
238,hit,Ryan Reaves,Brenden Dillon,[-74.  39.],3,07:38,VGK,SJS,SJS,28,VGK,54,0,5,8471817,8475455.0,Ryan Reaves hit Brenden Dillon
261,hit,Nick Holden,Melker Karlsson,[57. 40.],3,01:21,VGK,SJS,SJS,28,VGK,54,1,5,8474207,8477922.0,Nick Holden hit Melker Karlsson
264,hit,Erik Karlsson,Paul Stastny,[-32.  39.],3,01:06,SJS,VGK,SJS,28,VGK,54,1,5,8474578,8471669.0,Erik Karlsson hit Paul Stastny
265,hit,Brenden Dillon,Valentin Zykov,[-97.  17.],3,00:16,SJS,VGK,SJS,28,VGK,54,1,5,8475455,8477458.0,Brenden Dillon hit Valentin Zykov
4,hit,Michael Del Zotto,Kevin Labanc,[-96.  33.],1,18:56,ANA,SJS,ANA,24,SJS,28,0,0,8474584,8478099.0,Michael Del Zotto hit Kevin Labanc
9,hit,Carter Rowney,Mario Ferraro,[-96. -14.],1,18:11,ANA,SJS,ANA,24,SJS,28,0,0,8477240,8479983.0,Carter Rowney hit Mario Ferraro
12,hit,Jonny Brodzinski,Max Jones,[-34.  38.],1,17:58,SJS,ANA,ANA,24,SJS,28,0,0,8477380,8479368.0,Jonny Brodzinski hit Max Jones
13,hit,Trevor Carrick,Troy Terry,[97. -2.],1,17:55,SJS,ANA,ANA,24,SJS,28,0,0,8476953,8478873.0,Trevor Carrick hit Troy Terry
25,hit,Carter Rowney,Timo Meier,[ 39. -38.],1,14:55,ANA,SJS,ANA,24,SJS,28,1,0,8477240,8478414.0,Carter Rowney hit Timo Meier
27,hit,Adam Henrique,Jonny Brodzinski,[96. 27.],1,14:30,ANA,SJS,ANA,24,SJS,28,1,0,8474641,8477380.0,Adam Henrique hit Jonny Brodzinski
28,hit,Barclay Goodrow,Max Jones,[-75.  37.],1,14:10,SJS,ANA,ANA,24,SJS,28,1,0,8476624,8479368.0,Barclay Goodrow hit Max Jones
33,hit,Josh Manson,Tomas Hertl,[-29. -37.],1,13:09,ANA,SJS,ANA,24,SJS,28,1,0,8476312,8476881.0,Josh Manson hit Tomas Hertl
34,hit,Kevin Labanc,Hampus Lindholm,[-84. -39.],1,13:06,SJS,ANA,ANA,24,SJS,28,1,0,8478099,8476854.0,Kevin Labanc hit Hampus Lindholm
40,hit,Tomas Hertl,Cam Fowler,[ 40. -36.],1,12:35,SJS,ANA,ANA,24,SJS,28,1,0,8476881,8475764.0,Tomas Hertl hit Cam Fowler
44,hit,Danil Yurtaykin,Hampus Lindholm,[-97.  22.],1,11:22,SJS,ANA,ANA,24,SJS,28,1,0,8481515,8476854.0,Danil Yurtaykin hit Hampus Lindholm
46,hit,Michael Del Zotto,Lean Bergmann,[ 33. -37.],1,10:59,ANA,SJS,ANA,24,SJS,28,1,0,8474584,8481640.0,Michael Del Zotto hit Lean Bergmann
47,hit,Lean Bergmann,Troy Terry,[ 69. -34.],1,10:38,SJS,ANA,ANA,24,SJS,28,1,0,8481640,8478873.0,Lean Bergmann hit Troy Terry
49,hit,Max Jones,Trevor Carrick,[ 74. -37.],1,10:23,ANA,SJS,ANA,24,SJS,28,1,0,8479368,8476953.0,Max Jones hit Trevor Carrick
54,hit,Carter Rowney,Lukas Radil,[-83.  36.],1,08:59,ANA,SJS,ANA,24,SJS,28,1,0,8477240,8480780.0,Carter Rowney hit Lukas Radil
56,hit,Nicolas Deslauriers,Erik Karlsson,[ 72. -40.],1,08:33,ANA,SJS,ANA,24,SJS,28,1,0,8475235,8474578.0,Nicolas Deslauriers hit Erik Karlsson
61,hit,Ryan Getzlaf,Timo Meier,[-97.  16.],1,07:51,ANA,SJS,ANA,24,SJS,28,1,0,8470612,8478414.0,Ryan Getzlaf hit Timo Meier
84,hit,Adam Henrique,Brent Burns,[95. 17.],1,01:00,ANA,SJS,ANA,24,SJS,28,1,0,8474641,8470613.0,Adam Henrique hit Brent Burns
89,hit,Brenden Dillon,Jakob Silfverberg,[ 35. -39.],1,00:10,SJS,ANA,ANA,24,SJS,28,1,0,8475455,8475164.0,Brenden Dillon hit Jakob Silfverberg
104,hit,Josh Manson,Logan Couture,[64.  2.],2,17:21,ANA,SJS,ANA,24,SJS,28,1,0,8476312,8474053.0,Josh Manson hit Logan Couture
114,hit,Adam Henrique,Kevin Labanc,[-26. -36.],2,14:30,ANA,SJS,ANA,24,SJS,28,1,0,8474641,8478099.0,Adam Henrique hit Kevin Labanc
119,hit,Carter Rowney,Marc-Edouard Vlasic,[-92.   9.],2,13:27,ANA,SJS,ANA,24,SJS,28,1,1,8477240,8471709.0,Carter Rowney hit Marc-Edouard Vlasic
120,hit,Nicolas Deslauriers,Mario Ferraro,[-77.  35.],2,13:21,ANA,SJS,ANA,24,SJS,28,1,1,8475235,8479983.0,Nicolas Deslauriers hit Mario Ferraro
123,hit,Barclay Goodrow,Jacob Larsson,[94.  8.],2,12:32,SJS,ANA,ANA,24,SJS,28,2,1,8476624,8478491.0,Barclay Goodrow hit Jacob Larsson
128,hit,Derek Grant,Mario Ferraro,[-32.  39.],2,11:46,ANA,SJS,ANA,24,SJS,28,2,1,8474683,8479983.0,Derek Grant hit Mario Ferraro
139,hit,Michael Del Zotto,Barclay Goodrow,[71. 38.],2,08:17,ANA,SJS,ANA,24,SJS,28,2,1,8474584,8476624.0,Michael Del Zotto hit Barclay Goodrow
142,hit,Max Jones,Danil Yurtaykin,[-33. -37.],2,07:14,ANA,SJS,ANA,24,SJS,28,2,1,8479368,8481515.0,Max Jones hit Danil Yurtaykin
146,hit,Jonny Brodzinski,Michael Del Zotto,[-91.  35.],2,06:27,SJS,ANA,ANA,24,SJS,28,2,1,8477380,8474584.0,Jonny Brodzinski hit Michael Del Zotto
147,hit,Mario Ferraro,Jacob Larsson,[-84. -37.],2,06:16,SJS,ANA,ANA,24,SJS,28,2,1,8479983,8478491.0,Mario Ferraro hit Jacob Larsson
150,hit,Tomas Hertl,Ondrej Kase,[-82.  39.],2,05:30,SJS,ANA,ANA,24,SJS,28,2,1,8476881,8478131.0,Tomas Hertl hit Ondrej Kase
153,hit,Nicolas Deslauriers,Melker Karlsson,[ -3. -39.],2,04:21,ANA,SJS,ANA,24,SJS,28,2,1,8475235,8477922.0,Nicolas Deslauriers hit Melker Karlsson
154,hit,Joe Thornton,Troy Terry,[68. 38.],2,04:18,SJS,ANA,ANA,24,SJS,28,2,1,8466138,8478873.0,Joe Thornton hit Troy Terry
176,hit,Derek Grant,Mario Ferraro,[-97.  14.],2,00:14,ANA,SJS,ANA,24,SJS,28,3,1,8474683,8479983.0,Derek Grant hit Mario Ferraro
181,hit,Derek Grant,Brent Burns,[90. -9.],3,19:36,ANA,SJS,ANA,24,SJS,28,3,1,8474683,8470613.0,Derek Grant hit Brent Burns
184,hit,Melker Karlsson,Jacob Larsson,[-89.  39.],3,18:35,SJS,ANA,ANA,24,SJS,28,3,1,8477922,8478491.0,Melker Karlsson hit Jacob Larsson
187,hit,Max Jones,Tomas Hertl,[27. 39.],3,17:49,ANA,SJS,ANA,24,SJS,28,3,1,8479368,8476881.0,Max Jones hit Tomas Hertl
192,hit,Timo Meier,Hampus Lindholm,[-96. -21.],3,16:49,SJS,ANA,ANA,24,SJS,28,3,1,8478414,8476854.0,Timo Meier hit Hampus Lindholm
198,hit,Brendan Guhle,Lukas Radil,[-72.  38.],3,15:30,ANA,SJS,ANA,24,SJS,28,3,1,8478425,8480780.0,Brendan Guhle hit Lukas Radil
205,hit,Mario Ferraro,Nicolas Deslauriers,[19. 38.],3,13:44,SJS,ANA,ANA,24,SJS,28,3,1,8479983,8475235.0,Mario Ferraro hit Nicolas Deslauriers
206,hit,Nicolas Deslauriers,Mario Ferraro,[18. 38.],3,13:32,ANA,SJS,ANA,24,SJS,28,3,1,8475235,8479983.0,Nicolas Deslauriers hit Mario Ferraro
211,hit,Derek Grant,Kevin Labanc,[-71. -37.],3,12:17,ANA,SJS,ANA,24,SJS,28,3,1,8474683,8478099.0,Derek Grant hit Kevin Labanc
221,hit,Rickard Rakell,Erik Karlsson,[14.  3.],3,10:23,ANA,SJS,ANA,24,SJS,28,3,1,8476483,8474578.0,Rickard Rakell hit Erik Karlsson
225,hit,Jonny Brodzinski,Cam Fowler,[-35.  37.],3,09:02,SJS,ANA,ANA,24,SJS,28,3,1,8477380,8475764.0,Jonny Brodzinski hit Cam Fowler
12,hit,Marc-Edouard Vlasic,Matt Duchene,[96.  1.],1,17:24,SJS,NSH,NSH,18,SJS,28,0,0,8471709,8475168.0,Marc-Edouard Vlasic hit Matt Duchene
17,hit,Evander Kane,Ryan Ellis,[-24. -38.],1,16:43,SJS,NSH,NSH,18,SJS,28,0,0,8475169,8475176.0,Evander Kane hit Ryan Ellis
22,hit,Yannick Weber,Lukas Radil,[-78.  38.],1,15:23,NSH,SJS,NSH,18,SJS,28,0,0,8474134,8480780.0,Yannick Weber hit Lukas Radil
31,hit,Matt Irwin,Lukas Radil,[ 14. -38.],1,13:08,NSH,SJS,NSH,18,SJS,28,1,0,8475625,8480780.0,Matt Irwin hit Lukas Radil
35,hit,Dylan Gambrell,Rocco Grimaldi,[92. 37.],1,12:22,SJS,NSH,NSH,18,SJS,28,1,0,8479580,8476428.0,Dylan Gambrell hit Rocco Grimaldi
38,hit,Evander Kane,Viktor Arvidsson,[-47. -28.],1,11:24,SJS,NSH,NSH,18,SJS,28,1,0,8475169,8478042.0,Evander Kane hit Viktor Arvidsson
39,hit,Ryan Johansen,Evander Kane,[-65. -38.],1,11:10,NSH,SJS,NSH,18,SJS,28,1,0,8475793,8475169.0,Ryan Johansen hit Evander Kane
42,hit,Brent Burns,Craig Smith,[12. 38.],1,09:57,SJS,NSH,NSH,18,SJS,28,1,0,8470613,8475225.0,Brent Burns hit Craig Smith
60,hit,Austin Watson,Timo Meier,[-7. -4.],1,06:05,NSH,SJS,NSH,18,SJS,28,1,0,8475766,8478414.0,Austin Watson hit Timo Meier
65,hit,Marc-Edouard Vlasic,Ryan Johansen,[96. -6.],1,04:38,SJS,NSH,NSH,18,SJS,28,1,0,8471709,8475793.0,Marc-Edouard Vlasic hit Ryan Johansen
126,hit,Logan Couture,Austin Watson,[25. 30.],2,09:11,SJS,NSH,NSH,18,SJS,28,2,0,8474053,8475766.0,Logan Couture hit Austin Watson
127,hit,Austin Watson,Brenden Dillon,[ 29. -37.],2,08:16,NSH,SJS,NSH,18,SJS,28,2,0,8475766,8475455.0,Austin Watson hit Brenden Dillon
129,hit,Melker Karlsson,Matt Irwin,[ 77. -37.],2,08:06,SJS,NSH,NSH,18,SJS,28,2,0,8477922,8475625.0,Melker Karlsson hit Matt Irwin
133,hit,Matt Irwin,Melker Karlsson,[93. 35.],2,07:47,NSH,SJS,NSH,18,SJS,28,2,0,8475625,8477922.0,Matt Irwin hit Melker Karlsson
136,hit,Matt Irwin,Dylan Gambrell,[59. 38.],2,07:18,NSH,SJS,NSH,18,SJS,28,2,0,8475625,8479580.0,Matt Irwin hit Dylan Gambrell
140,hit,Colton Sissons,Evander Kane,[-45.  38.],2,06:15,NSH,SJS,NSH,18,SJS,28,2,0,8476925,8475169.0,Colton Sissons hit Evander Kane
141,hit,Evander Kane,Mattias Ekholm,[96. 11.],2,06:00,SJS,NSH,NSH,18,SJS,28,2,0,8475169,8475218.0,Evander Kane hit Mattias Ekholm
143,hit,Mattias Ekholm,Logan Couture,[96. 13.],2,05:45,NSH,SJS,NSH,18,SJS,28,2,0,8475218,8474053.0,Mattias Ekholm hit Logan Couture
159,hit,Colton Sissons,Logan Couture,[35. 37.],2,03:06,NSH,SJS,NSH,18,SJS,28,2,1,8476925,8474053.0,Colton Sissons hit Logan Couture
165,hit,Mattias Ekholm,Melker Karlsson,[ 95. -23.],2,01:16,NSH,SJS,NSH,18,SJS,28,2,1,8475218,8477922.0,Mattias Ekholm hit Melker Karlsson
215,hit,Filip Forsberg,Logan Couture,[-29. -38.],3,10:13,NSH,SJS,NSH,18,SJS,28,4,1,8476887,8474053.0,Filip Forsberg hit Logan Couture
1,hit,Olli Maatta,Patrick Marleau,[ 43. -38.],1,19:48,CHI,SJS,CHI,16,SJS,28,0,0,8476874,8466139.0,Olli Maatta hit Patrick Marleau
2,hit,Brent Seabrook,Timo Meier,[96. -9.],1,19:42,CHI,SJS,CHI,16,SJS,28,0,0,8470607,8478414.0,Brent Seabrook hit Timo Meier
10,hit,Brenden Dillon,Brandon Saad,[-91. -33.],1,18:51,SJS,CHI,CHI,16,SJS,28,0,0,8475455,8476438.0,Brenden Dillon hit Brandon Saad
11,hit,Dominik Kubalik,Erik Karlsson,[-98. -14.],1,18:45,CHI,SJS,CHI,16,SJS,28,0,0,8477330,8474578.0,Dominik Kubalik hit Erik Karlsson
14,hit,Lean Bergmann,Andrew Shaw,[59. 39.],1,18:20,SJS,CHI,CHI,16,SJS,28,0,0,8481640,8476381.0,Lean Bergmann hit Andrew Shaw
15,hit,Erik Gustafsson,Lean Bergmann,[25. 30.],1,18:07,CHI,SJS,CHI,16,SJS,28,0,0,8476979,8481640.0,Erik Gustafsson hit Lean Bergmann
16,hit,Andrew Shaw,Dylan Gambrell,[ 97. -24.],1,17:49,CHI,SJS,CHI,16,SJS,28,0,0,8476381,8479580.0,Andrew Shaw hit Dylan Gambrell
18,hit,Slater Koekkoek,Patrick Marleau,[ 72. -20.],1,17:01,CHI,SJS,CHI,16,SJS,28,0,0,8476886,8466139.0,Slater Koekkoek hit Patrick Marleau
19,hit,Patrick Marleau,Ryan Carpenter,[18. 40.],1,16:54,SJS,CHI,CHI,16,SJS,28,0,0,8466139,8477846.0,Patrick Marleau hit Ryan Carpenter
25,hit,Evander Kane,Connor Murphy,[93. 35.],1,16:09,SJS,CHI,CHI,16,SJS,28,0,0,8475169,8476473.0,Evander Kane hit Connor Murphy
36,hit,Andrew Shaw,Mario Ferraro,[43. 38.],1,14:30,CHI,SJS,CHI,16,SJS,28,1,0,8476381,8479983.0,Andrew Shaw hit Mario Ferraro
38,hit,Logan Couture,Connor Murphy,[93. 35.],1,14:01,SJS,CHI,CHI,16,SJS,28,1,0,8474053,8476473.0,Logan Couture hit Connor Murphy
40,hit,Brent Seabrook,Evander Kane,[36. 31.],1,13:20,CHI,SJS,CHI,16,SJS,28,1,0,8470607,8475169.0,Brent Seabrook hit Evander Kane
47,hit,Patrick Marleau,Slater Koekkoek,[ 95. -16.],1,11:51,SJS,CHI,CHI,16,SJS,28,1,0,8466139,8476886.0,Patrick Marleau hit Slater Koekkoek
50,hit,Melker Karlsson,Connor Murphy,[39. 37.],1,11:08,SJS,CHI,CHI,16,SJS,28,1,0,8477922,8476473.0,Melker Karlsson hit Connor Murphy
51,hit,Andrew Shaw,Brenden Dillon,[-89.  40.],1,10:50,CHI,SJS,CHI,16,SJS,28,1,0,8476381,8475455.0,Andrew Shaw hit Brenden Dillon
52,hit,Andrew Shaw,Marc-Edouard Vlasic,[-94. -34.],1,10:34,CHI,SJS,CHI,16,SJS,28,1,0,8476381,8471709.0,Andrew Shaw hit Marc-Edouard Vlasic
54,hit,Drake Caggiula,Mario Ferraro,[-97. -18.],1,10:18,CHI,SJS,CHI,16,SJS,28,1,0,8479465,8479983.0,Drake Caggiula hit Mario Ferraro
68,hit,Barclay Goodrow,David Kampf,[74. 38.],1,07:34,SJS,CHI,CHI,16,SJS,28,1,1,8476624,8480144.0,Barclay Goodrow hit David Kampf
76,hit,Kevin Labanc,Olli Maatta,[95. 25.],1,05:09,SJS,CHI,CHI,16,SJS,28,2,1,8478099,8476874.0,Kevin Labanc hit Olli Maatta
77,hit,Drake Caggiula,Trevor Carrick,[-93. -28.],1,04:58,CHI,SJS,CHI,16,SJS,28,2,1,8479465,8476953.0,Drake Caggiula hit Trevor Carrick
78,hit,Zack Smith,Trevor Carrick,[  7. -37.],1,04:44,CHI,SJS,CHI,16,SJS,28,2,1,8474250,8476953.0,Zack Smith hit Trevor Carrick
81,hit,Timo Meier,Slater Koekkoek,[ 17. -40.],1,04:12,SJS,CHI,CHI,16,SJS,28,2,1,8478414,8476886.0,Timo Meier hit Slater Koekkoek
84,hit,Brenden Dillon,Dominik Kubalik,[-97. -18.],1,03:52,SJS,CHI,CHI,16,SJS,28,2,1,8475455,8477330.0,Brenden Dillon hit Dominik Kubalik
91,hit,Brent Seabrook,Timo Meier,[82. 41.],1,02:10,CHI,SJS,CHI,16,SJS,28,2,1,8470607,8478414.0,Brent Seabrook hit Timo Meier
93,hit,Brenden Dillon,Patrick Kane,[-97.  10.],1,01:50,SJS,CHI,CHI,16,SJS,28,2,1,8475455,8474141.0,Brenden Dillon hit Patrick Kane
110,hit,Connor Murphy,Patrick Marleau,[-32. -36.],2,17:26,CHI,SJS,CHI,16,SJS,28,2,2,8476473,8466139.0,Connor Murphy hit Patrick Marleau
111,hit,Kevin Labanc,Olli Maatta,[-92. -36.],2,17:01,SJS,CHI,CHI,16,SJS,28,2,2,8478099,8476874.0,Kevin Labanc hit Olli Maatta
117,hit,Dominik Kubalik,Mario Ferraro,[ 78. -37.],2,15:49,CHI,SJS,CHI,16,SJS,28,2,2,8477330,8479983.0,Dominik Kubalik hit Mario Ferraro
118,hit,Dylan Gambrell,Dominik Kubalik,[ 57. -34.],2,15:27,SJS,CHI,CHI,16,SJS,28,2,2,8479580,8477330.0,Dylan Gambrell hit Dominik Kubalik
120,hit,Erik Gustafsson,Evander Kane,[-24. -31.],2,15:05,CHI,SJS,CHI,16,SJS,28,2,2,8476979,8475169.0,Erik Gustafsson hit Evander Kane
132,hit,Mario Ferraro,Ryan Carpenter,[ 88. -39.],2,12:56,SJS,CHI,CHI,16,SJS,28,2,2,8479983,8477846.0,Mario Ferraro hit Ryan Carpenter
137,hit,Patrick Marleau,Connor Murphy,[-96. -21.],2,11:43,SJS,CHI,CHI,16,SJS,28,2,2,8466139,8476473.0,Patrick Marleau hit Connor Murphy
