,event,hitter,hittee,coords,period,period_time_remaining,hitter_team,hittee_team,home_team,home_team_id,away_team,away_team_id,home_goals,away_goals,hitter_id,hittee_id,description
195,hit,Darnell Nurse,Marcus Sorensen,[-28.   9.],3,16:53,EDM,SJS,SJS,28,EDM,22,5,1,8477498,8475834.0,Darnell Nurse hit Marcus Sorensen
208,hit,Leon Draisaitl,Erik Karlsson,[-96. -22.],3,15:27,EDM,SJS,SJS,28,EDM,22,5,1,8477934,8474578.0,Leon Draisaitl hit Erik Karlsson
214,hit,Josh Archibald,Logan Couture,[63. 42.],3,14:43,EDM,SJS,SJS,28,EDM,22,5,1,8476326,8474053.0,Josh Archibald hit Logan Couture
225,hit,Matt Benning,Dylan Gambrell,[ 77. -42.],3,11:59,EDM,SJS,SJS,28,EDM,22,5,1,8476988,8479580.0,Matt Benning hit Dylan Gambrell
231,hit,Ryan Nugent-Hopkins,Radim Simek,[-92.  29.],3,10:33,EDM,SJS,SJS,28,EDM,22,5,2,8476454,8480160.0,Ryan Nugent-Hopkins hit Radim Simek
232,hit,Timo Meier,Ethan Bear,[78. 38.],3,09:35,SJS,EDM,SJS,28,EDM,22,5,2,8478414,8478451.0,Timo Meier hit Ethan Bear
237,hit,Tim Heed,Riley Sheahan,[-80. -38.],3,08:56,SJS,EDM,SJS,28,EDM,22,6,2,8475841,8475772.0,Tim Heed hit Riley Sheahan
245,hit,Brenden Dillon,Darnell Nurse,[-92.  28.],3,06:58,SJS,EDM,SJS,28,EDM,22,6,3,8475455,8477498.0,Brenden Dillon hit Darnell Nurse
246,hit,Darnell Nurse,Brenden Dillon,[-83.  37.],3,06:47,EDM,SJS,SJS,28,EDM,22,6,3,8477498,8475455.0,Darnell Nurse hit Brenden Dillon
253,hit,Patrick Russell,Evander Kane,[37. 40.],3,04:49,EDM,SJS,SJS,28,EDM,22,6,3,8479466,8475169.0,Patrick Russell hit Evander Kane
256,hit,Kris Russell,Marcus Sorensen,[ 85. -37.],3,04:06,EDM,SJS,SJS,28,EDM,22,6,3,8471729,8475834.0,Kris Russell hit Marcus Sorensen
257,hit,Timo Meier,Ryan Nugent-Hopkins,[ 36. -41.],3,03:28,SJS,EDM,SJS,28,EDM,22,6,3,8478414,8476454.0,Timo Meier hit Ryan Nugent-Hopkins
258,hit,Kris Russell,Logan Couture,[97. 25.],3,01:20,EDM,SJS,SJS,28,EDM,22,6,3,8471729,8474053.0,Kris Russell hit Logan Couture
260,hit,Marcus Sorensen,Ethan Bear,[-34.  -3.],3,00:21,SJS,EDM,SJS,28,EDM,22,6,3,8475834,8478451.0,Marcus Sorensen hit Ethan Bear
2,hit,Ondrej Kase,Evander Kane,[-28. -39.],1,19:21,ANA,SJS,ANA,24,SJS,28,0,0,8478131,8475169.0,Ondrej Kase hit Evander Kane
5,hit,Ryan Getzlaf,Brent Burns,[-56.  40.],1,19:08,ANA,SJS,ANA,24,SJS,28,0,0,8470612,8470613.0,Ryan Getzlaf hit Brent Burns
13,hit,Dylan Gambrell,Carter Rowney,[-12.  18.],1,17:32,SJS,ANA,ANA,24,SJS,28,1,0,8479580,8477240.0,Dylan Gambrell hit Carter Rowney
14,hit,Lukas Radil,Josh Mahura,[-93.  16.],1,17:27,SJS,ANA,ANA,24,SJS,28,1,0,8480780,8479372.0,Lukas Radil hit Josh Mahura
28,hit,Brenden Dillon,Ondrej Kase,[ 97. -16.],1,14:30,SJS,ANA,ANA,24,SJS,28,1,0,8475455,8478131.0,Brenden Dillon hit Ondrej Kase
37,hit,Carter Rowney,Brenden Dillon,[ 41. -38.],1,12:30,ANA,SJS,ANA,24,SJS,28,1,1,8477240,8475455.0,Carter Rowney hit Brenden Dillon
38,hit,Carter Rowney,Brenden Dillon,[ 35. -37.],1,12:27,ANA,SJS,ANA,24,SJS,28,1,1,8477240,8475455.0,Carter Rowney hit Brenden Dillon
57,hit,Radim Simek,Adam Henrique,[-30. -38.],1,07:30,SJS,ANA,ANA,24,SJS,28,1,1,8480160,8474641.0,Radim Simek hit Adam Henrique
58,hit,Dylan Gambrell,Rickard Rakell,[18. 40.],1,06:52,SJS,ANA,ANA,24,SJS,28,1,1,8479580,8476483.0,Dylan Gambrell hit Rickard Rakell
61,hit,Brenden Dillon,Troy Terry,[91. 31.],1,06:21,SJS,ANA,ANA,24,SJS,28,1,1,8475455,8478873.0,Brenden Dillon hit Troy Terry
62,hit,Derek Grant,Logan Couture,[-52. -39.],1,05:51,ANA,SJS,ANA,24,SJS,28,1,1,8474683,8474053.0,Derek Grant hit Logan Couture
74,hit,Marcus Sorensen,Josh Mahura,[-95.  18.],1,04:27,SJS,ANA,ANA,24,SJS,28,1,1,8475834,8479372.0,Marcus Sorensen hit Josh Mahura
77,hit,Dylan Gambrell,Korbinian Holzer,[-69.  38.],1,02:55,SJS,ANA,ANA,24,SJS,28,1,1,8479580,8473560.0,Dylan Gambrell hit Korbinian Holzer
78,hit,Korbinian Holzer,Lukas Radil,[-99.   7.],1,02:45,ANA,SJS,ANA,24,SJS,28,1,1,8473560,8480780.0,Korbinian Holzer hit Lukas Radil
79,hit,Brendan Guhle,Dylan Gambrell,[-83. -39.],1,02:26,ANA,SJS,ANA,24,SJS,28,1,1,8478425,8479580.0,Brendan Guhle hit Dylan Gambrell
80,hit,Derek Grant,Lukas Radil,[-86. -36.],1,02:19,ANA,SJS,ANA,24,SJS,28,1,1,8474683,8480780.0,Derek Grant hit Lukas Radil
81,hit,Nicolas Deslauriers,Dalton Prout,[-82.  38.],1,02:09,ANA,SJS,ANA,24,SJS,28,1,1,8475235,8474774.0,Nicolas Deslauriers hit Dalton Prout
84,hit,Nicolas Deslauriers,Brenden Dillon,[89. 32.],1,01:59,ANA,SJS,ANA,24,SJS,28,1,1,8475235,8475455.0,Nicolas Deslauriers hit Brenden Dillon
86,hit,Ryan Getzlaf,Brent Burns,[ 94. -26.],1,01:31,ANA,SJS,ANA,24,SJS,28,1,1,8470612,8470613.0,Ryan Getzlaf hit Brent Burns
100,hit,Brenden Dillon,Nicolas Deslauriers,[-97.  -8.],2,17:32,SJS,ANA,ANA,24,SJS,28,1,1,8475455,8475235.0,Brenden Dillon hit Nicolas Deslauriers
102,hit,Nicolas Deslauriers,Brenden Dillon,[-92. -10.],2,17:18,ANA,SJS,ANA,24,SJS,28,1,1,8475235,8475455.0,Nicolas Deslauriers hit Brenden Dillon
127,hit,Evander Kane,Korbinian Holzer,[97.  7.],2,11:07,SJS,ANA,ANA,24,SJS,28,1,1,8475169,8473560.0,Evander Kane hit Korbinian Holzer
129,hit,Brenden Dillon,Carter Rowney,[-66. -37.],2,10:40,SJS,ANA,ANA,24,SJS,28,1,1,8475455,8477240.0,Brenden Dillon hit Carter Rowney
131,hit,Dalton Prout,Rickard Rakell,[-93. -17.],2,10:20,SJS,ANA,ANA,24,SJS,28,1,1,8474774,8476483.0,Dalton Prout hit Rickard Rakell
133,hit,Melker Karlsson,Ondrej Kase,[-58. -39.],2,09:32,SJS,ANA,ANA,24,SJS,28,1,1,8477922,8478131.0,Melker Karlsson hit Ondrej Kase
142,hit,Brendan Guhle,Timo Meier,[ 31. -34.],2,07:52,ANA,SJS,ANA,24,SJS,28,1,1,8478425,8478414.0,Brendan Guhle hit Timo Meier
159,hit,Evander Kane,Korbinian Holzer,[ 89. -18.],2,05:14,SJS,ANA,ANA,24,SJS,28,2,1,8475169,8473560.0,Evander Kane hit Korbinian Holzer
166,hit,Brenden Dillon,Nick Ritchie,[-89.  34.],2,03:10,SJS,ANA,ANA,24,SJS,28,2,1,8475455,8477941.0,Brenden Dillon hit Nick Ritchie
174,hit,Carter Rowney,Dylan Gambrell,[-96.  25.],2,00:56,ANA,SJS,ANA,24,SJS,28,2,2,8477240,8479580.0,Carter Rowney hit Dylan Gambrell
181,hit,Jakob Silfverberg,Patrick Marleau,[38. 40.],3,18:56,ANA,SJS,ANA,24,SJS,28,2,2,8475164,8466139.0,Jakob Silfverberg hit Patrick Marleau
195,hit,Jacob Larsson,Evander Kane,[-95.  16.],3,15:31,ANA,SJS,ANA,24,SJS,28,2,2,8478491,8475169.0,Jacob Larsson hit Evander Kane
203,hit,Adam Henrique,Erik Karlsson,[98. 14.],3,13:40,ANA,SJS,ANA,24,SJS,28,2,2,8474641,8474578.0,Adam Henrique hit Erik Karlsson
217,hit,Timo Meier,Cam Fowler,[-61. -39.],3,11:21,SJS,ANA,ANA,24,SJS,28,2,3,8478414,8475764.0,Timo Meier hit Cam Fowler
239,hit,Brenden Dillon,Ryan Getzlaf,[ 87. -29.],3,05:19,SJS,ANA,ANA,24,SJS,28,2,4,8475455,8470612.0,Brenden Dillon hit Ryan Getzlaf
241,hit,Barclay Goodrow,Troy Terry,[ 79. -33.],3,05:07,SJS,ANA,ANA,24,SJS,28,2,4,8476624,8478873.0,Barclay Goodrow hit Troy Terry
244,hit,Carter Rowney,Radim Simek,[ 23. -41.],3,04:27,ANA,SJS,ANA,24,SJS,28,2,4,8477240,8480160.0,Carter Rowney hit Radim Simek
3,hit,Radim Simek,Darren Helm,[-91. -24.],1,19:29,SJS,DET,SJS,28,DET,17,0,0,8480160,8471794.0,Radim Simek hit Darren Helm
13,hit,Joe Hicketts,Dylan Gambrell,[ 72. -29.],1,16:47,DET,SJS,SJS,28,DET,17,0,0,8478176,8479580.0,Joe Hicketts hit Dylan Gambrell
15,hit,Luke Glendening,Timo Meier,[ 95. -17.],1,16:34,DET,SJS,SJS,28,DET,17,0,0,8476822,8478414.0,Luke Glendening hit Timo Meier
31,hit,Mario Ferraro,Luke Glendening,[-45. -36.],1,12:44,SJS,DET,SJS,28,DET,17,0,0,8479983,8476822.0,Mario Ferraro hit Luke Glendening
39,hit,Dylan McIlrath,Evander Kane,[-24.  22.],1,10:35,DET,SJS,SJS,28,DET,17,0,0,8475795,8475169.0,Dylan McIlrath hit Evander Kane
40,hit,Timo Meier,Dennis Cholowski,[ 94. -17.],1,10:19,SJS,DET,SJS,28,DET,17,0,0,8478414,8479395.0,Timo Meier hit Dennis Cholowski
52,hit,Mario Ferraro,Darren Helm,[-66. -36.],1,06:33,SJS,DET,SJS,28,DET,17,0,0,8479983,8471794.0,Mario Ferraro hit Darren Helm
56,hit,Melker Karlsson,Dylan McIlrath,[94. 16.],1,06:01,SJS,DET,SJS,28,DET,17,0,0,8477922,8475795.0,Melker Karlsson hit Dylan McIlrath
62,hit,Joe Hicketts,Patrick Marleau,[47. 36.],1,03:52,DET,SJS,SJS,28,DET,17,0,0,8478176,8466139.0,Joe Hicketts hit Patrick Marleau
63,hit,Marcus Sorensen,Dylan McIlrath,[90. 26.],1,03:48,SJS,DET,SJS,28,DET,17,0,0,8475834,8475795.0,Marcus Sorensen hit Dylan McIlrath
65,hit,Adam Erne,Radim Simek,[-94. -16.],1,03:30,DET,SJS,SJS,28,DET,17,0,0,8477454,8480160.0,Adam Erne hit Radim Simek
67,hit,Robby Fabbri,Brenden Dillon,[-85.  12.],1,03:10,DET,SJS,SJS,28,DET,17,0,0,8477952,8475455.0,Robby Fabbri hit Brenden Dillon
68,hit,Mario Ferraro,Robby Fabbri,[29. 15.],1,02:59,SJS,DET,SJS,28,DET,17,0,0,8479983,8477952.0,Mario Ferraro hit Robby Fabbri
74,hit,Andreas Athanasiou,Kevin Labanc,[91. 20.],1,01:27,DET,SJS,SJS,28,DET,17,0,0,8476960,8478099.0,Andreas Athanasiou hit Kevin Labanc
81,hit,Luke Glendening,Mario Ferraro,[ 41. -35.],1,00:39,DET,SJS,SJS,28,DET,17,1,0,8476822,8479983.0,Luke Glendening hit Mario Ferraro
98,hit,Logan Couture,Taro Hirose,[ 62. -35.],2,16:47,SJS,DET,SJS,28,DET,17,2,1,8474053,8481433.0,Logan Couture hit Taro Hirose
112,hit,Anthony Mantha,Marc-Edouard Vlasic,[ 69. -37.],2,11:53,DET,SJS,SJS,28,DET,17,2,1,8477511,8471709.0,Anthony Mantha hit Marc-Edouard Vlasic
122,hit,Luke Glendening,Mario Ferraro,[-59.  37.],2,09:05,DET,SJS,SJS,28,DET,17,2,1,8476822,8479983.0,Luke Glendening hit Mario Ferraro
127,hit,Dylan McIlrath,Timo Meier,[-50. -40.],2,08:10,DET,SJS,SJS,28,DET,17,2,2,8475795,8478414.0,Dylan McIlrath hit Timo Meier
128,hit,Barclay Goodrow,Dylan McIlrath,[-94.   6.],2,07:55,SJS,DET,SJS,28,DET,17,2,2,8476624,8475795.0,Barclay Goodrow hit Dylan McIlrath
141,hit,Anthony Mantha,Erik Karlsson,[95.  8.],2,04:37,DET,SJS,SJS,28,DET,17,3,2,8477511,8474578.0,Anthony Mantha hit Erik Karlsson
146,hit,Barclay Goodrow,Robby Fabbri,[78. 26.],2,02:37,SJS,DET,SJS,28,DET,17,3,2,8476624,8477952.0,Barclay Goodrow hit Robby Fabbri
163,hit,Barclay Goodrow,Dylan McIlrath,[95. -8.],3,15:13,SJS,DET,SJS,28,DET,17,3,2,8476624,8475795.0,Barclay Goodrow hit Dylan McIlrath
167,hit,Madison Bowey,Radim Simek,[-98.  -5.],3,14:19,DET,SJS,SJS,28,DET,17,3,2,8477474,8480160.0,Madison Bowey hit Radim Simek
169,hit,Timo Meier,Alex Biega,[ 45. -36.],3,13:29,SJS,DET,SJS,28,DET,17,3,2,8478414,8473415.0,Timo Meier hit Alex Biega
170,hit,Luke Glendening,Kevin Labanc,[ 67. -38.],3,12:53,DET,SJS,SJS,28,DET,17,3,2,8476822,8478099.0,Luke Glendening hit Kevin Labanc
171,hit,Kevin Labanc,Adam Erne,[-34. -35.],3,12:38,SJS,DET,SJS,28,DET,17,3,2,8478099,8477454.0,Kevin Labanc hit Adam Erne
172,hit,Jonathan Ericsson,Lukas Radil,[ 22. -37.],3,11:18,DET,SJS,SJS,28,DET,17,3,2,8470318,8480780.0,Jonathan Ericsson hit Lukas Radil
173,hit,Brenden Dillon,Robby Fabbri,[-20.  39.],3,11:00,SJS,DET,SJS,28,DET,17,3,2,8475455,8477952.0,Brenden Dillon hit Robby Fabbri
179,hit,Luke Glendening,Brenden Dillon,[-86.  18.],3,08:13,DET,SJS,SJS,28,DET,17,3,2,8476822,8475455.0,Luke Glendening hit Brenden Dillon
184,hit,Dylan McIlrath,Logan Couture,[53. 35.],3,06:33,DET,SJS,SJS,28,DET,17,3,2,8475795,8474053.0,Dylan McIlrath hit Logan Couture
196,hit,Evander Kane,Dennis Cholowski,[ 90. -23.],3,02:55,SJS,DET,SJS,28,DET,17,3,3,8475169,8479395.0,Evander Kane hit Dennis Cholowski
205,hit,Andreas Athanasiou,Mario Ferraro,[ 45. -35.],3,00:07,DET,SJS,SJS,28,DET,17,3,3,8476960,8479983.0,Andreas Athanasiou hit Mario Ferraro
210,hit,Evander Kane,Valtteri Filppula,[-85.   5.],4,03:59,SJS,DET,SJS,28,DET,17,3,3,8475169,8470047.0,Evander Kane hit Valtteri Filppula
8,hit,Timo Meier,Darnell Nurse,[ 63. -40.],1,17:27,SJS,EDM,SJS,28,EDM,22,0,0,8478414,8477498.0,Timo Meier hit Darnell Nurse
13,hit,Mario Ferraro,Alex Chiasson,[-96.   5.],1,16:56,SJS,EDM,SJS,28,EDM,22,0,0,8479983,8475163.0,Mario Ferraro hit Alex Chiasson
14,hit,Melker Karlsson,Oscar Klefbom,[-71. -42.],1,16:39,SJS,EDM,SJS,28,EDM,22,0,0,8477922,8476472.0,Melker Karlsson hit Oscar Klefbom
39,hit,Patrick Marleau,Riley Sheahan,[ 32. -38.],1,11:18,SJS,EDM,SJS,28,EDM,22,0,2,8466139,8475772.0,Patrick Marleau hit Riley Sheahan
55,hit,Darnell Nurse,Dylan Gambrell,[ 62. -39.],1,08:10,EDM,SJS,SJS,28,EDM,22,1,2,8477498,8479580.0,Darnell Nurse hit Dylan Gambrell
61,hit,Connor McDavid,Melker Karlsson,[ 30. -41.],1,07:25,EDM,SJS,SJS,28,EDM,22,1,2,8478402,8477922.0,Connor McDavid hit Melker Karlsson
63,hit,Brenden Dillon,Connor McDavid,[-77. -38.],1,06:49,SJS,EDM,SJS,28,EDM,22,1,2,8475455,8478402.0,Brenden Dillon hit Connor McDavid
65,hit,Leon Draisaitl,Melker Karlsson,[-55.  32.],1,06:21,EDM,SJS,SJS,28,EDM,22,1,2,8477934,8477922.0,Leon Draisaitl hit Melker Karlsson
66,hit,Evander Kane,Caleb Jones,[42. 39.],1,06:06,SJS,EDM,SJS,28,EDM,22,1,2,8475169,8478452.0,Evander Kane hit Caleb Jones
70,hit,Jujhar Khaira,Radim Simek,[-85.  35.],1,05:06,EDM,SJS,SJS,28,EDM,22,1,2,8476915,8480160.0,Jujhar Khaira hit Radim Simek
71,hit,Markus Granlund,Mario Ferraro,[-97. -19.],1,04:37,EDM,SJS,SJS,28,EDM,22,1,2,8476440,8479983.0,Markus Granlund hit Mario Ferraro
72,hit,Darnell Nurse,Patrick Marleau,[ 75. -39.],1,04:20,EDM,SJS,SJS,28,EDM,22,1,2,8477498,8466139.0,Darnell Nurse hit Patrick Marleau
74,hit,Darnell Nurse,Timo Meier,[80. -2.],1,03:54,EDM,SJS,SJS,28,EDM,22,1,2,8477498,8478414.0,Darnell Nurse hit Timo Meier
79,hit,Mario Ferraro,James Neal,[-55. -41.],1,01:37,SJS,EDM,SJS,28,EDM,22,1,2,8479983,8471707.0,Mario Ferraro hit James Neal
80,hit,Jujhar Khaira,Patrick Marleau,[ 46. -38.],1,01:24,EDM,SJS,SJS,28,EDM,22,1,2,8476915,8466139.0,Jujhar Khaira hit Patrick Marleau
84,hit,Brenden Dillon,Josh Archibald,[-97. -11.],1,00:25,SJS,EDM,SJS,28,EDM,22,1,2,8475455,8476326.0,Brenden Dillon hit Josh Archibald
89,hit,Oscar Klefbom,Kevin Labanc,[-64.  41.],2,19:38,EDM,SJS,SJS,28,EDM,22,1,3,8476472,8478099.0,Oscar Klefbom hit Kevin Labanc
91,hit,Logan Couture,Joakim Nygard,[-97.  -5.],2,19:33,SJS,EDM,SJS,28,EDM,22,1,3,8474053,8481638.0,Logan Couture hit Joakim Nygard
94,hit,Radim Simek,Connor McDavid,[ 55. -40.],2,17:33,SJS,EDM,SJS,28,EDM,22,1,3,8480160,8478402.0,Radim Simek hit Connor McDavid
97,hit,Lukas Radil,Kris Russell,[-98.  -5.],2,17:03,SJS,EDM,SJS,28,EDM,22,1,3,8480780,8471729.0,Lukas Radil hit Kris Russell
105,hit,Logan Couture,Gaetan Haas,[ 77. -40.],2,15:53,SJS,EDM,SJS,28,EDM,22,1,3,8474053,8481813.0,Logan Couture hit Gaetan Haas
106,hit,Mario Ferraro,Riley Sheahan,[30. 20.],2,15:17,SJS,EDM,SJS,28,EDM,22,1,3,8479983,8475772.0,Mario Ferraro hit Riley Sheahan
109,hit,Darnell Nurse,Timo Meier,[-14. -42.],2,14:37,EDM,SJS,SJS,28,EDM,22,1,3,8477498,8478414.0,Darnell Nurse hit Timo Meier
114,hit,Radim Simek,Connor McDavid,[63. 40.],2,13:16,SJS,EDM,SJS,28,EDM,22,1,3,8480160,8478402.0,Radim Simek hit Connor McDavid
115,hit,Dylan Gambrell,Ethan Bear,[-54. -40.],2,13:10,SJS,EDM,SJS,28,EDM,22,1,3,8479580,8478451.0,Dylan Gambrell hit Ethan Bear
120,hit,Jujhar Khaira,Brent Burns,[90. 32.],2,12:31,EDM,SJS,SJS,28,EDM,22,1,3,8476915,8470613.0,Jujhar Khaira hit Brent Burns
121,hit,Jujhar Khaira,Radim Simek,[ 89. -32.],2,12:19,EDM,SJS,SJS,28,EDM,22,1,3,8476915,8480160.0,Jujhar Khaira hit Radim Simek
123,hit,Brenden Dillon,Gaetan Haas,[57. 40.],2,11:40,SJS,EDM,SJS,28,EDM,22,1,3,8475455,8481813.0,Brenden Dillon hit Gaetan Haas
129,hit,Darnell Nurse,Dylan Gambrell,[-62. -40.],2,10:47,EDM,SJS,SJS,28,EDM,22,1,3,8477498,8479580.0,Darnell Nurse hit Dylan Gambrell
133,hit,Logan Couture,Darnell Nurse,[-95. -24.],2,10:08,SJS,EDM,SJS,28,EDM,22,1,3,8474053,8477498.0,Logan Couture hit Darnell Nurse
139,hit,Josh Archibald,Melker Karlsson,[ 5. 41.],2,08:58,EDM,SJS,SJS,28,EDM,22,1,3,8476326,8477922.0,Josh Archibald hit Melker Karlsson
142,hit,Patrick Marleau,Kris Russell,[-80. -38.],2,08:13,SJS,EDM,SJS,28,EDM,22,1,3,8466139,8471729.0,Patrick Marleau hit Kris Russell
147,hit,Jujhar Khaira,Timo Meier,[-29. -41.],2,07:52,EDM,SJS,SJS,28,EDM,22,1,3,8476915,8478414.0,Jujhar Khaira hit Timo Meier
150,hit,Alex Chiasson,Radim Simek,[42. 42.],2,07:27,EDM,SJS,SJS,28,EDM,22,1,3,8475163,8480160.0,Alex Chiasson hit Radim Simek
151,hit,Kevin Labanc,Markus Granlund,[-94.   7.],2,07:12,SJS,EDM,SJS,28,EDM,22,1,3,8478099,8476440.0,Kevin Labanc hit Markus Granlund
155,hit,Ethan Bear,Timo Meier,[-76. -17.],2,06:24,EDM,SJS,SJS,28,EDM,22,1,3,8478451,8478414.0,Ethan Bear hit Timo Meier
159,hit,Zack Kassian,Dylan Gambrell,[-15.  40.],2,06:01,EDM,SJS,SJS,28,EDM,22,1,3,8475178,8479580.0,Zack Kassian hit Dylan Gambrell
164,hit,Tomas Hertl,Ryan Nugent-Hopkins,[93. 31.],2,05:11,SJS,EDM,SJS,28,EDM,22,1,3,8476881,8476454.0,Tomas Hertl hit Ryan Nugent-Hopkins
166,hit,Jujhar Khaira,Brenden Dillon,[-65. -42.],2,04:41,EDM,SJS,SJS,28,EDM,22,1,3,8476915,8475455.0,Jujhar Khaira hit Brenden Dillon
173,hit,Radim Simek,Ryan Nugent-Hopkins,[ 45. -40.],2,02:55,SJS,EDM,SJS,28,EDM,22,1,3,8480160,8476454.0,Radim Simek hit Ryan Nugent-Hopkins
176,hit,Mario Ferraro,Joakim Nygard,[11. 37.],2,02:33,SJS,EDM,SJS,28,EDM,22,1,4,8479983,8481638.0,Mario Ferraro hit Joakim Nygard
183,hit,Brenden Dillon,Zack Kassian,[97. -7.],2,01:37,SJS,EDM,SJS,28,EDM,22,1,4,8475455,8475178.0,Brenden Dillon hit Zack Kassian
184,hit,Marc-Edouard Vlasic,Connor McDavid,[52. 40.],2,01:08,SJS,EDM,SJS,28,EDM,22,1,4,8471709,8478402.0,Marc-Edouard Vlasic hit Connor McDavid
188,hit,Radim Simek,Leon Draisaitl,[ 92. -29.],2,00:14,SJS,EDM,SJS,28,EDM,22,1,4,8480160,8477934.0,Radim Simek hit Leon Draisaitl
195,hit,Radim Simek,Riley Sheahan,[-52.  39.],3,18:18,SJS,EDM,SJS,28,EDM,22,1,4,8480160,8475772.0,Radim Simek hit Riley Sheahan
201,hit,Barclay Goodrow,Ryan Nugent-Hopkins,[38. 40.],3,16:46,SJS,EDM,SJS,28,EDM,22,1,4,8476624,8476454.0,Barclay Goodrow hit Ryan Nugent-Hopkins
211,hit,Kris Russell,Evander Kane,[99.  8.],3,15:32,EDM,SJS,SJS,28,EDM,22,1,4,8471729,8475169.0,Kris Russell hit Evander Kane
224,hit,Barclay Goodrow,Caleb Jones,[ 74. -39.],3,12:43,SJS,EDM,SJS,28,EDM,22,1,5,8476624,8478452.0,Barclay Goodrow hit Caleb Jones
238,hit,Dylan Gambrell,Gaetan Haas,[-25. -41.],3,09:58,SJS,EDM,SJS,28,EDM,22,2,5,8479580,8481813.0,Dylan Gambrell hit Gaetan Haas
244,hit,Erik Karlsson,Josh Archibald,[-72. -41.],3,08:59,SJS,EDM,SJS,28,EDM,22,2,5,8474578,8476326.0,Erik Karlsson hit Josh Archibald
251,hit,Melker Karlsson,Kris Russell,[88. 31.],3,07:10,SJS,EDM,SJS,28,EDM,22,2,5,8477922,8471729.0,Melker Karlsson hit Kris Russell
252,hit,Marcus Sorensen,Oscar Klefbom,[ 88. -36.],3,07:05,SJS,EDM,SJS,28,EDM,22,2,5,8475834,8476472.0,Marcus Sorensen hit Oscar Klefbom
254,hit,Alex Chiasson,Radim Simek,[65. 39.],3,06:54,EDM,SJS,SJS,28,EDM,22,2,5,8475163,8480160.0,Alex Chiasson hit Radim Simek
256,hit,Oscar Klefbom,Dylan Gambrell,[81. 39.],3,06:37,EDM,SJS,SJS,28,EDM,22,2,5,8476472,8479580.0,Oscar Klefbom hit Dylan Gambrell
261,hit,Logan Couture,Oscar Klefbom,[86. 33.],3,05:01,SJS,EDM,SJS,28,EDM,22,2,5,8474053,8476472.0,Logan Couture hit Oscar Klefbom
266,hit,Marcus Sorensen,Gaetan Haas,[90. 30.],3,04:01,SJS,EDM,SJS,28,EDM,22,2,5,8475834,8481813.0,Marcus Sorensen hit Gaetan Haas
269,hit,Timo Meier,Kris Russell,[ 80. -19.],3,01:56,SJS,EDM,SJS,28,EDM,22,2,5,8478414,8471729.0,Timo Meier hit Kris Russell
6,hit,Brayden McNabb,Timo Meier,[98. -7.],1,19:11,VGK,SJS,VGK,54,SJS,28,0,0,8475188,8478414.0,Brayden McNabb hit Timo Meier
8,hit,Brayden McNabb,Kevin Labanc,[53. 11.],1,19:02,VGK,SJS,VGK,54,SJS,28,0,0,8475188,8478099.0,Brayden McNabb hit Kevin Labanc
9,hit,Evander Kane,William Karlsson,[60. 40.],1,18:53,SJS,VGK,VGK,54,SJS,28,0,0,8475169,8476448.0,Evander Kane hit William Karlsson
13,hit,Ryan Reaves,Radim Simek,[-91.  36.],1,17:36,VGK,SJS,VGK,54,SJS,28,0,0,8471817,8480160.0,Ryan Reaves hit Radim Simek
14,hit,Ryan Reaves,Radim Simek,[-90. -33.],1,17:28,VGK,SJS,VGK,54,SJS,28,0,0,8471817,8480160.0,Ryan Reaves hit Radim Simek
16,hit,Ryan Reaves,Antti Suomela,[43. 41.],1,17:03,VGK,SJS,VGK,54,SJS,28,0,0,8471817,8480965.0,Ryan Reaves hit Antti Suomela
17,hit,Timo Meier,Brayden McNabb,[ 66. -42.],1,16:59,SJS,VGK,VGK,54,SJS,28,0,0,8478414,8475188.0,Timo Meier hit Brayden McNabb
20,hit,Timo Meier,Nicolas Hague,[16. -3.],1,16:23,SJS,VGK,VGK,54,SJS,28,0,0,8478414,8479980.0,Timo Meier hit Nicolas Hague
24,hit,Brayden McNabb,Evander Kane,[81. -1.],1,16:10,VGK,SJS,VGK,54,SJS,28,0,0,8475188,8475169.0,Brayden McNabb hit Evander Kane
27,hit,Mario Ferraro,Alex Tuch,[-94. -22.],1,15:19,SJS,VGK,VGK,54,SJS,28,0,0,8479983,8477949.0,Mario Ferraro hit Alex Tuch
30,hit,Brenden Dillon,William Carrier,[-98.  19.],1,14:45,SJS,VGK,VGK,54,SJS,28,0,0,8475455,8477478.0,Brenden Dillon hit William Carrier
31,hit,Ryan Reaves,Mario Ferraro,[-69. -40.],1,14:29,VGK,SJS,VGK,54,SJS,28,0,0,8471817,8479983.0,Ryan Reaves hit Mario Ferraro
33,hit,Ryan Reaves,Erik Karlsson,[-98.   2.],1,14:14,VGK,SJS,VGK,54,SJS,28,0,0,8471817,8474578.0,Ryan Reaves hit Erik Karlsson
34,hit,Ryan Reaves,Joe Thornton,[ 4. 40.],1,14:05,VGK,SJS,VGK,54,SJS,28,0,0,8471817,8466138.0,Ryan Reaves hit Joe Thornton
38,hit,Brayden McNabb,Evander Kane,[94. 27.],1,13:54,VGK,SJS,VGK,54,SJS,28,0,0,8475188,8475169.0,Brayden McNabb hit Evander Kane
41,hit,Antti Suomela,Jonathan Marchessault,[-94.  25.],1,13:32,SJS,VGK,VGK,54,SJS,28,0,0,8480965,8476539.0,Antti Suomela hit Jonathan Marchessault
42,hit,Nicolas Hague,Dylan Gambrell,[-53. -40.],1,13:17,VGK,SJS,VGK,54,SJS,28,0,0,8479980,8479580.0,Nicolas Hague hit Dylan Gambrell
43,hit,Barclay Goodrow,William Karlsson,[ 81. -38.],1,12:46,SJS,VGK,VGK,54,SJS,28,0,0,8476624,8476448.0,Barclay Goodrow hit William Karlsson
44,hit,Patrick Marleau,Max Pacioretty,[ 53. -40.],1,12:45,SJS,VGK,VGK,54,SJS,28,0,0,8466139,8474157.0,Patrick Marleau hit Max Pacioretty
55,hit,Ryan Reaves,Radim Simek,[-95.  23.],1,08:28,VGK,SJS,VGK,54,SJS,28,0,0,8471817,8480160.0,Ryan Reaves hit Radim Simek
60,hit,Patrick Marleau,Jon Merrill,[ -9. -39.],1,07:52,SJS,VGK,VGK,54,SJS,28,0,0,8466139,8475750.0,Patrick Marleau hit Jon Merrill
65,hit,Antti Suomela,Jon Merrill,[ 97. -15.],1,06:17,SJS,VGK,VGK,54,SJS,28,0,0,8480965,8475750.0,Antti Suomela hit Jon Merrill
72,hit,William Carrier,Evander Kane,[59. 40.],1,05:03,VGK,SJS,VGK,54,SJS,28,0,0,8477478,8475169.0,William Carrier hit Evander Kane
74,hit,Timo Meier,Jonathan Marchessault,[-10.  41.],1,04:11,SJS,VGK,VGK,54,SJS,28,0,0,8478414,8476539.0,Timo Meier hit Jonathan Marchessault
76,hit,Timo Meier,Cody Eakin,[-48.   0.],1,03:51,SJS,VGK,VGK,54,SJS,28,0,0,8478414,8475236.0,Timo Meier hit Cody Eakin
80,hit,Joe Thornton,William Karlsson,[87. 33.],1,03:09,SJS,VGK,VGK,54,SJS,28,0,0,8466138,8476448.0,Joe Thornton hit William Karlsson
84,hit,William Carrier,Barclay Goodrow,[ 31. -40.],1,01:40,VGK,SJS,VGK,54,SJS,28,0,0,8477478,8476624.0,William Carrier hit Barclay Goodrow
88,hit,Max Pacioretty,Joe Thornton,[97. 12.],1,00:42,VGK,SJS,VGK,54,SJS,28,0,0,8474157,8466138.0,Max Pacioretty hit Joe Thornton
89,hit,Max Pacioretty,Radim Simek,[ 5. 41.],1,00:32,VGK,SJS,VGK,54,SJS,28,0,0,8474157,8480160.0,Max Pacioretty hit Radim Simek
93,hit,Max Pacioretty,Dylan Gambrell,[19. 40.],2,18:39,VGK,SJS,VGK,54,SJS,28,0,0,8474157,8479580.0,Max Pacioretty hit Dylan Gambrell
98,hit,Ryan Reaves,Timo Meier,[-27. -41.],2,17:35,VGK,SJS,VGK,54,SJS,28,0,1,8471817,8478414.0,Ryan Reaves hit Timo Meier
100,hit,William Carrier,Tim Heed,[98. -5.],2,17:19,VGK,SJS,VGK,54,SJS,28,0,1,8477478,8475841.0,William Carrier hit Tim Heed
102,hit,Evander Kane,Shea Theodore,[  0. -40.],2,17:04,SJS,VGK,VGK,54,SJS,28,0,1,8475169,8477447.0,Evander Kane hit Shea Theodore
111,hit,Timo Meier,Shea Theodore,[-94.  -5.],2,15:14,SJS,VGK,VGK,54,SJS,28,0,1,8478414,8477447.0,Timo Meier hit Shea Theodore
113,hit,Logan Couture,Nicolas Hague,[-97.  12.],2,14:16,SJS,VGK,VGK,54,SJS,28,0,1,8474053,8479980.0,Logan Couture hit Nicolas Hague
117,hit,Brent Burns,William Karlsson,[64. 39.],2,13:42,SJS,VGK,VGK,54,SJS,28,0,1,8470613,8476448.0,Brent Burns hit William Karlsson
122,hit,Jonathan Marchessault,Melker Karlsson,[63. 40.],2,12:25,VGK,SJS,VGK,54,SJS,28,0,1,8476539,8477922.0,Jonathan Marchessault hit Melker Karlsson
124,hit,Joe Thornton,Mark Stone,[ 70. -41.],2,12:09,SJS,VGK,VGK,54,SJS,28,0,1,8466138,8475913.0,Joe Thornton hit Mark Stone
127,hit,Tomas Nosek,Marcus Sorensen,[ 54. -40.],2,11:51,VGK,SJS,VGK,54,SJS,28,0,1,8477931,8475834.0,Tomas Nosek hit Marcus Sorensen
128,hit,William Carrier,Joe Thornton,[ 89. -34.],2,11:46,VGK,SJS,VGK,54,SJS,28,0,1,8477478,8466138.0,William Carrier hit Joe Thornton
129,hit,Marcus Sorensen,Jon Merrill,[-97.  -2.],2,11:38,SJS,VGK,VGK,54,SJS,28,0,1,8475834,8475750.0,Marcus Sorensen hit Jon Merrill
130,hit,Ryan Reaves,Melker Karlsson,[-39. -37.],2,11:34,VGK,SJS,VGK,54,SJS,28,0,1,8471817,8477922.0,Ryan Reaves hit Melker Karlsson
131,hit,William Carrier,Radim Simek,[68. 41.],2,11:17,VGK,SJS,VGK,54,SJS,28,0,1,8477478,8480160.0,William Carrier hit Radim Simek
146,hit,Ryan Reaves,Marc-Edouard Vlasic,[-68. -40.],2,07:08,VGK,SJS,VGK,54,SJS,28,0,1,8471817,8471709.0,Ryan Reaves hit Marc-Edouard Vlasic
169,hit,Nicolas Hague,Timo Meier,[-31.  21.],2,01:58,VGK,SJS,VGK,54,SJS,28,0,1,8479980,8478414.0,Nicolas Hague hit Timo Meier
170,hit,Cody Eakin,Timo Meier,[ 43. -40.],2,01:43,VGK,SJS,VGK,54,SJS,28,0,1,8475236,8478414.0,Cody Eakin hit Timo Meier
171,hit,Brayden McNabb,Barclay Goodrow,[-28.  41.],2,01:40,VGK,SJS,VGK,54,SJS,28,0,1,8475188,8476624.0,Brayden McNabb hit Barclay Goodrow
172,hit,Melker Karlsson,Jonathan Marchessault,[99.  3.],2,01:28,SJS,VGK,VGK,54,SJS,28,0,1,8477922,8476539.0,Melker Karlsson hit Jonathan Marchessault
175,hit,Ryan Reaves,Brenden Dillon,[97.  0.],2,00:27,VGK,SJS,VGK,54,SJS,28,0,1,8471817,8475455.0,Ryan Reaves hit Brenden Dillon
176,hit,Logan Couture,Tomas Nosek,[55. 21.],2,00:24,SJS,VGK,VGK,54,SJS,28,0,1,8474053,8477931.0,Logan Couture hit Tomas Nosek
177,hit,Brayden McNabb,Kevin Labanc,[88. 33.],2,00:21,VGK,SJS,VGK,54,SJS,28,0,1,8475188,8478099.0,Brayden McNabb hit Kevin Labanc
181,hit,Mark Stone,Timo Meier,[-4. 39.],3,19:39,VGK,SJS,VGK,54,SJS,28,0,1,8475913,8478414.0,Mark Stone hit Timo Meier
185,hit,Evander Kane,Reilly Smith,[  9. -39.],3,18:51,SJS,VGK,VGK,54,SJS,28,0,1,8475169,8475191.0,Evander Kane hit Reilly Smith
187,hit,Max Pacioretty,Dylan Gambrell,[-53. -40.],3,18:23,VGK,SJS,VGK,54,SJS,28,0,1,8474157,8479580.0,Max Pacioretty hit Dylan Gambrell
195,hit,Brent Burns,Tomas Nosek,[-86.  35.],3,17:21,SJS,VGK,VGK,54,SJS,28,0,1,8470613,8477931.0,Brent Burns hit Tomas Nosek
