,event,hitter,hittee,coords,period,period_time_remaining,hitter_team,hittee_team,home_team,home_team_id,away_team,away_team_id,home_goals,away_goals,hitter_id,hittee_id,game_id,winning_team,date,description
144,hit,Scott Mayfield,John Tavares,[ 68. -31.],2,09:38,NYI,TOR,NYI,2,TOR,10,2,1,8476429,8475166.0,2019020282,,2019-11-14,Scott Mayfield hit John Tavares
154,hit,Michael Dal Colle,Cody Ceci,[-96. -21.],2,07:30,NYI,TOR,NYI,2,TOR,10,2,2,8477936,8476879.0,2019020282,,2019-11-14,Michael Dal Colle hit Cody Ceci
155,hit,Derick Brassard,Morgan Rielly,[-96.   9.],2,07:26,NYI,TOR,NYI,2,TOR,10,2,2,8473544,8476853.0,2019020282,,2019-11-14,Derick Brassard hit Morgan Rielly
156,hit,Leo Komarov,Morgan Rielly,[56. 39.],2,07:23,NYI,TOR,NYI,2,TOR,10,2,2,8473463,8476853.0,2019020282,,2019-11-14,Leo Komarov hit Morgan Rielly
163,hit,Adam Pelech,William Nylander,[85. 10.],2,06:21,NYI,TOR,NYI,2,TOR,10,2,2,8476917,8477939.0,2019020282,,2019-11-14,Adam Pelech hit William Nylander
165,hit,Kasperi Kapanen,Scott Mayfield,[ 95. -24.],2,05:41,TOR,NYI,NYI,2,TOR,10,2,2,8477953,8476429.0,2019020282,,2019-11-14,Kasperi Kapanen hit Scott Mayfield
170,hit,Frederik Gauthier,Anders Lee,[-96.   1.],2,04:52,TOR,NYI,NYI,2,TOR,10,2,2,8477512,8475314.0,2019020282,,2019-11-14,Frederik Gauthier hit Anders Lee
176,hit,Jake Muzzin,Brock Nelson,[-74. -34.],2,03:40,TOR,NYI,NYI,2,TOR,10,2,2,8474162,8475754.0,2019020282,,2019-11-14,Jake Muzzin hit Brock Nelson
196,hit,Zach Hyman,Scott Mayfield,[-93. -22.],3,19:40,TOR,NYI,NYI,2,TOR,10,3,2,8475786,8476429.0,2019020282,,2019-11-14,Zach Hyman hit Scott Mayfield
208,hit,Johnny Boychuk,Alexander Kerfoot,[-95. -19.],3,17:49,NYI,TOR,NYI,2,TOR,10,3,2,8470187,8477021.0,2019020282,,2019-11-14,Johnny Boychuk hit Alexander Kerfoot
212,hit,Frederik Gauthier,Ryan Pulock,[-84. -35.],3,16:59,TOR,NYI,NYI,2,TOR,10,3,2,8477512,8477506.0,2019020282,,2019-11-14,Frederik Gauthier hit Ryan Pulock
217,hit,Scott Mayfield,Andreas Johnsson,[-97. -15.],3,15:40,NYI,TOR,NYI,2,TOR,10,3,2,8476429,8477341.0,2019020282,,2019-11-14,Scott Mayfield hit Andreas Johnsson
218,hit,Derick Brassard,Morgan Rielly,[-87. -34.],3,15:21,NYI,TOR,NYI,2,TOR,10,3,2,8473544,8476853.0,2019020282,,2019-11-14,Derick Brassard hit Morgan Rielly
228,hit,Johnny Boychuk,William Nylander,[-88. -33.],3,14:25,NYI,TOR,NYI,2,TOR,10,3,2,8470187,8477939.0,2019020282,,2019-11-14,Johnny Boychuk hit William Nylander
246,hit,Johnny Boychuk,Alexander Kerfoot,[-89. -29.],3,09:55,NYI,TOR,NYI,2,TOR,10,4,2,8470187,8477021.0,2019020282,,2019-11-14,Johnny Boychuk hit Alexander Kerfoot
248,hit,Trevor Moore,Josh Bailey,[-94.  22.],3,09:47,TOR,NYI,NYI,2,TOR,10,4,2,8479675,8474573.0,2019020282,,2019-11-14,Trevor Moore hit Josh Bailey
265,hit,Morgan Rielly,Michael Dal Colle,[ 98. -18.],3,05:22,TOR,NYI,NYI,2,TOR,10,4,2,8476853,8477936.0,2019020282,,2019-11-14,Morgan Rielly hit Michael Dal Colle
267,hit,Andreas Johnsson,Ryan Pulock,[-69. -39.],3,05:14,TOR,NYI,NYI,2,TOR,10,4,2,8477341,8477506.0,2019020282,,2019-11-14,Andreas Johnsson hit Ryan Pulock
273,hit,Nick Leddy,Alexander Kerfoot,[-82.  37.],3,03:52,NYI,TOR,NYI,2,TOR,10,4,2,8475181,8477021.0,2019020282,,2019-11-14,Nick Leddy hit Alexander Kerfoot
278,hit,Mathew Barzal,Alexander Kerfoot,[92. 25.],3,03:10,NYI,TOR,NYI,2,TOR,10,4,2,8478445,8477021.0,2019020282,,2019-11-14,Mathew Barzal hit Alexander Kerfoot
289,hit,Cal Clutterbuck,Morgan Rielly,[-35. -40.],3,00:23,NYI,TOR,NYI,2,TOR,10,5,4,8473504,8476853.0,2019020282,,2019-11-14,Cal Clutterbuck hit Morgan Rielly
4,hit,Robert Hagg,Derick Brassard,[-11. -35.],1,19:03,PHI,NYI,PHI,4,NYI,2,0,0,8477462,8473544.0,2019020307,NYI,2019-11-17,Robert Hagg hit Derick Brassard
5,hit,Anthony Beauvillier,Travis Sanheim,[ 22. -38.],1,19:01,NYI,PHI,PHI,4,NYI,2,0,0,8478463,8477948.0,2019020307,NYI,2019-11-17,Anthony Beauvillier hit Travis Sanheim
8,hit,Sean Couturier,Anthony Beauvillier,[ 49. -37.],1,18:31,PHI,NYI,PHI,4,NYI,2,0,0,8476461,8478463.0,2019020307,NYI,2019-11-17,Sean Couturier hit Anthony Beauvillier
12,hit,Michael Dal Colle,Chris Stewart,[-13. -37.],1,17:37,NYI,PHI,PHI,4,NYI,2,1,0,8477936,8473485.0,2019020307,NYI,2019-11-17,Michael Dal Colle hit Chris Stewart
13,hit,Andy Andreoff,Scott Mayfield,[-97. -12.],1,17:32,PHI,NYI,PHI,4,NYI,2,1,0,8476404,8476429.0,2019020307,NYI,2019-11-17,Andy Andreoff hit Scott Mayfield
14,hit,Tyler Pitlick,Michael Dal Colle,[-6. 40.],1,17:28,PHI,NYI,PHI,4,NYI,2,1,0,8475752,8477936.0,2019020307,NYI,2019-11-17,Tyler Pitlick hit Michael Dal Colle
15,hit,Chris Stewart,Otto Koivula,[-14.  40.],1,17:26,PHI,NYI,PHI,4,NYI,2,1,0,8473485,8479526.0,2019020307,NYI,2019-11-17,Chris Stewart hit Otto Koivula
23,hit,Nick Leddy,Oskar Lindblom,[-97. -10.],1,16:01,NYI,PHI,PHI,4,NYI,2,1,0,8475181,8478067.0,2019020307,NYI,2019-11-17,Nick Leddy hit Oskar Lindblom
26,hit,Joel Farabee,Mathew Barzal,[52. 38.],1,15:37,PHI,NYI,PHI,4,NYI,2,1,0,8480797,8478445.0,2019020307,NYI,2019-11-17,Joel Farabee hit Mathew Barzal
31,hit,Casey Cizikas,Justin Braun,[97. -5.],1,13:47,NYI,PHI,PHI,4,NYI,2,1,0,8475231,8474027.0,2019020307,NYI,2019-11-17,Casey Cizikas hit Justin Braun
40,hit,Robert Hagg,Jordan Eberle,[ 92. -25.],1,11:24,PHI,NYI,PHI,4,NYI,2,1,0,8477462,8474586.0,2019020307,NYI,2019-11-17,Robert Hagg hit Jordan Eberle
45,hit,Robert Hagg,Anthony Beauvillier,[83. 33.],1,10:37,PHI,NYI,PHI,4,NYI,2,1,0,8477462,8478463.0,2019020307,NYI,2019-11-17,Robert Hagg hit Anthony Beauvillier
56,hit,Michael Raffl,Ryan Pulock,[-97.  -9.],1,09:03,PHI,NYI,PHI,4,NYI,2,1,0,8477290,8477506.0,2019020307,NYI,2019-11-17,Michael Raffl hit Ryan Pulock
72,hit,Jakub Voracek,Adam Pelech,[-96.  11.],1,05:24,PHI,NYI,PHI,4,NYI,2,1,0,8474161,8476917.0,2019020307,NYI,2019-11-17,Jakub Voracek hit Adam Pelech
75,hit,Johnny Boychuk,Tyler Pitlick,[-96. -18.],1,04:34,NYI,PHI,PHI,4,NYI,2,1,0,8470187,8475752.0,2019020307,NYI,2019-11-17,Johnny Boychuk hit Tyler Pitlick
76,hit,Johnny Boychuk,Tyler Pitlick,[-98. -13.],1,04:16,NYI,PHI,PHI,4,NYI,2,1,0,8470187,8475752.0,2019020307,NYI,2019-11-17,Johnny Boychuk hit Tyler Pitlick
94,hit,Adam Pelech,Joel Farabee,[-76.  39.],1,00:39,NYI,PHI,PHI,4,NYI,2,1,0,8476917,8480797.0,2019020307,NYI,2019-11-17,Adam Pelech hit Joel Farabee
100,hit,Matt Niskanen,Adam Pelech,[-52. -38.],2,18:16,PHI,NYI,PHI,4,NYI,2,2,0,8471702,8476917.0,2019020307,NYI,2019-11-17,Matt Niskanen hit Adam Pelech
102,hit,Michael Raffl,Nick Leddy,[ 58. -39.],2,18:01,PHI,NYI,PHI,4,NYI,2,2,0,8477290,8475181.0,2019020307,NYI,2019-11-17,Michael Raffl hit Nick Leddy
104,hit,Johnny Boychuk,Oskar Lindblom,[ 96. -21.],2,17:37,NYI,PHI,PHI,4,NYI,2,2,0,8470187,8478067.0,2019020307,NYI,2019-11-17,Johnny Boychuk hit Oskar Lindblom
107,hit,Otto Koivula,Justin Braun,[-98.   5.],2,16:34,NYI,PHI,PHI,4,NYI,2,2,0,8479526,8474027.0,2019020307,NYI,2019-11-17,Otto Koivula hit Justin Braun
109,hit,Adam Pelech,Kevin Hayes,[93. 26.],2,15:43,NYI,PHI,PHI,4,NYI,2,2,0,8476917,8475763.0,2019020307,NYI,2019-11-17,Adam Pelech hit Kevin Hayes
110,hit,Kevin Hayes,Nick Leddy,[ 83. -36.],2,15:16,PHI,NYI,PHI,4,NYI,2,2,0,8475763,8475181.0,2019020307,NYI,2019-11-17,Kevin Hayes hit Nick Leddy
114,hit,Ivan Provorov,Devon Toews,[-96. -15.],2,14:17,PHI,NYI,PHI,4,NYI,2,2,0,8478500,8478038.0,2019020307,NYI,2019-11-17,Ivan Provorov hit Devon Toews
122,hit,Kevin Hayes,Anthony Beauvillier,[-70. -40.],2,12:48,PHI,NYI,PHI,4,NYI,2,2,0,8475763,8478463.0,2019020307,NYI,2019-11-17,Kevin Hayes hit Anthony Beauvillier
124,hit,Michael Dal Colle,Justin Braun,[-98. -15.],2,12:14,NYI,PHI,PHI,4,NYI,2,2,0,8477936,8474027.0,2019020307,NYI,2019-11-17,Michael Dal Colle hit Justin Braun
126,hit,Jakub Voracek,Cal Clutterbuck,[-93.  28.],2,11:56,PHI,NYI,PHI,4,NYI,2,2,0,8474161,8473504.0,2019020307,NYI,2019-11-17,Jakub Voracek hit Cal Clutterbuck
129,hit,Kevin Hayes,Adam Pelech,[-87. -11.],2,11:31,PHI,NYI,PHI,4,NYI,2,2,0,8475763,8476917.0,2019020307,NYI,2019-11-17,Kevin Hayes hit Adam Pelech
130,hit,James van Riemsdyk,Ryan Pulock,[95. -6.],2,11:12,PHI,NYI,PHI,4,NYI,2,2,0,8474037,8477506.0,2019020307,NYI,2019-11-17,James van Riemsdyk hit Ryan Pulock
149,hit,Sean Couturier,Cal Clutterbuck,[74. 40.],2,03:44,PHI,NYI,PHI,4,NYI,2,3,0,8476461,8473504.0,2019020307,NYI,2019-11-17,Sean Couturier hit Cal Clutterbuck
156,hit,Devon Toews,Travis Konecny,[90. 28.],2,03:10,NYI,PHI,PHI,4,NYI,2,3,0,8478038,8478439.0,2019020307,NYI,2019-11-17,Devon Toews hit Travis Konecny
157,hit,Cal Clutterbuck,Shayne Gostisbehere,[58. 41.],2,03:04,NYI,PHI,PHI,4,NYI,2,3,0,8473504,8476906.0,2019020307,NYI,2019-11-17,Cal Clutterbuck hit Shayne Gostisbehere
158,hit,Claude Giroux,Casey Cizikas,[-10. -36.],2,02:58,PHI,NYI,PHI,4,NYI,2,3,0,8473512,8475231.0,2019020307,NYI,2019-11-17,Claude Giroux hit Casey Cizikas
159,hit,Ross Johnston,Travis Konecny,[-48. -40.],2,02:47,NYI,PHI,PHI,4,NYI,2,3,0,8477527,8478439.0,2019020307,NYI,2019-11-17,Ross Johnston hit Travis Konecny
160,hit,Kevin Hayes,Nick Leddy,[ 97. -13.],2,02:28,PHI,NYI,PHI,4,NYI,2,3,0,8475763,8475181.0,2019020307,NYI,2019-11-17,Kevin Hayes hit Nick Leddy
176,hit,Matt Niskanen,Anders Lee,[92. 31.],3,18:16,PHI,NYI,PHI,4,NYI,2,3,0,8471702,8475314.0,2019020307,NYI,2019-11-17,Matt Niskanen hit Anders Lee
179,hit,Otto Koivula,Justin Braun,[94. 30.],3,17:44,NYI,PHI,PHI,4,NYI,2,3,0,8479526,8474027.0,2019020307,NYI,2019-11-17,Otto Koivula hit Justin Braun
194,hit,Justin Braun,Otto Koivula,[97. -1.],3,14:05,PHI,NYI,PHI,4,NYI,2,3,0,8474027,8479526.0,2019020307,NYI,2019-11-17,Justin Braun hit Otto Koivula
195,hit,Ross Johnston,Andy Andreoff,[92. 25.],3,14:02,NYI,PHI,PHI,4,NYI,2,3,0,8477527,8476404.0,2019020307,NYI,2019-11-17,Ross Johnston hit Andy Andreoff
197,hit,Robert Hagg,Ross Johnston,[86. 34.],3,13:45,PHI,NYI,PHI,4,NYI,2,3,0,8477462,8477527.0,2019020307,NYI,2019-11-17,Robert Hagg hit Ross Johnston
200,hit,Robert Hagg,Derick Brassard,[-97.  -8.],3,12:41,PHI,NYI,PHI,4,NYI,2,3,0,8477462,8473544.0,2019020307,NYI,2019-11-17,Robert Hagg hit Derick Brassard
207,hit,Ryan Pulock,Tyler Pitlick,[-93. -26.],3,10:49,NYI,PHI,PHI,4,NYI,2,3,1,8477506,8475752.0,2019020307,NYI,2019-11-17,Ryan Pulock hit Tyler Pitlick
208,hit,Cal Clutterbuck,Travis Sanheim,[-83.  39.],3,10:41,NYI,PHI,PHI,4,NYI,2,3,1,8473504,8477948.0,2019020307,NYI,2019-11-17,Cal Clutterbuck hit Travis Sanheim
210,hit,Tyler Pitlick,Ross Johnston,[79. 39.],3,10:22,PHI,NYI,PHI,4,NYI,2,3,1,8475752,8477527.0,2019020307,NYI,2019-11-17,Tyler Pitlick hit Ross Johnston
212,hit,Robert Hagg,Cal Clutterbuck,[ 96. -10.],3,10:06,PHI,NYI,PHI,4,NYI,2,3,1,8477462,8473504.0,2019020307,NYI,2019-11-17,Robert Hagg hit Cal Clutterbuck
213,hit,Travis Sanheim,Cal Clutterbuck,[ 90. -29.],3,09:57,PHI,NYI,PHI,4,NYI,2,3,1,8477948,8473504.0,2019020307,NYI,2019-11-17,Travis Sanheim hit Cal Clutterbuck
222,hit,James van Riemsdyk,Anthony Beauvillier,[72. 40.],3,08:32,PHI,NYI,PHI,4,NYI,2,3,1,8474037,8478463.0,2019020307,NYI,2019-11-17,James van Riemsdyk hit Anthony Beauvillier
232,hit,Matt Niskanen,Brock Nelson,[82. -5.],3,06:53,PHI,NYI,PHI,4,NYI,2,3,1,8471702,8475754.0,2019020307,NYI,2019-11-17,Matt Niskanen hit Brock Nelson
235,hit,Michael Dal Colle,Justin Braun,[44. 38.],3,06:18,NYI,PHI,PHI,4,NYI,2,3,2,8477936,8474027.0,2019020307,NYI,2019-11-17,Michael Dal Colle hit Justin Braun
237,hit,Casey Cizikas,Jakub Voracek,[82. 37.],3,05:57,NYI,PHI,PHI,4,NYI,2,3,2,8475231,8474161.0,2019020307,NYI,2019-11-17,Casey Cizikas hit Jakub Voracek
243,hit,Michael Dal Colle,Matt Niskanen,[-5. 39.],3,03:46,NYI,PHI,PHI,4,NYI,2,3,2,8477936,8471702.0,2019020307,NYI,2019-11-17,Michael Dal Colle hit Matt Niskanen
249,hit,Michael Raffl,Johnny Boychuk,[ 60. -39.],3,02:45,PHI,NYI,PHI,4,NYI,2,3,2,8477290,8470187.0,2019020307,NYI,2019-11-17,Michael Raffl hit Johnny Boychuk
255,hit,Matt Niskanen,Cal Clutterbuck,[80. 36.],3,01:40,PHI,NYI,PHI,4,NYI,2,3,3,8471702,8473504.0,2019020307,NYI,2019-11-17,Matt Niskanen hit Cal Clutterbuck
256,hit,Matt Niskanen,Brock Nelson,[ 98. -10.],3,01:24,PHI,NYI,PHI,4,NYI,2,3,3,8471702,8475754.0,2019020307,NYI,2019-11-17,Matt Niskanen hit Brock Nelson
258,hit,Justin Braun,Michael Dal Colle,[ 42. -35.],3,01:02,PHI,NYI,PHI,4,NYI,2,3,3,8474027,8477936.0,2019020307,NYI,2019-11-17,Justin Braun hit Michael Dal Colle
260,hit,Michael Raffl,Anders Lee,[-64.  40.],3,00:03,PHI,NYI,PHI,4,NYI,2,3,3,8477290,8475314.0,2019020307,NYI,2019-11-17,Michael Raffl hit Anders Lee
270,hit,Devon Toews,Sean Couturier,[ 97. -12.],4,00:37,NYI,PHI,PHI,4,NYI,2,3,3,8478038,8476461.0,2019020307,NYI,2019-11-17,Devon Toews hit Sean Couturier
2,hit,Casey Cizikas,Brian Dumoulin,[36. 38.],1,19:34,NYI,PIT,PIT,5,NYI,2,0,0,8475231,8475208.0,2019020321,NYI,2019-11-20,Casey Cizikas hit Brian Dumoulin
3,hit,Zach Aston-Reese,Scott Mayfield,[99.  5.],1,19:27,PIT,NYI,PIT,5,NYI,2,0,0,8479944,8476429.0,2019020321,NYI,2019-11-20,Zach Aston-Reese hit Scott Mayfield
4,hit,Derick Brassard,Marcus Pettersson,[-77. -40.],1,18:52,NYI,PIT,PIT,5,NYI,2,0,0,8473544,8477969.0,2019020321,NYI,2019-11-20,Derick Brassard hit Marcus Pettersson
5,hit,Jared McCann,Adam Pelech,[ 11. -41.],1,18:38,PIT,NYI,PIT,5,NYI,2,0,0,8477955,8476917.0,2019020321,NYI,2019-11-20,Jared McCann hit Adam Pelech
13,hit,Cal Clutterbuck,Alex Galchenyuk,[ 60. -40.],1,17:51,NYI,PIT,PIT,5,NYI,2,0,0,8473504,8476851.0,2019020321,NYI,2019-11-20,Cal Clutterbuck hit Alex Galchenyuk
16,hit,Scott Mayfield,Evgeni Malkin,[ 96. -27.],1,17:17,NYI,PIT,PIT,5,NYI,2,0,0,8476429,8471215.0,2019020321,NYI,2019-11-20,Scott Mayfield hit Evgeni Malkin
19,hit,Scott Mayfield,Jake Guentzel,[99. -7.],1,16:46,NYI,PIT,PIT,5,NYI,2,0,0,8476429,8477404.0,2019020321,NYI,2019-11-20,Scott Mayfield hit Jake Guentzel
20,hit,Nick Leddy,Dominik Kahun,[99.  9.],1,16:25,NYI,PIT,PIT,5,NYI,2,0,0,8475181,8480946.0,2019020321,NYI,2019-11-20,Nick Leddy hit Dominik Kahun
22,hit,Adam Pelech,Zach Aston-Reese,[97. 16.],1,15:54,NYI,PIT,PIT,5,NYI,2,0,0,8476917,8479944.0,2019020321,NYI,2019-11-20,Adam Pelech hit Zach Aston-Reese
25,hit,Derick Brassard,Justin Schultz,[-80. -38.],1,15:10,NYI,PIT,PIT,5,NYI,2,0,0,8473544,8474602.0,2019020321,NYI,2019-11-20,Derick Brassard hit Justin Schultz
29,hit,Brock Nelson,Evgeni Malkin,[ 92. -32.],1,14:35,NYI,PIT,PIT,5,NYI,2,0,0,8475754,8471215.0,2019020321,NYI,2019-11-20,Brock Nelson hit Evgeni Malkin
30,hit,Casey Cizikas,Juuso Riikola,[-83. -38.],1,14:13,NYI,PIT,PIT,5,NYI,2,0,0,8475231,8480945.0,2019020321,NYI,2019-11-20,Casey Cizikas hit Juuso Riikola
32,hit,Jared McCann,Josh Bailey,[-98.  -5.],1,13:59,PIT,NYI,PIT,5,NYI,2,0,0,8477955,8474573.0,2019020321,NYI,2019-11-20,Jared McCann hit Josh Bailey
41,hit,Brandon Tanev,Josh Bailey,[-67.  38.],1,12:37,PIT,NYI,PIT,5,NYI,2,0,0,8479293,8474573.0,2019020321,NYI,2019-11-20,Brandon Tanev hit Josh Bailey
43,hit,Sam Lafferty,Adam Pelech,[  0. -40.],1,11:41,PIT,NYI,PIT,5,NYI,2,0,0,8478043,8476917.0,2019020321,NYI,2019-11-20,Sam Lafferty hit Adam Pelech
63,hit,Zach Aston-Reese,Jordan Eberle,[87. 36.],1,07:49,PIT,NYI,PIT,5,NYI,2,1,0,8479944,8474586.0,2019020321,NYI,2019-11-20,Zach Aston-Reese hit Jordan Eberle
64,hit,Sam Lafferty,Scott Mayfield,[93. 31.],1,07:44,PIT,NYI,PIT,5,NYI,2,1,0,8478043,8476429.0,2019020321,NYI,2019-11-20,Sam Lafferty hit Scott Mayfield
72,hit,Juuso Riikola,Josh Bailey,[ 59. -42.],1,07:13,PIT,NYI,PIT,5,NYI,2,1,0,8480945,8474573.0,2019020321,NYI,2019-11-20,Juuso Riikola hit Josh Bailey
74,hit,Brandon Tanev,Ryan Pulock,[ 97. -12.],1,06:59,PIT,NYI,PIT,5,NYI,2,1,0,8479293,8477506.0,2019020321,NYI,2019-11-20,Brandon Tanev hit Ryan Pulock
75,hit,Adam Pelech,Jared McCann,[20.  0.],1,06:52,NYI,PIT,PIT,5,NYI,2,1,0,8476917,8477955.0,2019020321,NYI,2019-11-20,Adam Pelech hit Jared McCann
77,hit,John Marino,Anders Lee,[-14. -19.],1,06:21,PIT,NYI,PIT,5,NYI,2,1,0,8478507,8475314.0,2019020321,NYI,2019-11-20,John Marino hit Anders Lee
81,hit,Jack Johnson,Nick Leddy,[-98.  14.],1,05:31,PIT,NYI,PIT,5,NYI,2,1,0,8471677,8475181.0,2019020321,NYI,2019-11-20,Jack Johnson hit Nick Leddy
82,hit,Michael Dal Colle,Juuso Riikola,[-98.  -3.],1,05:26,NYI,PIT,PIT,5,NYI,2,1,0,8477936,8480945.0,2019020321,NYI,2019-11-20,Michael Dal Colle hit Juuso Riikola
83,hit,Anthony Beauvillier,Marcus Pettersson,[-95.  19.],1,04:31,NYI,PIT,PIT,5,NYI,2,1,0,8478463,8477969.0,2019020321,NYI,2019-11-20,Anthony Beauvillier hit Marcus Pettersson
84,hit,Adam Pelech,Brandon Tanev,[98.  1.],1,03:46,NYI,PIT,PIT,5,NYI,2,1,0,8476917,8479293.0,2019020321,NYI,2019-11-20,Adam Pelech hit Brandon Tanev
89,hit,Michael Dal Colle,Brian Dumoulin,[-98.  14.],1,01:59,NYI,PIT,PIT,5,NYI,2,2,0,8477936,8475208.0,2019020321,NYI,2019-11-20,Michael Dal Colle hit Brian Dumoulin
92,hit,Justin Schultz,Leo Komarov,[ 0. 42.],1,01:40,PIT,NYI,PIT,5,NYI,2,2,0,8474602,8473463.0,2019020321,NYI,2019-11-20,Justin Schultz hit Leo Komarov
93,hit,Marcus Pettersson,Michael Dal Colle,[-48. -40.],1,01:30,PIT,NYI,PIT,5,NYI,2,2,0,8477969,8477936.0,2019020321,NYI,2019-11-20,Marcus Pettersson hit Michael Dal Colle
94,hit,Otto Koivula,Marcus Pettersson,[-98. -16.],1,01:16,NYI,PIT,PIT,5,NYI,2,2,0,8479526,8477969.0,2019020321,NYI,2019-11-20,Otto Koivula hit Marcus Pettersson
95,hit,Michael Dal Colle,Alex Galchenyuk,[-98.  18.],1,01:11,NYI,PIT,PIT,5,NYI,2,2,0,8477936,8476851.0,2019020321,NYI,2019-11-20,Michael Dal Colle hit Alex Galchenyuk
97,hit,Derick Brassard,Dominik Simon,[-74.  40.],1,00:59,NYI,PIT,PIT,5,NYI,2,2,0,8473544,8478866.0,2019020321,NYI,2019-11-20,Derick Brassard hit Dominik Simon
98,hit,Nick Leddy,Teddy Blueger,[ 99. -12.],1,00:09,NYI,PIT,PIT,5,NYI,2,2,0,8475181,8476927.0,2019020321,NYI,2019-11-20,Nick Leddy hit Teddy Blueger
99,hit,Anders Lee,John Marino,[87. 35.],1,00:02,NYI,PIT,PIT,5,NYI,2,2,0,8475314,8478507.0,2019020321,NYI,2019-11-20,Anders Lee hit John Marino
101,hit,Casey Cizikas,Teddy Blueger,[99. 11.],2,19:50,NYI,PIT,PIT,5,NYI,2,2,0,8475231,8476927.0,2019020321,NYI,2019-11-20,Casey Cizikas hit Teddy Blueger
106,hit,Casey Cizikas,Justin Schultz,[ 7. 39.],2,18:59,NYI,PIT,PIT,5,NYI,2,2,0,8475231,8474602.0,2019020321,NYI,2019-11-20,Casey Cizikas hit Justin Schultz
108,hit,Bryan Rust,Adam Pelech,[ 63. -41.],2,18:35,PIT,NYI,PIT,5,NYI,2,2,0,8475810,8476917.0,2019020321,NYI,2019-11-20,Bryan Rust hit Adam Pelech
116,hit,Leo Komarov,Marcus Pettersson,[99. -1.],2,16:56,NYI,PIT,PIT,5,NYI,2,2,1,8473463,8477969.0,2019020321,NYI,2019-11-20,Leo Komarov hit Marcus Pettersson
117,hit,Leo Komarov,Marcus Pettersson,[ 90. -33.],2,16:52,NYI,PIT,PIT,5,NYI,2,2,1,8473463,8477969.0,2019020321,NYI,2019-11-20,Leo Komarov hit Marcus Pettersson
118,hit,Otto Koivula,Joseph Blandisi,[-32.  39.],2,16:29,NYI,PIT,PIT,5,NYI,2,2,1,8479526,8477010.0,2019020321,NYI,2019-11-20,Otto Koivula hit Joseph Blandisi
120,hit,Casey Cizikas,Evgeni Malkin,[70. 41.],2,15:33,NYI,PIT,PIT,5,NYI,2,2,1,8475231,8471215.0,2019020321,NYI,2019-11-20,Casey Cizikas hit Evgeni Malkin
121,hit,Jake Guentzel,Casey Cizikas,[  4. -39.],2,15:22,PIT,NYI,PIT,5,NYI,2,2,1,8477404,8475231.0,2019020321,NYI,2019-11-20,Jake Guentzel hit Casey Cizikas
131,hit,Casey Cizikas,Juuso Riikola,[98. 19.],2,14:21,NYI,PIT,PIT,5,NYI,2,2,2,8475231,8480945.0,2019020321,NYI,2019-11-20,Casey Cizikas hit Juuso Riikola
138,hit,Zach Aston-Reese,Brock Nelson,[ 39. -41.],2,12:32,PIT,NYI,PIT,5,NYI,2,2,2,8479944,8475754.0,2019020321,NYI,2019-11-20,Zach Aston-Reese hit Brock Nelson
139,hit,Scott Mayfield,Teddy Blueger,[-99.  -8.],2,12:19,NYI,PIT,PIT,5,NYI,2,2,2,8476429,8476927.0,2019020321,NYI,2019-11-20,Scott Mayfield hit Teddy Blueger
146,hit,Anders Lee,John Marino,[93. -2.],2,11:22,NYI,PIT,PIT,5,NYI,2,2,2,8475314,8478507.0,2019020321,NYI,2019-11-20,Anders Lee hit John Marino
147,hit,Anders Lee,John Marino,[ 81. -27.],2,11:14,NYI,PIT,PIT,5,NYI,2,2,2,8475314,8478507.0,2019020321,NYI,2019-11-20,Anders Lee hit John Marino
149,hit,Jack Johnson,Anthony Beauvillier,[62. -1.],2,10:44,PIT,NYI,PIT,5,NYI,2,2,2,8471677,8478463.0,2019020321,NYI,2019-11-20,Jack Johnson hit Anthony Beauvillier
150,hit,Derick Brassard,Alex Galchenyuk,[ 41. -39.],2,10:24,NYI,PIT,PIT,5,NYI,2,2,2,8473544,8476851.0,2019020321,NYI,2019-11-20,Derick Brassard hit Alex Galchenyuk
151,hit,Alex Galchenyuk,Anthony Beauvillier,[69.  5.],2,10:09,PIT,NYI,PIT,5,NYI,2,2,2,8476851,8478463.0,2019020321,NYI,2019-11-20,Alex Galchenyuk hit Anthony Beauvillier
155,hit,Leo Komarov,Juuso Riikola,[98. 17.],2,09:41,NYI,PIT,PIT,5,NYI,2,2,2,8473463,8480945.0,2019020321,NYI,2019-11-20,Leo Komarov hit Juuso Riikola
157,hit,Marcus Pettersson,Ryan Pulock,[99. -4.],2,09:32,PIT,NYI,PIT,5,NYI,2,2,2,8477969,8477506.0,2019020321,NYI,2019-11-20,Marcus Pettersson hit Ryan Pulock
158,hit,Leo Komarov,Juuso Riikola,[ 50. -41.],2,09:23,NYI,PIT,PIT,5,NYI,2,2,2,8473463,8480945.0,2019020321,NYI,2019-11-20,Leo Komarov hit Juuso Riikola
163,hit,Adam Pelech,Bryan Rust,[48. 40.],2,08:43,NYI,PIT,PIT,5,NYI,2,2,2,8476917,8475810.0,2019020321,NYI,2019-11-20,Adam Pelech hit Bryan Rust
172,hit,Brock Nelson,Sam Lafferty,[-73.  34.],2,07:20,NYI,PIT,PIT,5,NYI,2,2,2,8475754,8478043.0,2019020321,NYI,2019-11-20,Brock Nelson hit Sam Lafferty
176,hit,Otto Koivula,Juuso Riikola,[ 68. -41.],2,06:24,NYI,PIT,PIT,5,NYI,2,2,2,8479526,8480945.0,2019020321,NYI,2019-11-20,Otto Koivula hit Juuso Riikola
179,hit,Michael Dal Colle,Justin Schultz,[ 97. -25.],2,05:51,NYI,PIT,PIT,5,NYI,2,2,2,8477936,8474602.0,2019020321,NYI,2019-11-20,Michael Dal Colle hit Justin Schultz
180,hit,Brandon Tanev,Adam Pelech,[-99.  10.],2,05:36,PIT,NYI,PIT,5,NYI,2,2,2,8479293,8476917.0,2019020321,NYI,2019-11-20,Brandon Tanev hit Adam Pelech
183,hit,Anders Lee,John Marino,[19. 40.],2,05:23,NYI,PIT,PIT,5,NYI,2,3,2,8475314,8478507.0,2019020321,NYI,2019-11-20,Anders Lee hit John Marino
184,hit,Jake Guentzel,Scott Mayfield,[-73. -40.],2,05:18,PIT,NYI,PIT,5,NYI,2,3,2,8477404,8476429.0,2019020321,NYI,2019-11-20,Jake Guentzel hit Scott Mayfield
191,hit,Zach Aston-Reese,Derick Brassard,[ 34. -41.],2,04:20,PIT,NYI,PIT,5,NYI,2,3,2,8479944,8473544.0,2019020321,NYI,2019-11-20,Zach Aston-Reese hit Derick Brassard
192,hit,Anthony Beauvillier,Justin Schultz,[ 43. -41.],2,04:04,NYI,PIT,PIT,5,NYI,2,3,2,8478463,8474602.0,2019020321,NYI,2019-11-20,Anthony Beauvillier hit Justin Schultz
193,hit,Johnny Boychuk,Dominik Simon,[-97.  23.],2,03:58,NYI,PIT,PIT,5,NYI,2,3,2,8470187,8478866.0,2019020321,NYI,2019-11-20,Johnny Boychuk hit Dominik Simon
201,hit,Cal Clutterbuck,Justin Schultz,[28. 32.],2,01:55,NYI,PIT,PIT,5,NYI,2,3,2,8473504,8474602.0,2019020321,NYI,2019-11-20,Cal Clutterbuck hit Justin Schultz
202,hit,Ryan Pulock,Jake Guentzel,[-96. -16.],2,01:48,NYI,PIT,PIT,5,NYI,2,3,2,8477506,8477404.0,2019020321,NYI,2019-11-20,Ryan Pulock hit Jake Guentzel
209,hit,Leo Komarov,Justin Schultz,[-3. 40.],2,00:15,NYI,PIT,PIT,5,NYI,2,3,2,8473463,8474602.0,2019020321,NYI,2019-11-20,Leo Komarov hit Justin Schultz
212,hit,Justin Schultz,Devon Toews,[-60.  10.],3,19:29,PIT,NYI,PIT,5,NYI,2,3,2,8474602,8478038.0,2019020321,NYI,2019-11-20,Justin Schultz hit Devon Toews
213,hit,Devon Toews,Sam Lafferty,[-65. -39.],3,19:21,NYI,PIT,PIT,5,NYI,2,3,2,8478038,8478043.0,2019020321,NYI,2019-11-20,Devon Toews hit Sam Lafferty
214,hit,Derick Brassard,Brian Dumoulin,[-88.  36.],3,18:51,NYI,PIT,PIT,5,NYI,2,3,2,8473544,8475208.0,2019020321,NYI,2019-11-20,Derick Brassard hit Brian Dumoulin
216,hit,Jordan Eberle,Justin Schultz,[ 54. -40.],3,18:20,NYI,PIT,PIT,5,NYI,2,3,2,8474586,8474602.0,2019020321,NYI,2019-11-20,Jordan Eberle hit Justin Schultz
217,hit,Anders Lee,Jared McCann,[ 1. 41.],3,18:07,NYI,PIT,PIT,5,NYI,2,3,2,8475314,8477955.0,2019020321,NYI,2019-11-20,Anders Lee hit Jared McCann
218,hit,Nick Leddy,Juuso Riikola,[-99.   0.],3,17:57,NYI,PIT,PIT,5,NYI,2,3,2,8475181,8480945.0,2019020321,NYI,2019-11-20,Nick Leddy hit Juuso Riikola
220,hit,Anders Lee,Justin Schultz,[-86. -35.],3,17:47,NYI,PIT,PIT,5,NYI,2,3,2,8475314,8474602.0,2019020321,NYI,2019-11-20,Anders Lee hit Justin Schultz
226,hit,Leo Komarov,Jack Johnson,[-99. -19.],3,16:45,NYI,PIT,PIT,5,NYI,2,4,2,8473463,8471677.0,2019020321,NYI,2019-11-20,Leo Komarov hit Jack Johnson
228,hit,Leo Komarov,Jared McCann,[-69. -38.],3,16:35,NYI,PIT,PIT,5,NYI,2,4,2,8473463,8477955.0,2019020321,NYI,2019-11-20,Leo Komarov hit Jared McCann
232,hit,Anthony Beauvillier,Brian Dumoulin,[-99.  -7.],3,15:40,NYI,PIT,PIT,5,NYI,2,4,2,8478463,8475208.0,2019020321,NYI,2019-11-20,Anthony Beauvillier hit Brian Dumoulin
233,hit,Marcus Pettersson,Jordan Eberle,[-52.  41.],3,14:59,PIT,NYI,PIT,5,NYI,2,4,2,8477969,8474586.0,2019020321,NYI,2019-11-20,Marcus Pettersson hit Jordan Eberle
240,hit,Alex Galchenyuk,Mathew Barzal,[-73.  40.],3,13:41,PIT,NYI,PIT,5,NYI,2,4,2,8476851,8478445.0,2019020321,NYI,2019-11-20,Alex Galchenyuk hit Mathew Barzal
243,hit,Brock Nelson,Teddy Blueger,[ 83. -38.],3,12:30,NYI,PIT,PIT,5,NYI,2,4,2,8475754,8476927.0,2019020321,NYI,2019-11-20,Brock Nelson hit Teddy Blueger
245,hit,Marcus Pettersson,Casey Cizikas,[-96.  27.],3,12:09,PIT,NYI,PIT,5,NYI,2,4,2,8477969,8475231.0,2019020321,NYI,2019-11-20,Marcus Pettersson hit Casey Cizikas
246,hit,Jake Guentzel,Jordan Eberle,[-89.  35.],3,12:05,PIT,NYI,PIT,5,NYI,2,4,2,8477404,8474586.0,2019020321,NYI,2019-11-20,Jake Guentzel hit Jordan Eberle
249,hit,Cal Clutterbuck,Brian Dumoulin,[-98. -11.],3,11:28,NYI,PIT,PIT,5,NYI,2,4,2,8473504,8475208.0,2019020321,NYI,2019-11-20,Cal Clutterbuck hit Brian Dumoulin
255,hit,Derick Brassard,Brian Dumoulin,[-97.  14.],3,10:11,NYI,PIT,PIT,5,NYI,2,4,2,8473544,8475208.0,2019020321,NYI,2019-11-20,Derick Brassard hit Brian Dumoulin
259,hit,Adam Pelech,Bryan Rust,[71. 41.],3,09:42,NYI,PIT,PIT,5,NYI,2,4,2,8476917,8475810.0,2019020321,NYI,2019-11-20,Adam Pelech hit Bryan Rust
262,hit,Zach Aston-Reese,Jordan Eberle,[-55.  40.],3,09:08,PIT,NYI,PIT,5,NYI,2,4,2,8479944,8474586.0,2019020321,NYI,2019-11-20,Zach Aston-Reese hit Jordan Eberle
265,hit,Anders Lee,Brian Dumoulin,[-81.  38.],3,08:41,NYI,PIT,PIT,5,NYI,2,4,2,8475314,8475208.0,2019020321,NYI,2019-11-20,Anders Lee hit Brian Dumoulin
267,hit,Johnny Boychuk,Brandon Tanev,[ 55. -40.],3,07:48,NYI,PIT,PIT,5,NYI,2,4,2,8470187,8479293.0,2019020321,NYI,2019-11-20,Johnny Boychuk hit Brandon Tanev
269,hit,Brandon Tanev,Anthony Beauvillier,[-22. -40.],3,07:43,PIT,NYI,PIT,5,NYI,2,4,2,8479293,8478463.0,2019020321,NYI,2019-11-20,Brandon Tanev hit Anthony Beauvillier
