,event,hitter,hittee,coords,period,period_time_remaining,hitter_team,hittee_team,home_team,home_team_id,away_team,away_team_id,home_goals,away_goals,hitter_id,hittee_id,game_id,winning_team,date,description
67,hit,Alexander Edler,Anthony Beauvillier,[ 88. -32.],1,08:41,VAN,NYI,VAN,23,NYI,2,2,1,8471303,8478463.0,2019021077,,2020-03-11,Alexander Edler hit Anthony Beauvillier
80,hit,Christopher Tanev,Jordan Eberle,[ 85. -36.],1,06:20,VAN,NYI,VAN,23,NYI,2,2,1,8475690,8474586.0,2019021077,,2020-03-11,Christopher Tanev hit Jordan Eberle
84,hit,Zack MacEwen,Matt Martin,[37. 39.],1,05:22,VAN,NYI,VAN,23,NYI,2,2,1,8479772,8474709.0,2019021077,,2020-03-11,Zack MacEwen hit Matt Martin
87,hit,Andrew Ladd,Alexander Edler,[-13. -42.],1,05:01,NYI,VAN,VAN,23,NYI,2,2,1,8471217,8471303.0,2019021077,,2020-03-11,Andrew Ladd hit Alexander Edler
88,hit,Ryan Pulock,Tyler Toffoli,[-98.  26.],1,04:33,NYI,VAN,VAN,23,NYI,2,2,1,8477506,8475726.0,2019021077,,2020-03-11,Ryan Pulock hit Tyler Toffoli
111,hit,Tyler Toffoli,Leo Komarov,[ 86. -36.],1,00:18,VAN,NYI,VAN,23,NYI,2,2,2,8475726,8473463.0,2019021077,,2020-03-11,Tyler Toffoli hit Leo Komarov
113,hit,Leo Komarov,Oscar Fantenberg,[ 91. -32.],1,00:11,NYI,VAN,VAN,23,NYI,2,2,2,8473463,8480147.0,2019021077,,2020-03-11,Leo Komarov hit Oscar Fantenberg
116,hit,Tyler Motte,Andy Greene,[ 63. -42.],2,19:47,VAN,NYI,VAN,23,NYI,2,2,2,8477353,8472382.0,2019021077,,2020-03-11,Tyler Motte hit Andy Greene
119,hit,Nick Leddy,Bo Horvat,[99. -8.],2,18:41,NYI,VAN,VAN,23,NYI,2,2,2,8475181,8477500.0,2019021077,,2020-03-11,Nick Leddy hit Bo Horvat
120,hit,Andrew Ladd,Oscar Fantenberg,[-98. -12.],2,18:32,NYI,VAN,VAN,23,NYI,2,2,2,8471217,8480147.0,2019021077,,2020-03-11,Andrew Ladd hit Oscar Fantenberg
124,hit,Zack MacEwen,Devon Toews,[ 92. -30.],2,17:49,VAN,NYI,VAN,23,NYI,2,2,2,8479772,8478038.0,2019021077,,2020-03-11,Zack MacEwen hit Devon Toews
128,hit,Tyler Motte,Anthony Beauvillier,[-76.  39.],2,17:25,VAN,NYI,VAN,23,NYI,2,3,2,8477353,8478463.0,2019021077,,2020-03-11,Tyler Motte hit Anthony Beauvillier
129,hit,Jean-Gabriel Pageau,Troy Stecher,[-60. -40.],2,17:21,NYI,VAN,VAN,23,NYI,2,3,2,8476419,8479442.0,2019021077,,2020-03-11,Jean-Gabriel Pageau hit Troy Stecher
130,hit,Troy Stecher,Jean-Gabriel Pageau,[ 53. -34.],2,17:13,VAN,NYI,VAN,23,NYI,2,3,2,8479442,8476419.0,2019021077,,2020-03-11,Troy Stecher hit Jean-Gabriel Pageau
131,hit,Alexander Edler,Anthony Beauvillier,[-19. -41.],2,17:05,VAN,NYI,VAN,23,NYI,2,3,2,8471303,8478463.0,2019021077,,2020-03-11,Alexander Edler hit Anthony Beauvillier
137,hit,Bo Horvat,Derick Brassard,[-98.  17.],2,15:31,VAN,NYI,VAN,23,NYI,2,3,2,8477500,8473544.0,2019021077,,2020-03-11,Bo Horvat hit Derick Brassard
138,hit,Derick Brassard,Christopher Tanev,[-93. -29.],2,15:23,NYI,VAN,VAN,23,NYI,2,3,2,8473544,8475690.0,2019021077,,2020-03-11,Derick Brassard hit Christopher Tanev
142,hit,Tyler Myers,Anthony Beauvillier,[ 36. -37.],2,15:04,VAN,NYI,VAN,23,NYI,2,3,2,8474574,8478463.0,2019021077,,2020-03-11,Tyler Myers hit Anthony Beauvillier
147,hit,Derick Brassard,Troy Stecher,[-98.  -3.],2,13:47,NYI,VAN,VAN,23,NYI,2,3,2,8473544,8479442.0,2019021077,,2020-03-11,Derick Brassard hit Troy Stecher
151,hit,Nick Leddy,Brandon Sutter,[ 80. -38.],2,12:30,NYI,VAN,VAN,23,NYI,2,3,2,8475181,8474091.0,2019021077,,2020-03-11,Nick Leddy hit Brandon Sutter
152,hit,Ryan Pulock,Brock Boeser,[ 88. -30.],2,12:25,NYI,VAN,VAN,23,NYI,2,3,2,8477506,8478444.0,2019021077,,2020-03-11,Ryan Pulock hit Brock Boeser
160,hit,J.T. Miller,Scott Mayfield,[86. 30.],2,11:13,VAN,NYI,VAN,23,NYI,2,3,2,8476468,8476429.0,2019021077,,2020-03-11,J.T. Miller hit Scott Mayfield
163,hit,Jake Virtanen,Matt Martin,[99. -9.],2,10:53,VAN,NYI,VAN,23,NYI,2,3,2,8477937,8474709.0,2019021077,,2020-03-11,Jake Virtanen hit Matt Martin
168,hit,Brandon Sutter,Matt Martin,[ 86. -34.],2,10:19,VAN,NYI,VAN,23,NYI,2,3,2,8474091,8474709.0,2019021077,,2020-03-11,Brandon Sutter hit Matt Martin
169,hit,Cal Clutterbuck,Troy Stecher,[ 31. -39.],2,10:15,NYI,VAN,VAN,23,NYI,2,3,2,8473504,8479442.0,2019021077,,2020-03-11,Cal Clutterbuck hit Troy Stecher
173,hit,Tyler Motte,Jean-Gabriel Pageau,[88. 35.],2,10:01,VAN,NYI,VAN,23,NYI,2,3,2,8477353,8476419.0,2019021077,,2020-03-11,Tyler Motte hit Jean-Gabriel Pageau
175,hit,Brock Boeser,Brock Nelson,[-41.  41.],2,09:42,VAN,NYI,VAN,23,NYI,2,3,2,8478444,8475754.0,2019021077,,2020-03-11,Brock Boeser hit Brock Nelson
176,hit,Andrew Ladd,Brock Boeser,[-11.  -3.],2,09:36,NYI,VAN,VAN,23,NYI,2,3,2,8471217,8478444.0,2019021077,,2020-03-11,Andrew Ladd hit Brock Boeser
183,hit,Tyler Motte,Ryan Pulock,[95.  4.],2,07:51,VAN,NYI,VAN,23,NYI,2,3,2,8477353,8477506.0,2019021077,,2020-03-11,Tyler Motte hit Ryan Pulock
184,hit,Ryan Pulock,Jake Virtanen,[97. 16.],2,07:46,NYI,VAN,VAN,23,NYI,2,3,2,8477506,8477937.0,2019021077,,2020-03-11,Ryan Pulock hit Jake Virtanen
187,hit,Troy Stecher,Anthony Beauvillier,[-87. -37.],2,07:28,VAN,NYI,VAN,23,NYI,2,3,2,8479442,8478463.0,2019021077,,2020-03-11,Troy Stecher hit Anthony Beauvillier
190,hit,J.T. Miller,Andrew Ladd,[ 64. -40.],2,07:06,VAN,NYI,VAN,23,NYI,2,3,2,8476468,8471217.0,2019021077,,2020-03-11,J.T. Miller hit Andrew Ladd
191,hit,Tyler Toffoli,Ryan Pulock,[38. 39.],2,06:53,VAN,NYI,VAN,23,NYI,2,3,2,8475726,8477506.0,2019021077,,2020-03-11,Tyler Toffoli hit Ryan Pulock
192,hit,Matt Martin,Oscar Fantenberg,[-95.  20.],2,05:40,NYI,VAN,VAN,23,NYI,2,3,2,8474709,8480147.0,2019021077,,2020-03-11,Matt Martin hit Oscar Fantenberg
193,hit,Derick Brassard,Adam Gaudette,[-99. -13.],2,05:35,NYI,VAN,VAN,23,NYI,2,3,2,8473544,8478874.0,2019021077,,2020-03-11,Derick Brassard hit Adam Gaudette
194,hit,Devon Toews,Antoine Roussel,[-34. -40.],2,05:31,NYI,VAN,VAN,23,NYI,2,3,2,8478038,8474849.0,2019021077,,2020-03-11,Devon Toews hit Antoine Roussel
217,hit,Andrew Ladd,Brock Boeser,[-59. -40.],2,01:20,NYI,VAN,VAN,23,NYI,2,4,3,8471217,8478444.0,2019021077,,2020-03-11,Andrew Ladd hit Brock Boeser
224,hit,Cal Clutterbuck,Antoine Roussel,[-64.  40.],2,00:04,NYI,VAN,VAN,23,NYI,2,4,3,8473504,8474849.0,2019021077,,2020-03-11,Cal Clutterbuck hit Antoine Roussel
233,hit,Tanner Pearson,Mathew Barzal,[43. 32.],3,18:44,VAN,NYI,VAN,23,NYI,2,4,3,8476871,8478445.0,2019021077,,2020-03-11,Tanner Pearson hit Mathew Barzal
234,hit,Andrew Ladd,Troy Stecher,[92. 31.],3,18:15,NYI,VAN,VAN,23,NYI,2,4,3,8471217,8479442.0,2019021077,,2020-03-11,Andrew Ladd hit Troy Stecher
235,hit,Leo Komarov,Alexander Edler,[ 38. -40.],3,17:51,NYI,VAN,VAN,23,NYI,2,4,3,8473463,8471303.0,2019021077,,2020-03-11,Leo Komarov hit Alexander Edler
237,hit,Tyler Motte,Anthony Beauvillier,[-33.  39.],3,17:33,VAN,NYI,VAN,23,NYI,2,4,3,8477353,8478463.0,2019021077,,2020-03-11,Tyler Motte hit Anthony Beauvillier
240,hit,Jordan Eberle,Christopher Tanev,[94. 27.],3,17:21,NYI,VAN,VAN,23,NYI,2,4,3,8474586,8475690.0,2019021077,,2020-03-11,Jordan Eberle hit Christopher Tanev
252,hit,J.T. Miller,Andy Greene,[-19.  16.],3,14:27,VAN,NYI,VAN,23,NYI,2,4,4,8476468,8472382.0,2019021077,,2020-03-11,J.T. Miller hit Andy Greene
257,hit,Tyler Motte,Noah Dobson,[-75. -37.],3,13:12,VAN,NYI,VAN,23,NYI,2,4,4,8477353,8480865.0,2019021077,,2020-03-11,Tyler Motte hit Noah Dobson
259,hit,Jean-Gabriel Pageau,Tyler Motte,[-94.  28.],3,12:49,NYI,VAN,VAN,23,NYI,2,4,4,8476419,8477353.0,2019021077,,2020-03-11,Jean-Gabriel Pageau hit Tyler Motte
262,hit,Anders Lee,Christopher Tanev,[94. 25.],3,12:03,NYI,VAN,VAN,23,NYI,2,4,4,8475314,8475690.0,2019021077,,2020-03-11,Anders Lee hit Christopher Tanev
265,hit,Tanner Pearson,Jordan Eberle,[97. 11.],3,11:31,VAN,NYI,VAN,23,NYI,2,4,4,8476871,8474586.0,2019021077,,2020-03-11,Tanner Pearson hit Jordan Eberle
267,hit,Andrew Ladd,Oscar Fantenberg,[69. -5.],3,10:51,NYI,VAN,VAN,23,NYI,2,4,4,8471217,8480147.0,2019021077,,2020-03-11,Andrew Ladd hit Oscar Fantenberg
274,hit,Tyler Toffoli,Mathew Barzal,[-94.  23.],3,09:16,VAN,NYI,VAN,23,NYI,2,4,4,8475726,8478445.0,2019021077,,2020-03-11,Tyler Toffoli hit Mathew Barzal
277,hit,Tanner Pearson,Scott Mayfield,[-99.  -7.],3,08:34,VAN,NYI,VAN,23,NYI,2,4,4,8476871,8476429.0,2019021077,,2020-03-11,Tanner Pearson hit Scott Mayfield
278,hit,Andrew Ladd,Tyler Myers,[-21.  40.],3,08:28,NYI,VAN,VAN,23,NYI,2,4,4,8471217,8474574.0,2019021077,,2020-03-11,Andrew Ladd hit Tyler Myers
283,hit,Zack MacEwen,Jean-Gabriel Pageau,[ 13. -41.],3,07:53,VAN,NYI,VAN,23,NYI,2,4,4,8479772,8476419.0,2019021077,,2020-03-11,Zack MacEwen hit Jean-Gabriel Pageau
285,hit,J.T. Miller,Mathew Barzal,[ 96. -20.],3,07:29,VAN,NYI,VAN,23,NYI,2,4,4,8476468,8478445.0,2019021077,,2020-03-11,J.T. Miller hit Mathew Barzal
289,hit,Andrew Ladd,Quinn Hughes,[ 70. -40.],3,06:32,NYI,VAN,VAN,23,NYI,2,4,4,8471217,8480800.0,2019021077,,2020-03-11,Andrew Ladd hit Quinn Hughes
295,hit,Andrew Ladd,Tyler Toffoli,[  7. -41.],3,03:57,NYI,VAN,VAN,23,NYI,2,4,4,8471217,8475726.0,2019021077,,2020-03-11,Andrew Ladd hit Tyler Toffoli
297,hit,Leo Komarov,Alexander Edler,[ 97. -20.],3,03:12,NYI,VAN,VAN,23,NYI,2,4,4,8473463,8471303.0,2019021077,,2020-03-11,Leo Komarov hit Alexander Edler
298,hit,Leo Komarov,Alexander Edler,[ 98. -19.],3,02:51,NYI,VAN,VAN,23,NYI,2,4,4,8473463,8471303.0,2019021077,,2020-03-11,Leo Komarov hit Alexander Edler
5,hit,Brock Nelson,Alex Ovechkin,[-67. -36.],1,18:42,NYI,WSH,NYI,2,WSH,15,0,0,8475754,8471214.0,2019020014,,2019-10-05,Brock Nelson hit Alex Ovechkin
6,hit,Anthony Beauvillier,Radko Gudas,[93. 22.],1,17:40,NYI,WSH,NYI,2,WSH,15,0,0,8478463,8475462.0,2019020014,,2019-10-05,Anthony Beauvillier hit Radko Gudas
7,hit,Martin Fehervary,Anthony Beauvillier,[87. 37.],1,17:26,WSH,NYI,NYI,2,WSH,15,0,0,8480796,8478463.0,2019020014,,2019-10-05,Martin Fehervary hit Anthony Beauvillier
15,hit,Alex Ovechkin,Adam Pelech,[-92.  36.],1,16:30,WSH,NYI,NYI,2,WSH,15,0,0,8471214,8476917.0,2019020014,,2019-10-05,Alex Ovechkin hit Adam Pelech
16,hit,Casey Cizikas,Dmitry Orlov,[-32. -29.],1,16:20,NYI,WSH,NYI,2,WSH,15,0,0,8475231,8475200.0,2019020014,,2019-10-05,Casey Cizikas hit Dmitry Orlov
23,hit,Derick Brassard,Nic Dowd,[-94.  19.],1,14:54,NYI,WSH,NYI,2,WSH,15,0,0,8473544,8475343.0,2019020014,,2019-10-05,Derick Brassard hit Nic Dowd
27,hit,Devon Toews,Chandler Stephenson,[-39.  37.],1,13:57,NYI,WSH,NYI,2,WSH,15,0,0,8478038,8476905.0,2019020014,,2019-10-05,Devon Toews hit Chandler Stephenson
28,hit,Adam Pelech,Tom Wilson,[-92.  32.],1,13:29,NYI,WSH,NYI,2,WSH,15,0,0,8476917,8476880.0,2019020014,,2019-10-05,Adam Pelech hit Tom Wilson
30,hit,Cal Clutterbuck,Martin Fehervary,[-17. -35.],1,13:09,NYI,WSH,NYI,2,WSH,15,0,0,8473504,8480796.0,2019020014,,2019-10-05,Cal Clutterbuck hit Martin Fehervary
38,hit,Tom Wilson,Brock Nelson,[ 29. -20.],1,11:15,WSH,NYI,NYI,2,WSH,15,0,0,8476880,8475754.0,2019020014,,2019-10-05,Tom Wilson hit Brock Nelson
48,hit,Johnny Boychuk,Chandler Stephenson,[-97.  -9.],1,08:59,NYI,WSH,NYI,2,WSH,15,0,1,8470187,8476905.0,2019020014,,2019-10-05,Johnny Boychuk hit Chandler Stephenson
59,hit,Dmitry Orlov,Derick Brassard,[97. -9.],1,06:32,WSH,NYI,NYI,2,WSH,15,1,1,8475200,8473544.0,2019020014,,2019-10-05,Dmitry Orlov hit Derick Brassard
60,hit,Derick Brassard,Carl Hagelin,[ 92. -27.],1,06:23,NYI,WSH,NYI,2,WSH,15,1,1,8473544,8474176.0,2019020014,,2019-10-05,Derick Brassard hit Carl Hagelin
70,hit,Mathew Barzal,Nic Dowd,[94. 16.],1,04:39,NYI,WSH,NYI,2,WSH,15,1,1,8478445,8475343.0,2019020014,,2019-10-05,Mathew Barzal hit Nic Dowd
73,hit,Johnny Boychuk,Brendan Leipsic,[-28. -35.],1,04:20,NYI,WSH,NYI,2,WSH,15,1,1,8470187,8476894.0,2019020014,,2019-10-05,Johnny Boychuk hit Brendan Leipsic
82,hit,Matt Martin,Tom Wilson,[-36.  37.],1,03:32,NYI,WSH,NYI,2,WSH,15,1,1,8474709,8476880.0,2019020014,,2019-10-05,Matt Martin hit Tom Wilson
89,hit,Lars Eller,Anders Lee,[96. 20.],1,01:49,WSH,NYI,NYI,2,WSH,15,1,1,8474189,8475314.0,2019020014,,2019-10-05,Lars Eller hit Anders Lee
93,hit,Leo Komarov,Nick Jensen,[89. 36.],1,01:10,NYI,WSH,NYI,2,WSH,15,1,1,8473463,8475324.0,2019020014,,2019-10-05,Leo Komarov hit Nick Jensen
94,hit,Alex Ovechkin,Casey Cizikas,[85. 33.],1,00:30,WSH,NYI,NYI,2,WSH,15,1,1,8471214,8475231.0,2019020014,,2019-10-05,Alex Ovechkin hit Casey Cizikas
95,hit,Alex Ovechkin,Matt Martin,[95.  8.],1,00:24,WSH,NYI,NYI,2,WSH,15,1,1,8471214,8474709.0,2019020014,,2019-10-05,Alex Ovechkin hit Matt Martin
96,hit,Casey Cizikas,Jonas Siegenthaler,[ 88. -22.],1,00:22,NYI,WSH,NYI,2,WSH,15,1,1,8475231,8478399.0,2019020014,,2019-10-05,Casey Cizikas hit Jonas Siegenthaler
116,hit,Garnet Hathaway,Adam Pelech,[-24. -34.],2,15:14,WSH,NYI,NYI,2,WSH,15,1,1,8477903,8476917.0,2019020014,,2019-10-05,Garnet Hathaway hit Adam Pelech
122,hit,Alex Ovechkin,Adam Pelech,[ 65. -35.],2,14:28,WSH,NYI,NYI,2,WSH,15,1,1,8471214,8476917.0,2019020014,,2019-10-05,Alex Ovechkin hit Adam Pelech
134,hit,Jordan Eberle,Martin Fehervary,[17. 34.],2,11:31,NYI,WSH,NYI,2,WSH,15,1,1,8474586,8480796.0,2019020014,,2019-10-05,Jordan Eberle hit Martin Fehervary
136,hit,Martin Fehervary,Jordan Eberle,[-33. -21.],2,11:03,WSH,NYI,NYI,2,WSH,15,1,1,8480796,8474586.0,2019020014,,2019-10-05,Martin Fehervary hit Jordan Eberle
137,hit,Anders Lee,Jakub Vrana,[-56.  34.],2,10:48,NYI,WSH,NYI,2,WSH,15,1,1,8475314,8477944.0,2019020014,,2019-10-05,Anders Lee hit Jakub Vrana
139,hit,Matt Martin,Martin Fehervary,[-45.  37.],2,10:22,NYI,WSH,NYI,2,WSH,15,1,1,8474709,8480796.0,2019020014,,2019-10-05,Matt Martin hit Martin Fehervary
140,hit,Martin Fehervary,Matt Martin,[-25.  38.],2,10:16,WSH,NYI,NYI,2,WSH,15,1,1,8480796,8474709.0,2019020014,,2019-10-05,Martin Fehervary hit Matt Martin
141,hit,Casey Cizikas,Radko Gudas,[-73. -35.],2,10:00,NYI,WSH,NYI,2,WSH,15,1,1,8475231,8475462.0,2019020014,,2019-10-05,Casey Cizikas hit Radko Gudas
144,hit,Scott Mayfield,Carl Hagelin,[93. 19.],2,09:42,NYI,WSH,NYI,2,WSH,15,1,1,8476429,8474176.0,2019020014,,2019-10-05,Scott Mayfield hit Carl Hagelin
159,hit,Adam Pelech,Garnet Hathaway,[ 93. -15.],2,05:52,NYI,WSH,NYI,2,WSH,15,1,1,8476917,8477903.0,2019020014,,2019-10-05,Adam Pelech hit Garnet Hathaway
162,hit,Dmitry Orlov,Leo Komarov,[ 5. 32.],2,05:11,WSH,NYI,NYI,2,WSH,15,1,1,8475200,8473463.0,2019020014,,2019-10-05,Dmitry Orlov hit Leo Komarov
165,hit,Carl Hagelin,Scott Mayfield,[-44.  37.],2,04:22,WSH,NYI,NYI,2,WSH,15,1,1,8474176,8476429.0,2019020014,,2019-10-05,Carl Hagelin hit Scott Mayfield
166,hit,Scott Mayfield,Martin Fehervary,[89. 12.],2,03:46,NYI,WSH,NYI,2,WSH,15,1,1,8476429,8480796.0,2019020014,,2019-10-05,Scott Mayfield hit Martin Fehervary
175,hit,Carl Hagelin,Anders Lee,[ 79. -35.],2,01:13,WSH,NYI,NYI,2,WSH,15,1,2,8474176,8475314.0,2019020014,,2019-10-05,Carl Hagelin hit Anders Lee
176,hit,Garnet Hathaway,Jordan Eberle,[-34.  35.],2,01:07,WSH,NYI,NYI,2,WSH,15,1,2,8477903,8474586.0,2019020014,,2019-10-05,Garnet Hathaway hit Jordan Eberle
183,hit,Cal Clutterbuck,Jonas Siegenthaler,[ 93. -20.],3,19:17,NYI,WSH,NYI,2,WSH,15,1,2,8473504,8478399.0,2019020014,,2019-10-05,Cal Clutterbuck hit Jonas Siegenthaler
188,hit,Johnny Boychuk,Lars Eller,[-89.  34.],3,17:46,NYI,WSH,NYI,2,WSH,15,1,2,8470187,8474189.0,2019020014,,2019-10-05,Johnny Boychuk hit Lars Eller
189,hit,Martin Fehervary,Mathew Barzal,[ 16. -39.],3,17:37,WSH,NYI,NYI,2,WSH,15,1,2,8480796,8478445.0,2019020014,,2019-10-05,Martin Fehervary hit Mathew Barzal
190,hit,Jordan Eberle,Martin Fehervary,[ -7. -35.],3,17:18,NYI,WSH,NYI,2,WSH,15,1,2,8474586,8480796.0,2019020014,,2019-10-05,Jordan Eberle hit Martin Fehervary
194,hit,Johnny Boychuk,Tom Wilson,[-69.  37.],3,15:09,NYI,WSH,NYI,2,WSH,15,1,2,8470187,8476880.0,2019020014,,2019-10-05,Johnny Boychuk hit Tom Wilson
198,hit,John Carlson,Anders Lee,[74. 38.],3,14:08,WSH,NYI,NYI,2,WSH,15,1,2,8474590,8475314.0,2019020014,,2019-10-05,John Carlson hit Anders Lee
204,hit,Nic Dowd,Derick Brassard,[82. 35.],3,13:02,WSH,NYI,NYI,2,WSH,15,1,2,8475343,8473544.0,2019020014,,2019-10-05,Nic Dowd hit Derick Brassard
215,hit,Garnet Hathaway,Johnny Boychuk,[-75. -33.],3,10:36,WSH,NYI,NYI,2,WSH,15,1,2,8477903,8470187.0,2019020014,,2019-10-05,Garnet Hathaway hit Johnny Boychuk
224,hit,Dmitry Orlov,Michael Dal Colle,[ 37. -37.],3,09:00,WSH,NYI,NYI,2,WSH,15,1,2,8475200,8477936.0,2019020014,,2019-10-05,Dmitry Orlov hit Michael Dal Colle
226,hit,Casey Cizikas,Jonas Siegenthaler,[-40. -37.],3,07:59,NYI,WSH,NYI,2,WSH,15,1,2,8475231,8478399.0,2019020014,,2019-10-05,Casey Cizikas hit Jonas Siegenthaler
227,hit,Scott Mayfield,Lars Eller,[-67. -38.],3,07:53,NYI,WSH,NYI,2,WSH,15,1,2,8476429,8474189.0,2019020014,,2019-10-05,Scott Mayfield hit Lars Eller
229,hit,Leo Komarov,Jonas Siegenthaler,[ 83. -35.],3,07:38,NYI,WSH,NYI,2,WSH,15,1,2,8473463,8478399.0,2019020014,,2019-10-05,Leo Komarov hit Jonas Siegenthaler
244,hit,T.J. Oshie,Adam Pelech,[67. -1.],3,04:43,WSH,NYI,NYI,2,WSH,15,1,2,8471698,8476917.0,2019020014,,2019-10-05,T.J. Oshie hit Adam Pelech
247,hit,Johnny Boychuk,Chandler Stephenson,[-42. -37.],3,03:22,NYI,WSH,NYI,2,WSH,15,1,2,8470187,8476905.0,2019020014,,2019-10-05,Johnny Boychuk hit Chandler Stephenson
1,hit,Matt Martin,Anthony Bitetto,[94. 25.],1,19:38,NYI,WPG,NYI,2,WPG,52,0,0,8474709,8475868.0,2019020033,,2019-10-07,Matt Martin hit Anthony Bitetto
2,hit,Casey Cizikas,Adam Lowry,[ 77. -34.],1,19:31,NYI,WPG,NYI,2,WPG,52,0,0,8475231,8476392.0,2019020033,,2019-10-07,Casey Cizikas hit Adam Lowry
8,hit,Jordan Eberle,Carl Dahlstrom,[-58. -38.],1,18:09,NYI,WPG,NYI,2,WPG,52,0,0,8474586,8477472.0,2019020033,,2019-10-07,Jordan Eberle hit Carl Dahlstrom
9,hit,Anthony Bitetto,Anthony Beauvillier,[93. 22.],1,17:36,WPG,NYI,NYI,2,WPG,52,0,0,8475868,8478463.0,2019020033,,2019-10-07,Anthony Bitetto hit Anthony Beauvillier
14,hit,Cal Clutterbuck,Mark Letestu,[ 0. 37.],1,16:48,NYI,WPG,NYI,2,WPG,52,0,0,8473504,8473914.0,2019020033,,2019-10-07,Cal Clutterbuck hit Mark Letestu
19,hit,Michael Dal Colle,Dmitry Kulikov,[ 88. -36.],1,15:31,NYI,WPG,NYI,2,WPG,52,0,0,8477936,8475179.0,2019020033,,2019-10-07,Michael Dal Colle hit Dmitry Kulikov
21,hit,Derick Brassard,Anthony Bitetto,[ 39. -39.],1,14:22,NYI,WPG,NYI,2,WPG,52,0,0,8473544,8475868.0,2019020033,,2019-10-07,Derick Brassard hit Anthony Bitetto
28,hit,Matt Martin,Neal Pionk,[95.  6.],1,13:29,NYI,WPG,NYI,2,WPG,52,0,0,8474709,8480145.0,2019020033,,2019-10-07,Matt Martin hit Neal Pionk
31,hit,Gabriel Bourque,Johnny Boychuk,[ 32. -32.],1,13:15,WPG,NYI,NYI,2,WPG,52,0,0,8475268,8470187.0,2019020033,,2019-10-07,Gabriel Bourque hit Johnny Boychuk
44,hit,Anthony Bitetto,Casey Cizikas,[ 66. -25.],1,10:32,WPG,NYI,NYI,2,WPG,52,0,0,8475868,8475231.0,2019020033,,2019-10-07,Anthony Bitetto hit Casey Cizikas
52,hit,Matt Martin,Ville Heinola,[90. 30.],1,08:19,NYI,WPG,NYI,2,WPG,52,0,0,8474709,8481572.0,2019020033,,2019-10-07,Matt Martin hit Ville Heinola
73,hit,Ryan Pulock,Mark Scheifele,[-87.  34.],1,03:59,NYI,WPG,NYI,2,WPG,52,0,0,8477506,8476460.0,2019020033,,2019-10-07,Ryan Pulock hit Mark Scheifele
79,hit,Cal Clutterbuck,Mason Appleton,[11. 39.],1,02:19,NYI,WPG,NYI,2,WPG,52,0,0,8473504,8478891.0,2019020033,,2019-10-07,Cal Clutterbuck hit Mason Appleton
80,hit,Gabriel Bourque,Johnny Boychuk,[-97.  -2.],1,02:07,WPG,NYI,NYI,2,WPG,52,0,0,8475268,8470187.0,2019020033,,2019-10-07,Gabriel Bourque hit Johnny Boychuk
82,hit,Matt Martin,Adam Lowry,[24. 24.],1,01:59,NYI,WPG,NYI,2,WPG,52,0,0,8474709,8476392.0,2019020033,,2019-10-07,Matt Martin hit Adam Lowry
84,hit,Gabriel Bourque,Scott Mayfield,[ 35. -33.],1,01:48,WPG,NYI,NYI,2,WPG,52,0,0,8475268,8476429.0,2019020033,,2019-10-07,Gabriel Bourque hit Scott Mayfield
88,hit,Blake Wheeler,Adam Pelech,[-74.  36.],1,00:34,WPG,NYI,NYI,2,WPG,52,0,0,8471218,8476917.0,2019020033,,2019-10-07,Blake Wheeler hit Adam Pelech
89,hit,Patrik Laine,Johnny Boychuk,[-94.  22.],1,00:14,WPG,NYI,NYI,2,WPG,52,0,0,8479339,8470187.0,2019020033,,2019-10-07,Patrik Laine hit Johnny Boychuk
99,hit,Blake Wheeler,Casey Cizikas,[ 87. -32.],2,17:47,WPG,NYI,NYI,2,WPG,52,1,0,8471218,8475231.0,2019020033,,2019-10-07,Blake Wheeler hit Casey Cizikas
103,hit,Ville Heinola,Anthony Beauvillier,[-98.   3.],2,16:59,WPG,NYI,NYI,2,WPG,52,1,0,8481572,8478463.0,2019020033,,2019-10-07,Ville Heinola hit Anthony Beauvillier
104,hit,Neal Pionk,Anthony Beauvillier,[-95. -25.],2,16:43,WPG,NYI,NYI,2,WPG,52,1,0,8480145,8478463.0,2019020033,,2019-10-07,Neal Pionk hit Anthony Beauvillier
128,hit,Dmitry Kulikov,Brock Nelson,[-57.   0.],2,13:08,WPG,NYI,NYI,2,WPG,52,2,0,8475179,8475754.0,2019020033,,2019-10-07,Dmitry Kulikov hit Brock Nelson
133,hit,Leo Komarov,Andrew Copp,[ 20. -36.],2,12:27,NYI,WPG,NYI,2,WPG,52,2,0,8473463,8477429.0,2019020033,,2019-10-07,Leo Komarov hit Andrew Copp
139,hit,Matt Martin,Tucker Poolman,[-97.  -1.],2,11:08,NYI,WPG,NYI,2,WPG,52,2,0,8474709,8477359.0,2019020033,,2019-10-07,Matt Martin hit Tucker Poolman
140,hit,Adam Lowry,Cal Clutterbuck,[-54.  22.],2,11:02,WPG,NYI,NYI,2,WPG,52,2,0,8476392,8473504.0,2019020033,,2019-10-07,Adam Lowry hit Cal Clutterbuck
141,hit,Mathieu Perreault,Casey Cizikas,[ 76. -33.],2,10:53,WPG,NYI,NYI,2,WPG,52,2,0,8473618,8475231.0,2019020033,,2019-10-07,Mathieu Perreault hit Casey Cizikas
142,hit,Mason Appleton,Ryan Pulock,[80. 36.],2,10:50,WPG,NYI,NYI,2,WPG,52,2,0,8478891,8477506.0,2019020033,,2019-10-07,Mason Appleton hit Ryan Pulock
143,hit,Blake Wheeler,Nick Leddy,[91. 26.],2,10:14,WPG,NYI,NYI,2,WPG,52,2,0,8471218,8475181.0,2019020033,,2019-10-07,Blake Wheeler hit Nick Leddy
144,hit,Johnny Boychuk,Blake Wheeler,[80. 30.],2,10:02,NYI,WPG,NYI,2,WPG,52,2,0,8470187,8471218.0,2019020033,,2019-10-07,Johnny Boychuk hit Blake Wheeler
155,hit,Mark Scheifele,Brock Nelson,[-97. -28.],2,08:41,WPG,NYI,NYI,2,WPG,52,2,0,8476460,8475754.0,2019020033,,2019-10-07,Mark Scheifele hit Brock Nelson
162,hit,Dmitry Kulikov,Mathew Barzal,[-83. -34.],2,06:09,WPG,NYI,NYI,2,WPG,52,2,0,8475179,8478445.0,2019020033,,2019-10-07,Dmitry Kulikov hit Mathew Barzal
167,hit,Matt Martin,Kyle Connor,[-82.  35.],2,04:52,NYI,WPG,NYI,2,WPG,52,2,0,8474709,8478398.0,2019020033,,2019-10-07,Matt Martin hit Kyle Connor
172,hit,Gabriel Bourque,Johnny Boychuk,[61. 38.],2,03:34,WPG,NYI,NYI,2,WPG,52,3,0,8475268,8470187.0,2019020033,,2019-10-07,Gabriel Bourque hit Johnny Boychuk
177,hit,Ryan Pulock,Patrik Laine,[71. 37.],2,01:26,NYI,WPG,NYI,2,WPG,52,3,1,8477506,8479339.0,2019020033,,2019-10-07,Ryan Pulock hit Patrik Laine
189,hit,Josh Bailey,Dmitry Kulikov,[-1. 38.],3,19:26,NYI,WPG,NYI,2,WPG,52,3,1,8474573,8475179.0,2019020033,,2019-10-07,Josh Bailey hit Dmitry Kulikov
200,hit,Mark Scheifele,Ryan Pulock,[-72.  39.],3,16:39,WPG,NYI,NYI,2,WPG,52,4,1,8476460,8477506.0,2019020033,,2019-10-07,Mark Scheifele hit Ryan Pulock
201,hit,Ville Heinola,Anthony Beauvillier,[95. -8.],3,16:10,WPG,NYI,NYI,2,WPG,52,4,1,8481572,8478463.0,2019020033,,2019-10-07,Ville Heinola hit Anthony Beauvillier
205,hit,Adam Lowry,Scott Mayfield,[-97. -21.],3,15:20,WPG,NYI,NYI,2,WPG,52,4,1,8476392,8476429.0,2019020033,,2019-10-07,Adam Lowry hit Scott Mayfield
208,hit,Kyle Connor,Nick Leddy,[-91.  24.],3,14:57,WPG,NYI,NYI,2,WPG,52,4,1,8478398,8475181.0,2019020033,,2019-10-07,Kyle Connor hit Nick Leddy
215,hit,Anthony Beauvillier,Dmitry Kulikov,[-36.  38.],3,13:05,NYI,WPG,NYI,2,WPG,52,4,1,8478463,8475179.0,2019020033,,2019-10-07,Anthony Beauvillier hit Dmitry Kulikov
216,hit,Scott Mayfield,Mathieu Perreault,[-92. -24.],3,12:54,NYI,WPG,NYI,2,WPG,52,4,1,8476429,8473618.0,2019020033,,2019-10-07,Scott Mayfield hit Mathieu Perreault
226,hit,Andrew Copp,Cal Clutterbuck,[-72. -34.],3,11:31,WPG,NYI,NYI,2,WPG,52,4,1,8477429,8473504.0,2019020033,,2019-10-07,Andrew Copp hit Cal Clutterbuck
228,hit,Johnny Boychuk,Adam Lowry,[-22.  -2.],3,10:36,NYI,WPG,NYI,2,WPG,52,4,1,8470187,8476392.0,2019020033,,2019-10-07,Johnny Boychuk hit Adam Lowry
233,hit,Anthony Bitetto,Casey Cizikas,[ 28. -37.],3,09:06,WPG,NYI,NYI,2,WPG,52,4,1,8475868,8475231.0,2019020033,,2019-10-07,Anthony Bitetto hit Casey Cizikas
235,hit,Matt Martin,Andrew Copp,[-73. -34.],3,08:50,NYI,WPG,NYI,2,WPG,52,4,1,8474709,8477429.0,2019020033,,2019-10-07,Matt Martin hit Andrew Copp
236,hit,Cal Clutterbuck,Anthony Bitetto,[ -1. -37.],3,08:41,NYI,WPG,NYI,2,WPG,52,4,1,8473504,8475868.0,2019020033,,2019-10-07,Cal Clutterbuck hit Anthony Bitetto
244,hit,Patrik Laine,Adam Pelech,[ 3. 36.],3,06:19,WPG,NYI,NYI,2,WPG,52,4,1,8479339,8476917.0,2019020033,,2019-10-07,Patrik Laine hit Adam Pelech
246,hit,Casey Cizikas,Anthony Bitetto,[  4. -36.],3,05:37,NYI,WPG,NYI,2,WPG,52,4,1,8475231,8475868.0,2019020033,,2019-10-07,Casey Cizikas hit Anthony Bitetto
248,hit,Matt Martin,Tucker Poolman,[94. 15.],3,05:02,NYI,WPG,NYI,2,WPG,52,4,1,8474709,8477359.0,2019020033,,2019-10-07,Matt Martin hit Tucker Poolman
5,hit,Devon Toews,Riley Sheahan,[-93. -35.],1,19:16,NYI,EDM,NYI,2,EDM,22,0,0,8478038,8475772.0,2019020037,,2019-10-09,Devon Toews hit Riley Sheahan
6,hit,Scott Mayfield,Patrick Russell,[-96.  12.],1,19:10,NYI,EDM,NYI,2,EDM,22,0,0,8476429,8479466.0,2019020037,,2019-10-09,Scott Mayfield hit Patrick Russell
14,hit,Gaetan Haas,Matt Martin,[59. 39.],1,16:37,EDM,NYI,NYI,2,EDM,22,0,0,8481813,8474709.0,2019020037,,2019-10-09,Gaetan Haas hit Matt Martin
15,hit,Oscar Klefbom,Cal Clutterbuck,[ 78. -38.],1,16:29,EDM,NYI,NYI,2,EDM,22,0,0,8476472,8473504.0,2019020037,,2019-10-09,Oscar Klefbom hit Cal Clutterbuck
22,hit,Darnell Nurse,Michael Dal Colle,[ 54. -38.],1,15:10,EDM,NYI,NYI,2,EDM,22,0,0,8477498,8477936.0,2019020037,,2019-10-09,Darnell Nurse hit Michael Dal Colle
23,hit,Zack Kassian,Brock Nelson,[ 96. -22.],1,15:01,EDM,NYI,NYI,2,EDM,22,0,0,8475178,8475754.0,2019020037,,2019-10-09,Zack Kassian hit Brock Nelson
33,hit,Casey Cizikas,Zack Kassian,[-95.  -9.],1,12:13,NYI,EDM,NYI,2,EDM,22,0,0,8475231,8475178.0,2019020037,,2019-10-09,Casey Cizikas hit Zack Kassian
42,hit,Darnell Nurse,Mathew Barzal,[ 96. -19.],1,11:03,EDM,NYI,NYI,2,EDM,22,0,0,8477498,8478445.0,2019020037,,2019-10-09,Darnell Nurse hit Mathew Barzal
44,hit,Zack Kassian,Ryan Pulock,[-94. -32.],1,10:06,EDM,NYI,NYI,2,EDM,22,0,0,8475178,8477506.0,2019020037,,2019-10-09,Zack Kassian hit Ryan Pulock
47,hit,Anthony Beauvillier,Gaetan Haas,[-10.  39.],1,09:35,NYI,EDM,NYI,2,EDM,22,0,0,8478463,8481813.0,2019020037,,2019-10-09,Anthony Beauvillier hit Gaetan Haas
