,event,penalty,penalty_on,drew_by,coords,period,period_time_remaining,penalty_team,drew_by_team,home_team,home_team_id,away_team,away_team_id,home_goals,away_goals,penalty_on_id,drew_by_id,description
213,penalty,Hooking,Nikolai Prokhorkin,Matt Niskanen,[81. 36.],3,12:22,LAK,PHI,PHI,4,LAK,26,3,1,8476947,8471702.0,Nikolai Prokhorkin Hooking against Matt Niskanen
90,penalty,Tripping,Jakub Voracek,Chad Ruhwedel,[-10. -13.],1,01:14,PHI,PIT,PHI,4,PIT,5,0,0,8474161,8477244.0,Jakub Voracek Tripping against Chad Ruhwedel
123,penalty,Holding,Juuso Riikola,Scott Laughton,[ 60. -38.],2,12:25,PIT,PHI,PHI,4,PIT,5,1,0,8480945,8476872.0,Juuso Riikola Holding against Scott Laughton
132,penalty,Roughing,Kris Letang,Travis Sanheim,[77. 26.],2,10:38,PIT,PHI,PHI,4,PIT,5,1,0,8471724,8477948.0,Kris Letang Roughing against Travis Sanheim
147,penalty,Hooking,Joel Farabee,Patric Hornqvist,[-32.  31.],2,06:05,PHI,PIT,PHI,4,PIT,5,1,0,8480797,8471887.0,Joel Farabee Hooking against Patric Hornqvist
169,penalty,Too many men on the ice,James van Riemsdyk,,[ 9. 37.],2,00:39,PHI,PIT,PHI,4,PIT,5,2,0,8474037,,Too many men/ice served by James van Riemsdyk
233,penalty,Hooking,Evgeni Malkin,Sean Couturier,[-56. -18.],3,03:36,PIT,PHI,PHI,4,PIT,5,2,0,8471215,8476461.0,Evgeni Malkin Hooking against Sean Couturier
71,penalty,Tripping,Alex Galchenyuk,Joel Farabee,[30. 40.],1,02:08,PIT,PHI,PIT,5,PHI,4,0,0,8476851,8480797.0,Alex Galchenyuk Tripping against Joel Farabee
93,penalty,Hooking,Philippe Myers,Jared McCann,[-72.  -5.],2,15:55,PHI,PIT,PIT,5,PHI,4,1,1,8479026,8477955.0,Philippe Myers Hooking against Jared McCann
110,penalty,Hooking,Evgeni Malkin,James van Riemsdyk,[63.  1.],2,12:02,PIT,PHI,PIT,5,PHI,4,2,1,8471215,8474037.0,Evgeni Malkin Hooking against James van Riemsdyk
115,penalty,Tripping,Travis Konecny,Bryan Rust,[ 90. -19.],2,09:56,PHI,PIT,PIT,5,PHI,4,2,1,8478439,8475810.0,Travis Konecny Tripping against Bryan Rust
149,penalty,Tripping,Sidney Crosby,Travis Sanheim,[21.  0.],2,01:14,PIT,PHI,PIT,5,PHI,4,3,2,8471675,8477948.0,Sidney Crosby Tripping against Travis Sanheim
67,penalty,Hi stick - double minor,Nathan MacKinnon,Matt Niskanen,[ 68. -14.],1,03:06,COL,PHI,PHI,4,COL,21,1,0,8477492,8471702.0,Nathan MacKinnon Hi stick - double minor against Matt Niskanen
103,penalty,Hooking,Nicolas Aube-Kubel,Samuel Girard,[59. 39.],2,16:07,PHI,COL,PHI,4,COL,21,3,1,8477979,8479398.0,Nicolas Aube-Kubel Hooking against Samuel Girard
119,penalty,Roughing,J.T. Compher,Travis Konecny,[-79. -23.],2,13:42,COL,PHI,PHI,4,COL,21,3,2,8477456,8478439.0,J.T. Compher Roughing against Travis Konecny
120,penalty,Roughing,Philippe Myers,J.T. Compher,[-72. -22.],2,13:42,PHI,COL,PHI,4,COL,21,3,2,8479026,8477456.0,Philippe Myers Roughing against J.T. Compher
123,penalty,Tripping,Andre Burakovsky,Travis Sanheim,[-11.  23.],2,13:06,COL,PHI,PHI,4,COL,21,3,2,8477444,8477948.0,Andre Burakovsky Tripping against Travis Sanheim
169,penalty,Tripping,Philippe Myers,Nathan MacKinnon,[-65. -18.],2,02:10,PHI,COL,PHI,4,COL,21,3,2,8479026,8477492.0,Philippe Myers Tripping against Nathan MacKinnon
179,penalty,Slashing,Samuel Girard,Philippe Myers,[73. -6.],2,00:00,COL,PHI,PHI,4,COL,21,3,2,8479398,8479026.0,Samuel Girard Slashing against Philippe Myers
235,penalty,Too many men on the ice,Tyson Jost,,[-17.  37.],3,06:23,COL,PHI,PHI,4,COL,21,4,3,8479370,,Too many men/ice served by Tyson Jost
239,penalty,Hooking,Travis Konecny,Matt Calvert,[-68.  38.],3,05:00,PHI,COL,PHI,4,COL,21,4,3,8478439,8474685.0,Travis Konecny Hooking against Matt Calvert
