,event,penalty,penalty_on,drew_by,coords,period,period_time_remaining,penalty_team,drew_by_team,home_team,home_team_id,away_team,away_team_id,home_goals,away_goals,penalty_on_id,drew_by_id,description
39,penalty,Hi-sticking,Ivan Provorov,Kasperi Kapanen,[ 68. -41.],1,06:43,PHI,TOR,PHI,4,TOR,10,0,0,8478500,8477953.0,Ivan Provorov Hi-sticking against Kasperi Kapanen
120,penalty,Holding,Zach Hyman,Shayne Gostisbehere,[ 84. -37.],2,07:47,TOR,PHI,PHI,4,TOR,10,1,0,8475786,8476906.0,Zach Hyman Holding against Shayne Gostisbehere
126,penalty,Hooking,Jake Muzzin,Sean Couturier,[88. -8.],2,05:42,TOR,PHI,PHI,4,TOR,10,1,0,8474162,8476461.0,Jake Muzzin Hooking against Sean Couturier
211,penalty,Interference,Auston Matthews,Claude Giroux,[63. -1.],3,06:18,TOR,PHI,PHI,4,TOR,10,2,1,8479318,8473512.0,Auston Matthews Interference against Claude Giroux
13,penalty,Slashing,Claude Giroux,Lawson Crouse,[68. 24.],1,17:56,PHI,ARI,PHI,4,ARI,53,0,0,8473512,8478474.0,Claude Giroux Slashing against Lawson Crouse
27,penalty,Tripping,Claude Giroux,Vinnie Hinostroza,[-20. -21.],1,14:07,PHI,ARI,PHI,4,ARI,53,0,1,8473512,8476994.0,Claude Giroux Tripping against Vinnie Hinostroza
42,penalty,Tripping,Jakob Chychrun,Jakub Voracek,[-97.   3.],1,10:17,ARI,PHI,PHI,4,ARI,53,0,1,8479345,8474161.0,Jakob Chychrun Tripping against Jakub Voracek
117,penalty,Hi-sticking,Philippe Myers,Michael Grabner,[-42.  -9.],2,11:58,PHI,ARI,PHI,4,ARI,53,0,1,8479026,8473546.0,Philippe Myers Hi-sticking against Michael Grabner
137,penalty,Interference,Jakob Chychrun,Tyler Pitlick,[97. 10.],2,05:56,ARI,PHI,PHI,4,ARI,53,0,1,8479345,8475752.0,Jakob Chychrun Interference against Tyler Pitlick
155,penalty,Slashing,Nick Schmaltz,Philippe Myers,[-50. -20.],2,02:16,ARI,PHI,PHI,4,ARI,53,0,1,8477951,8479026.0,Nick Schmaltz Slashing against Philippe Myers
235,penalty,Cross checking,Kevin Hayes,Oliver Ekman-Larsson,[-96.  -5.],3,02:23,PHI,ARI,PHI,4,ARI,53,1,2,8475763,8475171.0,Kevin Hayes Cross checking against Oliver Ekman-Larsson
50,penalty,Interference,Justin Braun,Vladislav Namestnikov,[73.  1.],1,05:53,PHI,OTT,PHI,4,OTT,9,2,1,8474027,8476480.0,Justin Braun Interference against Vladislav Namestnikov
73,penalty,Fighting,Jakub Voracek,Nick Paul,[12.  2.],1,01:17,PHI,OTT,PHI,4,OTT,9,2,1,8474161,8477426.0,Jakub Voracek Fighting against Nick Paul
74,penalty,Fighting,Nick Paul,Jakub Voracek,[ 1. 12.],1,01:17,OTT,PHI,PHI,4,OTT,9,2,1,8477426,8474161.0,Nick Paul Fighting against Jakub Voracek
83,penalty,Fighting,Joel Farabee,Jean-Gabriel Pageau,[-36.   6.],2,19:41,PHI,OTT,PHI,4,OTT,9,2,1,8480797,8476419.0,Joel Farabee Fighting against Jean-Gabriel Pageau
84,penalty,Fighting,Jean-Gabriel Pageau,Joel Farabee,[-34.   4.],2,19:41,OTT,PHI,PHI,4,OTT,9,2,1,8476419,8480797.0,Jean-Gabriel Pageau Fighting against Joel Farabee
109,penalty,Hooking,Kevin Hayes,Jean-Gabriel Pageau,[-38. -38.],2,11:41,PHI,OTT,PHI,4,OTT,9,2,1,8475763,8476419.0,Kevin Hayes Hooking against Jean-Gabriel Pageau
123,penalty,Too many men on the ice,Brady Tkachuk,,[-27.  38.],2,07:41,OTT,PHI,PHI,4,OTT,9,2,1,8480801,,Too many men/ice served by Brady Tkachuk
186,penalty,Tripping,Ivan Provorov,Brady Tkachuk,[82. -1.],3,09:24,PHI,OTT,PHI,4,OTT,9,3,2,8478500,8480801.0,Ivan Provorov Tripping against Brady Tkachuk
223,penalty,Cross checking,Brady Tkachuk,Scott Laughton,[-23.  26.],3,00:25,OTT,PHI,PHI,4,OTT,9,4,3,8480801,8476872.0,Brady Tkachuk Cross checking against Scott Laughton
225,penalty,Roughing,Brady Tkachuk,Scott Laughton,[-24.  29.],3,00:25,OTT,PHI,PHI,4,OTT,9,4,3,8480801,8476872.0,Brady Tkachuk Roughing against Scott Laughton
29,penalty,Interference,Matt Niskanen,Nazem Kadri,[-60.   6.],1,12:58,PHI,COL,COL,21,PHI,4,1,0,8471702,8475172.0,Matt Niskanen Interference against Nazem Kadri
33,penalty,Hooking,Gabriel Landeskog,Sean Couturier,[-45.   2.],1,12:20,COL,PHI,COL,21,PHI,4,1,0,8476455,8476461.0,Gabriel Landeskog Hooking against Sean Couturier
50,penalty,Cross checking,Robert Hagg,Tyson Jost,[17. 42.],1,08:06,PHI,COL,COL,21,PHI,4,1,0,8477462,8479370.0,Robert Hagg Cross checking against Tyson Jost
192,penalty,Tripping,Nathan MacKinnon,Chris Stewart,[ 0. 20.],3,13:53,COL,PHI,COL,21,PHI,4,3,0,8477492,8473485.0,Nathan MacKinnon Tripping against Chris Stewart
54,penalty,Hi-sticking,Tyler Pitlick,Jakub Voracek,[96. -7.],1,01:42,PHI,MIN,MIN,30,PHI,4,2,1,8475752,8474161.0,Tyler Pitlick Hi-sticking against Victor Rask served by Jakub Voracek
71,penalty,Hooking,Shayne Gostisbehere,Kevin Fiala,[63.  3.],2,15:03,PHI,MIN,MIN,30,PHI,4,2,1,8476906,8477942.0,Shayne Gostisbehere Hooking against Kevin Fiala
89,penalty,Tripping,Matt Niskanen,Ryan Donato,[89. 11.],2,05:05,PHI,MIN,MIN,30,PHI,4,3,1,8471702,8477987.0,Matt Niskanen Tripping against Ryan Donato
94,penalty,Tripping,Brennan Menell,Jakub Voracek,[-67. -13.],2,02:41,MIN,PHI,MIN,30,PHI,4,3,1,8479734,8474161.0,Brennan Menell Tripping against Jakub Voracek
102,penalty,Fighting,Marcus Foligno,Joel Farabee,[50. 35.],2,00:54,MIN,PHI,MIN,30,PHI,4,3,1,8475220,8480797.0,Marcus Foligno Fighting against Joel Farabee
103,penalty,Fighting,Joel Farabee,Marcus Foligno,[-5. 31.],2,00:54,PHI,MIN,MIN,30,PHI,4,3,1,8480797,8475220.0,Joel Farabee Fighting against Marcus Foligno
121,penalty,Tripping,Kevin Fiala,Shayne Gostisbehere,[-37.   3.],3,16:10,MIN,PHI,MIN,30,PHI,4,3,1,8477942,8476906.0,Kevin Fiala Tripping against Shayne Gostisbehere
123,penalty,Tripping,James van Riemsdyk,Ryan Suter,[ 47. -27.],3,15:18,PHI,MIN,MIN,30,PHI,4,3,1,8474037,8470600.0,James van Riemsdyk Tripping against Ryan Suter
135,penalty,Slashing,Chris Stewart,Kevin Fiala,[-18. -35.],3,10:46,PHI,MIN,MIN,30,PHI,4,3,1,8473485,8477942.0,Chris Stewart Slashing against Kevin Fiala
155,penalty,Holding,Kevin Fiala,Shayne Gostisbehere,[-78.  14.],3,04:13,MIN,PHI,MIN,30,PHI,4,3,1,8477942,8476906.0,Kevin Fiala Holding against Shayne Gostisbehere
25,penalty,Embellishment,Morgan Frost,Jack Roslovic,[39. -8.],1,14:29,PHI,WPG,WPG,52,PHI,4,1,0,8480028,8478458.0,Morgan Frost Embellishment against Jack Roslovic
26,penalty,Holding,Jack Roslovic,Morgan Frost,[42. -2.],1,14:29,WPG,PHI,WPG,52,PHI,4,1,0,8478458,8480028.0,Jack Roslovic Holding against Morgan Frost
96,penalty,Hooking,Mark Scheifele,Ivan Provorov,[-38. -32.],2,16:46,WPG,PHI,WPG,52,PHI,4,2,0,8476460,8478500.0,Mark Scheifele Hooking against Ivan Provorov
119,penalty,Interference,Joel Farabee,Chris Stewart,[-94. -26.],2,10:57,PHI,WPG,WPG,52,PHI,4,2,1,8480797,8473485.0,Joel Farabee Interference against Mathieu Perreault served by Chris Stewart
120,penalty,Game misconduct,Joel Farabee,,[-95. -27.],2,10:57,PHI,WPG,WPG,52,PHI,4,2,1,8480797,,Joel Farabee Game misconduct
166,penalty,Delaying Game - Puck over glass,Travis Sanheim,,[-52.  37.],3,17:41,PHI,WPG,WPG,52,PHI,4,6,2,8477948,,Travis Sanheim Delaying Game - Puck over glass
179,penalty,Delaying Game - Puck over glass,Shayne Gostisbehere,,[-70.  42.],3,13:25,PHI,WPG,WPG,52,PHI,4,6,2,8476906,,Shayne Gostisbehere Delaying Game - Puck over glass
33,penalty,Hooking,Chris Stewart,Ryan Getzlaf,[69. -1.],1,13:06,PHI,ANA,PHI,4,ANA,24,0,0,8473485,8470612.0,Chris Stewart Hooking against Ryan Getzlaf
48,penalty,Fighting,Nicolas Deslauriers,Chris Stewart,[81. 24.],1,08:12,ANA,PHI,PHI,4,ANA,24,0,0,8475235,8473485.0,Nicolas Deslauriers Fighting against Chris Stewart
49,penalty,Fighting,Chris Stewart,Nicolas Deslauriers,[82. 25.],1,08:12,PHI,ANA,PHI,4,ANA,24,0,0,8473485,8475235.0,Chris Stewart Fighting against Nicolas Deslauriers
78,penalty,Interference,Hampus Lindholm,Claude Giroux,[72. 36.],1,01:12,ANA,PHI,PHI,4,ANA,24,0,0,8476854,8473512.0,Hampus Lindholm Interference against Claude Giroux
108,penalty,Hi-sticking,Hampus Lindholm,Sean Couturier,[44.  0.],2,14:20,ANA,PHI,PHI,4,ANA,24,2,0,8476854,8476461.0,Hampus Lindholm Hi-sticking against Sean Couturier
149,penalty,Tripping,Claude Giroux,Rickard Rakell,[ 68. -37.],2,04:04,PHI,ANA,PHI,4,ANA,24,2,0,8473512,8476483.0,Claude Giroux Tripping against Rickard Rakell
157,penalty,Kneeing,Nicolas Aube-Kubel,Troy Terry,[ 51. -32.],2,01:58,PHI,ANA,PHI,4,ANA,24,2,1,8477979,8478873.0,Nicolas Aube-Kubel Kneeing against Troy Terry
177,penalty,Boarding,Matt Niskanen,Ondrej Kase,[98. -5.],3,18:30,PHI,ANA,PHI,4,ANA,24,2,1,8471702,8478131.0,Matt Niskanen Boarding against Ondrej Kase
178,penalty,Roughing,Travis Konecny,Erik Gudbranson,[95. 18.],3,18:30,PHI,ANA,PHI,4,ANA,24,2,1,8478439,8475790.0,Travis Konecny Roughing against Erik Gudbranson
179,penalty,Roughing,Erik Gudbranson,Travis Konecny,[95. 21.],3,18:30,ANA,PHI,PHI,4,ANA,24,2,1,8475790,8478439.0,Erik Gudbranson Roughing against Travis Konecny
204,penalty,Tripping,Kevin Hayes,Josh Manson,[-94.  25.],3,12:20,PHI,ANA,PHI,4,ANA,24,3,1,8475763,8476312.0,Kevin Hayes Tripping against Josh Manson
26,penalty,Cross checking,Morgan Frost,Johan Larsson,[63. 40.],1,12:05,PHI,BUF,PHI,4,BUF,7,0,0,8480028,8475728.0,Morgan Frost Cross checking against Johan Larsson
42,penalty,Missing key [PD_151],Kyle Okposo,,[-12. -38.],1,04:28,BUF,PHI,PHI,4,BUF,7,2,0,8473449,,Delaying Game - Unsucc. chlg served by Kyle Okposo
72,penalty,Hooking,Colin Miller,Nicolas Aube-Kubel,[81. -3.],2,18:02,BUF,PHI,PHI,4,BUF,7,3,0,8476525,8477979.0,Colin Miller Hooking against Nicolas Aube-Kubel
99,penalty,Holding,Rasmus Ristolainen,Sean Couturier,[79. -5.],2,11:45,BUF,PHI,PHI,4,BUF,7,3,0,8477499,8476461.0,Rasmus Ristolainen Holding against Sean Couturier
116,penalty,Slashing,Brandon Montour,Travis Sanheim,[65.  3.],2,07:53,BUF,PHI,PHI,4,BUF,7,5,0,8477986,8477948.0,Brandon Montour Slashing against Travis Sanheim
130,penalty,Slashing,Rasmus Dahlin,Travis Konecny,[75. 37.],2,01:24,BUF,PHI,PHI,4,BUF,7,6,0,8480839,8478439.0,Rasmus Dahlin Slashing against Travis Konecny
131,penalty,Cross checking,Rasmus Dahlin,Kyle Okposo,[74. 35.],2,01:24,BUF,PHI,PHI,4,BUF,7,6,0,8480839,8473449.0,Rasmus Dahlin Cross checking against Claude Giroux served by Kyle Okposo
132,penalty,Roughing,Travis Konecny,Rasmus Dahlin,[80. 35.],2,01:24,PHI,BUF,PHI,4,BUF,7,6,0,8478439,8480839.0,Travis Konecny Roughing against Rasmus Dahlin
171,penalty,Interference,Jakub Voracek,Jeff Skinner,[ 16. -32.],3,09:59,PHI,BUF,PHI,4,BUF,7,6,0,8474161,8475784.0,Jakub Voracek Interference against Jeff Skinner
11,penalty,Tripping,Thomas Chabot,Nicolas Aube-Kubel,[-95.   7.],1,18:18,OTT,PHI,OTT,9,PHI,4,0,0,8478469,8477979.0,Thomas Chabot Tripping against Nicolas Aube-Kubel
50,penalty,Slashing,Andy Andreoff,Vladislav Namestnikov,[54. 31.],1,10:15,PHI,OTT,OTT,9,PHI,4,0,1,8476404,8476480.0,Andy Andreoff Slashing against Vladislav Namestnikov
56,penalty,Holding,Thomas Chabot,Sean Couturier,[-77.   2.],1,09:33,OTT,PHI,OTT,9,PHI,4,0,1,8478469,8476461.0,Thomas Chabot Holding against Sean Couturier
79,penalty,Hooking,Claude Giroux,Andreas Englund,[-95. -21.],1,04:07,PHI,OTT,OTT,9,PHI,4,0,1,8473512,8477971.0,Claude Giroux Hooking against Andreas Englund
145,penalty,Too many men on the ice,Brady Tkachuk,,[-10.  38.],2,10:41,OTT,PHI,OTT,9,PHI,4,2,2,8480801,,Too many men/ice served by Brady Tkachuk
153,penalty,Holding,Shayne Gostisbehere,Anthony Duclair,[-80.  -1.],2,08:39,PHI,OTT,OTT,9,PHI,4,2,2,8476906,8477407.0,Shayne Gostisbehere Holding against Anthony Duclair
176,penalty,Tripping,Shayne Gostisbehere,Colin White,[-82.  17.],2,02:39,PHI,OTT,OTT,9,PHI,4,2,2,8476906,8478400.0,Shayne Gostisbehere Tripping against Colin White
207,penalty,Interference,Erik Brannstrom,Jakub Voracek,[-27.  -5.],3,15:14,OTT,PHI,OTT,9,PHI,4,3,4,8480073,8474161.0,Erik Brannstrom Interference against Jakub Voracek
257,penalty,Too many men on the ice,Brady Tkachuk,,[-22.  39.],3,02:50,OTT,PHI,OTT,9,PHI,4,4,4,8480801,,Too many men/ice served by Brady Tkachuk
3,penalty,Tripping,Pavel Buchnevich,Travis Sanheim,[7. 7.],1,19:05,NYR,PHI,PHI,4,NYR,3,0,0,8477402,8477948.0,Pavel Buchnevich Tripping against Travis Sanheim
27,penalty,Hooking,Travis Sanheim,Brendan Lemieux,[ 93. -30.],1,12:42,PHI,NYR,PHI,4,NYR,3,0,0,8477948,8477962.0,Travis Sanheim Hooking against Brendan Lemieux
31,penalty,Tripping,Philippe Myers,Mika Zibanejad,[74. 28.],1,11:46,PHI,NYR,PHI,4,NYR,3,0,0,8479026,8476459.0,Philippe Myers Tripping against Mika Zibanejad
42,penalty,Tripping,Greg McKegg,Shayne Gostisbehere,[-67. -25.],1,09:03,NYR,PHI,PHI,4,NYR,3,0,0,8475735,8476906.0,Greg McKegg Tripping against Shayne Gostisbehere
89,penalty,Hooking,Ryan Strome,Nicolas Aube-Kubel,[93. 30.],2,18:32,NYR,PHI,PHI,4,NYR,3,0,0,8476458,8477979.0,Ryan Strome Hooking against Nicolas Aube-Kubel
99,penalty,Tripping,Jakub Voracek,Ryan Lindgren,[  2. -32.],2,16:44,PHI,NYR,PHI,4,NYR,3,0,0,8474161,8479324.0,Jakub Voracek Tripping against Ryan Lindgren
107,penalty,Slashing,Brett Howden,Nicolas Aube-Kubel,[-26. -31.],2,14:01,NYR,PHI,PHI,4,NYR,3,0,0,8479353,8477979.0,Brett Howden Slashing against Nicolas Aube-Kubel
137,penalty,Hooking,Travis Konecny,Chris Kreider,[-76.   0.],2,06:59,PHI,NYR,PHI,4,NYR,3,0,1,8478439,8475184.0,Travis Konecny Hooking against Chris Kreider
146,penalty,Slashing,Greg McKegg,Shayne Gostisbehere,[ 28. -18.],2,04:23,NYR,PHI,PHI,4,NYR,3,0,1,8475735,8476906.0,Greg McKegg Slashing against Shayne Gostisbehere
232,penalty,Roughing,Tony DeAngelo,James van Riemsdyk,[-17.  -1.],3,01:51,NYR,PHI,PHI,4,NYR,3,4,1,8477950,8474037.0,Tony DeAngelo Roughing against James van Riemsdyk
49,penalty,Interference - Goalkeeper,Timo Meier,Carter Hart,[84.  0.],1,08:09,SJS,PHI,SJS,28,PHI,4,1,0,8478414,8479394.0,Timo Meier Interference - Goalkeeper against Carter Hart
103,penalty,Holding,Matt Niskanen,Tomas Hertl,[-54.  20.],2,14:00,PHI,SJS,SJS,28,PHI,4,2,0,8471702,8476881.0,Matt Niskanen Holding against Tomas Hertl
141,penalty,Hooking,Patrick Marleau,Ivan Provorov,[98.  0.],2,02:10,SJS,PHI,SJS,28,PHI,4,3,0,8466139,8478500.0,Patrick Marleau Hooking against Ivan Provorov
148,penalty,Tripping,Barclay Goodrow,Ivan Provorov,[76. -4.],2,00:06,SJS,PHI,SJS,28,PHI,4,3,0,8476624,8478500.0,Barclay Goodrow Tripping against Ivan Provorov
18,penalty,Holding,Josh Manson,Sean Couturier,[ 1. 34.],1,16:15,ANA,PHI,ANA,24,PHI,4,1,0,8476312,8476461.0,Josh Manson Holding against Sean Couturier
23,penalty,Interference,Nicolas Aube-Kubel,Ondrej Kase,[-55.  14.],1,15:04,PHI,ANA,ANA,24,PHI,4,1,0,8477979,8478131.0,Nicolas Aube-Kubel Interference against Ondrej Kase
76,penalty,Slashing,Mikhail Vorobyev,Nicolas Deslauriers,[ 7. 39.],1,01:54,PHI,ANA,ANA,24,PHI,4,1,1,8478844,8475235.0,Mikhail Vorobyev Slashing against Nicolas Deslauriers
148,penalty,Tripping,Ondrej Kase,Travis Konecny,[77.  6.],2,03:41,ANA,PHI,ANA,24,PHI,4,1,1,8478131,8478439.0,Ondrej Kase Tripping against Travis Konecny
188,penalty,Tripping,Mikhail Vorobyev,Korbinian Holzer,[-97.   7.],3,13:54,PHI,ANA,ANA,24,PHI,4,1,1,8478844,8473560.0,Mikhail Vorobyev Tripping against Korbinian Holzer
191,penalty,Boarding,Matt Niskanen,Adam Henrique,[94. 25.],3,13:04,PHI,ANA,ANA,24,PHI,4,1,1,8471702,8474641.0,Matt Niskanen Boarding against Adam Henrique
25,penalty,Holding,Robert Hagg,Kyle Clifford,[-61.  36.],1,13:50,PHI,LAK,LAK,26,PHI,4,1,0,8477462,8475160.0,Robert Hagg Holding against Kyle Clifford
33,penalty,Roughing,Scott Laughton,Michael Amadio,[72. 33.],1,11:53,PHI,LAK,LAK,26,PHI,4,2,0,8476872,8478020.0,Scott Laughton Roughing against Michael Amadio
69,penalty,Hi-sticking,Anze Kopitar,Jakub Voracek,[-94.  19.],1,03:37,LAK,PHI,LAK,26,PHI,4,3,0,8471685,8474161.0,Anze Kopitar Hi-sticking against Jakub Voracek
135,penalty,Roughing,Austin Wagner,Matt Niskanen,[-13. -27.],2,03:01,LAK,PHI,LAK,26,PHI,4,4,1,8478455,8471702.0,Austin Wagner Roughing against Matt Niskanen
145,penalty,Boarding,Scott Laughton,Blake Lizotte,[-67.  42.],2,00:24,PHI,LAK,LAK,26,PHI,4,4,1,8476872,8481481.0,Scott Laughton Boarding against Blake Lizotte
163,penalty,Holding the stick,Anze Kopitar,Claude Giroux,[ 0. 33.],3,13:46,LAK,PHI,LAK,26,PHI,4,5,1,8471685,8473512.0,Anze Kopitar Holding the stick against Claude Giroux
52,penalty,Slashing,Sean Couturier,Mark Stone,[33. 24.],1,10:08,PHI,VGK,VGK,54,PHI,4,1,1,8476461,8475913.0,Sean Couturier Slashing against Mark Stone
78,penalty,PS - Hooking on breakaway,Nick Holden,Scott Laughton,[80. -2.],1,06:37,VGK,PHI,VGK,54,PHI,4,3,1,8474207,8476872.0,Nick Holden PS - Hooking on breakaway against Scott Laughton
192,penalty,Tripping,Ryan Reaves,Philippe Myers,[-80.  38.],2,01:45,VGK,PHI,VGK,54,PHI,4,5,3,8471817,8479026.0,Ryan Reaves Tripping against Philippe Myers
269,penalty,Delaying Game - Puck over glass,Reilly Smith,,[40. 40.],3,02:46,VGK,PHI,VGK,54,PHI,4,5,4,8475191,,Reilly Smith Delaying Game - Puck over glass
280,penalty,Cross checking,Deryk Engelland,Jakub Voracek,[80. -6.],3,01:29,VGK,PHI,VGK,54,PHI,4,5,4,8468674,8474161.0,Deryk Engelland Cross checking against Jakub Voracek
28,penalty,Holding the stick,Sean Couturier,Christian Fischer,[-10.  35.],1,14:19,PHI,ARI,ARI,53,PHI,4,0,0,8476461,8478432.0,Sean Couturier Holding the stick against Christian Fischer
71,penalty,Roughing,Travis Sanheim,Taylor Hall,[81.  1.],1,04:37,PHI,ARI,ARI,53,PHI,4,2,0,8477948,8475791.0,Travis Sanheim Roughing against Taylor Hall
83,penalty,Interference,Vinnie Hinostroza,Travis Sanheim,[ -4. -13.],1,02:36,ARI,PHI,ARI,53,PHI,4,3,0,8476994,8477948.0,Vinnie Hinostroza Interference against Travis Sanheim
114,penalty,Interference,Scott Laughton,Jordan Oesterle,[33. 38.],2,15:24,PHI,ARI,ARI,53,PHI,4,3,0,8476872,8477851.0,Scott Laughton Interference against Jordan Oesterle
125,penalty,Hooking,Christian Dvorak,Nicolas Aube-Kubel,[66.  3.],2,11:42,ARI,PHI,ARI,53,PHI,4,3,0,8477989,8477979.0,Christian Dvorak Hooking against Nicolas Aube-Kubel
135,penalty,Hooking,Jordan Oesterle,Nicolas Aube-Kubel,[84. -8.],2,09:12,ARI,PHI,ARI,53,PHI,4,3,0,8477851,8477979.0,Jordan Oesterle Hooking against Nicolas Aube-Kubel
142,penalty,Hooking,Claude Giroux,Brad Richardson,[72. 39.],2,07:38,PHI,ARI,ARI,53,PHI,4,3,0,8473512,8470755.0,Claude Giroux Hooking against Brad Richardson
168,penalty,Hooking,Scott Laughton,Conor Garland,[-66.   4.],2,02:34,PHI,ARI,ARI,53,PHI,4,3,0,8476872,8478856.0,Scott Laughton Hooking against Conor Garland
177,penalty,Roughing,Vinnie Hinostroza,Travis Konecny,[12. 19.],2,00:00,ARI,PHI,ARI,53,PHI,4,4,0,8476994,8478439.0,Vinnie Hinostroza Roughing against Travis Konecny
178,penalty,Roughing,Travis Konecny,Vinnie Hinostroza,[11. 22.],2,00:00,PHI,ARI,ARI,53,PHI,4,4,0,8478439,8476994.0,Travis Konecny Roughing against Vinnie Hinostroza
238,penalty,Tripping,Phil Kessel,Sean Couturier,[-37.   5.],3,03:21,ARI,PHI,ARI,53,PHI,4,5,2,8473548,8476461.0,Phil Kessel Tripping against Sean Couturier
106,penalty,Tripping,Erik Haula,Jakub Voracek,[-53.  39.],1,00:21,CAR,PHI,CAR,12,PHI,4,2,2,8475287,8474161.0,Erik Haula Tripping against Jakub Voracek
172,penalty,Delaying Game - Puck over glass,Tyler Pitlick,,[ 28. -38.],2,04:54,PHI,CAR,CAR,12,PHI,4,4,3,8475752,,Tyler Pitlick Delaying Game - Puck over glass
205,penalty,Slashing,Andrei Svechnikov,Travis Konecny,[-96. -13.],3,16:06,CAR,PHI,CAR,12,PHI,4,4,3,8480830,8478439.0,Andrei Svechnikov Slashing against Travis Konecny
63,penalty,Tripping,Lars Eller,Jakub Voracek,[-60.  32.],1,02:51,WSH,PHI,PHI,4,WSH,15,1,2,8474189,8474161.0,Lars Eller Tripping against Jakub Voracek
64,penalty,Misconduct,Richard Panik,,[ -6. -40.],1,02:51,WSH,PHI,PHI,4,WSH,15,1,2,8475209,,Richard Panik Misconduct
94,penalty,Hi-sticking,Philippe Myers,Tom Wilson,[44. 32.],2,16:20,PHI,WSH,PHI,4,WSH,15,2,2,8479026,8476880.0,Philippe Myers Hi-sticking against Tom Wilson
133,penalty,Delaying Game - Puck over glass,Mikhail Vorobyev,,[-75.  40.],2,05:04,PHI,WSH,PHI,4,WSH,15,2,2,8478844,,Mikhail Vorobyev Delaying Game - Puck over glass
142,penalty,Slashing,Sean Couturier,Nick Jensen,[ 3. 41.],2,02:27,PHI,WSH,PHI,4,WSH,15,2,2,8476461,8475324.0,Sean Couturier Slashing against Nick Jensen
186,penalty,Slashing,Sean Couturier,Tom Wilson,[ 78. -32.],3,11:11,PHI,WSH,PHI,4,WSH,15,3,2,8476461,8476880.0,Sean Couturier Slashing against Tom Wilson
210,penalty,Tripping,Philippe Myers,Jakub Vrana,[49. 24.],3,05:30,PHI,WSH,PHI,4,WSH,15,3,2,8479026,8477944.0,Philippe Myers Tripping against Jakub Vrana
218,penalty,Hooking,Dmitry Orlov,Jakub Voracek,[-57. -10.],3,02:36,WSH,PHI,PHI,4,WSH,15,3,2,8475200,8474161.0,Dmitry Orlov Hooking against Jakub Voracek
12,penalty,Holding,Mitchell Stephens,David Kase,[11. 29.],1,17:12,TBL,PHI,PHI,4,TBL,14,0,0,8478477,8478436.0,Mitchell Stephens Holding against David Kase
29,penalty,Holding,Robert Hagg,Alexander Volkov,[64. 39.],1,13:02,PHI,TBL,PHI,4,TBL,14,0,0,8477462,8480186.0,Robert Hagg Holding against Alexander Volkov
50,penalty,Hi stick - double minor,Travis Konecny,Victor Hedman,[-98. -14.],1,06:17,PHI,TBL,PHI,4,TBL,14,0,0,8478439,8475167.0,Travis Konecny Hi stick - double minor against Victor Hedman
103,penalty,Slashing,Pat Maroon,Mark Friedman,[-85. -32.],2,14:52,TBL,PHI,PHI,4,TBL,14,0,0,8474034,8478017.0,Pat Maroon Slashing against Mark Friedman
162,penalty,Hooking,Kevin Hayes,Pat Maroon,[ 79. -11.],3,18:13,PHI,TBL,PHI,4,TBL,14,0,1,8475763,8474034.0,Kevin Hayes Hooking against Pat Maroon
211,penalty,Hi-sticking,Kevin Shattenkirk,Travis Konecny,[-98. -19.],3,05:35,TBL,PHI,PHI,4,TBL,14,0,1,8474031,8478439.0,Kevin Shattenkirk Hi-sticking against Travis Konecny
60,penalty,Roughing,Mark Friedman,Anders Bjork,[96. 14.],1,08:05,PHI,BOS,PHI,4,BOS,6,0,1,8478017,8478075.0,Mark Friedman Roughing against Anders Bjork
61,penalty,Roughing,Anders Bjork,Mark Friedman,[91. 24.],1,08:05,BOS,PHI,PHI,4,BOS,6,0,1,8478075,8478017.0,Anders Bjork Roughing against Mark Friedman
72,penalty,Tripping,Michael Raffl,Patrice Bergeron,[-74. -17.],1,04:30,PHI,BOS,PHI,4,BOS,6,0,1,8477290,8470638.0,Michael Raffl Tripping against Patrice Bergeron
84,penalty,Hi stick - double minor,Patrice Bergeron,Scott Laughton,[70.  0.],1,02:00,BOS,PHI,PHI,4,BOS,6,0,2,8470638,8476872.0,Patrice Bergeron Hi stick - double minor against Scott Laughton
141,penalty,Roughing,Chris Wagner,Travis Konecny,[86. 35.],2,10:58,BOS,PHI,PHI,4,BOS,6,2,5,8475780,8478439.0,Chris Wagner Roughing against Travis Konecny
186,penalty,Interference,Matt Niskanen,Brad Marchand,[28. 38.],3,19:32,PHI,BOS,PHI,4,BOS,6,4,5,8471702,8473419.0,Matt Niskanen Interference against Brad Marchand
231,penalty,Roughing,Joel Farabee,Torey Krug,[ 4. 39.],3,07:30,PHI,BOS,PHI,4,BOS,6,4,5,8480797,8476792.0,Joel Farabee Roughing against Torey Krug
232,penalty,Roughing,Torey Krug,Joel Farabee,[ 4. 39.],3,07:30,BOS,PHI,PHI,4,BOS,6,4,5,8476792,8480797.0,Torey Krug Roughing against Joel Farabee
53,penalty,Holding,Matt Niskanen,Jaden Schwartz,[97.  1.],1,06:51,PHI,STL,STL,19,PHI,4,0,0,8471702,8475768.0,Matt Niskanen Holding against Jaden Schwartz
69,penalty,Tripping,Michael Raffl,Jaden Schwartz,[-58.  39.],1,04:01,PHI,STL,STL,19,PHI,4,1,0,8477290,8475768.0,Michael Raffl Tripping against Jaden Schwartz
122,penalty,Interference - Goalkeeper,Brayden Schenn,Brian Elliott,[-86.   1.],2,09:54,STL,PHI,STL,19,PHI,4,1,0,8475170,8470880.0,Brayden Schenn Interference - Goalkeeper against Brian Elliott
130,penalty,Roughing,Ivan Barbashev,Travis Sanheim,[-67.  41.],2,07:17,STL,PHI,STL,19,PHI,4,1,1,8477964,8477948.0,Ivan Barbashev Roughing against Travis Sanheim
131,penalty,Roughing,Travis Sanheim,Ivan Barbashev,[-45.  38.],2,07:17,PHI,STL,STL,19,PHI,4,1,1,8477948,8477964.0,Travis Sanheim Roughing against Ivan Barbashev
160,penalty,Cross checking,David Perron,Travis Konecny,[-73. -38.],2,00:00,STL,PHI,STL,19,PHI,4,1,2,8474102,8478439.0,David Perron Cross checking against Travis Konecny
164,penalty,Holding,Michael Raffl,Jaden Schwartz,[91. 28.],3,18:57,PHI,STL,STL,19,PHI,4,1,3,8477290,8475768.0,Michael Raffl Holding against Jaden Schwartz
166,penalty,Hooking,Kevin Hayes,Brayden Schenn,[61. 13.],3,18:38,PHI,STL,STL,19,PHI,4,1,3,8475763,8475170.0,Kevin Hayes Hooking against Brayden Schenn
185,penalty,Slashing,Nicolas Aube-Kubel,Niko Mikkola,[-95. -17.],3,12:59,PHI,STL,STL,19,PHI,4,1,3,8477979,8478859.0,Nicolas Aube-Kubel Slashing against Niko Mikkola
223,penalty,Too many men on the ice,Travis Konecny,,[0. 2.],3,04:24,PHI,STL,STL,19,PHI,4,3,3,8478439,,Too many men/ice served by Travis Konecny
25,penalty,Tripping,Nicolas Aube-Kubel,Victor Mete,[-78. -34.],1,14:39,PHI,MTL,PHI,4,MTL,8,0,0,8477979,8479376.0,Nicolas Aube-Kubel Tripping against Victor Mete
88,penalty,Hooking,Kevin Hayes,Joel Armia,[-51.  -6.],2,19:05,PHI,MTL,PHI,4,MTL,8,1,1,8475763,8476469.0,Kevin Hayes Hooking against Joel Armia
109,penalty,Tripping,Dale Weise,Ivan Provorov,[-88. -27.],2,14:43,MTL,PHI,PHI,4,MTL,8,1,3,8474668,8478500.0,Dale Weise Tripping against Ivan Provorov
125,penalty,Holding,Connor Bunnaman,Joel Armia,[-94.  14.],2,10:53,PHI,MTL,PHI,4,MTL,8,1,3,8479382,8476469.0,Connor Bunnaman Holding against Joel Armia
157,penalty,Tripping,Marco Scandella,Travis Konecny,[94. 27.],2,03:15,MTL,PHI,PHI,4,MTL,8,1,3,8474618,8478439.0,Marco Scandella Tripping against Travis Konecny
189,penalty,Fighting,Robert Hagg,Jesperi Kotkaniemi,[53. 42.],3,18:13,PHI,MTL,PHI,4,MTL,8,1,3,8477462,8480829.0,Robert Hagg Fighting against Jesperi Kotkaniemi
190,penalty,Instigator,Jesperi Kotkaniemi,Nick Cousins,[51. 34.],3,18:13,MTL,PHI,PHI,4,MTL,8,1,3,8480829,8476393.0,Jesperi Kotkaniemi Instigator against Robert Hagg served by Nick Cousins
191,penalty,Fighting,Jesperi Kotkaniemi,Robert Hagg,[47. 37.],3,18:13,MTL,PHI,PHI,4,MTL,8,1,3,8480829,8477462.0,Jesperi Kotkaniemi Fighting against Robert Hagg
192,penalty,Misconduct,Jesperi Kotkaniemi,Robert Hagg,[61. 35.],3,18:13,MTL,PHI,PHI,4,MTL,8,1,3,8480829,8477462.0,Jesperi Kotkaniemi Misconduct against Robert Hagg
212,penalty,Tripping,Phillip Danault,Tyler Pitlick,[-32. -11.],3,13:57,MTL,PHI,PHI,4,MTL,8,1,3,8476479,8475752.0,Phillip Danault Tripping against Tyler Pitlick
87,penalty,Missing key [PD_151],James van Riemsdyk,,[ 12. -34.],2,19:07,PHI,LAK,PHI,4,LAK,26,1,0,8474037,,Delaying Game - Unsucc. chlg served by James van Riemsdyk
123,penalty,Hi-sticking,Drew Doughty,Joel Farabee,[95. -7.],2,09:26,LAK,PHI,PHI,4,LAK,26,2,0,8474563,8480797.0,Drew Doughty Hi-sticking against Joel Farabee
156,penalty,Holding the stick,Claude Giroux,Anze Kopitar,[-71. -21.],2,03:53,PHI,LAK,PHI,4,LAK,26,3,0,8473512,8471685.0,Claude Giroux Holding the stick against Anze Kopitar
