,event,penalty,penalty_on,drew_by,coords,period,period_time_remaining,penalty_team,drew_by_team,home_team,home_team_id,away_team,away_team_id,home_goals,away_goals,penalty_on_id,drew_by_id,description
225,penalty,Too many men on the ice,Chris Stewart,,[  6. -32.],3,10:03,PHI,CBJ,PHI,4,CBJ,29,2,4,8473485,,Too many men/ice served by Chris Stewart
248,penalty,Tripping,Sean Couturier,Josh Anderson,[-32. -27.],3,05:57,PHI,CBJ,PHI,4,CBJ,29,4,4,8476461,8476981.0,Sean Couturier Tripping against Josh Anderson
269,penalty,Slashing,Pierre-Luc Dubois,Claude Giroux,[-7. -3.],3,00:21,CBJ,PHI,PHI,4,CBJ,29,6,4,8479400,8473512.0,Pierre-Luc Dubois Slashing against Claude Giroux
14,penalty,Holding,Oliver Bjorkstrand,Riley Sheahan,[-69.  40.],1,16:48,CBJ,EDM,CBJ,29,EDM,22,0,0,8477416,8475772.0,Oliver Bjorkstrand Holding against Riley Sheahan
25,penalty,Tripping,Pierre-Luc Dubois,Ethan Bear,[-19.   3.],1,12:32,CBJ,EDM,CBJ,29,EDM,22,0,0,8479400,8478451.0,Pierre-Luc Dubois Tripping against Ethan Bear
49,penalty,Interference,Sonny Milano,Matt Benning,[ 24. -29.],1,05:01,CBJ,EDM,CBJ,29,EDM,22,0,1,8477947,8476988.0,Sonny Milano Interference against Matt Benning
96,penalty,Holding,Ryan Nugent-Hopkins,Boone Jenner,[87. 27.],2,14:54,EDM,CBJ,CBJ,29,EDM,22,0,4,8476454,8476432.0,Ryan Nugent-Hopkins Holding against Boone Jenner
134,penalty,Holding the stick,Zack Kassian,Gustav Nyquist,[61. 40.],2,04:08,EDM,CBJ,CBJ,29,EDM,22,1,4,8475178,8474679.0,Zack Kassian Holding the stick against Gustav Nyquist
136,penalty,Hi-sticking,Ethan Bear,Cam Atkinson,[-69. -25.],2,03:55,EDM,CBJ,CBJ,29,EDM,22,1,4,8478451,8474715.0,Ethan Bear Hi-sticking against Cam Atkinson
149,penalty,Too many men on the ice,Sonny Milano,,[-20.  40.],2,00:21,CBJ,EDM,CBJ,29,EDM,22,1,4,8477947,,Too many men/ice served by Sonny Milano
203,penalty,Too many men on the ice,Sonny Milano,,[-17.  42.],3,05:15,CBJ,EDM,CBJ,29,EDM,22,1,4,8477947,,Too many men/ice served by Sonny Milano
17,penalty,Too many men on the ice,Sonny Milano,,[0. 1.],1,15:25,CBJ,STL,STL,19,CBJ,29,0,0,8477947,,Too many men/ice served by Sonny Milano
37,penalty,Too many men on the ice,David Perron,,[0. 0.],1,09:51,STL,CBJ,STL,19,CBJ,29,0,0,8474102,,Too many men/ice served by David Perron
110,penalty,Hooking,Alexander Steen,Pierre-Luc Dubois,[ 28. -38.],2,10:11,STL,CBJ,STL,19,CBJ,29,1,2,8470257,8479400.0,Alexander Steen Hooking against Pierre-Luc Dubois
119,penalty,Interference,Sonny Milano,Alex Pietrangelo,[ 56. -41.],2,08:33,CBJ,STL,STL,19,CBJ,29,1,3,8477947,8474565.0,Sonny Milano Interference against Alex Pietrangelo
135,penalty,Slashing,Zach Sanford,Josh Anderson,[  9. -33.],2,05:01,STL,CBJ,STL,19,CBJ,29,3,3,8477482,8476981.0,Zach Sanford Slashing against Josh Anderson
158,penalty,Hooking,Vladislav Gavrikov,Oskar Sundqvist,[74. -1.],3,19:49,CBJ,STL,STL,19,CBJ,29,3,3,8478882,8476897.0,Vladislav Gavrikov Hooking against Oskar Sundqvist
217,penalty,Hooking,Sonny Milano,Alex Pietrangelo,[-77. -15.],3,01:52,CBJ,STL,STL,19,CBJ,29,3,3,8477947,8474565.0,Sonny Milano Hooking against Alex Pietrangelo
74,penalty,Hi-sticking,Sonny Milano,Rasmus Andersson,[51. 39.],1,00:28,CBJ,CGY,CBJ,29,CGY,20,0,1,8477947,8478397.0,Sonny Milano Hi-sticking against Rasmus Andersson
95,penalty,Roughing,Milan Lucic,Kole Sherwood,[-98.  -7.],2,15:08,CGY,CBJ,CBJ,29,CGY,20,0,1,8473473,8478949.0,Milan Lucic Roughing against Kole Sherwood
96,penalty,Roughing,Milan Lucic,Matthew Tkachuk,[-97.   3.],2,15:08,CGY,CBJ,CBJ,29,CGY,20,0,1,8473473,8479314.0,Milan Lucic Roughing against Kole Sherwood served by Matthew Tkachuk
97,penalty,Slashing,Kole Sherwood,Emil Bemstrom,[-94.   7.],2,15:08,CBJ,CGY,CBJ,29,CGY,20,0,1,8478949,8480205.0,Kole Sherwood Slashing against David Rittich served by Emil Bemstrom
142,penalty,Slashing,Sam Bennett,Gustav Nyquist,[-87.  -6.],2,03:18,CGY,CBJ,CBJ,29,CGY,20,0,2,8477935,8474679.0,Sam Bennett Slashing against Gustav Nyquist
168,penalty,Holding,Mark Giordano,Pierre-Luc Dubois,[ 70. -36.],3,17:17,CGY,CBJ,CBJ,29,CGY,20,0,2,8470966,8479400.0,Mark Giordano Holding against Pierre-Luc Dubois
184,penalty,Cross checking,Zach Werenski,Sam Bennett,[-82.   0.],3,13:27,CBJ,CGY,CBJ,29,CGY,20,0,2,8478460,8477935.0,Zach Werenski Cross checking against Sam Bennett
10,penalty,Hooking,Josh Anderson,Paul Stastny,[-93.  28.],1,18:02,CBJ,VGK,CBJ,29,VGK,54,0,0,8476981,8471669.0,Josh Anderson Hooking against Paul Stastny
27,penalty,Slashing,Ryan Reaves,Dean Kukan,[-22.  37.],1,12:16,VGK,CBJ,CBJ,29,VGK,54,0,0,8471817,8478567.0,Ryan Reaves Slashing against Dean Kukan
66,penalty,Missing key [PD_151],Sonny Milano,,[-20.  42.],1,00:45,CBJ,VGK,CBJ,29,VGK,54,0,1,8477947,,Delaying Game - Unsucc. chlg served by Sonny Milano
88,penalty,Hooking,Tomas Nosek,Sonny Milano,[-98.   1.],2,13:35,VGK,CBJ,CBJ,29,VGK,54,1,1,8477931,8477947.0,Tomas Nosek Hooking against Sonny Milano
104,penalty,Interference - Goalkeeper,Nicolas Roy,Joonas Korpisalo,[84.  2.],2,09:33,VGK,CBJ,CBJ,29,VGK,54,1,2,8478462,8476914.0,Nicolas Roy Interference - Goalkeeper against Joonas Korpisalo
135,penalty,Slashing,Gustav Nyquist,Jon Merrill,[-80.  -5.],2,00:53,CBJ,VGK,CBJ,29,VGK,54,1,2,8474679,8475750.0,Gustav Nyquist Slashing against Jon Merrill
179,penalty,Hi-sticking,Jon Merrill,Oliver Bjorkstrand,[70. 30.],3,06:54,VGK,CBJ,CBJ,29,VGK,54,1,2,8475750,8477416.0,Jon Merrill Hi-sticking against Oliver Bjorkstrand
44,penalty,Tripping,Scott Harrington,Vinnie Hinostroza,[ 27. -39.],1,11:18,CBJ,ARI,ARI,53,CBJ,29,0,1,8476449,8476994.0,Scott Harrington Tripping against Vinnie Hinostroza
69,penalty,Tripping,Barrett Hayton,Boone Jenner,[89. 20.],1,03:25,ARI,CBJ,ARI,53,CBJ,29,1,1,8480849,8476432.0,Barrett Hayton Tripping against Boone Jenner
83,penalty,Holding,Ilya Lyubushkin,Cam Atkinson,[-86.  20.],1,00:08,ARI,CBJ,ARI,53,CBJ,29,1,1,8480950,8474715.0,Ilya Lyubushkin Holding against Cam Atkinson
150,penalty,Tripping,Alex Goligoski,Sonny Milano,[70. 15.],2,02:56,ARI,CBJ,ARI,53,CBJ,29,2,1,8471274,8477947.0,Alex Goligoski Tripping against Sonny Milano
156,penalty,Roughing,Pierre-Luc Dubois,Jakob Chychrun,[96. 21.],2,01:10,CBJ,ARI,ARI,53,CBJ,29,2,2,8479400,8479345.0,Pierre-Luc Dubois Roughing against Jakob Chychrun
157,penalty,Cross checking,Jakob Chychrun,Oliver Bjorkstrand,[65. 41.],2,01:10,ARI,CBJ,ARI,53,CBJ,29,2,2,8479345,8477416.0,Jakob Chychrun Cross checking against Oliver Bjorkstrand
175,penalty,Interference,Alexandre Texier,Michael Grabner,[82.  4.],3,17:27,CBJ,ARI,ARI,53,CBJ,29,2,2,8480074,8473546.0,Alexandre Texier Interference against Michael Grabner
183,penalty,Tripping,Clayton Keller,Gustav Nyquist,[-30. -38.],3,14:37,ARI,CBJ,ARI,53,CBJ,29,2,2,8479343,8474679.0,Clayton Keller Tripping against Gustav Nyquist
226,penalty,Hooking,Vladislav Gavrikov,Clayton Keller,[ 70. -15.],3,01:48,CBJ,ARI,ARI,53,CBJ,29,2,3,8478882,8479343.0,Vladislav Gavrikov Hooking against Clayton Keller
20,penalty,Holding,Ryan Graves,Pierre-Luc Dubois,[88. -5.],1,15:57,COL,CBJ,COL,21,CBJ,29,0,0,8477435,8479400.0,Ryan Graves Holding against Pierre-Luc Dubois
68,penalty,Holding,Dean Kukan,Tyson Jost,[ 45. -39.],1,06:21,CBJ,COL,COL,21,CBJ,29,0,1,8478567,8479370.0,Dean Kukan Holding against Tyson Jost
92,penalty,Delaying Game - Puck over glass,Matt Calvert,,[ 58. -34.],1,00:44,COL,CBJ,COL,21,CBJ,29,1,2,8474685,,Matt Calvert Delaying Game - Puck over glass
178,penalty,Charging,Nick Foligno,Kole Sherwood,[23. -2.],2,02:45,CBJ,COL,COL,21,CBJ,29,3,2,8473422,8478949.0,Nick Foligno Charging against Pierre-Edouard Bellemare served by Kole Sherwood
179,penalty,Game misconduct,Nick Foligno,,[21.  0.],2,02:45,CBJ,COL,COL,21,CBJ,29,3,2,8473422,,Nick Foligno Game misconduct
200,penalty,Interference,Mark Barberio,Emil Bemstrom,[19. 21.],3,15:46,COL,CBJ,COL,21,CBJ,29,3,2,8474717,8480205.0,Mark Barberio Interference against Emil Bemstrom
209,penalty,Hooking,Tyson Jost,Oliver Bjorkstrand,[ 78. -27.],3,12:58,COL,CBJ,COL,21,CBJ,29,3,2,8479370,8477416.0,Tyson Jost Hooking against Oliver Bjorkstrand
16,penalty,Tripping,Shea Weber,Pierre-Luc Dubois,[ 89. -32.],1,16:06,MTL,CBJ,MTL,8,CBJ,29,0,0,8470642,8479400.0,Shea Weber Tripping against Pierre-Luc Dubois
34,penalty,Tripping,Shea Weber,Oliver Bjorkstrand,[70. 12.],1,12:27,MTL,CBJ,MTL,8,CBJ,29,0,0,8470642,8477416.0,Shea Weber Tripping against Oliver Bjorkstrand
106,penalty,Hooking,Zach Werenski,Max Domi,[71.  0.],2,14:51,CBJ,MTL,MTL,8,CBJ,29,0,1,8478460,8477503.0,Zach Werenski Hooking against Max Domi
153,penalty,Holding,Riley Nash,Tomas Tatar,[73. -9.],2,04:45,CBJ,MTL,MTL,8,CBJ,29,0,1,8474062,8475193.0,Riley Nash Holding against Tomas Tatar
267,penalty,Holding,Victor Mete,Alexander Wennberg,[-63.   0.],4,03:28,MTL,CBJ,MTL,8,CBJ,29,2,2,8479376,8477505.0,Victor Mete Holding against Alexander Wennberg
35,penalty,Concealing puck,Gustav Nyquist,,[-57.  40.],1,13:15,CBJ,STL,CBJ,29,STL,19,0,0,8474679,,Gustav Nyquist Concealing puck
63,penalty,Hooking,Brayden Schenn,Oliver Bjorkstrand,[98. -9.],1,05:54,STL,CBJ,CBJ,29,STL,19,1,0,8475170,8477416.0,Brayden Schenn Hooking against Oliver Bjorkstrand
118,penalty,Tripping,Eric Robinson,Sammy Blais,[ 76. -11.],2,11:02,CBJ,STL,CBJ,29,STL,19,1,1,8480762,8478104.0,Eric Robinson Tripping against Sammy Blais
128,penalty,Hi-sticking,Sammy Blais,Alexander Wennberg,[66.  0.],2,07:20,STL,CBJ,CBJ,29,STL,19,1,2,8478104,8477505.0,Sammy Blais Hi-sticking against Alexander Wennberg
240,penalty,Tripping,Oliver Bjorkstrand,Jaden Schwartz,[-56. -27.],4,04:24,CBJ,STL,CBJ,29,STL,19,2,2,8477416,8475768.0,Oliver Bjorkstrand Tripping against Jaden Schwartz
248,penalty,Too many men on the ice,David Perron,,[19. 40.],4,02:57,STL,CBJ,CBJ,29,STL,19,2,2,8474102,,Too many men/ice served by David Perron
147,penalty,Holding,Jordan Weal,Alexandre Texier,[-7.  2.],2,06:46,MTL,CBJ,CBJ,29,MTL,8,2,2,8475738,8480074.0,Jordan Weal Holding against Alexandre Texier
168,penalty,Holding,Ryan Murray,Brendan Gallagher,[ 26. -36.],2,02:00,CBJ,MTL,CBJ,29,MTL,8,2,2,8476850,8475848.0,Ryan Murray Holding against Brendan Gallagher
217,penalty,Interference,Max Domi,Alexander Wennberg,[-6.  0.],3,09:14,MTL,CBJ,CBJ,29,MTL,8,3,2,8477503,8477505.0,Max Domi Interference against Alexander Wennberg
222,penalty,Holding,Zach Werenski,Phillip Danault,[-83.  37.],3,07:51,CBJ,MTL,CBJ,29,MTL,8,4,2,8478460,8476479.0,Zach Werenski Holding against Phillip Danault
58,penalty,Hooking,David Savard,Frans Nielsen,[-69. -40.],1,06:50,CBJ,DET,CBJ,29,DET,17,1,1,8475233,8470144.0,David Savard Hooking against Frans Nielsen
80,penalty,Interference,Dylan McIlrath,Boone Jenner,[82.  2.],1,01:50,DET,CBJ,CBJ,29,DET,17,1,1,8475795,8476432.0,Dylan McIlrath Interference against Boone Jenner
98,penalty,Hi-sticking,Dylan McIlrath,Nick Foligno,[-83.   0.],2,17:01,DET,CBJ,CBJ,29,DET,17,1,1,8475795,8473422.0,Dylan McIlrath Hi-sticking against Nick Foligno
101,penalty,Boarding,Madison Bowey,Alexander Wennberg,[-62. -39.],2,15:47,DET,CBJ,CBJ,29,DET,17,1,1,8477474,8477505.0,Madison Bowey Boarding against Alexander Wennberg
130,penalty,Slashing,Seth Jones,Anthony Mantha,[79. -2.],2,08:01,CBJ,DET,CBJ,29,DET,17,2,1,8477495,8477511.0,Seth Jones Slashing against Anthony Mantha
132,penalty,Tripping,Gustav Nyquist,Dylan Larkin,[  2. -30.],2,07:12,CBJ,DET,CBJ,29,DET,17,2,1,8474679,8477946.0,Gustav Nyquist Tripping against Dylan Larkin
145,penalty,Interference,Dylan McIlrath,Josh Anderson,[-68.   2.],2,03:24,DET,CBJ,CBJ,29,DET,17,2,2,8475795,8476981.0,Dylan McIlrath Interference against Josh Anderson
179,penalty,Slashing,Robby Fabbri,Pierre-Luc Dubois,[ 60. -28.],3,13:29,DET,CBJ,CBJ,29,DET,17,2,3,8477952,8479400.0,Robby Fabbri Slashing against Pierre-Luc Dubois
19,penalty,Hooking,Luca Sbisa,Eric Robinson,[79.  1.],1,15:26,WPG,CBJ,WPG,52,CBJ,29,0,0,8474579,8480762.0,Luca Sbisa Hooking against Eric Robinson
68,penalty,Tripping,Pierre-Luc Dubois,Blake Wheeler,[-78.  -9.],1,03:15,CBJ,WPG,WPG,52,CBJ,29,1,1,8479400,8471218.0,Pierre-Luc Dubois Tripping against Blake Wheeler
92,penalty,Tripping,Nikolaj Ehlers,Alexandre Texier,[ 43. -10.],2,16:55,WPG,CBJ,WPG,52,CBJ,29,1,1,8477940,8480074.0,Nikolaj Ehlers Tripping against Alexandre Texier
100,penalty,Hooking,Tucker Poolman,Nick Foligno,[-63.  -8.],2,14:26,WPG,CBJ,WPG,52,CBJ,29,2,1,8477359,8473422.0,Tucker Poolman Hooking against Nick Foligno
102,penalty,Boarding,Luca Sbisa,Boone Jenner,[-95.  25.],2,14:17,WPG,CBJ,WPG,52,CBJ,29,2,1,8474579,8476432.0,Luca Sbisa Boarding against Boone Jenner
142,penalty,Hooking,Blake Wheeler,Boone Jenner,[97. 20.],2,04:29,WPG,CBJ,WPG,52,CBJ,29,3,3,8471218,8476432.0,Blake Wheeler Hooking against Boone Jenner
175,penalty,Hooking,Vladislav Gavrikov,Blake Wheeler,[-76.   4.],3,16:07,CBJ,WPG,WPG,52,CBJ,29,3,3,8478882,8471218.0,Vladislav Gavrikov Hooking against Blake Wheeler
189,penalty,Roughing,Josh Anderson,Mark Scheifele,[-55.  -6.],3,10:52,CBJ,WPG,WPG,52,CBJ,29,3,3,8476981,8476460.0,Josh Anderson Roughing against Mark Scheifele
19,penalty,Too many men on the ice,Brady Tkachuk,,[17. 40.],1,13:52,OTT,CBJ,CBJ,29,OTT,9,0,0,8480801,,Too many men/ice served by Brady Tkachuk
96,penalty,Hi-sticking,Boone Jenner,Chris Tierney,[ 95. -18.],2,14:51,CBJ,OTT,CBJ,29,OTT,9,0,0,8476432,8476919.0,Boone Jenner Hi-sticking against Chris Tierney
153,penalty,Interference,Nick Paul,Sonny Milano,[-53.  41.],2,02:27,OTT,CBJ,CBJ,29,OTT,9,0,0,8477426,8477947.0,Nick Paul Interference against Sonny Milano
201,penalty,Too many men on the ice,Brady Tkachuk,,[15. 40.],3,11:24,OTT,CBJ,CBJ,29,OTT,9,1,0,8480801,,Too many men/ice served by Brady Tkachuk
206,penalty,Interference,Zach Werenski,Chris Tierney,[33. 39.],3,10:15,CBJ,OTT,CBJ,29,OTT,9,1,0,8478460,8476919.0,Zach Werenski Interference against Chris Tierney
28,penalty,Slashing,Josh Anderson,Oskar Lindblom,[ 45. -26.],1,14:50,CBJ,PHI,CBJ,29,PHI,4,1,0,8476981,8478067.0,Josh Anderson Slashing against Oskar Lindblom
68,penalty,Roughing,Seth Jones,Oskar Lindblom,[-96.  10.],1,07:13,CBJ,PHI,CBJ,29,PHI,4,1,0,8477495,8478067.0,Seth Jones Roughing against Oskar Lindblom
76,penalty,Hooking,Oliver Bjorkstrand,Kevin Hayes,[56. 22.],1,04:41,CBJ,PHI,CBJ,29,PHI,4,1,0,8477416,8475763.0,Oliver Bjorkstrand Hooking against Kevin Hayes
89,penalty,Delay Gm - Face-off Violation,Alexander Wennberg,,[3. 0.],2,20:00,CBJ,PHI,CBJ,29,PHI,4,2,1,8477505,,Alexander Wennberg Delay Gm - Face-off Violation
127,penalty,Interference,Tyler Pitlick,Eric Robinson,[-3. 28.],2,08:44,PHI,CBJ,CBJ,29,PHI,4,2,2,8475752,8480762.0,Tyler Pitlick Interference against Eric Robinson
137,penalty,Interference,Sonny Milano,Morgan Frost,[-11.  -7.],2,04:45,CBJ,PHI,CBJ,29,PHI,4,2,2,8477947,8480028.0,Sonny Milano Interference against Morgan Frost
229,penalty,Misconduct,Boone Jenner,,[-13.  42.],3,00:00,CBJ,PHI,CBJ,29,PHI,4,2,3,8476432,,Boone Jenner Misconduct
44,penalty,Hooking,Sam Lafferty,Riley Nash,[80.  2.],1,09:30,PIT,CBJ,CBJ,29,PIT,5,1,0,8478043,8474062.0,Sam Lafferty Hooking against Riley Nash
78,penalty,Holding,Dominik Kahun,Josh Anderson,[-83.  29.],2,18:41,PIT,CBJ,CBJ,29,PIT,5,2,1,8480946,8476981.0,Dominik Kahun Holding against Josh Anderson
96,penalty,Roughing,Josh Anderson,Brandon Tanev,[-98.   8.],2,13:54,CBJ,PIT,CBJ,29,PIT,5,3,1,8476981,8479293.0,Josh Anderson Roughing against Brandon Tanev
139,penalty,Hooking,Jake Guentzel,Gustav Nyquist,[79. 39.],2,05:15,PIT,CBJ,CBJ,29,PIT,5,3,1,8477404,8474679.0,Jake Guentzel Hooking against Gustav Nyquist
156,penalty,Cross checking,Pierre-Luc Dubois,Patric Hornqvist,[82. -1.],2,01:40,CBJ,PIT,CBJ,29,PIT,5,4,1,8479400,8471887.0,Pierre-Luc Dubois Cross checking against Patric Hornqvist
168,penalty,Tripping,Alex Galchenyuk,Alexandre Texier,[-45. -28.],3,16:49,PIT,CBJ,CBJ,29,PIT,5,4,1,8476851,8480074.0,Alex Galchenyuk Tripping against Alexandre Texier
199,penalty,Tripping,Sonny Milano,Jared McCann,[-16. -38.],3,08:50,CBJ,PIT,CBJ,29,PIT,5,4,2,8477947,8477955.0,Sonny Milano Tripping against Jared McCann
222,penalty,Tripping,Gustav Nyquist,Marcus Pettersson,[-59. -16.],3,03:10,CBJ,PIT,CBJ,29,PIT,5,4,2,8474679,8477969.0,Gustav Nyquist Tripping against Marcus Pettersson
246,penalty,Interference,Josh Bailey,Seth Jones,[-30. -18.],3,03:01,NYI,CBJ,NYI,2,CBJ,29,2,0,8474573,8477495.0,Josh Bailey Interference against Seth Jones
56,penalty,Holding,Vladislav Gavrikov,Lawson Crouse,[-74. -40.],1,02:14,CBJ,ARI,CBJ,29,ARI,53,0,0,8478882,8478474.0,Vladislav Gavrikov Holding against Lawson Crouse
66,penalty,Hi stick - double minor,Jakob Chychrun,Gustav Nyquist,[-67.  41.],2,19:29,ARI,CBJ,CBJ,29,ARI,53,0,1,8479345,8474679.0,Jakob Chychrun Hi stick - double minor against Gustav Nyquist
134,penalty,Hooking,Oliver Ekman-Larsson,Oliver Bjorkstrand,[-93.  26.],2,00:36,ARI,CBJ,CBJ,29,ARI,53,1,3,8475171,8477416.0,Oliver Ekman-Larsson Hooking against Oliver Bjorkstrand
18,penalty,Tripping,Boo Nieves,Sonny Milano,[-55.  39.],1,14:39,NYR,CBJ,CBJ,29,NYR,3,0,0,8476922,8477947.0,Boo Nieves Tripping against Sonny Milano
61,penalty,Roughing,Brendan Lemieux,Oliver Bjorkstrand,[99. 12.],1,06:33,NYR,CBJ,CBJ,29,NYR,3,1,0,8477962,8477416.0,Brendan Lemieux Roughing against Oliver Bjorkstrand
114,penalty,Hi-sticking,Emil Bemstrom,Chris Kreider,[75.  4.],2,15:37,CBJ,NYR,CBJ,29,NYR,3,1,1,8480205,8475184.0,Emil Bemstrom Hi-sticking against Chris Kreider
137,penalty,Slashing,Boone Jenner,Jacob Trouba,[-87. -22.],2,11:06,CBJ,NYR,CBJ,29,NYR,3,1,2,8476432,8476885.0,Boone Jenner Slashing against Jacob Trouba
179,penalty,Holding,Adam Fox,Boone Jenner,[-96. -10.],2,00:19,NYR,CBJ,CBJ,29,NYR,3,1,3,8479323,8476432.0,Adam Fox Holding against Boone Jenner
194,penalty,Missing key [PD_151],Pavel Buchnevich,,[14. 40.],3,16:27,NYR,CBJ,CBJ,29,NYR,3,2,3,8477402,,Delaying Game - Unsucc. chlg served by Pavel Buchnevich
244,penalty,Tripping,Brady Skjei,Gustav Nyquist,[ 56. -23.],3,02:10,NYR,CBJ,CBJ,29,NYR,3,2,3,8476869,8474679.0,Brady Skjei Tripping against Gustav Nyquist
34,penalty,Holding,Eric Robinson,Brett Connolly,[-19.  30.],1,11:08,CBJ,FLA,FLA,13,CBJ,29,1,0,8480762,8475792.0,Eric Robinson Holding against Brett Connolly
40,penalty,Holding,Brian Boyle,Ryan Murray,[-90. -29.],1,09:11,FLA,CBJ,FLA,13,CBJ,29,1,0,8470619,8476850.0,Brian Boyle Holding against Ryan Murray
59,penalty,Fighting,Josh Brown,Nick Foligno,[70. -2.],1,05:04,FLA,CBJ,FLA,13,CBJ,29,1,0,8477384,8473422.0,Josh Brown Fighting against Nick Foligno
60,penalty,Fighting,Nick Foligno,Josh Brown,[70. -1.],1,05:04,CBJ,FLA,FLA,13,CBJ,29,1,0,8473422,8477384.0,Nick Foligno Fighting against Josh Brown
87,penalty,Holding,Alexandre Texier,Aleksander Barkov,[ 41. -35.],2,18:38,CBJ,FLA,FLA,13,CBJ,29,1,0,8480074,8477493.0,Alexandre Texier Holding against Aleksander Barkov
139,penalty,Roughing,Pierre-Luc Dubois,MacKenzie Weegar,[-77. -30.],2,06:38,CBJ,FLA,FLA,13,CBJ,29,2,0,8479400,8477346.0,Pierre-Luc Dubois Roughing against MacKenzie Weegar
161,penalty,Slashing,Frank Vatrano,Seth Jones,[97.  0.],2,00:36,FLA,CBJ,FLA,13,CBJ,29,2,0,8478366,8477495.0,Frank Vatrano Slashing against Seth Jones
187,penalty,Tripping,Dean Kukan,Dominic Toninato,[-59. -33.],3,14:02,CBJ,FLA,FLA,13,CBJ,29,2,0,8478567,8476952.0,Dean Kukan Tripping against Dominic Toninato
209,penalty,Holding,Aaron Ekblad,Boone Jenner,[94. 25.],3,08:41,FLA,CBJ,FLA,13,CBJ,29,3,1,8477932,8476432.0,Aaron Ekblad Holding against Boone Jenner
21,penalty,Tripping,Braden Holtby,Jakub Vrana,[76.  1.],1,15:32,WSH,CBJ,WSH,15,CBJ,29,0,1,8474651,8477944.0,Braden Holtby Tripping against Pierre-Luc Dubois served by Jakub Vrana
33,penalty,Charging,Richard Panik,Vladislav Gavrikov,[-95.   8.],1,10:41,WSH,CBJ,WSH,15,CBJ,29,0,1,8475209,8478882.0,Richard Panik Charging against Vladislav Gavrikov
40,penalty,Hooking,Nick Foligno,Jonas Siegenthaler,[66.  0.],1,10:03,CBJ,WSH,WSH,15,CBJ,29,0,1,8473422,8478399.0,Nick Foligno Hooking against Jonas Siegenthaler
169,penalty,Interference,Oliver Bjorkstrand,Brendan Leipsic,[11. 25.],2,07:34,CBJ,WSH,WSH,15,CBJ,29,0,2,8477416,8476894.0,Oliver Bjorkstrand Interference against Brendan Leipsic
176,penalty,Hooking,Pierre-Luc Dubois,Carl Hagelin,[ 31. -34.],2,04:40,CBJ,WSH,WSH,15,CBJ,29,0,2,8479400,8474176.0,Pierre-Luc Dubois Hooking against Carl Hagelin
195,penalty,Tripping,Nic Dowd,Dean Kukan,[61. 30.],2,01:29,WSH,CBJ,WSH,15,CBJ,29,0,2,8475343,8478567.0,Nic Dowd Tripping against Dean Kukan
213,penalty,Tripping,Nic Dowd,Alexandre Texier,[19.  2.],3,16:32,WSH,CBJ,WSH,15,CBJ,29,1,2,8475343,8480074.0,Nic Dowd Tripping against Alexandre Texier
258,penalty,Interference - Goalkeeper,Tom Wilson,Joonas Korpisalo,[-78.   4.],3,04:51,WSH,CBJ,WSH,15,CBJ,29,1,4,8476880,8476914.0,Tom Wilson Interference - Goalkeeper against Joonas Korpisalo
33,penalty,Slashing,Andrew Peeke,Brandon Tanev,[13. 40.],1,13:36,CBJ,PIT,PIT,5,CBJ,29,0,0,8479369,8479293.0,Andrew Peeke Slashing against Brandon Tanev
52,penalty,Hi-sticking,Pierre-Luc Dubois,Kris Letang,[-81.  -2.],1,07:08,CBJ,PIT,PIT,5,CBJ,29,0,0,8479400,8471724.0,Pierre-Luc Dubois Hi-sticking against Kris Letang
151,penalty,Tripping,Marcus Pettersson,Sonny Milano,[68. 17.],2,02:30,PIT,CBJ,PIT,5,CBJ,29,0,0,8477969,8477947.0,Marcus Pettersson Tripping against Sonny Milano
247,penalty,Slashing,Pierre-Luc Dubois,Kris Letang,[-62.  -3.],4,03:35,CBJ,PIT,PIT,5,CBJ,29,0,0,8479400,8471724.0,Pierre-Luc Dubois Slashing against Kris Letang
32,penalty,Fighting,Mark Borowiecki,Josh Anderson,[-13.  21.],1,14:39,OTT,CBJ,OTT,9,CBJ,29,1,1,8474697,8476981.0,Mark Borowiecki Fighting against Josh Anderson
33,penalty,Fighting,Josh Anderson,Mark Borowiecki,[-11.  22.],1,14:39,CBJ,OTT,OTT,9,CBJ,29,1,1,8476981,8474697.0,Josh Anderson Fighting against Mark Borowiecki
49,penalty,Holding,Connor Brown,Pierre-Luc Dubois,[-51.  38.],1,11:02,OTT,CBJ,OTT,9,CBJ,29,1,1,8477015,8479400.0,Connor Brown Holding against Pierre-Luc Dubois
132,penalty,Hi-sticking,Seth Jones,Connor Brown,[-79.   0.],2,09:08,CBJ,OTT,OTT,9,CBJ,29,3,1,8477495,8477015.0,Seth Jones Hi-sticking against Connor Brown
134,penalty,Tripping,Anthony Duclair,Cam Atkinson,[-46.  38.],2,08:59,OTT,CBJ,OTT,9,CBJ,29,3,1,8477407,8474715.0,Anthony Duclair Tripping against Cam Atkinson
154,penalty,Interference,Pierre-Luc Dubois,Logan Brown,[91. 28.],2,05:17,CBJ,OTT,OTT,9,CBJ,29,3,1,8479400,8479366.0,Pierre-Luc Dubois Interference against Logan Brown
159,penalty,Hi-sticking,Colin White,David Savard,[-92.  11.],2,03:27,OTT,CBJ,OTT,9,CBJ,29,3,1,8478400,8475233.0,Colin White Hi-sticking against David Savard
251,penalty,Hooking,Tyler Ennis,Cam Atkinson,[-80.  11.],3,03:08,OTT,CBJ,OTT,9,CBJ,29,3,3,8474589,8474715.0,Tyler Ennis Hooking against Cam Atkinson
269,penalty,Slashing,Alexander Wennberg,Jean-Gabriel Pageau,[-77.  13.],4,03:20,CBJ,OTT,OTT,9,CBJ,29,3,3,8477505,8476419.0,Alexander Wennberg Slashing against Jean-Gabriel Pageau
43,penalty,Interference,John Carlson,Alexandre Texier,[77. -2.],1,11:18,WSH,CBJ,CBJ,29,WSH,15,0,0,8474590,8480074.0,John Carlson Interference against Alexandre Texier
53,penalty,Hi-sticking,Cam Atkinson,Garnet Hathaway,[-11.  39.],1,06:22,CBJ,WSH,CBJ,29,WSH,15,1,0,8474715,8477903.0,Cam Atkinson Hi-sticking against Garnet Hathaway
79,penalty,Hooking,David Savard,T.J. Oshie,[-90. -30.],1,00:46,CBJ,WSH,CBJ,29,WSH,15,1,0,8475233,8471698.0,David Savard Hooking against T.J. Oshie
93,penalty,Hooking,Alexander Wennberg,Jakub Vrana,[63.  7.],2,17:32,CBJ,WSH,CBJ,29,WSH,15,1,0,8477505,8477944.0,Alexander Wennberg Hooking against Jakub Vrana
103,penalty,Holding,Jakub Vrana,Pierre-Luc Dubois,[-91.  32.],2,14:54,WSH,CBJ,CBJ,29,WSH,15,1,0,8477944,8479400.0,Jakub Vrana Holding against Pierre-Luc Dubois
141,penalty,Holding the stick,Kevin Stenlund,Jonas Siegenthaler,[-96.  23.],2,04:15,CBJ,WSH,CBJ,29,WSH,15,1,0,8478831,8478399.0,Kevin Stenlund Holding the stick against Jonas Siegenthaler
227,penalty,Instigator,David Savard,Tom Wilson,[-76.  -9.],3,02:08,CBJ,WSH,CBJ,29,WSH,15,3,0,8475233,8476880.0,David Savard Instigator against Tom Wilson
228,penalty,Fighting,David Savard,Tom Wilson,[-75. -13.],3,02:08,CBJ,WSH,CBJ,29,WSH,15,3,0,8475233,8476880.0,David Savard Fighting against Tom Wilson
229,penalty,Instigator - Misconduct,David Savard,Tom Wilson,[-69. -12.],3,02:08,CBJ,WSH,CBJ,29,WSH,15,3,0,8475233,8476880.0,David Savard Instigator - Misconduct against Tom Wilson
230,penalty,Charging,Tom Wilson,Vladislav Gavrikov,[-95.  27.],3,02:08,WSH,CBJ,CBJ,29,WSH,15,3,0,8476880,8478882.0,Tom Wilson Charging against Vladislav Gavrikov
231,penalty,Fighting,Tom Wilson,David Savard,[-77. -11.],3,02:08,WSH,CBJ,CBJ,29,WSH,15,3,0,8476880,8475233.0,Tom Wilson Fighting against David Savard
52,penalty,Interference,Marko Dano,Frans Nielsen,[-50.  17.],1,05:02,CBJ,DET,DET,17,CBJ,29,1,2,8477448,8470144.0,Marko Dano Interference against Frans Nielsen
73,penalty,Tripping,Nick Foligno,Mike Green,[ 42. -38.],2,18:57,CBJ,DET,DET,17,CBJ,29,2,2,8473422,8471242.0,Nick Foligno Tripping against Mike Green
90,penalty,Hooking,Anthony Mantha,David Savard,[-70.  -2.],2,14:31,DET,CBJ,DET,17,CBJ,29,3,2,8477511,8475233.0,Anthony Mantha Hooking against David Savard
101,penalty,Tripping,Patrik Nemeth,David Savard,[-91.  20.],2,10:40,DET,CBJ,DET,17,CBJ,29,3,3,8475747,8475233.0,Patrik Nemeth Tripping against David Savard
138,penalty,Hi-sticking,Boone Jenner,Tyler Bertuzzi,[ 42. -34.],2,01:08,CBJ,DET,DET,17,CBJ,29,3,3,8476432,8477479.0,Boone Jenner Hi-sticking against Tyler Bertuzzi
10,penalty,Holding,Kurtis MacDermid,Pierre-Luc Dubois,[80. 38.],1,18:06,LAK,CBJ,CBJ,29,LAK,26,0,1,8477073,8479400.0,Kurtis MacDermid Holding against Pierre-Luc Dubois
64,penalty,Hooking,Gabriel Carlsson,Blake Lizotte,[-87. -31.],1,03:04,CBJ,LAK,CBJ,29,LAK,26,1,1,8478506,8481481.0,Gabriel Carlsson Hooking against Blake Lizotte
76,penalty,Delaying Game - Puck over glass,Seth Jones,,[86. 32.],2,19:07,CBJ,LAK,CBJ,29,LAK,26,1,1,8477495,,Seth Jones Delaying Game - Puck over glass
104,penalty,Hooking,Sean Walker,Cam Atkinson,[-69.   2.],2,11:55,LAK,CBJ,CBJ,29,LAK,26,1,1,8480336,8474715.0,Sean Walker Hooking against Cam Atkinson
147,penalty,Hooking,Sean Walker,Pierre-Luc Dubois,[-79.  11.],2,03:15,LAK,CBJ,CBJ,29,LAK,26,1,2,8480336,8479400.0,Sean Walker Hooking against Pierre-Luc Dubois
200,penalty,Holding,Jeff Carter,Nick Foligno,[ 51. -28.],3,11:14,LAK,CBJ,CBJ,29,LAK,26,1,2,8470604,8473422.0,Jeff Carter Holding against Nick Foligno
