,event,penalty,penalty_on,drew_by,coords,period,period_time_remaining,penalty_team,drew_by_team,home_team,home_team_id,away_team,away_team_id,home_goals,away_goals,penalty_on_id,drew_by_id,game_id,winning_team,date,description
144,penalty,Slashing,Kevin Shattenkirk,Anthony Beauvillier,[ 63. -35.],2,08:18,TBL,NYI,TBL,14,NYI,2,0,2,8474031,8478463.0,2019020468,,2019-12-10,Kevin Shattenkirk Slashing against Anthony Beauvillier
182,penalty,Hooking,Michael Dal Colle,Anthony Cirelli,[ 63. -27.],3,19:17,NYI,TBL,TBL,14,NYI,2,1,2,8477936,8478519.0,2019020468,,2019-12-10,Michael Dal Colle Hooking against Anthony Cirelli
240,penalty,Cross checking,Mikhail Sergachev,Matt Martin,[-89.  20.],3,04:47,TBL,NYI,TBL,14,NYI,2,1,4,8479410,8474709.0,2019020468,,2019-12-10,Mikhail Sergachev Cross checking against Matt Martin
15,penalty,Hi-sticking,Mathieu Joseph,Josh Brown,[92. 23.],1,16:52,TBL,FLA,FLA,13,TBL,14,0,0,8478472,8477384.0,2019020473,,2019-12-11,Mathieu Joseph Hi-sticking against Josh Brown
64,penalty,Interference,Kevin Shattenkirk,Mike Hoffman,[  7. -33.],1,06:42,TBL,FLA,FLA,13,TBL,14,0,1,8474031,8474884.0,2019020473,,2019-12-11,Kevin Shattenkirk Interference against Mike Hoffman
165,penalty,Interference - Goalkeeper,Ondrej Palat,Sergei Bobrovsky,[-83.   0.],2,08:18,TBL,FLA,FLA,13,TBL,14,0,2,8476292,8475683.0,2019020473,,2019-12-11,Ondrej Palat Interference - Goalkeeper against Sergei Bobrovsky
182,penalty,Holding,Jonathan Huberdeau,Anthony Cirelli,[-95.  17.],2,06:21,FLA,TBL,FLA,13,TBL,14,0,2,8476456,8478519.0,2019020473,,2019-12-11,Jonathan Huberdeau Holding against Anthony Cirelli
223,penalty,Tripping,Keith Yandle,Nikita Kucherov,[ 67. -18.],3,17:21,FLA,TBL,FLA,13,TBL,14,0,2,8471735,8476453.0,2019020473,,2019-12-11,Keith Yandle Tripping against Nikita Kucherov
3,penalty,Fighting,Pat Maroon,Zdeno Chara,[7. 1.],1,19:33,TBL,BOS,TBL,14,BOS,6,0,0,8474034,8465009.0,2019020488,,2019-12-13,Pat Maroon Fighting against Zdeno Chara
4,penalty,Fighting,Zdeno Chara,Pat Maroon,[ 26. -15.],1,19:33,BOS,TBL,TBL,14,BOS,6,0,0,8465009,8474034.0,2019020488,,2019-12-13,Zdeno Chara Fighting against Pat Maroon
50,penalty,Tripping,John Moore,Alex Killorn,[ 81. -19.],1,07:16,BOS,TBL,TBL,14,BOS,6,0,1,8475186,8473986.0,2019020488,,2019-12-13,John Moore Tripping against Alex Killorn
81,penalty,Interference,Ryan McDonagh,David Krejci,[26. 17.],2,17:48,TBL,BOS,TBL,14,BOS,6,0,1,8474151,8471276.0,2019020488,,2019-12-13,Ryan McDonagh Interference against David Krejci
94,penalty,Tripping,Matt Grzelcyk,Anthony Cirelli,[-15.  18.],2,15:12,BOS,TBL,TBL,14,BOS,6,0,1,8476891,8478519.0,2019020488,,2019-12-13,Matt Grzelcyk Tripping against Anthony Cirelli
95,penalty,Roughing,Kevin Shattenkirk,Matt Grzelcyk,[-9. 18.],2,15:12,TBL,BOS,TBL,14,BOS,6,0,1,8474031,8476891.0,2019020488,,2019-12-13,Kevin Shattenkirk Roughing against Matt Grzelcyk
127,penalty,Tripping,John Moore,Alex Killorn,[-85.  17.],2,07:31,BOS,TBL,TBL,14,BOS,6,0,1,8475186,8473986.0,2019020488,,2019-12-13,John Moore Tripping against Alex Killorn
188,penalty,Hooking,Sean Kuraly,Mathieu Joseph,[-41.  31.],3,17:17,BOS,TBL,TBL,14,BOS,6,1,1,8476374,8478472.0,2019020488,,2019-12-13,Sean Kuraly Hooking against Mathieu Joseph
233,penalty,Hooking,Steven Stamkos,Charlie McAvoy,[-59.  -7.],3,09:32,TBL,BOS,TBL,14,BOS,6,2,1,8474564,8479325.0,2019020488,,2019-12-13,Steven Stamkos Hooking against Charlie McAvoy
49,penalty,Interference,Jan Rutta,Carl Hagelin,[-57. -35.],1,07:37,TBL,WSH,TBL,14,WSH,15,0,1,8480172,8474176.0,2019020507,,2019-12-15,Jan Rutta Interference against Carl Hagelin
51,penalty,Tripping,Nicklas Backstrom,Ryan McDonagh,[-84.  28.],1,07:01,WSH,TBL,TBL,14,WSH,15,0,1,8473563,8474151.0,2019020507,,2019-12-15,Nicklas Backstrom Tripping against Ryan McDonagh
65,penalty,Hi-sticking,Steven Stamkos,Jakub Vrana,[-21. -26.],1,02:48,TBL,WSH,TBL,14,WSH,15,0,1,8474564,8477944.0,2019020507,,2019-12-15,Steven Stamkos Hi-sticking against Jakub Vrana
77,penalty,Roughing,Michal Kempny,Steven Stamkos,[-62. -33.],2,18:28,WSH,TBL,TBL,14,WSH,15,0,1,8479482,8474564.0,2019020507,,2019-12-15,Michal Kempny Roughing against Steven Stamkos
91,penalty,Delaying Game - Puck over glass,Nicklas Backstrom,,[-62.  38.],2,14:57,WSH,TBL,TBL,14,WSH,15,0,1,8473563,,2019020507,,2019-12-15,Nicklas Backstrom Delaying Game - Puck over glass
107,penalty,Tripping,Alex Ovechkin,Victor Hedman,[ 29. -15.],2,11:40,WSH,TBL,TBL,14,WSH,15,1,1,8471214,8475167.0,2019020507,,2019-12-15,Alex Ovechkin Tripping against Victor Hedman
143,penalty,Tripping,T.J. Oshie,Mathieu Joseph,[-30. -27.],2,02:49,WSH,TBL,TBL,14,WSH,15,1,1,8471698,8478472.0,2019020507,,2019-12-15,T.J. Oshie Tripping against Mathieu Joseph
103,penalty,Tripping,Andrei Vasilevskiy,Steven Stamkos,[81. -3.],2,18:37,TBL,OTT,TBL,14,OTT,9,2,1,8476883,8474564.0,2019020526,OTT,2019-12-18,Andrei Vasilevskiy Tripping against Jean-Gabriel Pageau served by Steven Stamkos
172,penalty,Too many men on the ice,Carter Verhaeghe,,[-15.  36.],2,03:28,TBL,OTT,TBL,14,OTT,9,3,3,8477409,,2019020526,OTT,2019-12-18,Too many men/ice served by Carter Verhaeghe
177,penalty,Interference,Brady Tkachuk,Anthony Cirelli,[39. -2.],2,02:49,OTT,TBL,TBL,14,OTT,9,3,3,8480801,8478519.0,2019020526,OTT,2019-12-18,Brady Tkachuk Interference against Anthony Cirelli
214,penalty,Hi stick - double minor,Steven Stamkos,Nick Paul,[65. 34.],3,10:09,TBL,OTT,TBL,14,OTT,9,3,3,8474564,8477426.0,2019020526,OTT,2019-12-18,Steven Stamkos Hi stick - double minor against Nick Paul
26,penalty,Tripping,Carter Verhaeghe,Jason Dickinson,[58. -6.],1,16:43,TBL,DAL,TBL,14,DAL,25,0,0,8477409,8477450.0,2019020539,,2019-12-20,Carter Verhaeghe Tripping against Jason Dickinson
45,penalty,Tripping,Roope Hintz,Jan Rutta,[-62.  20.],1,11:32,DAL,TBL,TBL,14,DAL,25,0,1,8478449,8480172.0,2019020539,,2019-12-20,Roope Hintz Tripping against Jan Rutta
56,penalty,Hooking,Alexander Radulov,Brayden Point,[57. -5.],1,08:49,DAL,TBL,TBL,14,DAL,25,0,1,8471228,8478010.0,2019020539,,2019-12-20,Alexander Radulov Hooking against Brayden Point
71,penalty,Too many men on the ice,Alexander Radulov,,[14. 35.],1,04:59,DAL,TBL,TBL,14,DAL,25,1,1,8471228,,2019020539,,2019-12-20,Too many men/ice served by Alexander Radulov
223,penalty,Roughing,Radek Faksa,Yanni Gourde,[81. -3.],3,07:52,DAL,TBL,TBL,14,DAL,25,3,2,8476889,8476826.0,2019020539,,2019-12-20,Radek Faksa Roughing against Yanni Gourde
224,penalty,Roughing,Yanni Gourde,Radek Faksa,[80.  0.],3,07:52,TBL,DAL,TBL,14,DAL,25,3,2,8476826,8476889.0,2019020539,,2019-12-20,Yanni Gourde Roughing against Radek Faksa
18,penalty,Too many men on the ice,Steven Stamkos,,[-19.  32.],1,15:34,TBL,WSH,WSH,15,TBL,14,0,0,8474564,,2019020558,,2019-12-22,Too many men/ice served by Steven Stamkos
40,penalty,Hooking,Alex Ovechkin,Brayden Point,[95.  7.],1,11:52,WSH,TBL,WSH,15,TBL,14,0,0,8471214,8478010.0,2019020558,,2019-12-22,Alex Ovechkin Hooking against Brayden Point
86,penalty,Hi-sticking,Mitchell Stephens,Garnet Hathaway,[-76.   0.],1,03:01,TBL,WSH,WSH,15,TBL,14,0,0,8478477,8477903.0,2019020558,,2019-12-22,Mitchell Stephens Hi-sticking against Garnet Hathaway
97,penalty,Interference,Tom Wilson,Victor Hedman,[-11. -25.],1,01:13,WSH,TBL,WSH,15,TBL,14,0,0,8476880,8475167.0,2019020558,,2019-12-22,Tom Wilson Interference against Victor Hedman
165,penalty,Hooking,Garnet Hathaway,Mitchell Stephens,[-60.  -1.],2,07:46,WSH,TBL,WSH,15,TBL,14,1,0,8477903,8478477.0,2019020558,,2019-12-22,Garnet Hathaway Hooking against Mitchell Stephens
232,penalty,Holding,Jan Rutta,Nic Dowd,[-34. -29.],3,15:31,TBL,WSH,WSH,15,TBL,14,1,0,8480172,8475343.0,2019020558,,2019-12-22,Jan Rutta Holding against Nic Dowd
254,penalty,Interference,Nick Jensen,Mikhail Sergachev,[83. 34.],3,09:25,WSH,TBL,WSH,15,TBL,14,1,1,8475324,8479410.0,2019020558,,2019-12-22,Nick Jensen Interference against Mikhail Sergachev
256,penalty,Delaying Game - Puck over glass,Lars Eller,,[ 34. -21.],3,08:51,WSH,TBL,WSH,15,TBL,14,1,1,8474189,,2019020558,,2019-12-22,Lars Eller Delaying Game - Puck over glass
280,penalty,Slashing,Jonas Siegenthaler,Tyler Johnson,[80.  4.],3,03:48,WSH,TBL,WSH,15,TBL,14,2,1,8478399,8474870.0,2019020558,,2019-12-22,Jonas Siegenthaler Slashing against Tyler Johnson
291,penalty,Delaying Game - Puck over glass,John Carlson,,[52. 31.],3,01:09,WSH,TBL,WSH,15,TBL,14,3,1,8474590,,2019020558,,2019-12-22,John Carlson Delaying Game - Puck over glass
37,penalty,Interference,Mike Hoffman,Yanni Gourde,[-41. -21.],1,11:14,FLA,TBL,TBL,14,FLA,13,1,0,8474884,8476826.0,2019020572,,2019-12-27,Mike Hoffman Interference against Yanni Gourde
74,penalty,Cross checking,Jonathan Huberdeau,Ryan McDonagh,[-79.  31.],1,03:28,FLA,TBL,TBL,14,FLA,13,2,0,8476456,8474151.0,2019020572,,2019-12-27,Jonathan Huberdeau Cross checking against Ryan McDonagh
93,penalty,Hi-sticking,Alex Killorn,Vincent Trocheck,[-48.  37.],1,00:13,TBL,FLA,TBL,14,FLA,13,3,0,8473986,8476389.0,2019020572,,2019-12-27,Alex Killorn Hi-sticking against Vincent Trocheck
98,penalty,Too many men on the ice,Pat Maroon,,[-10.  22.],2,18:35,TBL,FLA,TBL,14,FLA,13,3,0,8474034,,2019020572,,2019-12-27,Too many men/ice served by Pat Maroon
121,penalty,Tripping,Anton Stralman,Cedric Paquette,[-90. -12.],2,14:17,FLA,TBL,TBL,14,FLA,13,3,1,8471873,8476975.0,2019020572,,2019-12-27,Anton Stralman Tripping against Cedric Paquette
128,penalty,Abuse of Officials,Pat Maroon,,[-14.  35.],2,13:10,TBL,FLA,TBL,14,FLA,13,4,1,8474034,,2019020572,,2019-12-27,Abuse of officials served by Pat Maroon
139,penalty,Slashing,Colton Sceviour,Ondrej Palat,[-36.  22.],2,10:28,FLA,TBL,TBL,14,FLA,13,4,1,8474098,8476292.0,2019020572,,2019-12-27,Colton Sceviour Slashing against Ondrej Palat
161,penalty,Holding the stick,Brayden Point,Aleksander Barkov,[70. 23.],2,04:27,TBL,FLA,TBL,14,FLA,13,5,1,8478010,8477493.0,2019020572,,2019-12-27,Brayden Point Holding the stick against Aleksander Barkov
141,penalty,Hooking,Nate Thompson,Mathieu Joseph,[-14. -23.],2,05:34,MTL,TBL,TBL,14,MTL,8,4,3,8470775,8478472.0,2019020594,,2019-12-29,Nate Thompson Hooking against Mathieu Joseph
210,penalty,Boarding,Mathieu Joseph,Cale Fleury,[-9. 38.],3,10:23,TBL,MTL,TBL,14,MTL,8,5,3,8478472,8479985.0,2019020594,,2019-12-29,Mathieu Joseph Boarding against Cale Fleury
232,penalty,Hi-sticking,Pat Maroon,Nick Cousins,[-67.  25.],3,03:12,TBL,MTL,TBL,14,MTL,8,5,3,8474034,8476393.0,2019020594,,2019-12-29,Pat Maroon Hi-sticking against Nick Cousins
30,penalty,Boarding,Pat Maroon,Christoffer Ehn,[-49.  38.],1,11:06,TBL,DET,TBL,14,DET,17,0,0,8474034,8478036.0,2019020607,,2019-12-30,Pat Maroon Boarding against Christoffer Ehn
48,penalty,Hi-sticking,Mike Green,Pat Maroon,[86. 22.],1,07:04,DET,TBL,TBL,14,DET,17,0,0,8471242,8474034.0,2019020607,,2019-12-30,Mike Green Hi-sticking against Pat Maroon
121,penalty,Tripping,Brendan Perlini,Mathieu Joseph,[-64. -33.],2,09:58,DET,TBL,TBL,14,DET,17,1,0,8477943,8478472.0,2019020607,,2019-12-30,Brendan Perlini Tripping against Mathieu Joseph
168,penalty,Hooking,Trevor Daley,Anthony Cirelli,[ 54. -33.],3,19:02,DET,TBL,TBL,14,DET,17,1,1,8470110,8478519.0,2019020607,,2019-12-30,Trevor Daley Hooking against Anthony Cirelli
177,penalty,Tripping,Mikhail Sergachev,Patrik Nemeth,[76. 20.],3,17:28,TBL,DET,TBL,14,DET,17,1,1,8479410,8475747.0,2019020607,,2019-12-30,Mikhail Sergachev Tripping against Patrik Nemeth
184,penalty,Interference,Adam Erne,Kevin Shattenkirk,[-69.  -3.],3,15:09,DET,TBL,TBL,14,DET,17,1,1,8477454,8474031.0,2019020607,,2019-12-30,Adam Erne Interference against Kevin Shattenkirk
10,penalty,Tripping,Steven Stamkos,Jack Eichel,[72. 28.],1,15:57,TBL,BUF,BUF,7,TBL,14,0,0,8474564,8478403.0,2019020617,,2020-01-01,Steven Stamkos Tripping against Jack Eichel
39,penalty,Slashing,Henri Jokiharju,Nikita Kucherov,[-77.  -3.],1,09:31,BUF,TBL,BUF,7,TBL,14,0,0,8480035,8476453.0,2019020617,,2020-01-01,Henri Jokiharju Slashing against Nikita Kucherov
81,penalty,Roughing,Luke Schenn,Dalton Smith,[ 24. -13.],2,19:52,TBL,BUF,BUF,7,TBL,14,1,0,8474568,8475748.0,2019020617,,2020-01-01,Luke Schenn Roughing against Dalton Smith
82,penalty,Roughing,Dalton Smith,Luke Schenn,[ 25. -17.],2,19:52,BUF,TBL,BUF,7,TBL,14,1,0,8475748,8474568.0,2019020617,,2020-01-01,Dalton Smith Roughing against Luke Schenn
92,penalty,Slashing,Kyle Okposo,Cedric Paquette,[-16. -41.],2,16:39,BUF,TBL,BUF,7,TBL,14,2,0,8473449,8476975.0,2019020617,,2020-01-01,Kyle Okposo Slashing against Cedric Paquette
101,penalty,Tripping,Henri Jokiharju,Brayden Point,[83. -7.],2,14:52,BUF,TBL,BUF,7,TBL,14,2,0,8480035,8478010.0,2019020617,,2020-01-01,Henri Jokiharju Tripping against Brayden Point
118,penalty,Fighting,Mikhail Sergachev,Jake McCabe,[30. -3.],2,11:26,TBL,BUF,BUF,7,TBL,14,3,1,8479410,8476931.0,2019020617,,2020-01-01,Mikhail Sergachev Fighting against Jake McCabe
119,penalty,Fighting,Jake McCabe,Mikhail Sergachev,[31.  3.],2,11:26,BUF,TBL,BUF,7,TBL,14,3,1,8476931,8479410.0,2019020617,,2020-01-01,Jake McCabe Fighting against Mikhail Sergachev
120,penalty,Instigator,Jake McCabe,Kyle Okposo,[25. -2.],2,11:26,BUF,TBL,BUF,7,TBL,14,3,1,8476931,8473449.0,2019020617,,2020-01-01,Jake McCabe Instigator against Mikhail Sergachev served by Kyle Okposo
121,penalty,Instigator - Misconduct,Jake McCabe,,[25. -2.],2,11:26,BUF,TBL,BUF,7,TBL,14,3,1,8476931,,2019020617,,2020-01-01,Jake McCabe Instigator - Misconduct
130,penalty,Interference,Tyler Johnson,Conor Sheary,[27.  0.],2,08:54,TBL,BUF,BUF,7,TBL,14,4,1,8474870,8477839.0,2019020617,,2020-01-01,Tyler Johnson Interference against Conor Sheary
133,penalty,Hooking,Marcus Johansson,Cedric Paquette,[-63. -11.],2,07:01,BUF,TBL,BUF,7,TBL,14,4,1,8475149,8476975.0,2019020617,,2020-01-01,Marcus Johansson Hooking against Cedric Paquette
194,penalty,Delaying Game - Puck over glass,Mikhail Sergachev,,[ 76. -35.],3,07:53,TBL,BUF,BUF,7,TBL,14,4,5,8479410,,2019020617,,2020-01-01,Mikhail Sergachev Delaying Game - Puck over glass
204,penalty,Cross checking,Nikita Kucherov,Rasmus Dahlin,[ 25. -37.],3,04:18,TBL,BUF,BUF,7,TBL,14,4,5,8476453,8480839.0,2019020617,,2020-01-01,Nikita Kucherov Cross checking against Rasmus Dahlin
16,penalty,Tripping,Yanni Gourde,Nick Cousins,[ 35. -31.],1,16:18,TBL,MTL,MTL,8,TBL,14,0,1,8476826,8476393.0,2019020629,,2020-01-03,Yanni Gourde Tripping against Nick Cousins
52,penalty,Tripping,Victor Hedman,Artturi Lehkonen,[-76.   5.],1,08:29,TBL,MTL,MTL,8,TBL,14,1,2,8475167,8477476.0,2019020629,,2020-01-03,Victor Hedman Tripping against Artturi Lehkonen
69,penalty,Roughing,Pat Maroon,Max Domi,[-17.  40.],1,04:21,TBL,MTL,MTL,8,TBL,14,1,2,8474034,8477503.0,2019020629,,2020-01-03,Pat Maroon Roughing against Max Domi
70,penalty,Roughing,Max Domi,Pat Maroon,[-17.  41.],1,04:21,MTL,TBL,MTL,8,TBL,14,1,2,8477503,8474034.0,2019020629,,2020-01-03,Max Domi Roughing against Pat Maroon
78,penalty,Fighting,Pat Maroon,Dale Weise,[-34. -35.],1,01:33,TBL,MTL,MTL,8,TBL,14,1,2,8474034,8474668.0,2019020629,,2020-01-03,Pat Maroon Fighting against Dale Weise
79,penalty,Fighting,Dale Weise,Pat Maroon,[-40. -39.],1,01:33,MTL,TBL,MTL,8,TBL,14,1,2,8474668,8474034.0,2019020629,,2020-01-03,Dale Weise Fighting against Pat Maroon
233,penalty,Unsportsmanlike conduct,Ben Chiarot,,[-97.   2.],3,09:14,MTL,TBL,MTL,8,TBL,14,1,2,8475279,,2019020629,,2020-01-03,Ben Chiarot Unsportsmanlike conduct
234,penalty,Slashing,Victor Hedman,Ben Chiarot,[-98.   1.],3,09:14,TBL,MTL,MTL,8,TBL,14,1,2,8475167,8475279.0,2019020629,,2020-01-03,Victor Hedman Slashing against Ben Chiarot
242,penalty,Tripping,Ondrej Palat,Shea Weber,[-69.  10.],3,07:42,TBL,MTL,MTL,8,TBL,14,1,2,8476292,8470642.0,2019020629,,2020-01-03,Ondrej Palat Tripping against Shea Weber
24,penalty,Tripping,Connor Brown,Ondrej Palat,[19. -4.],1,15:19,OTT,TBL,OTT,9,TBL,14,0,0,8477015,8476292.0,2019020648,,2020-01-05,Connor Brown Tripping against Ondrej Palat
45,penalty,Interference,Erik Cernak,Mikkel Boedker,[14. 39.],1,09:00,TBL,OTT,OTT,9,TBL,14,0,0,8478416,8474571.0,2019020648,,2020-01-05,Erik Cernak Interference against Mikkel Boedker
60,penalty,Fighting,Andreas Englund,Pat Maroon,[11. 40.],1,05:50,OTT,TBL,OTT,9,TBL,14,0,0,8477971,8474034.0,2019020648,,2020-01-05,Andreas Englund Fighting against Pat Maroon
61,penalty,Fighting,Pat Maroon,Andreas Englund,[41. 40.],1,05:50,TBL,OTT,OTT,9,TBL,14,0,0,8474034,8477971.0,2019020648,,2020-01-05,Pat Maroon Fighting against Andreas Englund
74,penalty,Tripping,Ryan McDonagh,Nick Paul,[ 91. -24.],1,04:26,TBL,OTT,OTT,9,TBL,14,0,0,8474151,8477426.0,2019020648,,2020-01-05,Ryan McDonagh Tripping against Nick Paul
94,penalty,Slashing,Cody Goloubef,Steven Stamkos,[-73.   1.],1,00:12,OTT,TBL,OTT,9,TBL,14,0,0,8474597,8474564.0,2019020648,,2020-01-05,Cody Goloubef Slashing against Steven Stamkos
142,penalty,Tripping,Nikita Kucherov,Nick Paul,[ 90. -23.],2,09:05,TBL,OTT,OTT,9,TBL,14,1,2,8476453,8477426.0,2019020648,,2020-01-05,Nikita Kucherov Tripping against Nick Paul
173,penalty,Roughing,Brady Tkachuk,Anthony Cirelli,[-73. -26.],2,03:14,OTT,TBL,OTT,9,TBL,14,2,2,8480801,8478519.0,2019020648,,2020-01-05,Brady Tkachuk Roughing against Anthony Cirelli
174,penalty,Roughing,Anthony Cirelli,Brady Tkachuk,[-73. -19.],2,03:14,TBL,OTT,OTT,9,TBL,14,2,2,8478519,8480801.0,2019020648,,2020-01-05,Anthony Cirelli Roughing against Brady Tkachuk
215,penalty,Hi-sticking,Kevin Shattenkirk,Mikkel Boedker,[-50. -19.],3,14:12,TBL,OTT,OTT,9,TBL,14,3,2,8474031,8474571.0,2019020648,,2020-01-05,Kevin Shattenkirk Hi-sticking against Mikkel Boedker
239,penalty,Roughing,Anthony Cirelli,Brady Tkachuk,[ 1. 39.],3,07:59,TBL,OTT,OTT,9,TBL,14,3,3,8478519,8480801.0,2019020648,,2020-01-05,Anthony Cirelli Roughing against Brady Tkachuk
240,penalty,Roughing,Brady Tkachuk,Anthony Cirelli,[ 2. 40.],3,07:59,OTT,TBL,OTT,9,TBL,14,3,3,8480801,8478519.0,2019020648,,2020-01-05,Brady Tkachuk Roughing against Anthony Cirelli
28,penalty,Hooking,Nino Niederreiter,Ondrej Palat,[32. -8.],1,10:36,CAR,TBL,CAR,12,TBL,14,0,2,8475799,8476292.0,2019020655,,2020-01-06,Nino Niederreiter Hooking against Ondrej Palat
53,penalty,Slashing,Mikhail Sergachev,Martin Necas,[-79. -32.],1,04:05,TBL,CAR,CAR,12,TBL,14,0,2,8479410,8480039.0,2019020655,,2020-01-06,Mikhail Sergachev Slashing against Martin Necas
127,penalty,Tripping,Joel Edmundson,Ondrej Palat,[-96. -20.],2,08:14,CAR,TBL,CAR,12,TBL,14,0,3,8476441,8476292.0,2019020655,,2020-01-06,Joel Edmundson Tripping against Ondrej Palat
203,penalty,Interference,Erik Cernak,Brock McGinn,[-74.  -4.],3,10:30,TBL,CAR,CAR,12,TBL,14,0,3,8478416,8476934.0,2019020655,,2020-01-06,Erik Cernak Interference against Brock McGinn
226,penalty,Unsportsmanlike conduct,Pat Maroon,,[ -1. -41.],3,02:26,TBL,CAR,CAR,12,TBL,14,1,3,8474034,,2019020655,,2020-01-06,Pat Maroon Unsportsmanlike conduct
227,penalty,Holding,Pat Maroon,Jake Gardiner,[-49. -40.],3,02:26,TBL,CAR,CAR,12,TBL,14,1,3,8474034,8474581.0,2019020655,,2020-01-06,Pat Maroon Holding against Jake Gardiner
23,penalty,Hooking,Bo Horvat,Nikita Kucherov,[80. 28.],1,12:46,VAN,TBL,TBL,14,VAN,23,0,0,8477500,8476453.0,2019020663,,2020-01-09,Bo Horvat Hooking against Nikita Kucherov
33,penalty,Holding,Nikita Kucherov,Quinn Hughes,[ 22. -27.],1,08:49,TBL,VAN,TBL,14,VAN,23,0,0,8476453,8480800.0,2019020663,,2020-01-09,Nikita Kucherov Holding against Quinn Hughes
42,penalty,Hi-sticking,Alexander Edler,Steven Stamkos,[91. 33.],1,06:21,VAN,TBL,TBL,14,VAN,23,0,0,8471303,8474564.0,2019020663,,2020-01-09,Alexander Edler Hi-sticking against Steven Stamkos
105,penalty,Hooking,Alexander Edler,Nikita Kucherov,[-96.   2.],2,09:52,VAN,TBL,TBL,14,VAN,23,1,1,8471303,8476453.0,2019020663,,2020-01-09,Alexander Edler Hooking against Nikita Kucherov
109,penalty,Hooking,Anthony Cirelli,Brock Boeser,[-86. -11.],2,09:11,TBL,VAN,TBL,14,VAN,23,2,1,8478519,8478444.0,2019020663,,2020-01-09,Anthony Cirelli Hooking against Brock Boeser
176,penalty,Hooking,Victor Hedman,Bo Horvat,[-37. -38.],3,12:36,TBL,VAN,TBL,14,VAN,23,7,2,8475167,8477500.0,2019020663,,2020-01-09,Victor Hedman Hooking against Bo Horvat
178,penalty,Hooking,Anthony Cirelli,Elias Pettersson,[-48.   3.],3,11:44,TBL,VAN,TBL,14,VAN,23,7,2,8478519,8480012.0,2019020663,,2020-01-09,Anthony Cirelli Hooking against Elias Pettersson
207,penalty,Charging,Jake Virtanen,Ondrej Palat,[14.  2.],3,03:19,VAN,TBL,TBL,14,VAN,23,8,2,8477937,8476292.0,2019020663,,2020-01-09,Jake Virtanen Charging against Ondrej Palat
214,penalty,Bench,Adam Gaudette,,[10. 41.],3,02:06,VAN,TBL,TBL,14,VAN,23,8,2,8478874,,2019020663,,2020-01-09,Bench served by Adam Gaudette
84,penalty,Unsportsmanlike conduct,Braydon Coburn,Lawson Crouse,[-62.  38.],2,16:30,TBL,ARI,TBL,14,ARI,53,2,0,8470601,8478474.0,2019020680,,2020-01-10,Braydon Coburn Unsportsmanlike conduct against Lawson Crouse
155,penalty,Tripping,Cedric Paquette,Ilya Lyubushkin,[-53. -40.],3,15:13,TBL,ARI,TBL,14,ARI,53,4,0,8476975,8480950.0,2019020680,,2020-01-10,Cedric Paquette Tripping against Ilya Lyubushkin
186,penalty,Interference,Taylor Hall,Conor Garland,[-48. -40.],3,07:16,ARI,TBL,TBL,14,ARI,53,4,0,8475791,8478856.0,2019020680,,2020-01-10,Taylor Hall Interference against Ondrej Palat served by Conor Garland
187,penalty,Roughing,Tyler Johnson,Taylor Hall,[-53. -37.],3,07:16,TBL,ARI,TBL,14,ARI,53,4,0,8474870,8475791.0,2019020680,,2020-01-10,Tyler Johnson Roughing against Taylor Hall
188,penalty,Roughing,Taylor Hall,Tyler Johnson,[-55. -39.],3,07:16,ARI,TBL,TBL,14,ARI,53,4,0,8475791,8474870.0,2019020680,,2020-01-10,Taylor Hall Roughing against Tyler Johnson
12,penalty,Holding,Mitchell Stephens,David Kase,[11. 29.],1,17:12,TBL,PHI,PHI,4,TBL,14,0,0,8478477,8478436.0,2019020695,,2020-01-12,Mitchell Stephens Holding against David Kase
29,penalty,Holding,Robert Hagg,Alexander Volkov,[64. 39.],1,13:02,PHI,TBL,PHI,4,TBL,14,0,0,8477462,8480186.0,2019020695,,2020-01-12,Robert Hagg Holding against Alexander Volkov
50,penalty,Hi stick - double minor,Travis Konecny,Victor Hedman,[-98. -14.],1,06:17,PHI,TBL,PHI,4,TBL,14,0,0,8478439,8475167.0,2019020695,,2020-01-12,Travis Konecny Hi stick - double minor against Victor Hedman
103,penalty,Slashing,Pat Maroon,Mark Friedman,[-85. -32.],2,14:52,TBL,PHI,PHI,4,TBL,14,0,0,8474034,8478017.0,2019020695,,2020-01-12,Pat Maroon Slashing against Mark Friedman
162,penalty,Hooking,Kevin Hayes,Pat Maroon,[ 79. -11.],3,18:13,PHI,TBL,PHI,4,TBL,14,0,1,8475763,8474034.0,2019020695,,2020-01-12,Kevin Hayes Hooking against Pat Maroon
211,penalty,Hi-sticking,Kevin Shattenkirk,Travis Konecny,[-98. -19.],3,05:35,TBL,PHI,PHI,4,TBL,14,0,1,8474031,8478439.0,2019020695,,2020-01-12,Kevin Shattenkirk Hi-sticking against Travis Konecny
9,penalty,Hi-sticking,Yanni Gourde,Wayne Simmonds,[98. 11.],1,17:28,TBL,NJD,NJD,1,TBL,14,0,0,8476826,8474190.0,2019020708,,2020-01-13,Yanni Gourde Hi-sticking against Wayne Simmonds
43,penalty,Roughing,Anthony Cirelli,Kevin Rooney,[-21.  37.],1,10:27,TBL,NJD,NJD,1,TBL,14,0,0,8478519,8479291.0,2019020708,,2020-01-13,Anthony Cirelli Roughing against Kevin Rooney
54,penalty,Hooking,Andy Greene,Nikita Kucherov,[-58.   7.],1,07:24,NJD,TBL,NJD,1,TBL,14,0,0,8472382,8476453.0,2019020708,,2020-01-13,Andy Greene Hooking against Nikita Kucherov
74,penalty,Tripping,Ondrej Palat,Nico Hischier,[-71.   3.],1,02:26,TBL,NJD,NJD,1,TBL,14,0,0,8476292,8480002.0,2019020708,,2020-01-13,Ondrej Palat Tripping against Nico Hischier
144,penalty,Slashing,John Hayden,Anthony Cirelli,[ 65. -18.],2,03:56,NJD,TBL,NJD,1,TBL,14,2,1,8477401,8478519.0,2019020708,,2020-01-13,John Hayden Slashing against Anthony Cirelli
156,penalty,Fighting,Connor Carrick,Yanni Gourde,[ 27. -33.],2,01:12,NJD,TBL,NJD,1,TBL,14,2,1,8476941,8476826.0,2019020708,,2020-01-13,Connor Carrick Fighting against Yanni Gourde
157,penalty,Fighting,Yanni Gourde,Connor Carrick,[ 24. -31.],2,01:12,TBL,NJD,NJD,1,TBL,14,2,1,8476826,8476941.0,2019020708,,2020-01-13,Yanni Gourde Fighting against Connor Carrick
161,penalty,Slashing,Nikita Kucherov,Nikita Gusev,[-35.  27.],2,00:23,TBL,NJD,NJD,1,TBL,14,2,1,8476453,8477038.0,2019020708,,2020-01-13,Nikita Kucherov Slashing against Nikita Gusev
123,penalty,Slashing,Jeff Carter,Victor Hedman,[-69. -30.],2,09:57,LAK,TBL,TBL,14,LAK,26,2,2,8470604,8475167.0,2019020716,,2020-01-16,Jeff Carter Slashing against Victor Hedman
132,penalty,Tripping,Tyler Johnson,Kyle Clifford,[ 32. -36.],2,07:40,TBL,LAK,TBL,14,LAK,26,2,2,8474870,8475160.0,2019020716,,2020-01-16,Tyler Johnson Tripping against Kyle Clifford
182,penalty,Broken stick,Alexander Volkov,,[ 97. -11.],3,14:50,TBL,LAK,TBL,14,LAK,26,2,2,8480186,,2019020716,,2020-01-16,Alexander Volkov Broken stick
203,penalty,Hooking,Alexander Volkov,Trevor Lewis,[ 53. -29.],3,09:46,TBL,LAK,TBL,14,LAK,26,2,2,8480186,8473453.0,2019020716,,2020-01-16,Alexander Volkov Hooking against Trevor Lewis
243,penalty,Hi-sticking,Kyle Clifford,Jan Rutta,[-64. -12.],3,00:59,LAK,TBL,TBL,14,LAK,26,3,3,8475160,8480172.0,2019020716,,2020-01-16,Kyle Clifford Hi-sticking against Jan Rutta
26,penalty,Holding,Jan Rutta,Eric Staal,[-74.   0.],1,11:13,TBL,MIN,MIN,30,TBL,14,0,0,8480172,8470595.0,2019020736,,2020-01-17,Jan Rutta Holding against Eric Staal
39,penalty,Tripping,Brayden Point,Mats Zuccarello,[-98.  -9.],1,07:40,TBL,MIN,MIN,30,TBL,14,0,0,8478010,8475692.0,2019020736,,2020-01-17,Brayden Point Tripping against Mats Zuccarello
142,penalty,Hooking,Alexander Volkov,Carson Soucy,[94. 17.],2,04:14,TBL,MIN,MIN,30,TBL,14,3,1,8480186,8477369.0,2019020736,,2020-01-17,Alexander Volkov Hooking against Carson Soucy
163,penalty,Holding,Mikko Koivu,Steven Stamkos,[75. -1.],3,18:36,MIN,TBL,MIN,30,TBL,14,3,1,8469459,8474564.0,2019020736,,2020-01-17,Mikko Koivu Holding against Steven Stamkos
181,penalty,Roughing,Matt Dumba,Steven Stamkos,[-7. 41.],3,12:17,MIN,TBL,MIN,30,TBL,14,3,1,8476856,8474564.0,2019020736,,2020-01-17,Matt Dumba Roughing against Steven Stamkos
193,penalty,Hooking,Steven Stamkos,Ryan Hartman,[-54. -20.],3,08:17,TBL,MIN,MIN,30,TBL,14,3,2,8474564,8477451.0,2019020736,,2020-01-17,Steven Stamkos Hooking against Ryan Hartman
90,penalty,Holding,Jan Rutta,Mark Scheifele,[83. -3.],2,19:09,TBL,WPG,WPG,52,TBL,14,0,3,8480172,8476460.0,2019020742,,2020-01-18,Jan Rutta Holding against Mark Scheifele
