,event,penalty,penalty_on,drew_by,coords,period,period_time_remaining,penalty_team,drew_by_team,home_team,home_team_id,away_team,away_team_id,home_goals,away_goals,penalty_on_id,drew_by_id,game_id,winning_team,date,description
214,penalty,Delaying Game - Puck over glass,Scott Mayfield,Yanni Gourde,[-84. -36.],3,12:39,NYI,TBL,NYI,2,TBL,14,2,1,8476429,8476826.0,2019020197,,2019-11-02,Scott Mayfield Delaying Game - Puck over glass against Yanni Gourde
244,penalty,Delay of game,Anders Lee,Tyler Johnson,[-4.  0.],3,05:33,TBL,NYI,NYI,2,TBL,14,4,1,8475314,8474870.0,2019020197,,2019-11-02, against Anders LeeDelay of Game - Bench served by Tyler Johnson
70,penalty,Interference,Rasmus Dahlin,Yanni Gourde,[96. -7.],1,04:40,BUF,TBL,BUF,7,TBL,14,0,1,8480839,8476826.0,2019020249,TBL,2019-11-09,Rasmus Dahlin Interference against Yanni Gourde
81,penalty,Interference,Erik Cernak,Jack Eichel,[-76.   2.],1,01:05,TBL,BUF,BUF,7,TBL,14,0,2,8478416,8478403.0,2019020249,TBL,2019-11-09,Erik Cernak Interference against Jack Eichel
101,penalty,Hi-sticking,Jake McCabe,Brayden Point,[-87.  29.],2,14:10,BUF,TBL,BUF,7,TBL,14,0,2,8476931,8478010.0,2019020249,TBL,2019-11-09,Jake McCabe Hi-sticking against Brayden Point
180,penalty,Interference,Rasmus Ristolainen,Alexander Volkov,[-18. -37.],3,15:34,BUF,TBL,BUF,7,TBL,14,1,2,8477499,8480186.0,2019020249,TBL,2019-11-09,Rasmus Ristolainen Interference against Alexander Volkov
181,penalty,Roughing,Ondrej Palat,Jeff Skinner,[-32. -38.],3,15:34,TBL,BUF,BUF,7,TBL,14,1,2,8476292,8475784.0,2019020249,TBL,2019-11-09,Ondrej Palat Roughing against Jeff Skinner
182,penalty,Roughing,Jeff Skinner,Ondrej Palat,[-12. -35.],3,15:34,BUF,TBL,BUF,7,TBL,14,1,2,8475784,8476292.0,2019020249,TBL,2019-11-09,Jeff Skinner Roughing against Ondrej Palat
192,penalty,Hi-sticking,Yanni Gourde,Jeff Skinner,[-19.   9.],3,12:11,TBL,BUF,BUF,7,TBL,14,1,3,8476826,8475784.0,2019020249,TBL,2019-11-09,Yanni Gourde Hi-sticking against Jeff Skinner
213,penalty,Tripping,Jack Eichel,Erik Cernak,[-93. -25.],3,05:48,BUF,TBL,BUF,7,TBL,14,2,3,8478403,8478416.0,2019020249,TBL,2019-11-09,Jack Eichel Tripping against Erik Cernak
47,penalty,Hooking,Nikita Kucherov,Rasmus Ristolainen,[48.  8.],1,09:20,TBL,BUF,TBL,14,BUF,7,0,1,8476453,8477499.0,2019020256,,2019-11-10,Nikita Kucherov Hooking against Rasmus Ristolainen
68,penalty,Roughing,Brandon Montour,Nikita Kucherov,[78.  2.],1,04:53,BUF,TBL,TBL,14,BUF,7,0,1,8477986,8476453.0,2019020256,,2019-11-10,Brandon Montour Roughing against Nikita Kucherov
94,penalty,Interference,Marcus Johansson,Mathieu Joseph,[ 51. -22.],2,18:09,BUF,TBL,TBL,14,BUF,7,1,1,8475149,8478472.0,2019020256,,2019-11-10,Marcus Johansson Interference against Mathieu Joseph
148,penalty,Interference,Rasmus Ristolainen,Steven Stamkos,[-79.   3.],2,05:17,BUF,TBL,TBL,14,BUF,7,2,1,8477499,8474564.0,2019020256,,2019-11-10,Rasmus Ristolainen Interference against Steven Stamkos
246,penalty,Unsportsmanlike conduct,Cedric Paquette,Pat Maroon,[-12. -34.],3,03:46,TBL,BUF,TBL,14,BUF,7,5,2,8476975,8474034.0,2019020256,,2019-11-10,Cedric Paquette Unsportsmanlike conduct against Marcus Johansson served by Pat Maroon
247,penalty,Game misconduct,Cedric Paquette,Marcus Johansson,[-20. -30.],3,03:46,TBL,BUF,TBL,14,BUF,7,5,2,8476975,8475149.0,2019020256,,2019-11-10,Cedric Paquette Game misconduct against Marcus Johansson
256,penalty,Roughing,Erik Cernak,Sam Reinhart,[-16.  40.],3,02:01,TBL,BUF,TBL,14,BUF,7,5,2,8478416,8477933.0,2019020256,,2019-11-10,Erik Cernak Roughing against Sam Reinhart
257,penalty,Roughing,Sam Reinhart,Erik Cernak,[-56. -35.],3,02:01,BUF,TBL,TBL,14,BUF,7,5,2,8477933,8478416.0,2019020256,,2019-11-10,Sam Reinhart Roughing against Erik Cernak
22,penalty,Cross checking,Brendan Lemieux,Mikhail Sergachev,[-41.  31.],1,14:24,NYR,TBL,TBL,14,NYR,3,1,0,8477962,8479410.0,2019020287,,2019-11-15,Brendan Lemieux Cross checking against Mikhail Sergachev
23,penalty,Slashing,Tony DeAngelo,Alex Killorn,[ 94. -13.],1,14:24,NYR,TBL,TBL,14,NYR,3,1,0,8477950,8473986.0,2019020287,,2019-11-15,Tony DeAngelo Slashing against Alex Killorn
50,penalty,Holding,Luke Schenn,Chris Kreider,[-78.  25.],1,08:51,TBL,NYR,TBL,14,NYR,3,4,0,8474568,8475184.0,2019020287,,2019-11-15,Luke Schenn Holding against Chris Kreider
85,penalty,Hooking,Alex Killorn,Artemi Panarin,[-33. -14.],1,01:20,TBL,NYR,TBL,14,NYR,3,4,1,8473986,8478550.0,2019020287,,2019-11-15,Alex Killorn Hooking against Artemi Panarin
113,penalty,Too many men on the ice,Artemi Panarin,,[14. 32.],2,13:28,NYR,TBL,TBL,14,NYR,3,4,1,8478550,,2019020287,,2019-11-15,Too many men/ice served by Artemi Panarin
122,penalty,Boarding,Cedric Paquette,Libor Hajek,[-93. -17.],2,12:25,TBL,NYR,TBL,14,NYR,3,5,1,8476975,8479333.0,2019020287,,2019-11-15,Cedric Paquette Boarding against Libor Hajek
136,penalty,Roughing,Tyler Johnson,Ryan Lindgren,[-71.   5.],2,09:12,TBL,NYR,TBL,14,NYR,3,6,1,8474870,8479324.0,2019020287,,2019-11-15,Tyler Johnson Roughing against Ryan Lindgren
137,penalty,Roughing,Ryan Lindgren,Tyler Johnson,[-75.   0.],2,09:12,NYR,TBL,TBL,14,NYR,3,6,1,8479324,8474870.0,2019020287,,2019-11-15,Ryan Lindgren Roughing against Tyler Johnson
164,penalty,Interference - Goalkeeper,Brendan Lemieux,Artemi Panarin,[84. -1.],2,01:05,NYR,TBL,TBL,14,NYR,3,7,1,8477962,8478550.0,2019020287,,2019-11-15,Brendan Lemieux Interference - Goalkeeper against Andrei Vasilevskiy served by Artemi Panarin
165,penalty,Fighting,Ryan McDonagh,Brendan Lemieux,[91. -9.],2,01:05,TBL,NYR,TBL,14,NYR,3,7,1,8474151,8477962.0,2019020287,,2019-11-15,Ryan McDonagh Fighting against Brendan Lemieux
166,penalty,Fighting,Brendan Lemieux,Ryan McDonagh,[82. -7.],2,01:05,NYR,TBL,TBL,14,NYR,3,7,1,8477962,8474151.0,2019020287,,2019-11-15,Brendan Lemieux Fighting against Ryan McDonagh
170,penalty,Roughing,Micheal Haley,Luke Schenn,[  5. -24.],2,00:44,NYR,TBL,TBL,14,NYR,3,8,1,8474230,8474568.0,2019020287,,2019-11-15,Micheal Haley Roughing against Luke Schenn
171,penalty,Slashing,Micheal Haley,Luke Schenn,[ -9. -12.],2,00:44,NYR,TBL,TBL,14,NYR,3,8,1,8474230,8474568.0,2019020287,,2019-11-15,Micheal Haley Slashing against Luke Schenn
172,penalty,Roughing,Luke Schenn,Micheal Haley,[ 14. -19.],2,00:44,TBL,NYR,TBL,14,NYR,3,8,1,8474568,8474230.0,2019020287,,2019-11-15,Luke Schenn Roughing against Micheal Haley
174,penalty,Misconduct,Micheal Haley,,[ -2. -30.],2,00:44,NYR,TBL,TBL,14,NYR,3,8,1,8474230,,2019020287,,2019-11-15,Micheal Haley Misconduct
213,penalty,Tripping,Ryan Lindgren,Carter Verhaeghe,[-16.  27.],3,10:20,NYR,TBL,TBL,14,NYR,3,8,2,8479324,8477409.0,2019020287,,2019-11-15,Ryan Lindgren Tripping against Carter Verhaeghe
223,penalty,Hi stick - double minor,Jesper Fast,Nikita Kucherov,[-25. -18.],3,08:11,NYR,TBL,TBL,14,NYR,3,8,2,8475855,8476453.0,2019020287,,2019-11-15,Jesper Fast Hi stick - double minor against Nikita Kucherov
248,penalty,Misconduct,Mikhail Sergachev,,[ -6. -27.],3,02:52,TBL,NYR,TBL,14,NYR,3,9,3,8479410,,2019020287,,2019-11-15,Mikhail Sergachev Misconduct
250,penalty,Misconduct,Brendan Lemieux,,[-11. -30.],3,02:52,NYR,TBL,TBL,14,NYR,3,9,3,8477962,,2019020287,,2019-11-15,Brendan Lemieux Misconduct
256,penalty,Hi-sticking,Pat Maroon,Brayden Point,[ 83. -26.],3,01:25,TBL,NYR,TBL,14,NYR,3,9,3,8474034,8478010.0,2019020287,,2019-11-15,Pat Maroon Hi-sticking against Ryan Lindgren served by Brayden Point
257,penalty,Misconduct,Pat Maroon,,[  6. -29.],3,01:25,TBL,NYR,TBL,14,NYR,3,9,3,8474034,,2019020287,,2019-11-15,Pat Maroon Misconduct
258,penalty,Misconduct,Micheal Haley,,[ 12. -31.],3,01:25,NYR,TBL,TBL,14,NYR,3,9,3,8474230,,2019020287,,2019-11-15,Micheal Haley Misconduct
82,penalty,Interference,Yanni Gourde,Josh Morrissey,[-75.   2.],2,16:35,TBL,WPG,TBL,14,WPG,52,1,1,8476826,8477504.0,2019020300,WPG,2019-11-16,Yanni Gourde Interference against Josh Morrissey
97,penalty,Missing key [PD_151],Carter Verhaeghe,,[-9. 36.],2,12:42,TBL,WPG,TBL,14,WPG,52,1,2,8477409,,2019020300,WPG,2019-11-16,Delaying Game - Unsucc. chlg served by Carter Verhaeghe
127,penalty,Boarding,Dmitry Kulikov,Anthony Cirelli,[-81. -35.],2,05:33,WPG,TBL,TBL,14,WPG,52,1,3,8475179,8478519.0,2019020300,WPG,2019-11-16,Dmitry Kulikov Boarding against Anthony Cirelli
158,penalty,Holding,Nathan Beaulieu,Cedric Paquette,[ 49. -23.],3,18:12,WPG,TBL,TBL,14,WPG,52,1,3,8476470,8476975.0,2019020300,WPG,2019-11-16,Nathan Beaulieu Holding against Cedric Paquette
165,penalty,Hooking,Kevin Shattenkirk,Andrew Copp,[-61.  12.],3,16:26,TBL,WPG,TBL,14,WPG,52,1,3,8474031,8477429.0,2019020300,WPG,2019-11-16,Kevin Shattenkirk Hooking against Andrew Copp
182,penalty,Hi-sticking,Nikita Kucherov,Nikolaj Ehlers,[ 64. -17.],3,11:53,TBL,WPG,TBL,14,WPG,52,1,3,8476453,8477940.0,2019020300,WPG,2019-11-16,Nikita Kucherov Hi-sticking against Nikolaj Ehlers
24,penalty,Holding,Jay Bouwmeester,Kevin Shattenkirk,[-76. -41.],1,14:32,STL,TBL,STL,19,TBL,14,0,0,8470151,8474031.0,2019020324,TBL,2019-11-20,Jay Bouwmeester Holding against Kevin Shattenkirk
83,penalty,Interference,Victor Hedman,Ryan O'Reilly,[74.  0.],1,00:35,TBL,STL,STL,19,TBL,14,0,1,8475167,8475158.0,2019020324,TBL,2019-11-20,Victor Hedman Interference against Ryan O'Reilly
124,penalty,Cross checking,Luke Schenn,Zach Sanford,[-69.  -1.],2,11:38,TBL,STL,STL,19,TBL,14,0,1,8474568,8477482.0,2019020324,TBL,2019-11-20,Luke Schenn Cross checking against Zach Sanford
135,penalty,Slashing,David Perron,Steven Stamkos,[ 4. -7.],2,08:33,STL,TBL,STL,19,TBL,14,0,1,8474102,8474564.0,2019020324,TBL,2019-11-20,David Perron Slashing against Steven Stamkos
139,penalty,Delaying Game - Illegal play by goalie,Andrei Vasilevskiy,Pat Maroon,[-92.  16.],2,07:17,TBL,STL,STL,19,TBL,14,0,1,8476883,8474034.0,2019020324,TBL,2019-11-20,Andrei Vasilevskiy Delaying Game - Illegal play by goalie served by Pat Maroon
165,penalty,Roughing,Erik Cernak,Pat Maroon,[ 34. -40.],2,02:03,TBL,STL,STL,19,TBL,14,1,1,8478416,8474034.0,2019020324,TBL,2019-11-20,Erik Cernak Roughing against Brayden Schenn served by Pat Maroon
166,penalty,Roughing,Erik Cernak,Brayden Schenn,[ 33. -39.],2,02:03,TBL,STL,STL,19,TBL,14,1,1,8478416,8475170.0,2019020324,TBL,2019-11-20,Erik Cernak Roughing against Brayden Schenn
167,penalty,Roughing,Brayden Schenn,Nikita Kucherov,[ 33. -41.],2,02:03,STL,TBL,STL,19,TBL,14,1,1,8475170,8476453.0,2019020324,TBL,2019-11-20,Brayden Schenn Roughing against Nikita Kucherov
73,penalty,Cross checking,Alex Killorn,Slater Koekkoek,[74.  1.],1,07:04,TBL,CHI,CHI,16,TBL,14,0,0,8473986,8476886.0,2019020341,,2019-11-22,Alex Killorn Cross checking against Slater Koekkoek
82,penalty,Interference,Duncan Keith,Brayden Point,[-28. -37.],1,05:00,CHI,TBL,CHI,16,TBL,14,0,0,8470281,8478010.0,2019020341,,2019-11-22,Duncan Keith Interference against Brayden Point
111,penalty,Interference,Erik Cernak,David Kampf,[-76. -37.],1,00:15,TBL,CHI,CHI,16,TBL,14,0,1,8478416,8480144.0,2019020341,,2019-11-22,Erik Cernak Interference against David Kampf
193,penalty,Slashing,Jan Rutta,Kirby Dach,[69.  1.],2,03:55,TBL,CHI,CHI,16,TBL,14,0,1,8480172,8481523.0,2019020341,,2019-11-22,Jan Rutta Slashing against Kirby Dach
210,penalty,Boarding,David Kampf,Mathieu Joseph,[ 37. -38.],3,17:17,CHI,TBL,CHI,16,TBL,14,0,1,8480144,8478472.0,2019020341,,2019-11-22,David Kampf Boarding against Mathieu Joseph
270,penalty,Hooking,Brandon Saad,Ondrej Palat,[-60.  40.],3,05:08,CHI,TBL,CHI,16,TBL,14,1,3,8476438,8476292.0,2019020341,,2019-11-22,Brandon Saad Hooking against Ondrej Palat
4,penalty,Tripping,Cory Conacher,Sam Steel,[ 92. -15.],1,18:18,TBL,ANA,TBL,14,ANA,24,0,0,8476195,8479351.0,2019020353,,2019-11-25,Cory Conacher Tripping against Sam Steel
77,penalty,Tripping,Erik Gudbranson,Ryan McDonagh,[54. -7.],1,02:48,ANA,TBL,TBL,14,ANA,24,1,0,8475790,8474151.0,2019020353,,2019-11-25,Erik Gudbranson Tripping against Ryan McDonagh
115,penalty,Hooking,Jan Rutta,Rickard Rakell,[ 64. -12.],2,14:06,TBL,ANA,TBL,14,ANA,24,2,1,8480172,8476483.0,2019020353,,2019-11-25,Jan Rutta Hooking against Rickard Rakell
140,penalty,Hooking,Hampus Lindholm,Nikita Kucherov,[-58.  30.],2,07:38,ANA,TBL,TBL,14,ANA,24,2,2,8476854,8476453.0,2019020353,,2019-11-25,Hampus Lindholm Hooking against Nikita Kucherov
188,penalty,Hi-sticking,Pat Maroon,Carter Rowney,[-70.  23.],3,15:46,TBL,ANA,TBL,14,ANA,24,4,2,8474034,8477240.0,2019020353,,2019-11-25,Pat Maroon Hi-sticking against Carter Rowney
195,penalty,Slashing,Troy Terry,Victor Hedman,[-68.  28.],3,14:22,ANA,TBL,TBL,14,ANA,24,4,2,8478873,8475167.0,2019020353,,2019-11-25,Troy Terry Slashing against Victor Hedman
227,penalty,Roughing,Erik Cernak,Korbinian Holzer,[ 49. -28.],3,04:31,TBL,ANA,TBL,14,ANA,24,5,2,8478416,8473560.0,2019020353,,2019-11-25,Erik Cernak Roughing against Korbinian Holzer
228,penalty,Cross checking,Anthony Cirelli,Korbinian Holzer,[ 53. -26.],3,04:31,TBL,ANA,TBL,14,ANA,24,5,2,8478519,8473560.0,2019020353,,2019-11-25,Anthony Cirelli Cross checking against Korbinian Holzer
229,penalty,Cross checking,Nick Ritchie,Anthony Cirelli,[ 63. -27.],3,04:31,ANA,TBL,TBL,14,ANA,24,5,2,8477941,8478519.0,2019020353,,2019-11-25,Nick Ritchie Cross checking against Anthony Cirelli
230,penalty,Roughing,Nick Ritchie,Anthony Cirelli,[ 57. -33.],3,04:31,ANA,TBL,TBL,14,ANA,24,5,2,8477941,8478519.0,2019020353,,2019-11-25,Nick Ritchie Roughing against Anthony Cirelli
231,penalty,Misconduct,Nick Ritchie,,[ 69. -32.],3,04:31,ANA,TBL,TBL,14,ANA,24,5,2,8477941,,2019020353,,2019-11-25,Nick Ritchie Misconduct
232,penalty,Cross checking,Korbinian Holzer,Erik Cernak,[ 68. -34.],3,04:31,ANA,TBL,TBL,14,ANA,24,5,2,8473560,8478416.0,2019020353,,2019-11-25,Korbinian Holzer Cross checking against Erik Cernak
247,penalty,Roughing,Pat Maroon,Derek Grant,[-89.  30.],3,00:00,TBL,ANA,TBL,14,ANA,24,6,2,8474034,8474683.0,2019020353,,2019-11-25,Pat Maroon Roughing against Derek Grant
248,penalty,Roughing,Derek Grant,Pat Maroon,[-82.  34.],3,00:00,ANA,TBL,TBL,14,ANA,24,6,2,8474683,8474034.0,2019020353,,2019-11-25,Derek Grant Roughing against Pat Maroon
65,penalty,Tripping,Carter Hutton,Johan Larsson,[91.  8.],1,03:58,BUF,TBL,TBL,14,BUF,7,1,1,8475622,8475728.0,2019020365,,2019-11-26,Carter Hutton Tripping against Yanni Gourde served by Johan Larsson
92,penalty,Hi-sticking,Nikita Kucherov,Colin Miller,[-64. -28.],2,17:04,TBL,BUF,TBL,14,BUF,7,1,2,8476453,8476525.0,2019020365,,2019-11-26,Nikita Kucherov Hi-sticking against Colin Miller
108,penalty,Hi-sticking,Johan Larsson,Tyler Johnson,[-71.  -4.],2,14:26,BUF,TBL,TBL,14,BUF,7,1,2,8475728,8474870.0,2019020365,,2019-11-26,Johan Larsson Hi-sticking against Tyler Johnson
127,penalty,Hi-sticking,Yanni Gourde,Colin Miller,[-85.  13.],2,07:52,TBL,BUF,TBL,14,BUF,7,3,2,8476826,8476525.0,2019020365,,2019-11-26,Yanni Gourde Hi-sticking against Colin Miller
139,penalty,Tripping,Alex Killorn,Johan Larsson,[-28.  28.],2,02:53,TBL,BUF,TBL,14,BUF,7,3,2,8473986,8475728.0,2019020365,,2019-11-26,Alex Killorn Tripping against Johan Larsson
153,penalty,Holding,Johan Larsson,Erik Cernak,[95. 17.],2,00:00,BUF,TBL,TBL,14,BUF,7,3,2,8475728,8478416.0,2019020365,,2019-11-26,Johan Larsson Holding against Erik Cernak
178,penalty,Hooking,Marco Scandella,Nikita Kucherov,[75.  9.],3,13:47,BUF,TBL,TBL,14,BUF,7,3,2,8474618,8476453.0,2019020365,,2019-11-26,Marco Scandella Hooking against Nikita Kucherov
185,penalty,Tripping,Kevin Shattenkirk,Jimmy Vesey,[ -7. -34.],3,11:53,TBL,BUF,TBL,14,BUF,7,3,2,8474031,8476918.0,2019020365,,2019-11-26,Kevin Shattenkirk Tripping against Jimmy Vesey
102,penalty,Slashing,Zach Sanford,Nikita Kucherov,[ 37. -14.],2,15:36,STL,TBL,TBL,14,STL,19,1,0,8477482,8476453.0,2019020380,,2019-11-28,Zach Sanford Slashing against Nikita Kucherov
147,penalty,Slashing,Alex Pietrangelo,Alex Killorn,[-38.  14.],2,04:31,STL,TBL,TBL,14,STL,19,2,2,8474565,8473986.0,2019020380,,2019-11-28,Alex Pietrangelo Slashing against Alex Killorn
163,penalty,Tripping,David Perron,Victor Hedman,[-82.  18.],3,19:40,STL,TBL,TBL,14,STL,19,2,2,8474102,8475167.0,2019020380,,2019-11-28,David Perron Tripping against Victor Hedman
195,penalty,Slashing,Alex Killorn,Robert Thomas,[-77.  20.],3,10:58,TBL,STL,TBL,14,STL,19,2,3,8473986,8480023.0,2019020380,,2019-11-28,Alex Killorn Slashing against Robert Thomas
197,penalty,Tripping,Yanni Gourde,Alex Pietrangelo,[81. 34.],3,10:42,TBL,STL,TBL,14,STL,19,2,3,8476826,8474565.0,2019020380,,2019-11-28,Yanni Gourde Tripping against Alex Pietrangelo
208,penalty,Slashing,Robert Thomas,Mathieu Joseph,[ 63. -21.],3,06:48,STL,TBL,TBL,14,STL,19,2,4,8480023,8478472.0,2019020380,,2019-11-28,Robert Thomas Slashing against Mathieu Joseph
47,penalty,Interference,Lars Eller,Brayden Point,[-19. -33.],1,11:43,WSH,TBL,WSH,15,TBL,14,0,0,8474189,8478010.0,2019020398,,2019-11-30,Lars Eller Interference against Brayden Point
99,penalty,Hi-sticking,Richard Panik,Ondrej Palat,[ 43. -18.],1,02:06,WSH,TBL,WSH,15,TBL,14,0,0,8475209,8476292.0,2019020398,,2019-11-30,Richard Panik Hi-sticking against Ondrej Palat
143,penalty,Interference,Mikhail Sergachev,Lars Eller,[48.  1.],2,15:09,TBL,WSH,WSH,15,TBL,14,0,2,8479410,8474189.0,2019020398,,2019-11-30,Mikhail Sergachev Interference against Lars Eller
168,penalty,Roughing,Evgeny Kuznetsov,Yanni Gourde,[-95.   0.],2,11:13,WSH,TBL,WSH,15,TBL,14,1,2,8475744,8476826.0,2019020398,,2019-11-30,Evgeny Kuznetsov Roughing against Yanni Gourde
169,penalty,Roughing,Yanni Gourde,Evgeny Kuznetsov,[-96.  -4.],2,11:13,TBL,WSH,WSH,15,TBL,14,1,2,8476826,8475744.0,2019020398,,2019-11-30,Yanni Gourde Roughing against Evgeny Kuznetsov
184,penalty,Roughing,Richard Panik,Nikita Kucherov,[-80.  -3.],2,06:47,WSH,TBL,WSH,15,TBL,14,1,2,8475209,8476453.0,2019020398,,2019-11-30,Richard Panik Roughing against Nikita Kucherov
227,penalty,Interference,Alex Ovechkin,Mikhail Sergachev,[-36.   0.],3,14:41,WSH,TBL,WSH,15,TBL,14,2,3,8471214,8479410.0,2019020398,,2019-11-30,Alex Ovechkin Interference against Mikhail Sergachev
249,penalty,Holding,Nikita Kucherov,Dmitry Orlov,[-55. -38.],3,10:14,TBL,WSH,WSH,15,TBL,14,2,3,8476453,8475200.0,2019020398,,2019-11-30,Nikita Kucherov Holding against Dmitry Orlov
13,penalty,Too many men on the ice,Carter Verhaeghe,,[-11.  31.],1,15:49,TBL,CAR,TBL,14,CAR,12,0,0,8477409,,2019020407,,2019-12-01,Too many men/ice served by Carter Verhaeghe
64,penalty,Holding,Trevor van Riemsdyk,Pat Maroon,[92. 16.],1,03:02,CAR,TBL,TBL,14,CAR,12,0,2,8477845,8474034.0,2019020407,,2019-12-01,Trevor van Riemsdyk Holding against Pat Maroon
85,penalty,Roughing,Brock McGinn,Yanni Gourde,[-81.   5.],2,19:21,CAR,TBL,TBL,14,CAR,12,0,3,8476934,8476826.0,2019020407,,2019-12-01,Brock McGinn Roughing against Yanni Gourde
97,penalty,Tripping,Clark Bishop,Cedric Paquette,[78. 29.],2,16:14,CAR,TBL,TBL,14,CAR,12,0,3,8478056,8476975.0,2019020407,,2019-12-01,Clark Bishop Tripping against Cedric Paquette
175,penalty,Holding,Jake Gardiner,Anthony Cirelli,[ 78. -33.],3,17:21,CAR,TBL,TBL,14,CAR,12,0,3,8474581,8478519.0,2019020407,,2019-12-01,Jake Gardiner Holding against Anthony Cirelli
188,penalty,Hi-sticking,Joel Edmundson,Cedric Paquette,[56. 32.],3,14:10,CAR,TBL,TBL,14,CAR,12,1,3,8476441,8476975.0,2019020407,,2019-12-01,Joel Edmundson Hi-sticking against Cedric Paquette
208,penalty,Tripping,Yanni Gourde,Jordan Staal,[ 76. -28.],3,09:58,TBL,CAR,TBL,14,CAR,12,2,3,8476826,8473533.0,2019020407,,2019-12-01,Yanni Gourde Tripping against Jordan Staal
210,penalty,Hooking,Ryan Dzingel,Ryan McDonagh,[-92.  18.],3,09:51,CAR,TBL,TBL,14,CAR,12,2,3,8476288,8474151.0,2019020407,,2019-12-01,Ryan Dzingel Hooking against Ryan McDonagh
226,penalty,Hooking,Steven Stamkos,Jordan Staal,[-95.  18.],3,05:26,TBL,CAR,TBL,14,CAR,12,2,3,8474564,8473533.0,2019020407,,2019-12-01,Steven Stamkos Hooking against Jordan Staal
241,penalty,Slashing,Victor Hedman,Andrei Svechnikov,[54. 41.],3,00:35,TBL,CAR,TBL,14,CAR,12,2,3,8475167,8480830.0,2019020407,,2019-12-01,Victor Hedman Slashing against Andrei Svechnikov
242,penalty,Misconduct,Pat Maroon,,[-30.   3.],3,00:35,TBL,CAR,TBL,14,CAR,12,2,3,8474034,,2019020407,,2019-12-01,Pat Maroon Misconduct
45,penalty,Interference,Carter Verhaeghe,Ryan Ellis,[ 52. -36.],1,08:33,TBL,NSH,NSH,18,TBL,14,0,1,8477409,8475176.0,2019020430,,2019-12-04,Carter Verhaeghe Interference against Ryan Ellis
74,penalty,Hi-sticking,Nikita Kucherov,Rocco Grimaldi,[ 43. -38.],2,19:47,TBL,NSH,NSH,18,TBL,14,0,1,8476453,8476428.0,2019020430,,2019-12-04,Nikita Kucherov Hi-sticking against Rocco Grimaldi
87,penalty,Fighting,Luke Schenn,Austin Watson,[64. 10.],2,17:07,TBL,NSH,NSH,18,TBL,14,0,1,8474568,8475766.0,2019020430,,2019-12-04,Luke Schenn Fighting against Austin Watson
88,penalty,Fighting,Austin Watson,Luke Schenn,[70. 18.],2,17:07,NSH,TBL,NSH,18,TBL,14,0,1,8475766,8474568.0,2019020430,,2019-12-04,Austin Watson Fighting against Luke Schenn
114,penalty,Elbowing,Ryan Johansen,Daniel Carr,[69. 38.],2,10:50,NSH,TBL,NSH,18,TBL,14,1,2,8475793,8477901.0,2019020430,,2019-12-04,Ryan Johansen Elbowing against Brayden Point served by Daniel Carr
115,penalty,Game misconduct,Ryan Johansen,,[61. 37.],2,10:50,NSH,TBL,NSH,18,TBL,14,1,2,8475793,,2019020430,,2019-12-04,Ryan Johansen Game misconduct
169,penalty,Hi-sticking,Mathieu Olivier,Nikita Kucherov,[-59.  38.],3,15:59,NSH,TBL,NSH,18,TBL,14,1,2,8479671,8476453.0,2019020430,,2019-12-04,Mathieu Olivier Hi-sticking against Nikita Kucherov
182,penalty,Illegal check to head,Erik Cernak,Daniel Carr,[ 95. -15.],3,12:01,TBL,NSH,NSH,18,TBL,14,1,2,8478416,8477901.0,2019020430,,2019-12-04,Erik Cernak Illegal check to head against Daniel Carr
202,penalty,Roughing,Cedric Paquette,Pat Maroon,[-73.   4.],3,06:59,TBL,NSH,NSH,18,TBL,14,2,2,8476975,8474034.0,2019020430,,2019-12-04,Cedric Paquette Roughing against Dante Fabbro served by Pat Maroon
203,penalty,Roughing,Dante Fabbro,Cedric Paquette,[-69.  14.],3,06:59,NSH,TBL,NSH,18,TBL,14,2,2,8479371,8476975.0,2019020430,,2019-12-04,Dante Fabbro Roughing against Cedric Paquette
204,penalty,Roughing,Cedric Paquette,Dante Fabbro,[-75.  10.],3,06:59,TBL,NSH,NSH,18,TBL,14,2,2,8476975,8479371.0,2019020430,,2019-12-04,Cedric Paquette Roughing against Dante Fabbro
215,penalty,Hi-sticking,Nick Bonino,Steven Stamkos,[-69.   1.],3,03:57,NSH,TBL,NSH,18,TBL,14,2,2,8474009,8474564.0,2019020430,,2019-12-04,Nick Bonino Hi-sticking against Steven Stamkos
13,penalty,Tripping,Alex Killorn,Nick Seeler,[-74. -32.],1,16:33,TBL,MIN,TBL,14,MIN,30,1,0,8473986,8476372.0,2019020440,,2019-12-06,Alex Killorn Tripping against Nick Seeler
72,penalty,Hooking,Joel Eriksson Ek,Ryan McDonagh,[76.  3.],1,00:35,MIN,TBL,TBL,14,MIN,30,2,3,8478493,8474151.0,2019020440,,2019-12-06,Joel Eriksson Ek Hooking against Ryan McDonagh
112,penalty,Hi-sticking,Luke Schenn,Zach Parise,[ 82. -27.],2,10:24,TBL,MIN,TBL,14,MIN,30,2,3,8474568,8470610.0,2019020440,,2019-12-06,Luke Schenn Hi-sticking against Zach Parise
123,penalty,Interference,Nick Seeler,Yanni Gourde,[-66. -32.],2,06:29,MIN,TBL,TBL,14,MIN,30,2,3,8476372,8476826.0,2019020440,,2019-12-06,Nick Seeler Interference against Yanni Gourde
143,penalty,Hooking,Ryan Hartman,Anthony Cirelli,[-76.   5.],2,02:12,MIN,TBL,TBL,14,MIN,30,2,3,8477451,8478519.0,2019020440,,2019-12-06,Ryan Hartman Hooking against Anthony Cirelli
169,penalty,Slashing,Kevin Fiala,Nikita Kucherov,[-62. -26.],3,14:27,MIN,TBL,TBL,14,MIN,30,4,5,8477942,8476453.0,2019020440,,2019-12-06,Kevin Fiala Slashing against Nikita Kucherov
170,penalty,Slashing,Nikita Kucherov,Kevin Fiala,[-64. -28.],3,14:27,TBL,MIN,TBL,14,MIN,30,4,5,8476453,8477942.0,2019020440,,2019-12-06,Nikita Kucherov Slashing against Kevin Fiala
183,penalty,Holding the stick,Joel Eriksson Ek,Brayden Point,[68. 32.],3,09:46,MIN,TBL,TBL,14,MIN,30,4,5,8478493,8478010.0,2019020440,,2019-12-06,Joel Eriksson Ek Holding the stick against Brayden Point
2,penalty,Tripping,Ondrej Palat,Logan Couture,[-73.  -1.],1,19:45,TBL,SJS,TBL,14,SJS,28,0,0,8476292,8474053.0,2019020456,,2019-12-08,Ondrej Palat Tripping against Logan Couture
25,penalty,Hi stick - double minor,Mathieu Joseph,Marcus Sorensen,[60.  4.],1,14:09,TBL,SJS,TBL,14,SJS,28,1,0,8478472,8475834.0,2019020456,,2019-12-08,Mathieu Joseph Hi stick - double minor against Marcus Sorensen
98,penalty,Slashing,Erik Karlsson,Cedric Paquette,[-44. -30.],2,17:32,SJS,TBL,TBL,14,SJS,28,1,0,8474578,8476975.0,2019020456,,2019-12-08,Erik Karlsson Slashing against Cedric Paquette
151,penalty,Hi stick - double minor,Kevin Labanc,Anthony Cirelli,[52.  4.],2,03:44,SJS,TBL,TBL,14,SJS,28,2,0,8478099,8478519.0,2019020456,,2019-12-08,Kevin Labanc Hi stick - double minor against Anthony Cirelli
233,penalty,Slashing,Timo Meier,Brayden Point,[-59.   3.],3,04:31,SJS,TBL,TBL,14,SJS,28,5,1,8478414,8478010.0,2019020456,,2019-12-08,Timo Meier Slashing against Brayden Point
241,penalty,Hi-sticking,Mathieu Joseph,Timo Meier,[12.  6.],3,03:42,TBL,SJS,TBL,14,SJS,28,6,1,8478472,8478414.0,2019020456,,2019-12-08,Mathieu Joseph Hi-sticking against Timo Meier
26,penalty,Tripping,Adam Pelech,Mitchell Stephens,[ 94. -11.],1,12:43,NYI,TBL,TBL,14,NYI,2,0,0,8476917,8478477.0,2019020468,,2019-12-10,Adam Pelech Tripping against Mitchell Stephens
74,penalty,Roughing,Cal Clutterbuck,Cory Conacher,[83. -2.],1,02:51,NYI,TBL,TBL,14,NYI,2,0,0,8473504,8476195.0,2019020468,,2019-12-10,Cal Clutterbuck Roughing against Cory Conacher
75,penalty,Roughing,Cory Conacher,Cal Clutterbuck,[80.  0.],1,02:51,TBL,NYI,TBL,14,NYI,2,0,0,8476195,8473504.0,2019020468,,2019-12-10,Cory Conacher Roughing against Cal Clutterbuck
119,penalty,Cross checking,Scott Mayfield,Nikita Kucherov,[-71. -26.],2,12:30,NYI,TBL,TBL,14,NYI,2,0,1,8476429,8476453.0,2019020468,,2019-12-10,Scott Mayfield Cross checking against Nikita Kucherov
120,penalty,Roughing,Cedric Paquette,Scott Mayfield,[-82.  31.],2,12:30,TBL,NYI,TBL,14,NYI,2,0,1,8476975,8476429.0,2019020468,,2019-12-10,Cedric Paquette Roughing against Scott Mayfield
121,penalty,Roughing,Scott Mayfield,Michael Dal Colle,[-76.  33.],2,12:30,NYI,TBL,TBL,14,NYI,2,0,1,8476429,8477936.0,2019020468,,2019-12-10,Scott Mayfield Roughing against Cedric Paquette served by Michael Dal Colle
