,event,hitter,hittee,coords,period,period_time_remaining,hitter_team,hittee_team,home_team,home_team_id,away_team,away_team_id,home_goals,away_goals,hitter_id,hittee_id,game_id,winning_team,date,description
32,hit,Vladislav Namestnikov,Travis Sanheim,[ 99. -17.],1,13:52,OTT,PHI,OTT,9,PHI,4,0,1,8476480,8477948.0,2019020557,,2019-12-22,Vladislav Namestnikov hit Travis Sanheim
33,hit,Andy Andreoff,Colin White,[89. 35.],1,13:48,PHI,OTT,OTT,9,PHI,4,0,1,8476404,8478400.0,2019020557,,2019-12-22,Andy Andreoff hit Colin White
34,hit,Brady Tkachuk,Mikhail Vorobyev,[-38.  39.],1,13:25,OTT,PHI,OTT,9,PHI,4,0,1,8480801,8478844.0,2019020557,,2019-12-22,Brady Tkachuk hit Mikhail Vorobyev
36,hit,Brady Tkachuk,Robert Hagg,[-60.  41.],1,12:57,OTT,PHI,OTT,9,PHI,4,0,1,8480801,8477462.0,2019020557,,2019-12-22,Brady Tkachuk hit Robert Hagg
39,hit,Jean-Gabriel Pageau,Robert Hagg,[ 98. -10.],1,12:27,OTT,PHI,OTT,9,PHI,4,0,1,8476419,8477462.0,2019020557,,2019-12-22,Jean-Gabriel Pageau hit Robert Hagg
47,hit,Nicolas Aube-Kubel,Chris Tierney,[-35. -41.],1,11:28,PHI,OTT,OTT,9,PHI,4,0,1,8477979,8476919.0,2019020557,,2019-12-22,Nicolas Aube-Kubel hit Chris Tierney
53,hit,Justin Braun,Brady Tkachuk,[92. 30.],1,09:43,PHI,OTT,OTT,9,PHI,4,0,1,8474027,8480801.0,2019020557,,2019-12-22,Justin Braun hit Brady Tkachuk
59,hit,Philippe Myers,Connor Brown,[80. -9.],1,09:20,PHI,OTT,OTT,9,PHI,4,0,1,8479026,8477015.0,2019020557,,2019-12-22,Philippe Myers hit Connor Brown
72,hit,Maxime Lajoie,Mikhail Vorobyev,[-63.  41.],1,06:38,OTT,PHI,OTT,9,PHI,4,0,1,8479320,8478844.0,2019020557,,2019-12-22,Maxime Lajoie hit Mikhail Vorobyev
74,hit,Logan Brown,Justin Braun,[81. 39.],1,05:57,OTT,PHI,OTT,9,PHI,4,0,1,8479366,8474027.0,2019020557,,2019-12-22,Logan Brown hit Justin Braun
75,hit,J.C. Beaudin,Travis Sanheim,[-20. -41.],1,05:33,OTT,PHI,OTT,9,PHI,4,0,1,8478833,8477948.0,2019020557,,2019-12-22,J.C. Beaudin hit Travis Sanheim
76,hit,Nick Paul,Ivan Provorov,[ 94. -27.],1,05:00,OTT,PHI,OTT,9,PHI,4,0,1,8477426,8478500.0,2019020557,,2019-12-22,Nick Paul hit Ivan Provorov
81,hit,Robert Hagg,Brady Tkachuk,[98. -5.],1,03:35,PHI,OTT,OTT,9,PHI,4,0,1,8477462,8480801.0,2019020557,,2019-12-22,Robert Hagg hit Brady Tkachuk
92,hit,Brady Tkachuk,Travis Sanheim,[95. 25.],1,02:02,OTT,PHI,OTT,9,PHI,4,0,1,8480801,8477948.0,2019020557,,2019-12-22,Brady Tkachuk hit Travis Sanheim
113,hit,Chris Stewart,Maxime Lajoie,[ 89. -34.],2,18:07,PHI,OTT,OTT,9,PHI,4,0,2,8473485,8479320.0,2019020557,,2019-12-22,Chris Stewart hit Maxime Lajoie
124,hit,Chris Stewart,Andreas Englund,[98. -4.],2,14:16,PHI,OTT,OTT,9,PHI,4,0,2,8473485,8477971.0,2019020557,,2019-12-22,Chris Stewart hit Andreas Englund
129,hit,Philippe Myers,Mark Borowiecki,[-45. -31.],2,13:46,PHI,OTT,OTT,9,PHI,4,1,2,8479026,8474697.0,2019020557,,2019-12-22,Philippe Myers hit Mark Borowiecki
140,hit,Nicolas Aube-Kubel,Thomas Chabot,[-34. -32.],2,11:44,PHI,OTT,OTT,9,PHI,4,2,2,8477979,8478469.0,2019020557,,2019-12-22,Nicolas Aube-Kubel hit Thomas Chabot
141,hit,Thomas Chabot,Nicolas Aube-Kubel,[-24. -40.],2,11:39,OTT,PHI,OTT,9,PHI,4,2,2,8478469,8477979.0,2019020557,,2019-12-22,Thomas Chabot hit Nicolas Aube-Kubel
142,hit,Nicolas Aube-Kubel,Thomas Chabot,[ 81. -39.],2,11:29,PHI,OTT,OTT,9,PHI,4,2,2,8477979,8478469.0,2019020557,,2019-12-22,Nicolas Aube-Kubel hit Thomas Chabot
152,hit,Anthony Duclair,Kevin Hayes,[ 16. -40.],2,08:49,OTT,PHI,OTT,9,PHI,4,2,2,8477407,8475763.0,2019020557,,2019-12-22,Anthony Duclair hit Kevin Hayes
155,hit,Justin Braun,Tyler Ennis,[-74. -40.],2,07:56,PHI,OTT,OTT,9,PHI,4,2,2,8474027,8474589.0,2019020557,,2019-12-22,Justin Braun hit Tyler Ennis
157,hit,Ivan Provorov,Colin White,[-77.  40.],2,07:19,PHI,OTT,OTT,9,PHI,4,2,2,8478500,8478400.0,2019020557,,2019-12-22,Ivan Provorov hit Colin White
159,hit,Robert Hagg,Colin White,[-78. -40.],2,06:37,PHI,OTT,OTT,9,PHI,4,2,2,8477462,8478400.0,2019020557,,2019-12-22,Robert Hagg hit Colin White
160,hit,Mark Borowiecki,Travis Sanheim,[ 59. -41.],2,05:51,OTT,PHI,OTT,9,PHI,4,2,2,8474697,8477948.0,2019020557,,2019-12-22,Mark Borowiecki hit Travis Sanheim
163,hit,Mark Borowiecki,Travis Konecny,[98.  9.],2,05:21,OTT,PHI,OTT,9,PHI,4,2,2,8474697,8478439.0,2019020557,,2019-12-22,Mark Borowiecki hit Travis Konecny
164,hit,Mark Borowiecki,Travis Konecny,[90. 32.],2,05:13,OTT,PHI,OTT,9,PHI,4,2,2,8474697,8478439.0,2019020557,,2019-12-22,Mark Borowiecki hit Travis Konecny
165,hit,J.C. Beaudin,Shayne Gostisbehere,[ 10. -40.],2,04:44,OTT,PHI,OTT,9,PHI,4,2,2,8478833,8476906.0,2019020557,,2019-12-22,J.C. Beaudin hit Shayne Gostisbehere
166,hit,Nicolas Aube-Kubel,Thomas Chabot,[ 80. -39.],2,04:05,PHI,OTT,OTT,9,PHI,4,2,2,8477979,8478469.0,2019020557,,2019-12-22,Nicolas Aube-Kubel hit Thomas Chabot
167,hit,Justin Braun,Artem Anisimov,[-86. -36.],2,03:51,PHI,OTT,OTT,9,PHI,4,2,2,8474027,8473573.0,2019020557,,2019-12-22,Justin Braun hit Artem Anisimov
174,hit,Colin White,Justin Braun,[ 12. -40.],2,02:53,OTT,PHI,OTT,9,PHI,4,2,2,8478400,8474027.0,2019020557,,2019-12-22,Colin White hit Justin Braun
175,hit,J.C. Beaudin,Justin Braun,[  6. -41.],2,02:44,OTT,PHI,OTT,9,PHI,4,2,2,8478833,8474027.0,2019020557,,2019-12-22,J.C. Beaudin hit Justin Braun
187,hit,Jean-Gabriel Pageau,Justin Braun,[-98.  13.],2,00:22,OTT,PHI,OTT,9,PHI,4,3,3,8476419,8474027.0,2019020557,,2019-12-22,Jean-Gabriel Pageau hit Justin Braun
188,hit,Sean Couturier,Brady Tkachuk,[-88.  35.],2,00:10,PHI,OTT,OTT,9,PHI,4,3,3,8476461,8480801.0,2019020557,,2019-12-22,Sean Couturier hit Brady Tkachuk
197,hit,Robert Hagg,Colin White,[97. -8.],3,17:49,PHI,OTT,OTT,9,PHI,4,3,4,8477462,8478400.0,2019020557,,2019-12-22,Robert Hagg hit Colin White
199,hit,Chris Tierney,Sean Couturier,[98.  8.],3,17:17,OTT,PHI,OTT,9,PHI,4,3,4,8476919,8476461.0,2019020557,,2019-12-22,Chris Tierney hit Sean Couturier
216,hit,Nick Paul,Philippe Myers,[90. 33.],3,11:05,OTT,PHI,OTT,9,PHI,4,3,4,8477426,8479026.0,2019020557,,2019-12-22,Nick Paul hit Philippe Myers
218,hit,Nicolas Aube-Kubel,Erik Brannstrom,[17. 40.],3,10:50,PHI,OTT,OTT,9,PHI,4,3,4,8477979,8480073.0,2019020557,,2019-12-22,Nicolas Aube-Kubel hit Erik Brannstrom
219,hit,Mark Borowiecki,Travis Konecny,[-20.  32.],3,10:37,OTT,PHI,OTT,9,PHI,4,3,4,8474697,8478439.0,2019020557,,2019-12-22,Mark Borowiecki hit Travis Konecny
229,hit,Andreas Englund,Tyler Pitlick,[34. 38.],3,08:38,OTT,PHI,OTT,9,PHI,4,4,4,8477971,8475752.0,2019020557,,2019-12-22,Andreas Englund hit Tyler Pitlick
233,hit,Brady Tkachuk,Justin Braun,[-29.  35.],3,07:55,OTT,PHI,OTT,9,PHI,4,4,4,8480801,8474027.0,2019020557,,2019-12-22,Brady Tkachuk hit Justin Braun
239,hit,Vladislav Namestnikov,Philippe Myers,[ 93. -29.],3,06:12,OTT,PHI,OTT,9,PHI,4,4,4,8476480,8479026.0,2019020557,,2019-12-22,Vladislav Namestnikov hit Philippe Myers
240,hit,Erik Brannstrom,Travis Konecny,[-24. -40.],3,05:49,OTT,PHI,OTT,9,PHI,4,4,4,8480073,8478439.0,2019020557,,2019-12-22,Erik Brannstrom hit Travis Konecny
244,hit,Ivan Provorov,Tyler Ennis,[ 48. -40.],3,04:56,PHI,OTT,OTT,9,PHI,4,4,4,8478500,8474589.0,2019020557,,2019-12-22,Ivan Provorov hit Tyler Ennis
250,hit,Nicolas Aube-Kubel,Thomas Chabot,[-56.  39.],3,03:36,PHI,OTT,OTT,9,PHI,4,4,4,8477979,8478469.0,2019020557,,2019-12-22,Nicolas Aube-Kubel hit Thomas Chabot
256,hit,Tyler Pitlick,Thomas Chabot,[-22. -40.],3,02:52,PHI,OTT,OTT,9,PHI,4,4,4,8475752,8478469.0,2019020557,,2019-12-22,Tyler Pitlick hit Thomas Chabot
259,hit,Cody Goloubef,Sean Couturier,[-67. -40.],3,02:25,OTT,PHI,OTT,9,PHI,4,4,4,8474597,8476461.0,2019020557,,2019-12-22,Cody Goloubef hit Sean Couturier
2,hit,Brady Tkachuk,Rasmus Ristolainen,[23. 33.],1,19:26,OTT,BUF,OTT,9,BUF,7,0,0,8480801,8477499.0,2019020575,,2019-12-25,Brady Tkachuk hit Rasmus Ristolainen
6,hit,Andreas Englund,Rasmus Asplund,[-64.  39.],1,18:27,OTT,BUF,OTT,9,BUF,7,0,0,8477971,8479335.0,2019020575,,2019-12-25,Andreas Englund hit Rasmus Asplund
7,hit,Logan Brown,Jake McCabe,[-24. -38.],1,17:53,OTT,BUF,OTT,9,BUF,7,0,0,8479366,8476931.0,2019020575,,2019-12-25,Logan Brown hit Jake McCabe
11,hit,Brady Tkachuk,Victor Olofsson,[-95. -16.],1,16:49,OTT,BUF,OTT,9,BUF,7,0,0,8480801,8478109.0,2019020575,,2019-12-25,Brady Tkachuk hit Victor Olofsson
12,hit,Victor Olofsson,Brady Tkachuk,[-94.  23.],1,16:41,BUF,OTT,OTT,9,BUF,7,0,0,8478109,8480801.0,2019020575,,2019-12-25,Victor Olofsson hit Brady Tkachuk
15,hit,Henri Jokiharju,Chris Tierney,[83. 35.],1,15:58,BUF,OTT,OTT,9,BUF,7,0,0,8480035,8476919.0,2019020575,,2019-12-25,Henri Jokiharju hit Chris Tierney
17,hit,Zach Bogosian,Artem Anisimov,[ 92. -24.],1,15:20,BUF,OTT,OTT,9,BUF,7,0,0,8474567,8473573.0,2019020575,,2019-12-25,Zach Bogosian hit Artem Anisimov
21,hit,Thomas Chabot,Jake McCabe,[-40.  40.],1,15:06,OTT,BUF,OTT,9,BUF,7,0,0,8478469,8476931.0,2019020575,,2019-12-25,Thomas Chabot hit Jake McCabe
23,hit,Mark Borowiecki,Jimmy Vesey,[-30. -36.],1,14:54,OTT,BUF,OTT,9,BUF,7,0,0,8474697,8476918.0,2019020575,,2019-12-25,Mark Borowiecki hit Jimmy Vesey
25,hit,Nick Paul,Jake McCabe,[-40. -37.],1,14:41,OTT,BUF,OTT,9,BUF,7,0,0,8477426,8476931.0,2019020575,,2019-12-25,Nick Paul hit Jake McCabe
31,hit,Cody Goloubef,Jimmy Vesey,[-63. -36.],1,13:22,OTT,BUF,OTT,9,BUF,7,0,0,8474597,8476918.0,2019020575,,2019-12-25,Cody Goloubef hit Jimmy Vesey
32,hit,Andreas Englund,Evan Rodrigues,[-96.  18.],1,11:52,OTT,BUF,OTT,9,BUF,7,0,0,8477971,8478542.0,2019020575,,2019-12-25,Andreas Englund hit Evan Rodrigues
42,hit,Andreas Englund,Rasmus Asplund,[20. 38.],1,09:11,OTT,BUF,OTT,9,BUF,7,0,0,8477971,8479335.0,2019020575,,2019-12-25,Andreas Englund hit Rasmus Asplund
46,hit,Curtis Lazar,Artem Anisimov,[-84.  37.],1,08:42,BUF,OTT,OTT,9,BUF,7,0,0,8477508,8473573.0,2019020575,,2019-12-25,Curtis Lazar hit Artem Anisimov
48,hit,Curtis Lazar,Andreas Englund,[-87.  36.],1,08:28,BUF,OTT,OTT,9,BUF,7,0,0,8477508,8477971.0,2019020575,,2019-12-25,Curtis Lazar hit Andreas Englund
53,hit,Jean-Gabriel Pageau,Jake McCabe,[-13. -39.],1,07:41,OTT,BUF,OTT,9,BUF,7,0,0,8476419,8476931.0,2019020575,,2019-12-25,Jean-Gabriel Pageau hit Jake McCabe
67,hit,Jack Eichel,Brady Tkachuk,[85. 38.],1,05:46,BUF,OTT,OTT,9,BUF,7,0,0,8478403,8480801.0,2019020575,,2019-12-25,Jack Eichel hit Brady Tkachuk
72,hit,Mark Borowiecki,Conor Sheary,[-84. -34.],1,04:42,OTT,BUF,OTT,9,BUF,7,0,0,8474697,8477839.0,2019020575,,2019-12-25,Mark Borowiecki hit Conor Sheary
83,hit,Henri Jokiharju,Nick Paul,[89. 32.],1,02:32,BUF,OTT,OTT,9,BUF,7,0,0,8480035,8477426.0,2019020575,,2019-12-25,Henri Jokiharju hit Nick Paul
86,hit,Marco Scandella,J.C. Beaudin,[ 91. -29.],1,02:12,BUF,OTT,OTT,9,BUF,7,0,0,8474618,8478833.0,2019020575,,2019-12-25,Marco Scandella hit J.C. Beaudin
109,hit,Sam Reinhart,Cody Goloubef,[93. 30.],2,18:37,BUF,OTT,OTT,9,BUF,7,1,0,8477933,8474597.0,2019020575,,2019-12-25,Sam Reinhart hit Cody Goloubef
120,hit,Jake McCabe,Anthony Duclair,[-59.  39.],2,15:46,BUF,OTT,OTT,9,BUF,7,1,0,8476931,8477407.0,2019020575,,2019-12-25,Jake McCabe hit Anthony Duclair
125,hit,Zach Bogosian,Erik Brannstrom,[-96.  -8.],2,14:19,BUF,OTT,OTT,9,BUF,7,1,0,8474567,8480073.0,2019020575,,2019-12-25,Zach Bogosian hit Erik Brannstrom
140,hit,Nick Paul,Henri Jokiharju,[ 27. -37.],2,10:21,OTT,BUF,OTT,9,BUF,7,1,0,8477426,8480035.0,2019020575,,2019-12-25,Nick Paul hit Henri Jokiharju
142,hit,Sam Reinhart,Chris Tierney,[ 92. -17.],2,10:04,BUF,OTT,OTT,9,BUF,7,1,0,8477933,8476919.0,2019020575,,2019-12-25,Sam Reinhart hit Chris Tierney
147,hit,Zemgus Girgensons,Maxime Lajoie,[-13. -37.],2,08:19,BUF,OTT,OTT,9,BUF,7,1,0,8476878,8479320.0,2019020575,,2019-12-25,Zemgus Girgensons hit Maxime Lajoie
148,hit,Mark Borowiecki,Zemgus Girgensons,[ 23. -37.],2,08:09,OTT,BUF,OTT,9,BUF,7,1,0,8474697,8476878.0,2019020575,,2019-12-25,Mark Borowiecki hit Zemgus Girgensons
155,hit,Thomas Chabot,Henri Jokiharju,[ 48. -39.],2,07:11,OTT,BUF,OTT,9,BUF,7,1,0,8478469,8480035.0,2019020575,,2019-12-25,Thomas Chabot hit Henri Jokiharju
161,hit,Evan Rodrigues,Maxime Lajoie,[-71.  38.],2,05:07,BUF,OTT,OTT,9,BUF,7,1,0,8478542,8479320.0,2019020575,,2019-12-25,Evan Rodrigues hit Maxime Lajoie
162,hit,Anthony Duclair,Evan Rodrigues,[ 52. -37.],2,04:50,OTT,BUF,OTT,9,BUF,7,1,0,8477407,8478542.0,2019020575,,2019-12-25,Anthony Duclair hit Evan Rodrigues
167,hit,Erik Brannstrom,Curtis Lazar,[ 58. -38.],2,04:01,OTT,BUF,OTT,9,BUF,7,1,1,8480073,8477508.0,2019020575,,2019-12-25,Erik Brannstrom hit Curtis Lazar
170,hit,J.C. Beaudin,Rasmus Dahlin,[-88.  33.],2,03:18,OTT,BUF,OTT,9,BUF,7,1,1,8478833,8480839.0,2019020575,,2019-12-25,J.C. Beaudin hit Rasmus Dahlin
172,hit,Logan Brown,Henri Jokiharju,[-95. -17.],2,02:52,OTT,BUF,OTT,9,BUF,7,1,1,8479366,8480035.0,2019020575,,2019-12-25,Logan Brown hit Henri Jokiharju
173,hit,Thomas Chabot,Marcus Johansson,[ 35. -37.],2,02:41,OTT,BUF,OTT,9,BUF,7,1,1,8478469,8475149.0,2019020575,,2019-12-25,Thomas Chabot hit Marcus Johansson
194,hit,Tyler Ennis,Conor Sheary,[ 6. 39.],3,18:26,OTT,BUF,OTT,9,BUF,7,1,1,8474589,8477839.0,2019020575,,2019-12-25,Tyler Ennis hit Conor Sheary
199,hit,Sam Reinhart,Mark Borowiecki,[-71. -38.],3,17:14,BUF,OTT,OTT,9,BUF,7,1,1,8477933,8474697.0,2019020575,,2019-12-25,Sam Reinhart hit Mark Borowiecki
201,hit,Jake McCabe,J.C. Beaudin,[29. 38.],3,16:48,BUF,OTT,OTT,9,BUF,7,1,1,8476931,8478833.0,2019020575,,2019-12-25,Jake McCabe hit J.C. Beaudin
204,hit,Sam Reinhart,Thomas Chabot,[-94.  24.],3,15:23,BUF,OTT,OTT,9,BUF,7,1,1,8477933,8478469.0,2019020575,,2019-12-25,Sam Reinhart hit Thomas Chabot
226,hit,Mark Borowiecki,Jack Eichel,[-98.  20.],3,10:53,OTT,BUF,OTT,9,BUF,7,2,1,8474697,8478403.0,2019020575,,2019-12-25,Mark Borowiecki hit Jack Eichel
229,hit,J.C. Beaudin,Rasmus Ristolainen,[93. 12.],3,10:13,OTT,BUF,OTT,9,BUF,7,2,1,8478833,8477499.0,2019020575,,2019-12-25,J.C. Beaudin hit Rasmus Ristolainen
237,hit,Nick Paul,Rasmus Ristolainen,[-22.  39.],3,09:12,OTT,BUF,OTT,9,BUF,7,2,1,8477426,8477499.0,2019020575,,2019-12-25,Nick Paul hit Rasmus Ristolainen
241,hit,Anthony Duclair,Brandon Montour,[68. 39.],3,08:41,OTT,BUF,OTT,9,BUF,7,2,1,8477407,8477986.0,2019020575,,2019-12-25,Anthony Duclair hit Brandon Montour
242,hit,Brandon Montour,Anthony Duclair,[94. 28.],3,08:35,BUF,OTT,OTT,9,BUF,7,2,1,8477986,8477407.0,2019020575,,2019-12-25,Brandon Montour hit Anthony Duclair
245,hit,Jean-Gabriel Pageau,Sam Reinhart,[-49. -38.],3,08:05,OTT,BUF,OTT,9,BUF,7,2,1,8476419,8477933.0,2019020575,,2019-12-25,Jean-Gabriel Pageau hit Sam Reinhart
251,hit,Tyler Ennis,Evan Rodrigues,[77. 40.],3,07:03,OTT,BUF,OTT,9,BUF,7,2,1,8474589,8478542.0,2019020575,,2019-12-25,Tyler Ennis hit Evan Rodrigues
253,hit,Mark Borowiecki,Zemgus Girgensons,[-82.  36.],3,06:45,OTT,BUF,OTT,9,BUF,7,2,1,8474697,8476878.0,2019020575,,2019-12-25,Mark Borowiecki hit Zemgus Girgensons
261,hit,Sam Reinhart,Brady Tkachuk,[-39. -38.],3,04:56,BUF,OTT,OTT,9,BUF,7,2,1,8477933,8480801.0,2019020575,,2019-12-25,Sam Reinhart hit Brady Tkachuk
266,hit,Rasmus Ristolainen,Brady Tkachuk,[ 97. -10.],3,04:14,BUF,OTT,OTT,9,BUF,7,2,1,8477499,8480801.0,2019020575,,2019-12-25,Rasmus Ristolainen hit Brady Tkachuk
268,hit,Marco Scandella,Nick Paul,[98. -6.],3,03:27,BUF,OTT,OTT,9,BUF,7,2,1,8474618,8477426.0,2019020575,,2019-12-25,Marco Scandella hit Nick Paul
270,hit,Marco Scandella,Nick Paul,[88. 32.],3,03:19,BUF,OTT,OTT,9,BUF,7,2,1,8474618,8477426.0,2019020575,,2019-12-25,Marco Scandella hit Nick Paul
272,hit,Cody Goloubef,Marcus Johansson,[-81.  32.],3,02:34,OTT,BUF,OTT,9,BUF,7,2,1,8474597,8475149.0,2019020575,,2019-12-25,Cody Goloubef hit Marcus Johansson
282,hit,Mark Borowiecki,Rasmus Ristolainen,[-94.  24.],3,00:14,OTT,BUF,OTT,9,BUF,7,3,1,8474697,8477499.0,2019020575,,2019-12-25,Mark Borowiecki hit Rasmus Ristolainen
6,hit,Jean-Gabriel Pageau,Andy Greene,[ 41. -40.],1,18:57,OTT,NJD,OTT,9,NJD,1,0,0,8476419,8472382.0,2019020603,,2019-12-30,Jean-Gabriel Pageau hit Andy Greene
18,hit,Blake Coleman,Anthony Duclair,[ 97. -20.],1,16:17,NJD,OTT,OTT,9,NJD,1,0,0,8476399,8477407.0,2019020603,,2019-12-30,Blake Coleman hit Anthony Duclair
22,hit,Brady Tkachuk,Jesper Bratt,[ 20. -38.],1,15:23,OTT,NJD,OTT,9,NJD,1,0,0,8480801,8479407.0,2019020603,,2019-12-30,Brady Tkachuk hit Jesper Bratt
24,hit,Wayne Simmonds,Anthony Duclair,[ -8. -40.],1,14:42,NJD,OTT,OTT,9,NJD,1,0,0,8474190,8477407.0,2019020603,,2019-12-30,Wayne Simmonds hit Anthony Duclair
25,hit,Miles Wood,Mark Borowiecki,[-80.  38.],1,14:35,NJD,OTT,OTT,9,NJD,1,0,0,8477425,8474697.0,2019020603,,2019-12-30,Miles Wood hit Mark Borowiecki
27,hit,Scott Sabourin,Mirco Mueller,[ 54. -40.],1,14:06,OTT,NJD,OTT,9,NJD,1,0,0,8477149,8477509.0,2019020603,,2019-12-30,Scott Sabourin hit Mirco Mueller
28,hit,Connor Carrick,Andreas Englund,[26. 41.],1,13:56,NJD,OTT,OTT,9,NJD,1,0,0,8476941,8477971.0,2019020603,,2019-12-30,Connor Carrick hit Andreas Englund
41,hit,Chris Tierney,P.K. Subban,[ 79. -38.],1,11:49,OTT,NJD,OTT,9,NJD,1,0,0,8476919,8474056.0,2019020603,,2019-12-30,Chris Tierney hit P.K. Subban
47,hit,Tyler Ennis,Mirco Mueller,[-5. 38.],1,10:49,OTT,NJD,OTT,9,NJD,1,0,1,8474589,8477509.0,2019020603,,2019-12-30,Tyler Ennis hit Mirco Mueller
48,hit,Blake Coleman,Christian Jaros,[-97.   5.],1,10:37,NJD,OTT,OTT,9,NJD,1,0,1,8476399,8478868.0,2019020603,,2019-12-30,Blake Coleman hit Christian Jaros
52,hit,Wayne Simmonds,Jean-Gabriel Pageau,[-96. -23.],1,09:51,NJD,OTT,OTT,9,NJD,1,0,1,8474190,8476419.0,2019020603,,2019-12-30,Wayne Simmonds hit Jean-Gabriel Pageau
68,hit,Scott Sabourin,Connor Carrick,[99.  1.],1,06:26,OTT,NJD,OTT,9,NJD,1,0,1,8477149,8476941.0,2019020603,,2019-12-30,Scott Sabourin hit Connor Carrick
69,hit,Scott Sabourin,Wayne Simmonds,[-66. -41.],1,06:05,OTT,NJD,OTT,9,NJD,1,0,1,8477149,8474190.0,2019020603,,2019-12-30,Scott Sabourin hit Wayne Simmonds
72,hit,J.C. Beaudin,Mirco Mueller,[93. 29.],1,05:41,OTT,NJD,OTT,9,NJD,1,0,1,8478833,8477509.0,2019020603,,2019-12-30,J.C. Beaudin hit Mirco Mueller
78,hit,Kyle Palmieri,Mark Borowiecki,[-99.   5.],1,05:03,NJD,OTT,OTT,9,NJD,1,0,1,8475151,8474697.0,2019020603,,2019-12-30,Kyle Palmieri hit Mark Borowiecki
91,hit,Mirco Mueller,Tyler Ennis,[98.  3.],1,01:55,NJD,OTT,OTT,9,NJD,1,0,1,8477509,8474589.0,2019020603,,2019-12-30,Mirco Mueller hit Tyler Ennis
92,hit,Mirco Mueller,Tyler Ennis,[ 64. -41.],1,01:41,NJD,OTT,OTT,9,NJD,1,0,1,8477509,8474589.0,2019020603,,2019-12-30,Mirco Mueller hit Tyler Ennis
101,hit,Damon Severson,Connor Brown,[-59. -40.],2,19:45,NJD,OTT,OTT,9,NJD,1,0,1,8476923,8477015.0,2019020603,,2019-12-30,Damon Severson hit Connor Brown
107,hit,Erik Brannstrom,Nico Hischier,[ 48. -40.],2,18:29,OTT,NJD,OTT,9,NJD,1,0,1,8480073,8480002.0,2019020603,,2019-12-30,Erik Brannstrom hit Nico Hischier
108,hit,Wayne Simmonds,Andreas Englund,[-55. -41.],2,18:18,NJD,OTT,OTT,9,NJD,1,0,1,8474190,8477971.0,2019020603,,2019-12-30,Wayne Simmonds hit Andreas Englund
110,hit,Wayne Simmonds,Andreas Englund,[97. -5.],2,17:41,NJD,OTT,OTT,9,NJD,1,0,1,8474190,8477971.0,2019020603,,2019-12-30,Wayne Simmonds hit Andreas Englund
115,hit,Cody Goloubef,Jesper Boqvist,[-12.  40.],2,17:19,OTT,NJD,OTT,9,NJD,1,0,1,8474597,8480003.0,2019020603,,2019-12-30,Cody Goloubef hit Jesper Boqvist
120,hit,Chris Tierney,P.K. Subban,[-84. -36.],2,15:59,OTT,NJD,OTT,9,NJD,1,0,1,8476919,8474056.0,2019020603,,2019-12-30,Chris Tierney hit P.K. Subban
130,hit,Erik Brannstrom,Connor Carrick,[-37. -40.],2,12:46,OTT,NJD,OTT,9,NJD,1,0,1,8480073,8476941.0,2019020603,,2019-12-30,Erik Brannstrom hit Connor Carrick
133,hit,Cody Goloubef,Wayne Simmonds,[92. 30.],2,12:16,OTT,NJD,OTT,9,NJD,1,0,1,8474597,8474190.0,2019020603,,2019-12-30,Cody Goloubef hit Wayne Simmonds
135,hit,Damon Severson,Chris Tierney,[-89.  34.],2,11:46,NJD,OTT,OTT,9,NJD,1,0,1,8476923,8476919.0,2019020603,,2019-12-30,Damon Severson hit Chris Tierney
136,hit,Nick Paul,Nico Hischier,[-67.  41.],2,11:40,OTT,NJD,OTT,9,NJD,1,0,1,8477426,8480002.0,2019020603,,2019-12-30,Nick Paul hit Nico Hischier
141,hit,Wayne Simmonds,Brady Tkachuk,[-20. -40.],2,11:04,NJD,OTT,OTT,9,NJD,1,1,1,8474190,8480801.0,2019020603,,2019-12-30,Wayne Simmonds hit Brady Tkachuk
145,hit,Christian Jaros,Wayne Simmonds,[98. 11.],2,10:24,OTT,NJD,OTT,9,NJD,1,1,1,8478868,8474190.0,2019020603,,2019-12-30,Christian Jaros hit Wayne Simmonds
150,hit,J.C. Beaudin,Pavel Zacha,[-91. -33.],2,08:50,OTT,NJD,OTT,9,NJD,1,1,1,8478833,8478401.0,2019020603,,2019-12-30,J.C. Beaudin hit Pavel Zacha
151,hit,J.C. Beaudin,P.K. Subban,[-50.  41.],2,08:43,OTT,NJD,OTT,9,NJD,1,1,1,8478833,8474056.0,2019020603,,2019-12-30,J.C. Beaudin hit P.K. Subban
152,hit,Connor Carrick,Scott Sabourin,[-91. -32.],2,08:37,NJD,OTT,OTT,9,NJD,1,1,1,8476941,8477149.0,2019020603,,2019-12-30,Connor Carrick hit Scott Sabourin
154,hit,Blake Coleman,Mark Borowiecki,[97. 21.],2,07:44,NJD,OTT,OTT,9,NJD,1,1,1,8476399,8474697.0,2019020603,,2019-12-30,Blake Coleman hit Mark Borowiecki
161,hit,Miles Wood,Cody Goloubef,[30. 41.],2,06:11,NJD,OTT,OTT,9,NJD,1,2,1,8477425,8474597.0,2019020603,,2019-12-30,Miles Wood hit Cody Goloubef
175,hit,Cody Goloubef,Pavel Zacha,[52. 41.],2,04:23,OTT,NJD,OTT,9,NJD,1,2,2,8474597,8478401.0,2019020603,,2019-12-30,Cody Goloubef hit Pavel Zacha
176,hit,Mark Borowiecki,Jesper Bratt,[97.  4.],2,04:13,OTT,NJD,OTT,9,NJD,1,2,2,8474697,8479407.0,2019020603,,2019-12-30,Mark Borowiecki hit Jesper Bratt
191,hit,Damon Severson,Colin White,[-96.  -2.],2,02:05,NJD,OTT,OTT,9,NJD,1,2,2,8476923,8478400.0,2019020603,,2019-12-30,Damon Severson hit Colin White
197,hit,Brady Tkachuk,Sami Vatanen,[-97. -13.],2,00:09,OTT,NJD,OTT,9,NJD,1,2,3,8480801,8475222.0,2019020603,,2019-12-30,Brady Tkachuk hit Sami Vatanen
200,hit,Brady Tkachuk,Andy Greene,[90. 34.],3,18:56,OTT,NJD,OTT,9,NJD,1,2,3,8480801,8472382.0,2019020603,,2019-12-30,Brady Tkachuk hit Andy Greene
206,hit,Christian Jaros,Wayne Simmonds,[-76. -39.],3,17:52,OTT,NJD,OTT,9,NJD,1,2,3,8478868,8474190.0,2019020603,,2019-12-30,Christian Jaros hit Wayne Simmonds
213,hit,J.C. Beaudin,Pavel Zacha,[-92.  30.],3,17:10,OTT,NJD,OTT,9,NJD,1,2,3,8478833,8478401.0,2019020603,,2019-12-30,J.C. Beaudin hit Pavel Zacha
214,hit,Vladislav Namestnikov,John Hayden,[-96.  25.],3,16:34,OTT,NJD,OTT,9,NJD,1,2,3,8476480,8477401.0,2019020603,,2019-12-30,Vladislav Namestnikov hit John Hayden
225,hit,Brady Tkachuk,Andy Greene,[ 86. -34.],3,14:03,OTT,NJD,OTT,9,NJD,1,2,3,8480801,8472382.0,2019020603,,2019-12-30,Brady Tkachuk hit Andy Greene
227,hit,Miles Wood,Connor Brown,[92. 29.],3,13:56,NJD,OTT,OTT,9,NJD,1,2,3,8477425,8477015.0,2019020603,,2019-12-30,Miles Wood hit Connor Brown
229,hit,Nikita Gusev,Thomas Chabot,[52. 40.],3,13:12,NJD,OTT,OTT,9,NJD,1,2,3,8477038,8478469.0,2019020603,,2019-12-30,Nikita Gusev hit Thomas Chabot
230,hit,Travis Zajac,Artem Anisimov,[ 67. -40.],3,13:02,NJD,OTT,OTT,9,NJD,1,2,3,8471233,8473573.0,2019020603,,2019-12-30,Travis Zajac hit Artem Anisimov
232,hit,Connor Carrick,Tyler Ennis,[81. 36.],3,12:57,NJD,OTT,OTT,9,NJD,1,2,3,8476941,8474589.0,2019020603,,2019-12-30,Connor Carrick hit Tyler Ennis
233,hit,Blake Coleman,Tyler Ennis,[-31.  32.],3,12:47,NJD,OTT,OTT,9,NJD,1,2,3,8476399,8474589.0,2019020603,,2019-12-30,Blake Coleman hit Tyler Ennis
236,hit,Andreas Englund,Jesper Boqvist,[-21.  39.],3,12:20,OTT,NJD,OTT,9,NJD,1,2,3,8477971,8480003.0,2019020603,,2019-12-30,Andreas Englund hit Jesper Boqvist
237,hit,John Hayden,Christian Jaros,[-99.   3.],3,12:14,NJD,OTT,OTT,9,NJD,1,2,3,8477401,8478868.0,2019020603,,2019-12-30,John Hayden hit Christian Jaros
241,hit,J.C. Beaudin,Connor Carrick,[80. 38.],3,10:42,OTT,NJD,OTT,9,NJD,1,2,3,8478833,8476941.0,2019020603,,2019-12-30,J.C. Beaudin hit Connor Carrick
244,hit,Jack Hughes,Thomas Chabot,[98. 18.],3,10:04,NJD,OTT,OTT,9,NJD,1,2,3,8481559,8478469.0,2019020603,,2019-12-30,Jack Hughes hit Thomas Chabot
246,hit,Blake Coleman,Tyler Ennis,[-62.  41.],3,09:09,NJD,OTT,OTT,9,NJD,1,2,3,8476399,8474589.0,2019020603,,2019-12-30,Blake Coleman hit Tyler Ennis
247,hit,Brady Tkachuk,P.K. Subban,[54. 41.],3,08:58,OTT,NJD,OTT,9,NJD,1,2,3,8480801,8474056.0,2019020603,,2019-12-30,Brady Tkachuk hit P.K. Subban
250,hit,Anthony Duclair,P.K. Subban,[ 94. -28.],3,07:35,OTT,NJD,OTT,9,NJD,1,2,3,8477407,8474056.0,2019020603,,2019-12-30,Anthony Duclair hit P.K. Subban
253,hit,Erik Brannstrom,Jack Hughes,[-40. -40.],3,06:31,OTT,NJD,OTT,9,NJD,1,2,3,8480073,8481559.0,2019020603,,2019-12-30,Erik Brannstrom hit Jack Hughes
257,hit,Sami Vatanen,Jean-Gabriel Pageau,[98. -1.],3,05:15,NJD,OTT,OTT,9,NJD,1,2,3,8475222,8476419.0,2019020603,,2019-12-30,Sami Vatanen hit Jean-Gabriel Pageau
262,hit,Cody Goloubef,Damon Severson,[-39. -40.],3,04:03,OTT,NJD,OTT,9,NJD,1,3,3,8474597,8476923.0,2019020603,,2019-12-30,Cody Goloubef hit Damon Severson
267,hit,Nick Paul,Blake Coleman,[ -7. -40.],3,02:26,OTT,NJD,OTT,9,NJD,1,3,3,8477426,8476399.0,2019020603,,2019-12-30,Nick Paul hit Blake Coleman
269,hit,Blake Coleman,Thomas Chabot,[ 40. -40.],3,02:00,NJD,OTT,OTT,9,NJD,1,3,3,8476399,8478469.0,2019020603,,2019-12-30,Blake Coleman hit Thomas Chabot
272,hit,Blake Coleman,Cody Goloubef,[ 50. -40.],3,01:44,NJD,OTT,OTT,9,NJD,1,3,3,8476399,8474597.0,2019020603,,2019-12-30,Blake Coleman hit Cody Goloubef
2,hit,Brady Tkachuk,Kris Letang,[-33.   2.],1,19:46,OTT,PIT,PIT,5,OTT,9,0,0,8480801,8471724.0,2019020612,,2019-12-31,Brady Tkachuk hit Kris Letang
7,hit,Zach Aston-Reese,Cody Goloubef,[-30.  38.],1,18:46,PIT,OTT,PIT,5,OTT,9,1,0,8479944,8474597.0,2019020612,,2019-12-31,Zach Aston-Reese hit Cody Goloubef
10,hit,Andreas Englund,Patric Hornqvist,[ 77. -39.],1,17:37,OTT,PIT,PIT,5,OTT,9,1,0,8477971,8471887.0,2019020612,,2019-12-31,Andreas Englund hit Patric Hornqvist
14,hit,Connor Brown,Kris Letang,[-96.  24.],1,17:10,OTT,PIT,PIT,5,OTT,9,1,0,8477015,8471724.0,2019020612,,2019-12-31,Connor Brown hit Kris Letang
15,hit,Chris Tierney,Brandon Tanev,[ 89. -35.],1,16:32,OTT,PIT,PIT,5,OTT,9,1,0,8476919,8479293.0,2019020612,,2019-12-31,Chris Tierney hit Brandon Tanev
16,hit,Nick Paul,Marcus Pettersson,[-53.  41.],1,16:19,OTT,PIT,PIT,5,OTT,9,1,0,8477426,8477969.0,2019020612,,2019-12-31,Nick Paul hit Marcus Pettersson
17,hit,Anthony Duclair,Brandon Tanev,[78. 42.],1,16:16,OTT,PIT,PIT,5,OTT,9,1,0,8477407,8479293.0,2019020612,,2019-12-31,Anthony Duclair hit Brandon Tanev
