,event,hitter,hittee,coords,period,period_time_remaining,hitter_team,hittee_team,home_team,home_team_id,away_team,away_team_id,home_goals,away_goals,hitter_id,hittee_id,game_id,winning_team,date,description
230,hit,Mike Reilly,Evander Kane,[-99.  10.],3,07:02,OTT,SJS,SJS,28,OTT,9,1,1,8476422,8475169.0,2019021057,,2020-03-08,Mike Reilly hit Evander Kane
244,hit,Andreas Englund,Timo Meier,[ 56. -41.],3,03:08,OTT,SJS,SJS,28,OTT,9,1,1,8477971,8478414.0,2019021057,,2020-03-08,Andreas Englund hit Timo Meier
246,hit,Andreas Englund,Timo Meier,[17. 40.],3,02:58,OTT,SJS,SJS,28,OTT,9,1,1,8477971,8478414.0,2019021057,,2020-03-08,Andreas Englund hit Timo Meier
247,hit,Marcus Sorensen,Christian Wolanin,[ 92. -32.],3,02:52,SJS,OTT,SJS,28,OTT,9,1,1,8475834,8478846.0,2019021057,,2020-03-08,Marcus Sorensen hit Christian Wolanin
249,hit,Marc-Edouard Vlasic,Anthony Duclair,[-98.  11.],3,02:38,SJS,OTT,SJS,28,OTT,9,1,1,8471709,8477407.0,2019021057,,2020-03-08,Marc-Edouard Vlasic hit Anthony Duclair
1,hit,Jayce Hawryluk,Matt Irwin,[-95.  19.],1,19:48,OTT,ANA,ANA,24,OTT,9,0,0,8477963,8475625.0,2019021078,,2020-03-11,Jayce Hawryluk hit Matt Irwin
4,hit,Brady Tkachuk,Matt Irwin,[-83.  39.],1,19:37,OTT,ANA,ANA,24,OTT,9,0,0,8480801,8475625.0,2019021078,,2020-03-11,Brady Tkachuk hit Matt Irwin
8,hit,Jani Hakanpaa,Connor Brown,[-73. -40.],1,19:13,ANA,OTT,ANA,24,OTT,9,0,0,8475825,8477015.0,2019021078,,2020-03-11,Jani Hakanpaa hit Connor Brown
9,hit,Rudolfs Balcers,Christian Djoos,[-99. -13.],1,19:11,OTT,ANA,ANA,24,OTT,9,0,0,8478870,8477043.0,2019021078,,2020-03-11,Rudolfs Balcers hit Christian Djoos
12,hit,Nikita Zaitsev,Sam Steel,[ 76. -38.],1,18:33,OTT,ANA,ANA,24,OTT,9,0,0,8479458,8479351.0,2019021078,,2020-03-11,Nikita Zaitsev hit Sam Steel
21,hit,Jayce Hawryluk,Matt Irwin,[-98.  25.],1,16:59,OTT,ANA,ANA,24,OTT,9,2,0,8477963,8475625.0,2019021078,,2020-03-11,Jayce Hawryluk hit Matt Irwin
28,hit,Jani Hakanpaa,Mike Reilly,[ 18. -38.],1,15:55,ANA,OTT,ANA,24,OTT,9,2,0,8475825,8476422.0,2019021078,,2020-03-11,Jani Hakanpaa hit Mike Reilly
30,hit,Rudolfs Balcers,Jani Hakanpaa,[-90. -24.],1,15:36,OTT,ANA,ANA,24,OTT,9,2,0,8478870,8475825.0,2019021078,,2020-03-11,Rudolfs Balcers hit Jani Hakanpaa
31,hit,Connor Brown,Jacob Larsson,[-93. -22.],1,15:18,OTT,ANA,ANA,24,OTT,9,2,0,8477015,8478491.0,2019021078,,2020-03-11,Connor Brown hit Jacob Larsson
32,hit,Andreas Englund,Max Jones,[ 30. -17.],1,15:04,OTT,ANA,ANA,24,OTT,9,2,0,8477971,8479368.0,2019021078,,2020-03-11,Andreas Englund hit Max Jones
35,hit,Max Jones,Andreas Englund,[61. 38.],1,14:42,ANA,OTT,ANA,24,OTT,9,2,0,8479368,8477971.0,2019021078,,2020-03-11,Max Jones hit Andreas Englund
51,hit,Jani Hakanpaa,Mikkel Boedker,[-91. -17.],1,10:00,ANA,OTT,ANA,24,OTT,9,2,0,8475825,8474571.0,2019021078,,2020-03-11,Jani Hakanpaa hit Mikkel Boedker
52,hit,Scott Sabourin,Sam Steel,[6. 0.],1,09:45,OTT,ANA,ANA,24,OTT,9,2,0,8477149,8479351.0,2019021078,,2020-03-11,Scott Sabourin hit Sam Steel
55,hit,Matt Irwin,Connor Brown,[ 18. -15.],1,09:23,ANA,OTT,ANA,24,OTT,9,2,0,8475625,8477015.0,2019021078,,2020-03-11,Matt Irwin hit Connor Brown
69,hit,Jayce Hawryluk,Matt Irwin,[ 8. 39.],1,07:07,OTT,ANA,ANA,24,OTT,9,4,0,8477963,8475625.0,2019021078,,2020-03-11,Jayce Hawryluk hit Matt Irwin
72,hit,Bobby Ryan,Jani Hakanpaa,[-93. -21.],1,05:56,OTT,ANA,ANA,24,OTT,9,4,0,8471676,8475825.0,2019021078,,2020-03-11,Bobby Ryan hit Jani Hakanpaa
73,hit,Mike Reilly,Kiefer Sherwood,[71. 39.],1,05:56,OTT,ANA,ANA,24,OTT,9,4,0,8476422,8480748.0,2019021078,,2020-03-11,Mike Reilly hit Kiefer Sherwood
74,hit,Brady Tkachuk,Sam Steel,[74. 41.],1,05:48,OTT,ANA,ANA,24,OTT,9,4,0,8480801,8479351.0,2019021078,,2020-03-11,Brady Tkachuk hit Sam Steel
79,hit,Nick Paul,Christian Djoos,[-99.  13.],1,03:59,OTT,ANA,ANA,24,OTT,9,4,0,8477426,8477043.0,2019021078,,2020-03-11,Nick Paul hit Christian Djoos
81,hit,Nicolas Deslauriers,Nikita Zaitsev,[96. 20.],1,03:35,ANA,OTT,ANA,24,OTT,9,4,0,8475235,8479458.0,2019021078,,2020-03-11,Nicolas Deslauriers hit Nikita Zaitsev
82,hit,Rudolfs Balcers,Jacob Larsson,[-97.  15.],1,02:53,OTT,ANA,ANA,24,OTT,9,4,0,8478870,8478491.0,2019021078,,2020-03-11,Rudolfs Balcers hit Jacob Larsson
83,hit,Max Jones,Andreas Englund,[86. 34.],1,02:27,ANA,OTT,ANA,24,OTT,9,4,0,8479368,8477971.0,2019021078,,2020-03-11,Max Jones hit Andreas Englund
100,hit,Brady Tkachuk,Jani Hakanpaa,[98. -8.],2,19:14,OTT,ANA,ANA,24,OTT,9,4,0,8480801,8475825.0,2019021078,,2020-03-11,Brady Tkachuk hit Jani Hakanpaa
103,hit,Ryan Getzlaf,Rudolfs Balcers,[ 46. -42.],2,18:33,ANA,OTT,ANA,24,OTT,9,4,0,8470612,8478870.0,2019021078,,2020-03-11,Ryan Getzlaf hit Rudolfs Balcers
107,hit,Andreas Englund,Max Jones,[ 31. -23.],2,18:25,OTT,ANA,ANA,24,OTT,9,4,0,8477971,8479368.0,2019021078,,2020-03-11,Andreas Englund hit Max Jones
108,hit,Max Jones,Andreas Englund,[-83. -38.],2,18:10,ANA,OTT,ANA,24,OTT,9,4,0,8479368,8477971.0,2019021078,,2020-03-11,Max Jones hit Andreas Englund
109,hit,Kiefer Sherwood,Andreas Englund,[-95.  21.],2,17:53,ANA,OTT,ANA,24,OTT,9,4,0,8480748,8477971.0,2019021078,,2020-03-11,Kiefer Sherwood hit Andreas Englund
110,hit,Scott Sabourin,Michael Del Zotto,[95. 28.],2,17:33,OTT,ANA,ANA,24,OTT,9,4,0,8477149,8474584.0,2019021078,,2020-03-11,Scott Sabourin hit Michael Del Zotto
115,hit,Mike Reilly,Rickard Rakell,[-95.  26.],2,16:29,OTT,ANA,ANA,24,OTT,9,4,0,8476422,8476483.0,2019021078,,2020-03-11,Mike Reilly hit Rickard Rakell
117,hit,Brady Tkachuk,Matt Irwin,[97. 22.],2,16:15,OTT,ANA,ANA,24,OTT,9,4,0,8480801,8475625.0,2019021078,,2020-03-11,Brady Tkachuk hit Matt Irwin
132,hit,Nikita Zaitsev,Max Jones,[-80. -36.],2,13:36,OTT,ANA,ANA,24,OTT,9,4,1,8479458,8479368.0,2019021078,,2020-03-11,Nikita Zaitsev hit Max Jones
134,hit,Jayce Hawryluk,Jacob Larsson,[48. 41.],2,13:25,OTT,ANA,ANA,24,OTT,9,4,1,8477963,8478491.0,2019021078,,2020-03-11,Jayce Hawryluk hit Jacob Larsson
135,hit,Jayce Hawryluk,Michael Del Zotto,[ 21. -38.],2,13:12,OTT,ANA,ANA,24,OTT,9,4,1,8477963,8474584.0,2019021078,,2020-03-11,Jayce Hawryluk hit Michael Del Zotto
137,hit,Scott Sabourin,Christian Djoos,[ 95. -20.],2,12:41,OTT,ANA,ANA,24,OTT,9,4,1,8477149,8477043.0,2019021078,,2020-03-11,Scott Sabourin hit Christian Djoos
142,hit,Brady Tkachuk,Michael Del Zotto,[99.  9.],2,11:47,OTT,ANA,ANA,24,OTT,9,4,1,8480801,8474584.0,2019021078,,2020-03-11,Brady Tkachuk hit Michael Del Zotto
150,hit,Jacob Larsson,Matthew Peca,[ 71. -38.],2,09:47,ANA,OTT,ANA,24,OTT,9,5,1,8478491,8476285.0,2019021078,,2020-03-11,Jacob Larsson hit Matthew Peca
152,hit,Scott Sabourin,Jacob Larsson,[-13. -40.],2,09:15,OTT,ANA,ANA,24,OTT,9,5,1,8477149,8478491.0,2019021078,,2020-03-11,Scott Sabourin hit Jacob Larsson
153,hit,Josh Manson,Brady Tkachuk,[ 95. -27.],2,09:08,ANA,OTT,ANA,24,OTT,9,5,1,8476312,8480801.0,2019021078,,2020-03-11,Josh Manson hit Brady Tkachuk
154,hit,Andreas Englund,Matt Irwin,[-29. -38.],2,08:38,OTT,ANA,ANA,24,OTT,9,5,1,8477971,8475625.0,2019021078,,2020-03-11,Andreas Englund hit Matt Irwin
168,hit,Brady Tkachuk,Nicolas Deslauriers,[ 36. -40.],2,04:39,OTT,ANA,ANA,24,OTT,9,5,1,8480801,8475235.0,2019021078,,2020-03-11,Brady Tkachuk hit Nicolas Deslauriers
175,hit,Matthew Peca,Kiefer Sherwood,[70. 39.],2,02:03,OTT,ANA,ANA,24,OTT,9,5,1,8476285,8480748.0,2019021078,,2020-03-11,Matthew Peca hit Kiefer Sherwood
183,hit,Thomas Chabot,Carter Rowney,[-38.  39.],2,00:17,OTT,ANA,ANA,24,OTT,9,5,1,8478469,8477240.0,2019021078,,2020-03-11,Thomas Chabot hit Carter Rowney
206,hit,Nicolas Deslauriers,Andreas Englund,[-42. -37.],3,13:45,ANA,OTT,ANA,24,OTT,9,5,1,8475235,8477971.0,2019021078,,2020-03-11,Nicolas Deslauriers hit Andreas Englund
207,hit,Andreas Englund,Jacob Larsson,[ 34. -26.],3,13:36,OTT,ANA,ANA,24,OTT,9,5,1,8477971,8478491.0,2019021078,,2020-03-11,Andreas Englund hit Jacob Larsson
218,hit,Colin White,Kiefer Sherwood,[-94. -29.],3,09:23,OTT,ANA,ANA,24,OTT,9,5,1,8478400,8480748.0,2019021078,,2020-03-11,Colin White hit Kiefer Sherwood
222,hit,Ryan Getzlaf,Thomas Chabot,[-42. -36.],3,08:28,ANA,OTT,ANA,24,OTT,9,5,1,8470612,8478469.0,2019021078,,2020-03-11,Ryan Getzlaf hit Thomas Chabot
225,hit,Kiefer Sherwood,Colin White,[-46.  40.],3,07:34,ANA,OTT,ANA,24,OTT,9,5,1,8480748,8478400.0,2019021078,,2020-03-11,Kiefer Sherwood hit Colin White
227,hit,Nicolas Deslauriers,Nikita Zaitsev,[ 82. -37.],3,06:50,ANA,OTT,ANA,24,OTT,9,5,1,8475235,8479458.0,2019021078,,2020-03-11,Nicolas Deslauriers hit Nikita Zaitsev
228,hit,Carter Rowney,Nikita Zaitsev,[96. 17.],3,06:45,ANA,OTT,ANA,24,OTT,9,5,1,8477240,8479458.0,2019021078,,2020-03-11,Carter Rowney hit Nikita Zaitsev
235,hit,David Backes,Mikkel Boedker,[-59. -38.],3,04:32,ANA,OTT,ANA,24,OTT,9,5,2,8470655,8474571.0,2019021078,,2020-03-11,David Backes hit Mikkel Boedker
238,hit,Michael Del Zotto,Brady Tkachuk,[-58. -39.],3,03:56,ANA,OTT,ANA,24,OTT,9,5,2,8474584,8480801.0,2019021078,,2020-03-11,Michael Del Zotto hit Brady Tkachuk
247,hit,Mike Reilly,Jakob Silfverberg,[ 49. -39.],3,01:07,OTT,ANA,ANA,24,OTT,9,5,2,8476422,8475164.0,2019021078,,2020-03-11,Mike Reilly hit Jakob Silfverberg
4,hit,Kurtis MacDermid,Jayce Hawryluk,[ 36. -38.],1,18:20,LAK,OTT,LAK,26,OTT,9,0,1,8477073,8477963.0,2019021082,,2020-03-12,Kurtis MacDermid hit Jayce Hawryluk
9,hit,Scott Sabourin,Ben Hutton,[95. 23.],1,17:19,OTT,LAK,LAK,26,OTT,9,0,1,8477149,8477018.0,2019021082,,2020-03-12,Scott Sabourin hit Ben Hutton
10,hit,Bobby Ryan,Mikey Anderson,[94. 20.],1,16:52,OTT,LAK,LAK,26,OTT,9,0,1,8471676,8479998.0,2019021082,,2020-03-12,Bobby Ryan hit Mikey Anderson
11,hit,Rudolfs Balcers,Sean Walker,[94. 30.],1,16:18,OTT,LAK,LAK,26,OTT,9,0,1,8478870,8480336.0,2019021082,,2020-03-12,Rudolfs Balcers hit Sean Walker
13,hit,Martin Frk,Mike Reilly,[-96. -12.],1,15:01,LAK,OTT,LAK,26,OTT,9,0,1,8476924,8476422.0,2019021082,,2020-03-12,Martin Frk hit Mike Reilly
18,hit,Brady Tkachuk,Alex Iafallo,[ 64. -38.],1,13:39,OTT,LAK,LAK,26,OTT,9,0,1,8480801,8480113.0,2019021082,,2020-03-12,Brady Tkachuk hit Alex Iafallo
20,hit,Alex Iafallo,Colin White,[-15.  42.],1,13:16,LAK,OTT,LAK,26,OTT,9,0,1,8480113,8478400.0,2019021082,,2020-03-12,Alex Iafallo hit Colin White
32,hit,Colin White,Anze Kopitar,[-92.  30.],1,10:47,OTT,LAK,LAK,26,OTT,9,0,1,8478400,8471685.0,2019021082,,2020-03-12,Colin White hit Anze Kopitar
41,hit,Austin Wagner,Andreas Englund,[-93.  25.],1,09:05,LAK,OTT,LAK,26,OTT,9,1,1,8478455,8477971.0,2019021082,,2020-03-12,Austin Wagner hit Andreas Englund
44,hit,Dustin Brown,Andreas Englund,[-83.  40.],1,08:50,LAK,OTT,LAK,26,OTT,9,1,1,8470606,8477971.0,2019021082,,2020-03-12,Dustin Brown hit Andreas Englund
60,hit,Brady Tkachuk,Drew Doughty,[-34.  30.],1,06:26,OTT,LAK,LAK,26,OTT,9,1,1,8480801,8474563.0,2019021082,,2020-03-12,Brady Tkachuk hit Drew Doughty
61,hit,Brady Tkachuk,Martin Frk,[-74. -41.],1,06:07,OTT,LAK,LAK,26,OTT,9,1,1,8480801,8476924.0,2019021082,,2020-03-12,Brady Tkachuk hit Martin Frk
63,hit,Nikita Zaitsev,Michael Amadio,[-96.  18.],1,05:30,OTT,LAK,LAK,26,OTT,9,1,1,8479458,8478020.0,2019021082,,2020-03-12,Nikita Zaitsev hit Michael Amadio
69,hit,Adrian Kempe,Mikkel Boedker,[-95.  23.],1,03:55,LAK,OTT,LAK,26,OTT,9,1,1,8477960,8474571.0,2019021082,,2020-03-12,Adrian Kempe hit Mikkel Boedker
87,hit,Brady Tkachuk,Drew Doughty,[ 39. -38.],2,18:45,OTT,LAK,LAK,26,OTT,9,1,1,8480801,8474563.0,2019021082,,2020-03-12,Brady Tkachuk hit Drew Doughty
99,hit,Bobby Ryan,Ben Hutton,[22. 39.],2,16:36,OTT,LAK,LAK,26,OTT,9,1,1,8471676,8477018.0,2019021082,,2020-03-12,Bobby Ryan hit Ben Hutton
112,hit,Ben Hutton,Brady Tkachuk,[ 51. -37.],2,12:41,LAK,OTT,LAK,26,OTT,9,1,1,8477018,8480801.0,2019021082,,2020-03-12,Ben Hutton hit Brady Tkachuk
116,hit,Andreas Englund,Dustin Brown,[-17.  22.],2,12:00,OTT,LAK,LAK,26,OTT,9,1,1,8477971,8470606.0,2019021082,,2020-03-12,Andreas Englund hit Dustin Brown
120,hit,Rudolfs Balcers,Blake Lizotte,[-72. -37.],2,11:33,OTT,LAK,LAK,26,OTT,9,1,1,8478870,8481481.0,2019021082,,2020-03-12,Rudolfs Balcers hit Blake Lizotte
121,hit,Matt Roy,Rudolfs Balcers,[-76.  41.],2,11:24,LAK,OTT,LAK,26,OTT,9,1,1,8478911,8478870.0,2019021082,,2020-03-12,Matt Roy hit Rudolfs Balcers
122,hit,Nikolai Prokhorkin,Mike Reilly,[-83.  26.],2,10:00,LAK,OTT,LAK,26,OTT,9,1,1,8476947,8476422.0,2019021082,,2020-03-12,Nikolai Prokhorkin hit Mike Reilly
123,hit,Brady Tkachuk,Matt Roy,[-93. -20.],2,09:04,OTT,LAK,LAK,26,OTT,9,1,1,8480801,8478911.0,2019021082,,2020-03-12,Brady Tkachuk hit Matt Roy
126,hit,Scott Sabourin,Matt Roy,[-91. -31.],2,07:53,OTT,LAK,LAK,26,OTT,9,1,1,8477149,8478911.0,2019021082,,2020-03-12,Scott Sabourin hit Matt Roy
129,hit,Gabriel Vilardi,Matthew Peca,[-91. -31.],2,07:33,LAK,OTT,LAK,26,OTT,9,1,1,8480014,8476285.0,2019021082,,2020-03-12,Gabriel Vilardi hit Matthew Peca
144,hit,Kurtis MacDermid,Thomas Chabot,[11. 41.],2,04:52,LAK,OTT,LAK,26,OTT,9,1,1,8477073,8478469.0,2019021082,,2020-03-12,Kurtis MacDermid hit Thomas Chabot
148,hit,Dustin Brown,Christian Wolanin,[69. 10.],2,02:56,LAK,OTT,LAK,26,OTT,9,1,1,8470606,8478846.0,2019021082,,2020-03-12,Dustin Brown hit Christian Wolanin
155,hit,Bobby Ryan,Blake Lizotte,[ 91. -24.],2,01:53,OTT,LAK,LAK,26,OTT,9,1,1,8471676,8481481.0,2019021082,,2020-03-12,Bobby Ryan hit Blake Lizotte
156,hit,Brady Tkachuk,Blake Lizotte,[-97.   9.],2,01:40,OTT,LAK,LAK,26,OTT,9,1,1,8480801,8481481.0,2019021082,,2020-03-12,Brady Tkachuk hit Blake Lizotte
172,hit,Matthew Peca,Michael Amadio,[31. 21.],3,17:31,OTT,LAK,LAK,26,OTT,9,1,2,8476285,8478020.0,2019021082,,2020-03-12,Matthew Peca hit Michael Amadio
182,hit,Nick Paul,Michael Amadio,[87. 36.],3,14:28,OTT,LAK,LAK,26,OTT,9,1,2,8477426,8478020.0,2019021082,,2020-03-12,Nick Paul hit Michael Amadio
184,hit,Kurtis MacDermid,Scott Sabourin,[ 91. -30.],3,14:12,LAK,OTT,LAK,26,OTT,9,1,2,8477073,8477149.0,2019021082,,2020-03-12,Kurtis MacDermid hit Scott Sabourin
202,hit,Nick Paul,Austin Wagner,[-4. 39.],3,09:31,OTT,LAK,LAK,26,OTT,9,2,2,8477426,8478455.0,2019021082,,2020-03-12,Nick Paul hit Austin Wagner
226,hit,Brady Tkachuk,Matt Roy,[99. -9.],3,04:23,OTT,LAK,LAK,26,OTT,9,3,2,8480801,8478911.0,2019021082,,2020-03-12,Brady Tkachuk hit Matt Roy
231,hit,Martin Frk,Rudolfs Balcers,[-95. -17.],3,02:56,LAK,OTT,LAK,26,OTT,9,3,2,8476924,8478870.0,2019021082,,2020-03-12,Martin Frk hit Rudolfs Balcers
237,hit,Brady Tkachuk,Dustin Brown,[-14.  38.],3,01:45,OTT,LAK,LAK,26,OTT,9,3,2,8480801,8470606.0,2019021082,,2020-03-12,Brady Tkachuk hit Dustin Brown
12,hit,Dylan DeMelo,Frederik Gauthier,[-96. -36.],1,16:54,OTT,TOR,TOR,10,OTT,9,0,1,8476331,8477512.0,2019020001,,2019-10-03,Dylan DeMelo hit Frederik Gauthier
18,hit,Scott Sabourin,Cody Ceci,[75. 39.],1,15:53,OTT,TOR,TOR,10,OTT,9,0,1,8477149,8476879.0,2019020001,,2019-10-03,Scott Sabourin hit Cody Ceci
34,hit,Chris Tierney,Mitchell Marner,[-40. -38.],1,13:05,OTT,TOR,TOR,10,OTT,9,0,1,8476919,8478483.0,2019020001,,2019-10-03,Chris Tierney hit Mitchell Marner
51,hit,Nikita Zaitsev,Frederik Gauthier,[ 47. -39.],1,09:33,OTT,TOR,TOR,10,OTT,9,0,1,8479458,8477512.0,2019020001,,2019-10-03,Nikita Zaitsev hit Frederik Gauthier
52,hit,Brady Tkachuk,Dmytro Timashov,[-97.  27.],1,09:22,OTT,TOR,TOR,10,OTT,9,0,1,8480801,8478857.0,2019020001,,2019-10-03,Brady Tkachuk hit Dmytro Timashov
54,hit,Trevor Moore,Dylan DeMelo,[-97.   0.],1,08:42,TOR,OTT,TOR,10,OTT,9,0,1,8479675,8476331.0,2019020001,,2019-10-03,Trevor Moore hit Dylan DeMelo
55,hit,Scott Sabourin,Jake Muzzin,[96. 17.],1,08:17,OTT,TOR,TOR,10,OTT,9,0,1,8477149,8474162.0,2019020001,,2019-10-03,Scott Sabourin hit Jake Muzzin
57,hit,Anthony Duclair,Mitchell Marner,[18. 39.],1,08:00,OTT,TOR,TOR,10,OTT,9,0,1,8477407,8478483.0,2019020001,,2019-10-03,Anthony Duclair hit Mitchell Marner
62,hit,Mark Borowiecki,William Nylander,[-98.  28.],1,06:39,OTT,TOR,TOR,10,OTT,9,0,1,8474697,8477939.0,2019020001,,2019-10-03,Mark Borowiecki hit William Nylander
68,hit,Erik Brannstrom,Trevor Moore,[-96.  25.],1,05:32,OTT,TOR,TOR,10,OTT,9,0,1,8480073,8479675.0,2019020001,,2019-10-03,Erik Brannstrom hit Trevor Moore
71,hit,Scott Sabourin,Morgan Rielly,[96. 33.],1,04:57,OTT,TOR,TOR,10,OTT,9,0,1,8477149,8476853.0,2019020001,,2019-10-03,Scott Sabourin hit Morgan Rielly
74,hit,Cody Ceci,Filip Chlapik,[-38. -33.],1,04:17,TOR,OTT,TOR,10,OTT,9,0,1,8476879,8478488.0,2019020001,,2019-10-03,Cody Ceci hit Filip Chlapik
81,hit,Alexander Kerfoot,Erik Brannstrom,[62. 40.],1,02:59,TOR,OTT,TOR,10,OTT,9,0,1,8477021,8480073.0,2019020001,,2019-10-03,Alexander Kerfoot hit Erik Brannstrom
82,hit,Dylan DeMelo,Trevor Moore,[  0. -39.],1,02:39,OTT,TOR,TOR,10,OTT,9,0,1,8476331,8479675.0,2019020001,,2019-10-03,Dylan DeMelo hit Trevor Moore
90,hit,Kasperi Kapanen,Thomas Chabot,[-93.  37.],1,01:27,TOR,OTT,TOR,10,OTT,9,0,1,8477953,8478469.0,2019020001,,2019-10-03,Kasperi Kapanen hit Thomas Chabot
95,hit,Erik Brannstrom,Frederik Gauthier,[-41.  40.],1,00:45,OTT,TOR,TOR,10,OTT,9,0,1,8480073,8477512.0,2019020001,,2019-10-03,Erik Brannstrom hit Frederik Gauthier
96,hit,Dmytro Timashov,Colin White,[96. 31.],1,00:40,TOR,OTT,TOR,10,OTT,9,0,1,8478857,8478400.0,2019020001,,2019-10-03,Dmytro Timashov hit Colin White
103,hit,Cody Ceci,Brady Tkachuk,[-43. -38.],2,19:44,TOR,OTT,TOR,10,OTT,9,0,1,8476879,8480801.0,2019020001,,2019-10-03,Cody Ceci hit Brady Tkachuk
104,hit,Connor Brown,Morgan Rielly,[-97.   5.],2,19:22,OTT,TOR,TOR,10,OTT,9,0,1,8477015,8476853.0,2019020001,,2019-10-03,Connor Brown hit Morgan Rielly
105,hit,Bobby Ryan,Tyson Barrie,[-96. -10.],2,19:00,OTT,TOR,TOR,10,OTT,9,0,1,8471676,8475197.0,2019020001,,2019-10-03,Bobby Ryan hit Tyson Barrie
108,hit,Trevor Moore,Tyler Ennis,[-36. -39.],2,18:34,TOR,OTT,TOR,10,OTT,9,0,1,8479675,8474589.0,2019020001,,2019-10-03,Trevor Moore hit Tyler Ennis
113,hit,Dmytro Timashov,Nikita Zaitsev,[11. 40.],2,17:58,TOR,OTT,TOR,10,OTT,9,0,1,8478857,8479458.0,2019020001,,2019-10-03,Dmytro Timashov hit Nikita Zaitsev
118,hit,Filip Chlapik,Martin Marincin,[-97. -20.],2,17:29,OTT,TOR,TOR,10,OTT,9,1,1,8478488,8475716.0,2019020001,,2019-10-03,Filip Chlapik hit Martin Marincin
119,hit,Trevor Moore,Erik Brannstrom,[97. 26.],2,17:19,TOR,OTT,TOR,10,OTT,9,1,1,8479675,8480073.0,2019020001,,2019-10-03,Trevor Moore hit Erik Brannstrom
122,hit,Kasperi Kapanen,Dylan DeMelo,[99. 27.],2,17:08,TOR,OTT,TOR,10,OTT,9,1,1,8477953,8476331.0,2019020001,,2019-10-03,Kasperi Kapanen hit Dylan DeMelo
127,hit,Bobby Ryan,William Nylander,[81. 38.],2,15:38,OTT,TOR,TOR,10,OTT,9,1,1,8471676,8477939.0,2019020001,,2019-10-03,Bobby Ryan hit William Nylander
139,hit,Jean-Gabriel Pageau,Jake Muzzin,[96. 25.],2,14:19,OTT,TOR,TOR,10,OTT,9,2,1,8476419,8474162.0,2019020001,,2019-10-03,Jean-Gabriel Pageau hit Jake Muzzin
153,hit,Dmytro Timashov,Thomas Chabot,[96.  1.],2,11:17,TOR,OTT,TOR,10,OTT,9,3,2,8478857,8478469.0,2019020001,,2019-10-03,Dmytro Timashov hit Thomas Chabot
154,hit,Jake Muzzin,Drake Batherson,[-43.  38.],2,10:46,TOR,OTT,TOR,10,OTT,9,3,2,8474162,8480208.0,2019020001,,2019-10-03,Jake Muzzin hit Drake Batherson
156,hit,Brady Tkachuk,Cody Ceci,[-37. -39.],2,10:12,OTT,TOR,TOR,10,OTT,9,3,2,8480801,8476879.0,2019020001,,2019-10-03,Brady Tkachuk hit Cody Ceci
158,hit,Brady Tkachuk,Alexander Kerfoot,[ 95. -19.],2,10:02,OTT,TOR,TOR,10,OTT,9,3,2,8480801,8477021.0,2019020001,,2019-10-03,Brady Tkachuk hit Alexander Kerfoot
167,hit,Andreas Johnsson,Nikita Zaitsev,[ 96. -17.],2,07:41,TOR,OTT,TOR,10,OTT,9,3,2,8477341,8479458.0,2019020001,,2019-10-03,Andreas Johnsson hit Nikita Zaitsev
177,hit,Alexander Kerfoot,Mark Borowiecki,[-94. -26.],2,06:12,TOR,OTT,TOR,10,OTT,9,3,2,8477021,8474697.0,2019020001,,2019-10-03,Alexander Kerfoot hit Mark Borowiecki
188,hit,Ilya Mikheyev,Dylan DeMelo,[ 93. -35.],2,05:00,TOR,OTT,TOR,10,OTT,9,4,2,8481624,8476331.0,2019020001,,2019-10-03,Ilya Mikheyev hit Dylan DeMelo
196,hit,Chris Tierney,Martin Marincin,[-98.   3.],2,02:39,OTT,TOR,TOR,10,OTT,9,4,2,8476919,8475716.0,2019020001,,2019-10-03,Chris Tierney hit Martin Marincin
197,hit,Erik Brannstrom,Dmytro Timashov,[ 84. -37.],2,02:30,OTT,TOR,TOR,10,OTT,9,4,2,8480073,8478857.0,2019020001,,2019-10-03,Erik Brannstrom hit Dmytro Timashov
199,hit,Ron Hainsey,Jake Muzzin,[74. 40.],2,02:20,OTT,TOR,TOR,10,OTT,9,4,2,8468493,8474162.0,2019020001,,2019-10-03,Ron Hainsey hit Jake Muzzin
200,hit,Thomas Chabot,Andreas Johnsson,[ 63. -39.],2,01:56,OTT,TOR,TOR,10,OTT,9,4,2,8478469,8477341.0,2019020001,,2019-10-03,Thomas Chabot hit Andreas Johnsson
203,hit,Nikita Zaitsev,John Tavares,[95. 20.],2,01:26,OTT,TOR,TOR,10,OTT,9,4,2,8479458,8475166.0,2019020001,,2019-10-03,Nikita Zaitsev hit John Tavares
209,hit,Anthony Duclair,Cody Ceci,[-96. -26.],2,00:24,OTT,TOR,TOR,10,OTT,9,4,2,8477407,8476879.0,2019020001,,2019-10-03,Anthony Duclair hit Cody Ceci
215,hit,Kasperi Kapanen,Nikita Zaitsev,[-83.  39.],3,19:15,TOR,OTT,TOR,10,OTT,9,4,2,8477953,8479458.0,2019020001,,2019-10-03,Kasperi Kapanen hit Nikita Zaitsev
219,hit,Chris Tierney,Jake Muzzin,[-43. -38.],3,18:56,OTT,TOR,TOR,10,OTT,9,4,2,8476919,8474162.0,2019020001,,2019-10-03,Chris Tierney hit Jake Muzzin
222,hit,Tyler Ennis,Alexander Kerfoot,[-10.  24.],3,18:13,OTT,TOR,TOR,10,OTT,9,4,2,8474589,8477021.0,2019020001,,2019-10-03,Tyler Ennis hit Alexander Kerfoot
223,hit,Dylan DeMelo,Alexander Kerfoot,[-33.  29.],3,18:07,OTT,TOR,TOR,10,OTT,9,4,2,8476331,8477021.0,2019020001,,2019-10-03,Dylan DeMelo hit Alexander Kerfoot
228,hit,Erik Brannstrom,Mitchell Marner,[-94. -23.],3,17:25,OTT,TOR,TOR,10,OTT,9,4,2,8480073,8478483.0,2019020001,,2019-10-03,Erik Brannstrom hit Mitchell Marner
230,hit,Dmytro Timashov,Filip Chlapik,[51. 36.],3,17:00,TOR,OTT,TOR,10,OTT,9,4,2,8478857,8478488.0,2019020001,,2019-10-03,Dmytro Timashov hit Filip Chlapik
238,hit,Anthony Duclair,Tyson Barrie,[96.  0.],3,15:16,OTT,TOR,TOR,10,OTT,9,4,2,8477407,8475197.0,2019020001,,2019-10-03,Anthony Duclair hit Tyson Barrie
241,hit,Nikita Zaitsev,Frederik Gauthier,[-97.  13.],3,14:30,OTT,TOR,TOR,10,OTT,9,4,2,8479458,8477512.0,2019020001,,2019-10-03,Nikita Zaitsev hit Frederik Gauthier
250,hit,Brady Tkachuk,Morgan Rielly,[96. -9.],3,11:58,OTT,TOR,TOR,10,OTT,9,4,2,8480801,8476853.0,2019020001,,2019-10-03,Brady Tkachuk hit Morgan Rielly
251,hit,Scott Sabourin,Cody Ceci,[97. 22.],3,11:46,OTT,TOR,TOR,10,OTT,9,4,2,8477149,8476879.0,2019020001,,2019-10-03,Scott Sabourin hit Cody Ceci
254,hit,Dylan DeMelo,Rasmus Sandin,[-44. -38.],3,10:34,OTT,TOR,TOR,10,OTT,9,4,2,8476331,8480873.0,2019020001,,2019-10-03,Dylan DeMelo hit Rasmus Sandin
259,hit,Chris Tierney,Alexander Kerfoot,[-97.  25.],3,10:07,OTT,TOR,TOR,10,OTT,9,5,2,8476919,8477021.0,2019020001,,2019-10-03,Chris Tierney hit Alexander Kerfoot
261,hit,Bobby Ryan,Alexander Kerfoot,[35. 39.],3,09:34,OTT,TOR,TOR,10,OTT,9,5,2,8471676,8477021.0,2019020001,,2019-10-03,Bobby Ryan hit Alexander Kerfoot
264,hit,Filip Chlapik,Tyson Barrie,[63. 41.],3,08:14,OTT,TOR,TOR,10,OTT,9,5,2,8478488,8475197.0,2019020001,,2019-10-03,Filip Chlapik hit Tyson Barrie
268,hit,Anthony Duclair,Rasmus Sandin,[-18. -38.],3,07:24,OTT,TOR,TOR,10,OTT,9,5,2,8477407,8480873.0,2019020001,,2019-10-03,Anthony Duclair hit Rasmus Sandin
269,hit,Chris Tierney,John Tavares,[-34. -37.],3,07:10,OTT,TOR,TOR,10,OTT,9,5,2,8476919,8475166.0,2019020001,,2019-10-03,Chris Tierney hit John Tavares
270,hit,Ron Hainsey,John Tavares,[ 27. -37.],3,07:01,OTT,TOR,TOR,10,OTT,9,5,2,8468493,8475166.0,2019020001,,2019-10-03,Ron Hainsey hit John Tavares
280,hit,Brady Tkachuk,Dmytro Timashov,[ 92. -35.],3,05:19,OTT,TOR,TOR,10,OTT,9,5,2,8480801,8478857.0,2019020001,,2019-10-03,Brady Tkachuk hit Dmytro Timashov
281,hit,Brady Tkachuk,Rasmus Sandin,[ 94. -35.],3,05:10,OTT,TOR,TOR,10,OTT,9,5,2,8480801,8480873.0,2019020001,,2019-10-03,Brady Tkachuk hit Rasmus Sandin
283,hit,Bobby Ryan,Cody Ceci,[85. 40.],3,04:45,OTT,TOR,TOR,10,OTT,9,5,2,8471676,8476879.0,2019020001,,2019-10-03,Bobby Ryan hit Cody Ceci
284,hit,Dylan DeMelo,William Nylander,[-98.  29.],3,04:33,OTT,TOR,TOR,10,OTT,9,5,2,8476331,8477939.0,2019020001,,2019-10-03,Dylan DeMelo hit William Nylander
3,hit,Jean-Gabriel Pageau,Artemi Panarin,[ 87. -38.],1,19:31,OTT,NYR,OTT,9,NYR,3,0,0,8476419,8478550.0,2019020020,,2019-10-06,Jean-Gabriel Pageau hit Artemi Panarin
5,hit,Brady Tkachuk,Jacob Trouba,[72. 37.],1,18:48,OTT,NYR,OTT,9,NYR,3,0,0,8480801,8476885.0,2019020020,,2019-10-06,Brady Tkachuk hit Jacob Trouba
6,hit,Mark Borowiecki,Vladislav Namestnikov,[-93.  35.],1,18:24,OTT,NYR,OTT,9,NYR,3,0,0,8474697,8476480.0,2019020020,,2019-10-06,Mark Borowiecki hit Vladislav Namestnikov
11,hit,Brendan Smith,Nikita Zaitsev,[  5. -36.],1,17:30,NYR,OTT,OTT,9,NYR,3,0,0,8474090,8479458.0,2019020020,,2019-10-06,Brendan Smith hit Nikita Zaitsev
13,hit,Nikita Zaitsev,Lias Andersson,[-98.  25.],1,17:11,OTT,NYR,OTT,9,NYR,3,0,0,8479458,8480072.0,2019020020,,2019-10-06,Nikita Zaitsev hit Lias Andersson
15,hit,Erik Brannstrom,Kaapo Kakko,[-25.  37.],1,16:27,OTT,NYR,OTT,9,NYR,3,0,0,8480073,8481554.0,2019020020,,2019-10-06,Erik Brannstrom hit Kaapo Kakko
31,hit,Nikita Zaitsev,Brendan Lemieux,[-75. -40.],1,13:11,OTT,NYR,OTT,9,NYR,3,0,1,8479458,8477962.0,2019020020,,2019-10-06,Nikita Zaitsev hit Brendan Lemieux
32,hit,Brady Skjei,Artem Anisimov,[ 32. -36.],1,12:57,NYR,OTT,OTT,9,NYR,3,0,1,8476869,8473573.0,2019020020,,2019-10-06,Brady Skjei hit Artem Anisimov
37,hit,Bobby Ryan,Brady Skjei,[97.  7.],1,11:50,OTT,NYR,OTT,9,NYR,3,0,1,8471676,8476869.0,2019020020,,2019-10-06,Bobby Ryan hit Brady Skjei
40,hit,Scott Sabourin,Jacob Trouba,[69. 36.],1,11:19,OTT,NYR,OTT,9,NYR,3,0,1,8477149,8476885.0,2019020020,,2019-10-06,Scott Sabourin hit Jacob Trouba
46,hit,Thomas Chabot,Mika Zibanejad,[-20.  38.],1,10:41,OTT,NYR,OTT,9,NYR,3,0,1,8478469,8476459.0,2019020020,,2019-10-06,Thomas Chabot hit Mika Zibanejad
57,hit,Jesper Fast,Nikita Zaitsev,[-92.  20.],1,08:20,NYR,OTT,OTT,9,NYR,3,0,1,8475855,8479458.0,2019020020,,2019-10-06,Jesper Fast hit Nikita Zaitsev
58,hit,Brady Tkachuk,Tony DeAngelo,[-39.  38.],1,08:15,OTT,NYR,OTT,9,NYR,3,0,1,8480801,8477950.0,2019020020,,2019-10-06,Brady Tkachuk hit Tony DeAngelo
59,hit,Marc Staal,Thomas Chabot,[ 82. -36.],1,08:01,NYR,OTT,OTT,9,NYR,3,0,1,8471686,8478469.0,2019020020,,2019-10-06,Marc Staal hit Thomas Chabot
